ID,"LICENSE ID","ACCOUNT NUMBER","SITE NUMBER","LEGAL NAME","DOING BUSINESS AS NAME",ADDRESS,CITY,STATE,"ZIP CODE",WARD,PRECINCT,"WARD PRECINCT","POLICE DISTRICT","LICENSE CODE","LICENSE DESCRIPTION","BUSINESS ACTIVITY ID","BUSINESS ACTIVITY","LICENSE NUMBER","APPLICATION TYPE","APPLICATION CREATED DATE","APPLICATION REQUIREMENTS COMPLETE","PAYMENT DATE","CONDITIONAL APPROVAL","LICENSE TERM START DATE","LICENSE TERM EXPIRATION DATE","LICENSE APPROVED FOR ISSUANCE","DATE ISSUED","LICENSE STATUS","LICENSE STATUS CHANGE DATE",SSA,LATITUDE,LONGITUDE,LOCATION,DI_CreateDate,DI_WorkflowFileName,APPLICATION_CREATED_DATE_CONVERTED,PAYMENT_DATE_CONVERTED,"LICENSE_TERM_START DATE_CONVERTED","LICENSE TERM EXPIRATION DATE CONVERTED","DATE ISSUED CONVERTED","LICENSE STATUS CHANGE DATE CONVERTED"
16570-20000216,76522,51755,1,"THORNDALE CONSTRUCTION","THORNDALE CONSTRUCTION","11243  CHESAPEAKE PLAC   1ST",WESTCHESTER,IL,60154,NULL,NULL,NULL,NULL,1010,"Limited Business License",NULL,NULL,16570,RENEW,NULL,06/16/2000,08/21/2009,N,02/16/2000,02/15/2001,12/22/2003,08/24/2009,AAI,NULL,NULL,NULL,NULL,NULL,"2022-10-06 12:53:44",test,NULL,"2009-08-21 00:00:00","2000-02-16 00:00:00","2001-02-15 00:00:00","2009-08-24 00:00:00",NULL
25710-19960216,119268,52896,1,"PAT HAMILTON, INC","PAT HAMILTON CO.","17021 S MAGNOLIA DR  1ST","HAZEL CREST",IL,60429,NULL,NULL,NULL,NULL,1010,"Limited Business License",NULL,NULL,25710,ISSUE,NULL,06/20/2000,NULL,N,02/16/1996,02/15/1997,12/22/2003,04/12/2006,AAI,NULL,NULL,NULL,NULL,NULL,"2022-10-06 12:53:44",test,NULL,NULL,"1996-02-16 00:00:00","1997-02-15 00:00:00","2006-04-12 00:00:00",NULL
2712733-20210816,2796409,461483,3,"J & H DESIGNS INC.","DCI Furniture","2729 W DEVON AVE",CHICAGO,IL,60659,50,NULL,50-,NULL,1010,"Limited Business License",764,"Retail Sales of Carpet and/or Furniture",2712733,RENEW,NULL,06/15/2021,05/11/2022,N,08/16/2021,08/15/2023,05/11/2022,05/11/2022,AAI,NULL,43,41.997471914,-87.698364983,"(41.99747191369513, -87.6983649831795)","2022-10-06 12:53:44",test,NULL,"2022-05-11 00:00:00","2021-08-16 00:00:00","2023-08-15 00:00:00","2022-05-11 00:00:00",NULL
53383-20150316,2375632,38691,1,"MEE INC","MEE INC","11845 W LARAWAY RD  1",FRANKFORT,IL,60423,NULL,NULL,NULL,NULL,1010,"Limited Business License",NULL,NULL,53383,RENEW,NULL,01/16/2015,03/12/2015,N,03/16/2015,03/15/2017,03/12/2015,03/13/2015,AAI,NULL,NULL,NULL,NULL,NULL,"2022-10-06 12:53:44",test,NULL,"2015-03-12 00:00:00","2015-03-16 00:00:00","2017-03-15 00:00:00","2015-03-13 00:00:00",NULL
1847540-20090116,1940503,89020,45,"FEDEX OFFICE AND PRINT SERVICES, INC.","FEDEX OFFICE AND PRINT SVCS, INC.","2301 S DR MARTIN LUTHER KING JR DR  SOUTH BL",CHICAGO,IL,60616,4,3,4-3,1,1010,"Limited Business License",NULL,NULL,1847540,RENEW,NULL,11/14/2008,01/08/2009,N,01/16/2009,01/15/2011,01/08/2009,01/22/2009,AAI,NULL,NULL,NULL,NULL,NULL,"2022-10-06 12:53:44",test,NULL,"2009-01-08 00:00:00","2009-01-16 00:00:00","2011-01-15 00:00:00","2009-01-22 00:00:00",NULL
50776-20040216,1458339,56730,1,"FREDERICK MCGEE","MCGEE'S REMODELING","1009 S 11TH AVE  1",MAYWOOD,IL,60153,NULL,NULL,NULL,NULL,1011,"Home Repair",NULL,NULL,50776,RENEW,NULL,12/15/2003,02/26/2004,N,02/16/2004,02/15/2005,12/22/2003,11/24/2008,AAI,NULL,NULL,NULL,NULL,NULL,"2022-10-06 12:53:44",test,NULL,"2004-02-26 00:00:00","2004-02-16 00:00:00","2005-02-15 00:00:00","2008-11-24 00:00:00",NULL
63024-19990216,275807,19866,1,"SWISTUN, INC.","SWISTUN ALUMINUM INC","65 E PALATINE RD  117","PROSPECT HEIGHTS",IL,60070,NULL,NULL,NULL,NULL,1010,"Limited Business License",NULL,NULL,63024,RENEW,NULL,NULL,02/28/2008,N,02/16/1999,02/15/2000,12/22/2003,02/28/2008,AAI,NULL,NULL,NULL,NULL,NULL,"2022-10-06 12:53:44",test,NULL,"2008-02-28 00:00:00","1999-02-16 00:00:00","2000-02-15 00:00:00","2008-02-28 00:00:00",NULL
67045-19990516,286129,59758,1,"LAURENCE DUREKE",LA'VERA,"12440 S ASHLAND AVE  1ST","CALUMET PARK",IL,60643,NULL,NULL,NULL,NULL,1315,"Mobile Food Dispenser",NULL,NULL,67045,RENEW,NULL,12/22/2003,NULL,N,05/16/1999,02/15/2000,03/23/2001,11/29/2012,AAI,NULL,NULL,NULL,NULL,NULL,"2022-10-06 12:53:44",test,NULL,NULL,"1999-05-16 00:00:00","2000-02-15 00:00:00","2012-11-29 00:00:00",NULL
1927-20220916,2858237,62544,3,"HYATT CORPORATION","CRYSTAL BALLROOM/PLAZA BALLROOM","151 E WACKER DR  PLAZA",CHICAGO,IL,60601,42,44,42-44,1,1477,"Outdoor Patio",784,"Sale of Liquor Outdoors on Private Property",1927,RENEW,NULL,07/15/2022,08/05/2022,N,09/16/2022,09/15/2024,08/05/2022,08/08/2022,AAI,NULL,NULL,NULL,NULL,NULL,"2022-10-06 12:53:44",test,NULL,"2022-08-05 00:00:00","2022-09-16 00:00:00","2024-09-15 00:00:00","2022-08-08 00:00:00",NULL
39535-20060216,1660219,54914,1,"RILEY HEATING & COOLING","RILEY HEATING & COOLING","16 N 9 TH AVE  1ST","MELROSE PARK",IL,60160,NULL,NULL,NULL,NULL,1011,"Home Repair",NULL,NULL,39535,RENEW,NULL,12/21/2005,01/27/2006,N,02/16/2006,02/15/2007,NULL,02/22/2007,AAI,NULL,NULL,NULL,NULL,NULL,"2022-10-06 12:53:44",test,NULL,"2006-01-27 00:00:00","2006-02-16 00:00:00","2007-02-15 00:00:00","2007-02-22 00:00:00",NULL
1888980-20160516,2454132,61178,3,"NORTHERN BUILDERS INC","NORTHERN BUILDERS, INC.","5060  RIVER RD 1 1","SCHILLER PARK",IL,60176,NULL,NULL,NULL,NULL,1010,"Limited Business License",NULL,NULL,1888980,RENEW,NULL,03/15/2016,04/06/2016,N,05/16/2016,05/15/2018,04/06/2016,04/07/2016,AAI,NULL,NULL,NULL,NULL,NULL,"2022-10-06 12:53:44",test,NULL,"2016-04-06 00:00:00","2016-05-16 00:00:00","2018-05-15 00:00:00","2016-04-07 00:00:00",NULL
79838-20000216,310105,48577,1,"NAZI ORAHA","IMPERIAL CLEANING SERVICE","26  STACY CT  1ST",GLENVIEW,IL,60025,NULL,NULL,NULL,NULL,1010,"Limited Business License",NULL,NULL,79838,RENEW,NULL,06/16/2000,05/14/2010,N,02/16/2000,02/15/2001,12/22/2003,05/17/2010,AAI,NULL,NULL,NULL,NULL,NULL,"2022-10-06 12:53:44",test,NULL,"2010-05-14 00:00:00","2000-02-16 00:00:00","2001-02-15 00:00:00","2010-05-17 00:00:00",NULL
2113456-20130916,2276800,365474,1,"7 DAYS A WEEK INC.","7 DAYS A WEEK INC.","4714  MAIN ST  3C",LISLE,IL,60532,NULL,NULL,NULL,NULL,1010,"Limited Business License",NULL,NULL,2113456,RENEW,NULL,07/15/2013,NULL,N,09/16/2013,09/15/2015,04/07/2016,04/07/2016,AAI,NULL,NULL,NULL,NULL,NULL,"2022-10-06 12:53:44",test,NULL,NULL,"2013-09-16 00:00:00","2015-09-15 00:00:00","2016-04-07 00:00:00",NULL
1121240-20130702,1121240,21818,3,"PRECISION CONTRACTING SERVICES","PRESCISION CONTRACTING SERVICES","1011 E TOUHY AVE  210","DES PLAINES",IL,60018,NULL,NULL,NULL,NULL,1010,"Limited Business License",NULL,NULL,1121240,C_LOC,02/06/2001,02/06/2001,02/21/2001,N,07/02/2013,02/15/2002,01/03/2003,07/02/2013,AAI,NULL,NULL,NULL,NULL,NULL,"2022-10-06 12:53:44",test,"2001-02-06 00:00:00","2001-02-21 00:00:00","2013-07-02 00:00:00","2002-02-15 00:00:00","2013-07-02 00:00:00",NULL
30465-20010216,1104543,31585,1,"MELVIN ARMSTRONG","DMC REFRIGERATION HEATING & AC","17935  CHAPPEL AVE  MAIN",LANSING,IL,60438,NULL,NULL,NULL,NULL,1010,"Limited Business License",NULL,NULL,30465,RENEW,12/18/2000,12/19/2000,06/07/2011,N,02/16/2001,02/15/2002,12/22/2003,06/08/2011,AAI,NULL,NULL,NULL,NULL,NULL,"2022-10-06 12:53:44",test,"2000-12-18 00:00:00","2011-06-07 00:00:00","2001-02-16 00:00:00","2002-02-15 00:00:00","2011-06-08 00:00:00",NULL
17220-20160516,2453785,28261,1,"HOLLWAY MEYER'S INC","HOLLAWAY MEYER'S INC","950  165TH ST  1",HAMMOND,IN,46324,NULL,NULL,NULL,NULL,1010,"Limited Business License",NULL,NULL,17220,RENEW,NULL,03/15/2016,04/01/2016,N,05/16/2016,05/15/2018,04/01/2016,04/04/2016,AAI,NULL,NULL,NULL,NULL,NULL,"2022-10-06 12:53:44",test,NULL,"2016-04-01 00:00:00","2016-05-16 00:00:00","2018-05-15 00:00:00","2016-04-04 00:00:00",NULL
55461-20010216,1112535,57558,1,"STERLING ELEVATOR SERVICE CO","STRERLING ELEVATOR SERVICE CO","2510 E DEMPSTER   208","DES PLAINES",IL,60016,NULL,NULL,NULL,NULL,1010,"Limited Business License",NULL,NULL,55461,RENEW,12/18/2000,12/19/2000,05/18/2001,N,02/16/2001,02/15/2002,07/28/2001,06/19/2008,AAI,NULL,NULL,NULL,NULL,NULL,"2022-10-06 12:53:44",test,"2000-12-18 00:00:00","2001-05-18 00:00:00","2001-02-16 00:00:00","2002-02-15 00:00:00","2008-06-19 00:00:00",NULL
78446-20010216,1115264,67310,1,"360NETWORKS (USA) INC.","360NETWORKS (USA) INC.","12202  AIRPORT WAY  300",BROOMFIELD,CO,80021,NULL,NULL,NULL,NULL,1010,"Limited Business License",NULL,NULL,78446,RENEW,12/18/2000,12/19/2000,04/22/2008,N,02/16/2001,02/15/2002,12/22/2003,07/30/2007,AAI,NULL,NULL,NULL,NULL,NULL,"2022-10-06 12:53:44",test,"2000-12-18 00:00:00","2008-04-22 00:00:00","2001-02-16 00:00:00","2002-02-15 00:00:00","2007-07-30 00:00:00",NULL
1140501-20100511,1140501,213133,1,"MICHAEL BRUCE VLASEK","MIKE VLASEK INC","7305 W 157TH ST 3RD 3B","ORLAND PARK",IL,60462,NULL,NULL,NULL,NULL,1010,"Limited Business License",NULL,NULL,1140501,ISSUE,04/12/2001,04/12/2001,04/12/2001,N,05/11/2010,02/15/2005,01/06/2003,05/11/2010,AAI,NULL,NULL,NULL,NULL,NULL,"2022-10-06 12:53:44",test,"2001-04-12 00:00:00","2001-04-12 00:00:00","2010-05-11 00:00:00","2005-02-15 00:00:00","2010-05-11 00:00:00",NULL
83699-20010216,1115778,68530,1,"URGENT HEATING & COOLING CORP.","URGENT HEATING","560  CHESTER AVE  1ST",ELGIN,IL,60120,NULL,NULL,NULL,NULL,1010,"Limited Business License",NULL,NULL,83699,RENEW,12/18/2000,12/19/2000,01/31/2001,N,02/16/2001,02/15/2002,01/31/2001,06/16/2008,AAI,NULL,NULL,NULL,NULL,NULL,"2022-10-06 12:53:44",test,"2000-12-18 00:00:00","2001-01-31 00:00:00","2001-02-16 00:00:00","2002-02-15 00:00:00","2008-06-16 00:00:00",NULL
1140502-20100511,1140502,213133,1,"MICHAEL BRUCE VLASEK","MIKE VLASEK INC","7305 W 157TH ST 3RD 3B","ORLAND PARK",IL,60462,NULL,NULL,NULL,NULL,1011,"Home Repair",NULL,NULL,1140502,ISSUE,04/12/2001,04/12/2001,04/12/2001,N,05/11/2010,02/15/2002,09/18/2001,05/11/2010,AAI,NULL,NULL,NULL,NULL,NULL,"2022-10-06 12:53:44",test,"2001-04-12 00:00:00","2001-04-12 00:00:00","2010-05-11 00:00:00","2002-02-15 00:00:00","2010-05-11 00:00:00",NULL
1621057-20150316,2375471,22721,1,"GEM COMMERCIAL INC","GEM COMMERCIAL INC","1302  INDUSTRIAL DR  UNITA",ITASCA,IL,60143,NULL,NULL,NULL,NULL,1010,"Limited Business License",NULL,NULL,1621057,RENEW,NULL,01/16/2015,02/11/2015,N,03/16/2015,03/15/2017,02/11/2015,02/13/2015,AAI,NULL,NULL,NULL,NULL,NULL,"2022-10-06 12:53:44",test,NULL,"2015-02-11 00:00:00","2015-03-16 00:00:00","2017-03-15 00:00:00","2015-02-13 00:00:00",NULL
44918-20011116,1172795,465,2,"MILLARD MAINTENANCE SERVICE CO","STANDARD WINDOW CLEANING CO","7301 N CICERO AVE  1ST",LINCOLNWOOD,IL,60646,NULL,NULL,NULL,NULL,1010,"Limited Business License",NULL,NULL,44918,RENEW,NULL,10/03/2001,07/26/2006,N,11/16/2001,11/15/2002,12/22/2003,08/16/2006,AAI,NULL,NULL,NULL,NULL,NULL,"2022-10-06 12:53:44",test,NULL,"2006-07-26 00:00:00","2001-11-16 00:00:00","2002-11-15 00:00:00","2006-08-16 00:00:00",NULL
1932-20220916,2858248,62544,18,"HYATT CORPORATION",STETSON'S,"151 E WACKER DR  PLAZA",CHICAGO,IL,60601,42,44,42-44,1,1006,"Retail Food Establishment",775,"Retail Sales of Perishable Foods",1932,RENEW,NULL,07/15/2022,08/05/2022,N,09/16/2022,09/15/2024,08/05/2022,08/08/2022,AAI,NULL,NULL,NULL,NULL,NULL,"2022-10-06 12:53:44",test,NULL,"2022-08-05 00:00:00","2022-09-16 00:00:00","2024-09-15 00:00:00","2022-08-08 00:00:00",NULL
69904-20020216,1202098,21298,2,"ILLINOIS QUALITY BUILDERS","ILL QUALITY BUILDERS","600  LOCUST   1ST F",WILMETTE,IL,60091,NULL,NULL,NULL,NULL,1010,"Limited Business License",NULL,NULL,69904,RENEW,NULL,12/20/2001,02/15/2002,N,02/16/2002,02/15/2003,02/15/2002,05/11/2010,AAI,NULL,NULL,NULL,NULL,NULL,"2022-10-06 12:53:44",test,NULL,"2002-02-15 00:00:00","2002-02-16 00:00:00","2003-02-15 00:00:00","2010-05-11 00:00:00",NULL
37359-20160416,2448239,54581,1,"HAGEN DECORATORS, INC.","NORTH CENTRAL INSULATION","3204  PLEASANT ST  1ST",ALTOONA,WI,54720,NULL,NULL,NULL,NULL,1010,"Limited Business License",NULL,NULL,37359,RENEW,NULL,02/15/2016,03/24/2016,N,04/16/2016,04/15/2018,03/24/2016,03/25/2016,AAI,NULL,NULL,NULL,NULL,NULL,"2022-10-06 12:53:44",test,NULL,"2016-03-24 00:00:00","2016-04-16 00:00:00","2018-04-15 00:00:00","2016-03-25 00:00:00",NULL
55014-20020216,1201283,18088,3,"AMERITECH COMMUNICATIONS INC","AMERITECH COMMUNICATIONS INC","9525 W BRYN MAWR AVE  600",ROSEMONT,IL,60018,NULL,NULL,NULL,NULL,1010,"Limited Business License",NULL,NULL,55014,RENEW,NULL,12/20/2001,03/12/2002,N,02/16/2002,02/15/2003,04/30/2002,04/28/2010,AAI,NULL,NULL,NULL,NULL,NULL,"2022-10-06 12:53:44",test,NULL,"2002-03-12 00:00:00","2002-02-16 00:00:00","2003-02-15 00:00:00","2010-04-28 00:00:00",NULL
37444-20020216,1205853,33414,1,"MAESTRO GENERAL CONTRACTOR, IN","MAESTRO GENERAL CONTRACTOR, IN","411  SPRINGHILL DR  HOME",ROSELLE,IL,60172,NULL,NULL,NULL,NULL,1011,"Home Repair",NULL,NULL,37444,RENEW,NULL,12/20/2001,02/19/2002,N,02/16/2002,02/15/2003,06/11/2003,09/18/2009,AAI,NULL,NULL,NULL,NULL,NULL,"2022-10-06 12:53:44",test,NULL,"2002-02-19 00:00:00","2002-02-16 00:00:00","2003-02-15 00:00:00","2009-09-18 00:00:00",NULL
17129-20020216,1215056,85715,2,"FCI CONSTRUCTION INC","FCI CONTRUCTION, INC.","735 N YALE   A","VILLA PARK",IL,60181,NULL,NULL,NULL,NULL,1010,"Limited Business License",NULL,NULL,17129,RENEW,NULL,12/20/2001,01/22/2002,N,02/16/2002,02/15/2003,01/22/2002,06/07/2006,AAI,NULL,NULL,NULL,NULL,NULL,"2022-10-06 12:53:44",test,NULL,"2002-01-22 00:00:00","2002-02-16 00:00:00","2003-02-15 00:00:00","2006-06-07 00:00:00",NULL
71647-20030216,1309915,21652,1,"GEMINI HEATING & AIR CONDITIONING INC.","GEMINI HTG & AIR CONDITIONING","8  FRANCES CT  1ST","BUFFALO GROVE",IL,60089,NULL,NULL,NULL,NULL,1011,"Home Repair",NULL,NULL,71647,RENEW,NULL,12/17/2002,03/11/2003,N,02/16/2003,02/15/2004,12/22/2003,10/03/2007,AAI,NULL,NULL,NULL,NULL,NULL,"2022-10-06 12:53:44",test,NULL,"2003-03-11 00:00:00","2003-02-16 00:00:00","2004-02-15 00:00:00","2007-10-03 00:00:00",NULL
1594885-20060216,1652038,7700,1,"WARNING CHARTER SERVICE INC","WARNING CHARTER SERVICE INC","4845 W 167TH ST  300","OAK FOREST",IL,60452,NULL,NULL,NULL,NULL,1010,"Limited Business License",NULL,NULL,1594885,RENEW,NULL,12/21/2005,02/23/2006,N,02/16/2006,02/15/2007,02/23/2006,06/18/2008,AAI,NULL,NULL,NULL,NULL,NULL,"2022-10-06 12:53:44",test,NULL,"2006-02-23 00:00:00","2006-02-16 00:00:00","2007-02-15 00:00:00","2008-06-18 00:00:00",NULL
37443-20030216,1313198,33414,1,"MAESTRO GENERAL CONTRACTOR, IN","MAESTRO GENERAL CONTRACTOR, IN","411  SPRINGHILL DR  HOME",ROSELLE,IL,60172,NULL,NULL,NULL,NULL,1010,"Limited Business License",NULL,NULL,37443,RENEW,NULL,12/17/2002,03/31/2003,N,02/16/2003,02/15/2004,12/22/2003,09/18/2009,AAI,NULL,NULL,NULL,NULL,NULL,"2022-10-06 12:53:44",test,NULL,"2003-03-31 00:00:00","2003-02-16 00:00:00","2004-02-15 00:00:00","2009-09-18 00:00:00",NULL
2205100-20220516,2836870,50840,1,"AIDA & METANIOS ELRASSI","STATE AMUSEMENT","8468 N GROSSPOINT  1ST",SKOKIE,IL,60077,NULL,NULL,NULL,NULL,4404,"Regulated Business License",645,"Distribution, Placing, Leasing or Sales of Automatic Amusement Devices",2205100,RENEW,NULL,03/15/2022,05/10/2022,N,05/16/2022,05/15/2024,05/10/2022,05/11/2022,AAI,NULL,NULL,NULL,NULL,NULL,"2022-10-06 12:53:44",test,NULL,"2022-05-10 00:00:00","2022-05-16 00:00:00","2024-05-15 00:00:00","2022-05-11 00:00:00",NULL
2617269-20220916,2857496,1611,5,"TTX COMPANY","TTX COMPANY","4016 S ASHLAND AVE",CHICAGO,IL,60609,12,19,12-19,9,1010,"Limited Business License",708,"Miscellaneous Commercial Services",2617269,RENEW,NULL,07/15/2022,08/05/2022,N,09/16/2022,09/15/2024,08/05/2022,08/08/2022,AAI,NULL,NULL,41.820284936,-87.665396822,"(41.82028493557808, -87.66539682158037)","2022-10-06 12:53:44",test,NULL,"2022-08-05 00:00:00","2022-09-16 00:00:00","2024-09-15 00:00:00","2022-08-08 00:00:00",NULL
2652692-20201217,2652692,456833,1,"JYM INVESTMENTS LLC",WINGMAN,"2321 W HOWARD ST 1ST",CHICAGO,IL,60645,49,21,49-21,24,1006,"Retail Food Establishment",781,"Sale of Food Prepared Onsite With Dining Area",2652692,ISSUE,03/01/2019,11/18/2020,11/19/2020,N,12/17/2020,01/15/2023,12/16/2020,12/17/2020,AAC,08/08/2022,NULL,42.019413271,-87.688628188,"(42.019413270594214, -87.68862818775574)","2022-10-06 12:53:44",test,"2019-03-01 00:00:00","2020-11-19 00:00:00","2020-12-17 00:00:00","2023-01-15 00:00:00","2020-12-17 00:00:00","2022-08-08 00:00:00"
2647849-20200916,2739788,64603,7,"LEOPARDO COMPANIES INC.","Leopardo Companies Inc","210 N CARPENTER ST 3RD FLOOR",CHICAGO,IL,60607,27,NULL,27-,NULL,1010,"Limited Business License",602,"Administrative Commercial Office",2647849,RENEW,NULL,07/15/2020,08/20/2020,N,09/16/2020,09/15/2022,08/20/2020,08/21/2020,AAC,08/08/2022,NULL,41.885944958,-87.653461783,"(41.88594495760403, -87.65346178255953)","2022-10-06 12:53:44",test,NULL,"2020-08-20 00:00:00","2020-09-16 00:00:00","2022-09-15 00:00:00","2020-08-21 00:00:00","2022-08-08 00:00:00"
1579838-20220616,2842924,289144,1,"1021 MONTROSE, L.L.C.",Driftwood,"1021 W MONTROSE AVE",CHICAGO,IL,60613,46,9,46-9,19,1470,Tavern,829,"Tavern - Consumption of Liquor on Premise",1579838,RENEW,NULL,04/15/2022,05/10/2022,N,06/16/2022,06/15/2024,05/10/2022,05/11/2022,AAI,NULL,34,41.961655309,-87.655649945,"(41.961655308981946, -87.65564994485091)","2022-10-06 12:53:44",test,NULL,"2022-05-10 00:00:00","2022-06-16 00:00:00","2024-06-15 00:00:00","2022-05-11 00:00:00",NULL
2333323-20220616,2843903,390516,1,"Weiss Entities LLC","Weiss Entities LLC","104 S MICHIGAN AVE 13 1300",CHICAGO,IL,60603,42,NULL,42-,NULL,4404,"Regulated Business License",601,"Acquisition and Improvement of Land/Residential Buildings (Residential Real Estate Developer)",2333323,RENEW,NULL,04/15/2022,05/10/2022,N,06/16/2022,06/15/2024,05/10/2022,05/11/2022,AAI,NULL,NULL,41.88067914,-87.62449086,"(41.880679139638694, -87.62449086000186)","2022-10-06 12:53:44",test,NULL,"2022-05-10 00:00:00","2022-06-16 00:00:00","2024-06-15 00:00:00","2022-05-11 00:00:00",NULL
2027540-20220616,2841687,10726,5,"GRAHAM ENTERPRISE INC","Rock N Roll BP (GEI-157)","631-647 N LA SALLE DR",CHICAGO,IL,60654,42,46,42-46,18,1275,"Filling Station",666,"Operation of a Fuel Filling Station",2027540,RENEW,NULL,04/15/2022,05/10/2022,N,06/16/2022,06/15/2024,05/10/2022,05/11/2022,AAI,NULL,NULL,41.893251198,-87.632493012,"(41.89325119846543, -87.63249301222938)","2022-10-06 12:53:44",test,NULL,"2022-05-10 00:00:00","2022-06-16 00:00:00","2024-06-15 00:00:00","2022-05-11 00:00:00",NULL
2009389-20200616,2726247,349503,4,"CHICAGO CUBS BASEBALL CLUB, LLC","CHICAGO CUBS","1126 W GRACE ST 1ST",CHICAGO,IL,60613,44,18,44-18,19,1003,"Commercial Garage",725,"Provide Parking Spaces For a Fee - Available and Advertised to the Public",2009389,RENEW,NULL,04/15/2020,08/07/2020,N,06/16/2020,06/15/2022,08/07/2020,05/11/2022,AAI,NULL,NULL,41.951174722,-87.658075269,"(41.951174721597646, -87.65807526932429)","2022-10-06 12:53:44",test,NULL,"2020-08-07 00:00:00","2020-06-16 00:00:00","2022-06-15 00:00:00","2022-05-11 00:00:00",NULL
2780650-20220516,2839285,424430,3,"MEHRAB MANAGEMENT, INC.","MEHRAB RESTAURANT","2437 W DEVON AVE",CHICAGO,IL,60659,50,NULL,50-,NULL,1006,"Retail Food Establishment",781,"Sale of Food Prepared Onsite With Dining Area",2780650,RENEW,NULL,03/15/2022,05/10/2022,N,05/16/2022,05/15/2024,05/10/2022,05/11/2022,AAI,NULL,43,41.997597404,-87.691331516,"(41.99759740363999, -87.6913315163539)","2022-10-06 12:53:44",test,NULL,"2022-05-10 00:00:00","2022-05-16 00:00:00","2024-05-15 00:00:00","2022-05-11 00:00:00",NULL
1899783-20090316,1953094,330192,1,"ELIAS A. KANELLOPOULOS","RITZ CLEANERS","200 E DELAWARE PL 1",CHICAGO,IL,60611,2,13,2-13,18,1010,"Limited Business License",NULL,NULL,1899783,RENEW,NULL,01/15/2009,02/20/2009,N,03/16/2009,03/15/2011,02/20/2009,02/23/2009,AAI,NULL,NULL,41.899354739,-87.621791302,"(41.89935473944382, -87.621791301926)","2022-10-06 12:53:44",test,NULL,"2009-02-20 00:00:00","2009-03-16 00:00:00","2011-03-15 00:00:00","2009-02-23 00:00:00",NULL
2846132-20220511,2846132,485647,1,"Silverwolf Productions LLC","Silverwolf Productions LLC","2673 N GREENVIEW AVE  UNIT H",CHICAGO,IL,60614,32,NULL,32-,NULL,4404,"Regulated Business License","665 | 667 | 702 | 719","Freelance Writer (Home Based Business) | Graphic Design (Home Based Business) | Marketing / Advertising / Public Relations (Home Based Business) | Professional Consulting (Home Based Business)",2846132,ISSUE,05/10/2022,05/10/2022,05/10/2022,N,05/11/2022,05/15/2024,05/10/2022,05/11/2022,AAI,NULL,NULL,41.930322481,-87.665386892,"(41.93032248132474, -87.66538689175445)","2022-10-06 12:53:44",test,"2022-05-10 00:00:00","2022-05-10 00:00:00","2022-05-11 00:00:00","2024-05-15 00:00:00","2022-05-11 00:00:00",NULL
2845828-20220511,2845828,485450,1,"LOS ALTOS DE LA SIERRA LLC","LOS ALTOS DE LA SIERRA","6043 W ADDISON ST 1 B",CHICAGO,IL,60634,36,NULL,36-,NULL,1006,"Retail Food Establishment",735,"Preparation of Food and Dining on Premise With Seating",2845828,ISSUE,05/04/2022,05/04/2022,05/04/2022,N,05/11/2022,05/15/2024,05/10/2022,05/11/2022,AAI,NULL,NULL,41.945644782,-87.778210264,"(41.945644781746616, -87.778210263651)","2022-10-06 12:53:44",test,"2022-05-04 00:00:00","2022-05-04 00:00:00","2022-05-11 00:00:00","2024-05-15 00:00:00","2022-05-11 00:00:00",NULL
2206588-20201116,2751202,281408,3,"HTH INCORPORATED","INSIGHT STUDIOS","1062 N MILWAUKEE AVE 1ST",CHICAGO,IL,60642,2,56,2-56,12,4404,"Regulated Business License",143,"Engage in Body Piercing",2206588,RENEW,NULL,09/15/2020,10/02/2020,N,11/16/2020,11/15/2022,10/02/2020,05/11/2022,AAI,NULL,29,41.901102965,-87.663198449,"(41.90110296450634, -87.66319844892888)","2022-10-06 12:53:44",test,NULL,"2020-10-02 00:00:00","2020-11-16 00:00:00","2022-11-15 00:00:00","2022-05-11 00:00:00",NULL
1899783-20110316,2078221,330192,1,"ELIAS A. KANELLOPOULOS","RITZ CLEANERS","200 E DELAWARE PL 1",CHICAGO,IL,60611,2,13,2-13,18,1010,"Limited Business License",NULL,NULL,1899783,RENEW,NULL,01/14/2011,02/14/2011,N,03/16/2011,03/15/2013,02/14/2011,02/15/2011,AAI,NULL,NULL,41.899354739,-87.621791302,"(41.89935473944382, -87.621791301926)","2022-10-06 12:53:44",test,NULL,"2011-02-14 00:00:00","2011-03-16 00:00:00","2013-03-15 00:00:00","2011-02-15 00:00:00",NULL
2863350-20220808,2863350,488437,1,"DOMONANT MEDIA LLC","DOMONANT MEDIA","1200 W 35TH ST 3RD 3A3130",CHICAGO,IL,60609,11,11,11-11,9,1010,"Limited Business License","476 | 1089","Photography Services | Multi-Media Services",2863350,ISSUE,08/08/2022,08/08/2022,08/08/2022,N,08/08/2022,08/15/2024,08/08/2022,08/08/2022,AAI,NULL,NULL,41.830728826,-87.655813252,"(41.830728825995436, -87.65581325202945)","2022-10-06 12:53:44",test,"2022-08-08 00:00:00","2022-08-08 00:00:00","2022-08-08 00:00:00","2024-08-15 00:00:00","2022-08-08 00:00:00",NULL
36311-20030216,1307168,5392,3,"FUJITEC AMERICA INC","FUJITEC AMERICA INC","1225  GREENBRIAR DR  G",ADDISON,IL,60101,NULL,NULL,NULL,NULL,1010,"Limited Business License",NULL,NULL,36311,RENEW,NULL,12/17/2002,01/08/2003,N,02/16/2003,02/15/2004,01/08/2003,12/18/2008,AAI,NULL,NULL,NULL,NULL,NULL,"2022-10-06 12:53:44",test,NULL,"2003-01-08 00:00:00","2003-02-16 00:00:00","2004-02-15 00:00:00","2008-12-18 00:00:00",NULL
2477179-20200716,2731774,408244,1,"NAIL JUNKIE ROSCOE, INC.","NAIL JUNKIE ROSCOE, INC.","2127 W BELMONT AVE 1",CHICAGO,IL,60618,32,45,32-45,19,1010,"Limited Business License",895,"Nail Services",2477179,RENEW,NULL,05/15/2020,07/21/2020,N,07/16/2020,07/15/2022,07/21/2020,07/22/2020,AAC,05/11/2022,NULL,41.939420519,-87.681875251,"(41.93942051904007, -87.68187525122258)","2022-10-06 12:53:44",test,NULL,"2020-07-21 00:00:00","2020-07-16 00:00:00","2022-07-15 00:00:00","2020-07-22 00:00:00","2022-05-11 00:00:00"
1170911-20030216,1307340,6402,3,"ICC ENTERPRISES","ICC ENTERPRISES","601 W CAMPUS DR  B3","ARLINGTON HEIGHTS",IL,60004,NULL,NULL,NULL,NULL,1010,"Limited Business License",NULL,NULL,1170911,RENEW,NULL,12/17/2002,03/12/2003,N,02/16/2003,02/15/2004,03/12/2003,07/25/2006,AAI,NULL,NULL,NULL,NULL,NULL,"2022-10-06 12:53:44",test,NULL,"2003-03-12 00:00:00","2003-02-16 00:00:00","2004-02-15 00:00:00","2006-07-25 00:00:00",NULL
2009364-20200616,2726245,349503,1,"CHICAGO CUBS BASEBALL CLUB, LLC","CHICAGO CUBS","1060 W ADDISON ST 1ST",CHICAGO,IL,60613,44,31,44-31,19,1050,"Public Place of Amusement",743,"Provides Onsite Amusement or Entertainment",2009364,RENEW,NULL,04/15/2020,08/07/2020,N,06/16/2020,06/15/2022,08/07/2020,05/11/2022,AAI,NULL,17,41.947317489,-87.656417948,"(41.94731748901495, -87.65641794764645)","2022-10-06 12:53:44",test,NULL,"2020-08-07 00:00:00","2020-06-16 00:00:00","2022-06-15 00:00:00","2022-05-11 00:00:00",NULL
2818513-20220616,2844542,427773,2,"MOVING UNITS INC.","MOVING UNITS INC.","4432 N KEDZIE AVE  104",CHICAGO,IL,60625,33,NULL,33-,NULL,1010,"Limited Business License","668 | 904","Graphic Design and Consultation | Retail Sales of General Merchandise",2818513,RENEW,NULL,04/15/2022,05/10/2022,N,06/16/2022,06/15/2024,05/10/2022,05/11/2022,AAI,NULL,60,41.96218474,-87.708422754,"(41.962184740105535, -87.70842275378467)","2022-10-06 12:53:44",test,NULL,"2022-05-10 00:00:00","2022-06-16 00:00:00","2024-06-15 00:00:00","2022-05-11 00:00:00",NULL
1939-20220916,2858243,62544,9,"HYATT CORPORATION","EAST TOWER MAIN KITCHEN","151 E WACKER DR  L",CHICAGO,IL,60601,42,44,42-44,1,1006,"Retail Food Establishment",775,"Retail Sales of Perishable Foods",1939,RENEW,NULL,07/15/2022,08/05/2022,N,09/16/2022,09/15/2024,08/05/2022,08/08/2022,AAI,NULL,NULL,41.887999887,-87.622565133,"(41.88799988734853, -87.62256513255957)","2022-10-06 12:53:44",test,NULL,"2022-08-05 00:00:00","2022-09-16 00:00:00","2024-09-15 00:00:00","2022-08-08 00:00:00",NULL
2808785-20220511,2808785,478909,1,"DANIELLE TO","DANIELLE TO","2725 S HALSTED ST",CHICAGO,IL,60608,11,NULL,11-,NULL,7008,"Shared Housing Unit Operator",981,"Shared Housing Operator - Host of More Than One Shared Housing Unit",2808785,ISSUE,09/08/2021,09/08/2021,09/18/2021,N,05/11/2022,10/15/2023,09/23/2021,09/24/2021,AAI,NULL,NULL,41.843548903,-87.646265567,"(41.843548903182935, -87.64626556723158)","2022-10-06 12:53:44",test,"2021-09-08 00:00:00","2021-09-18 00:00:00","2022-05-11 00:00:00","2023-10-15 00:00:00","2021-09-24 00:00:00",NULL
69793-20030216,1309805,21274,3,"UNIVANCE TELECOMMUNICATIONS,IN","UNIVANCE TELECOMMUNICATIONS IN","373  INVERNESS SOUTH DR  100",ENGLEWOOD,CO,80112,NULL,NULL,NULL,NULL,1010,"Limited Business License",NULL,NULL,69793,RENEW,NULL,12/17/2002,03/17/2003,N,02/16/2003,02/15/2004,03/26/2003,05/11/2010,AAI,NULL,NULL,NULL,NULL,NULL,"2022-10-06 12:53:44",test,NULL,"2003-03-17 00:00:00","2003-02-16 00:00:00","2004-02-15 00:00:00","2010-05-11 00:00:00",NULL
1968629-20220616,2841685,10726,3,"GRAHAM ENTERPRISE INC","Chicago BP@Irving (GEI-152)","841 W IRVING PARK RD",CHICAGO,IL,60613,46,10,46-10,19,1781,Tobacco,763,"Retail Sale of Tobacco",1968629,RENEW,NULL,04/15/2022,05/10/2022,N,06/16/2022,06/15/2023,05/10/2022,05/11/2022,AAI,NULL,18,41.954425019,-87.651324017,"(41.95442501861227, -87.65132401707042)","2022-10-06 12:53:44",test,NULL,"2022-05-10 00:00:00","2022-06-16 00:00:00","2023-06-15 00:00:00","2022-05-11 00:00:00",NULL
2594594-20180417,2594594,426783,1,"HALLE LEONARD","HALLE LEONARD","[REDACTED FOR PRIVACY]",CHICAGO,IL,60614,43,29,43-29,18,7009,"Pharmaceutical Representative",990,"Markets / Promotes Pharmaceuticals to Health Care Professionals and Conducts Business for More than 15 Calendar Days per Year",2594594,ISSUE,04/16/2018,04/16/2018,04/16/2018,N,04/17/2018,05/15/2019,04/16/2018,04/17/2018,AAI,NULL,NULL,NULL,NULL,NULL,"2022-10-06 12:53:44",test,"2018-04-16 00:00:00","2018-04-16 00:00:00","2018-04-17 00:00:00","2019-05-15 00:00:00","2018-04-17 00:00:00",NULL
1938-20220916,2858242,62544,8,"HYATT CORPORATION","THE GALLERY","151 E WACKER DR  SKYWA",CHICAGO,IL,60601,42,44,42-44,1,1475,"Consumption on Premises - Incidental Activity",638,"Consumption of Liquor on Premises",1938,RENEW,NULL,07/15/2022,08/05/2022,N,09/16/2022,09/15/2024,08/05/2022,08/08/2022,AAI,NULL,NULL,41.887999887,-87.622565133,"(41.88799988734853, -87.62256513255957)","2022-10-06 12:53:44",test,NULL,"2022-08-05 00:00:00","2022-09-16 00:00:00","2024-09-15 00:00:00","2022-08-08 00:00:00",NULL
2009378-20200616,2726246,349503,3,"CHICAGO CUBS BASEBALL CLUB, LLC","CHICAGO CUBS","1140 W EDDY ST 1ST",CHICAGO,IL,60657,44,38,44-38,19,1003,"Commercial Garage",725,"Provide Parking Spaces For a Fee - Available and Advertised to the Public",2009378,RENEW,NULL,04/15/2020,08/07/2020,N,06/16/2020,06/15/2022,08/07/2020,05/11/2022,AAI,NULL,17,41.94636181,-87.657484742,"(41.94636181029152, -87.6574847423939)","2022-10-06 12:53:44",test,NULL,"2020-08-07 00:00:00","2020-06-16 00:00:00","2022-06-15 00:00:00","2022-05-11 00:00:00",NULL
2055080-20220916,2860372,356337,1,"PRIMERA IRON WORKS CORP.","PRIMERA IRON WORKS CORP.","855 N CICERO AVE 1",CHICAGO,IL,60651,37,21,37-21,11,1010,"Limited Business License",NULL,NULL,2055080,RENEW,NULL,07/15/2022,08/05/2022,N,09/16/2022,09/15/2024,08/05/2022,08/08/2022,AAI,NULL,NULL,41.896742416,-87.745703326,"(41.8967424164436, -87.74570332642313)","2022-10-06 12:53:44",test,NULL,"2022-08-05 00:00:00","2022-09-16 00:00:00","2024-09-15 00:00:00","2022-08-08 00:00:00",NULL
1899785-20210316,2769221,330192,2,"ELIAS A. KANELLOPOULOS","GOLD COAST CLEANERS","900 N LAKE SHORE DR 1",CHICAGO,IL,60611,2,29,2-29,18,1010,"Limited Business License",648,"Dry Cleaning - Drop Off Location",1899785,RENEW,NULL,01/15/2021,03/04/2021,N,03/16/2021,03/15/2023,03/04/2021,05/11/2022,AAI,NULL,NULL,41.899280991,-87.618894512,"(41.899280990919685, -87.61889451230181)","2022-10-06 12:53:44",test,NULL,"2021-03-04 00:00:00","2021-03-16 00:00:00","2023-03-15 00:00:00","2022-05-11 00:00:00",NULL
2857176-20220808,2857176,218538,96,"LINCOLN SQUARE RAVENSWOOD CHAMBER OF COMMERCE","LINCOLN SQUARE RAVENSWOOD CHAMBER OF COMMERCE","4505 N LINCOLN AVE  STOREFRONT",CHICAGO,IL,60625,47,42,47-42,19,4409,"Pop-Up Retail User",1027,"Organizer of a 1-5 Day Event w/ Pop-Up Retail Users at a Trade Show, Exhibition or Convention",2857176,ISSUE,07/08/2022,07/08/2022,08/08/2022,N,08/08/2022,08/13/2022,08/08/2022,08/08/2022,AAI,NULL,21,41.963424053,-87.684990788,"(41.963424053299256, -87.68499078804334)","2022-10-06 12:53:44",test,"2022-07-08 00:00:00","2022-08-08 00:00:00","2022-08-08 00:00:00","2022-08-13 00:00:00","2022-08-08 00:00:00",NULL
1145136-20220916,2857739,14479,2,"THE BUTLER DID IT INC.","ENTERTAINING COMPANY","1640 W WALNUT ST",CHICAGO,IL,60612,27,33,27-33,12,1481,"Caterer's Liquor License",630,"Catering of Liquor To Events",1145136,RENEW,NULL,07/15/2022,08/05/2022,N,09/16/2022,09/15/2024,08/05/2022,08/08/2022,AAI,NULL,NULL,41.886238989,-87.66859588,"(41.886238989108286, -87.66859587973032)","2022-10-06 12:53:44",test,NULL,"2022-08-05 00:00:00","2022-09-16 00:00:00","2024-09-15 00:00:00","2022-08-08 00:00:00",NULL
2548725-20220816,2855099,419075,1,"ALISON MELE","ALISON MELE","[REDACTED FOR PRIVACY]","TINLEY PARK",IL,60487,NULL,NULL,NULL,NULL,7009,"Pharmaceutical Representative",990,"Markets / Promotes Pharmaceuticals to Health Care Professionals and Conducts Business for More than 15 Calendar Days per Year",2548725,RENEW,NULL,06/15/2022,08/05/2022,N,08/16/2022,08/15/2023,08/05/2022,08/08/2022,AAI,NULL,NULL,NULL,NULL,NULL,"2022-10-06 12:53:44",test,NULL,"2022-08-05 00:00:00","2022-08-16 00:00:00","2023-08-15 00:00:00","2022-08-08 00:00:00",NULL
2594594-20210516,2779990,426783,1,"HALLE LEONARD","HALLE LEONARD","[REDACTED FOR PRIVACY]",CHICAGO,IL,60614,43,29,43-29,18,7009,"Pharmaceutical Representative",990,"Markets / Promotes Pharmaceuticals to Health Care Professionals and Conducts Business for More than 15 Calendar Days per Year",2594594,RENEW,NULL,03/15/2021,06/16/2021,N,05/16/2021,05/15/2022,06/16/2021,06/17/2021,AAI,NULL,NULL,NULL,NULL,NULL,"2022-10-06 12:53:44",test,NULL,"2021-06-16 00:00:00","2021-05-16 00:00:00","2022-05-15 00:00:00","2021-06-17 00:00:00",NULL
2846205-20220511,2846205,485684,1,"SUPREME RIMS & TIRES INC.","SUPREME RIMS & TIRES INC.","4163 S ARCHER AVE 1ST",CHICAGO,IL,60632,12,13,12-13,9,1010,"Limited Business License",792,"Sale of Vehicle Parts and Accessories",2846205,ISSUE,05/11/2022,05/11/2022,05/11/2022,N,05/11/2022,05/15/2024,05/11/2022,05/11/2022,AAI,NULL,39,41.817770713,-87.698006394,"(41.81777071313062, -87.69800639403326)","2022-10-06 12:53:44",test,"2022-05-11 00:00:00","2022-05-11 00:00:00","2022-05-11 00:00:00","2024-05-15 00:00:00","2022-05-11 00:00:00",NULL
2780957-20220416,2833895,390575,2,"DINEAMIC STEAK, LLC","PRIME & PROVISIONS","222 N LA SALLE ST 1-2",CHICAGO,IL,60601,42,9,42-9,1,1781,Tobacco,"776 | 937","Retail Sales of Tobacco Products | Retail Sales of Tobacco and Flavored Tobacco Products",2780957,RENEW,NULL,02/15/2022,05/06/2022,N,04/16/2022,04/15/2023,05/06/2022,05/11/2022,AAI,NULL,NULL,41.886351604,-87.632613946,"(41.886351604488574, -87.63261394551859)","2022-10-06 12:53:44",test,NULL,"2022-05-06 00:00:00","2022-04-16 00:00:00","2023-04-15 00:00:00","2022-05-11 00:00:00",NULL
2616993-20180809,2616993,374703,2,"SAE INSTITUTE OF TECHNOLOGY (CHICAGO) CORP.","8/10/18 River North Block Party","820 N ORLEANS ST",CHICAGO,IL,60610,27,48,27-48,18,4409,"Pop-Up Retail User",723,"Organizer of Vendors That Sell for Retail at a Trade Show, Exhibition or Convention",2616993,ISSUE,08/03/2018,08/03/2018,08/09/2018,N,08/09/2018,08/10/2018,08/09/2018,08/09/2018,AAI,NULL,NULL,41.897338047,-87.63734543,"(41.897338047455214, -87.63734543001038)","2022-10-06 12:53:44",test,"2018-08-03 00:00:00","2018-08-09 00:00:00","2018-08-09 00:00:00","2018-08-10 00:00:00","2018-08-09 00:00:00",NULL
2321004-20220816,2854072,355521,15,"BRIGHT HORIZONS CHILDREN'S CENTERS LLC","Bright Horizons at Clybourn","1425 N DAYTON ST 1ST",CHICAGO,IL,60642,27,46,27-46,18,1023,"Children's Services Facility License","820 | 823","Supervision of, and Care for, Children 0-6 Years of Age, During the Day between 6am-9pm | Supervision of, and Care for, Children 2-6 Years of Age, During the Day between 6am-9pm",2321004,RENEW,NULL,06/15/2022,06/23/2022,N,08/16/2022,08/15/2024,08/05/2022,08/08/2022,AAI,NULL,NULL,41.907156887,-87.649259472,"(41.9071568870692, -87.64925947162907)","2022-10-06 12:53:44",test,NULL,"2022-06-23 00:00:00","2022-08-16 00:00:00","2024-08-15 00:00:00","2022-08-08 00:00:00",NULL
2293833-20220516,2838574,386117,1,"FLYING SQUIRREL INDUSTRIES LLC","SLIPPERY SLOPE","2357 N MILWAUKEE AVE 1 & 2",CHICAGO,IL,60647,1,10,1-10,14,1470,Tavern,829,"Tavern - Consumption of Liquor on Premise",2293833,RENEW,NULL,03/15/2022,05/11/2022,N,05/16/2022,05/15/2024,05/11/2022,05/11/2022,AAI,NULL,NULL,41.924150306,-87.699150883,"(41.92415030562805, -87.69915088269197)","2022-10-06 12:53:44",test,NULL,"2022-05-11 00:00:00","2022-05-16 00:00:00","2024-05-15 00:00:00","2022-05-11 00:00:00",NULL
2684605-20210816,2796407,461483,1,"J & H DESIGNS INC.","J & H DESIGNS INC.","2746 W DEVON AVE",CHICAGO,IL,60659,50,NULL,50-,NULL,1010,"Limited Business License",764,"Retail Sales of Carpet and/or Furniture",2684605,RENEW,NULL,06/15/2021,05/11/2022,N,08/16/2021,08/15/2023,05/11/2022,05/11/2022,AAI,NULL,43,41.997679634,-87.699081003,"(41.99767963379983, -87.69908100330238)","2022-10-06 12:53:44",test,NULL,"2022-05-11 00:00:00","2021-08-16 00:00:00","2023-08-15 00:00:00","2022-05-11 00:00:00",NULL
2863342-20220808,2863342,488428,1,"YUN SIL JANG","YUN SIL JANG","462 W BROOKLINE CT",PALATINE,IL,60067,NULL,NULL,NULL,NULL,4406,"Peddler License",819,"Street Performer, Moving Along the Public Way",2863342,ISSUE,08/08/2022,08/08/2022,08/08/2022,N,08/08/2022,08/15/2024,NULL,08/08/2022,AAI,NULL,NULL,NULL,NULL,NULL,"2022-10-06 12:53:44",test,"2022-08-08 00:00:00","2022-08-08 00:00:00","2022-08-08 00:00:00","2024-08-15 00:00:00","2022-08-08 00:00:00",NULL
1968626-20220616,2841684,10726,3,"GRAHAM ENTERPRISE INC","Chicago BP@Irving (GEI-152)","841 W IRVING PARK RD",CHICAGO,IL,60613,46,10,46-10,19,1006,"Retail Food Establishment",775,"Retail Sales of Perishable Foods",1968626,RENEW,NULL,04/15/2022,05/10/2022,N,06/16/2022,06/15/2024,05/10/2022,05/11/2022,AAI,NULL,18,41.954425019,-87.651324017,"(41.95442501861227, -87.65132401707042)","2022-10-06 12:53:44",test,NULL,"2022-05-10 00:00:00","2022-06-16 00:00:00","2024-06-15 00:00:00","2022-05-11 00:00:00",NULL
2621669-20211216,2816160,402671,2,"SIXT RENT A CAR, LLC","Sixt Rent A Car, LLC","10255 W ZEMKE BLVD",CHICAGO,IL,60666,41,27,41-27,16,1010,"Limited Business License",793,"Sales / Car Rental / Lease of Motorized Vehicles",2621669,RENEW,NULL,10/15/2021,11/11/2021,N,12/16/2021,12/15/2023,11/11/2021,08/08/2022,AAI,NULL,NULL,41.994793386,-87.88270766,"(41.994793386111766, -87.88270765951567)","2022-10-06 12:53:44",test,NULL,"2021-11-11 00:00:00","2021-12-16 00:00:00","2023-12-15 00:00:00","2022-08-08 00:00:00",NULL
2212246-20180816,2604971,334772,2,"MIGUEL ANGEL DUARTE-SOLIS","MIGUEL ANGEL DUARTE-SOLIS","5015 S DAMEN AVE 1ST",CHICAGO,IL,60609,15,15,15-15,9,4406,"Peddler License",770,"Peddler (Over 65 Years of Age) - Retail Sales of General Merchandise, Whole Uncut Fruits/Vegetables, Flowers, Moving Along the Public Way",2212246,RENEW,NULL,06/15/2018,08/22/2018,N,08/16/2018,10/15/2020,NULL,08/22/2018,AAI,NULL,NULL,41.802569456,-87.674395755,"(41.802569455769735, -87.67439575456822)","2022-10-06 12:53:44",test,NULL,"2018-08-22 00:00:00","2018-08-16 00:00:00","2020-10-15 00:00:00","2018-08-22 00:00:00",NULL
1144115-20030216,1324330,215267,1,"COMMERCIAL LEASING CORPORATION.","SunBridge Capital, Inc.","6300  NALL AVE 2 200",MISSION,KS,66202,NULL,NULL,NULL,NULL,1010,"Limited Business License",NULL,NULL,1144115,RENEW,NULL,12/17/2002,02/26/2003,N,02/16/2003,02/15/2004,02/26/2003,01/25/2006,AAI,NULL,NULL,NULL,NULL,NULL,"2022-10-06 12:53:44",test,NULL,"2003-02-26 00:00:00","2003-02-16 00:00:00","2004-02-15 00:00:00","2006-01-25 00:00:00",NULL
2840733-20220511,2840733,8970,210,"COMPASS GROUP USA, INC.","Compass Group USA, Inc.","1 N WACKER DR 2ND",CHICAGO,IL,60606,42,NULL,42-,NULL,7013,"Pop-Up Establishment Host - Tier II",1025,"Pop-Up Food Est. User Host - Tier II (Pre-Packaged Prepared Hot/Cold Food. Final Prep On-Site)",2840733,ISSUE,03/31/2022,03/31/2022,04/01/2022,N,05/11/2022,04/15/2023,05/11/2022,05/11/2022,AAI,NULL,NULL,41.881951876,-87.636620349,"(41.88195187648601, -87.63662034940238)","2022-10-06 12:53:44",test,"2022-03-31 00:00:00","2022-04-01 00:00:00","2022-05-11 00:00:00","2023-04-15 00:00:00","2022-05-11 00:00:00",NULL
1694745-20061116,1753621,64603,5,"LEOPARDO COMPANIES INC.","LEOPARDO COMPANIES INC","1945 W HUBBARD ST  B",CHICAGO,IL,60622,27,27,27-27,12,1010,"Limited Business License",NULL,NULL,1694745,RENEW,NULL,09/20/2006,11/03/2006,N,11/16/2006,11/15/2007,11/03/2006,11/06/2006,AAI,NULL,NULL,41.889627703,-87.67623091,"(41.8896277030332, -87.67623090978807)","2022-10-06 12:53:44",test,NULL,"2006-11-03 00:00:00","2006-11-16 00:00:00","2007-11-15 00:00:00","2006-11-06 00:00:00",NULL
2511412-20190516,2657181,413393,26,"SSP AMERICA, INC.","ORANGE LINE","5700 S CICERO AVE  CB12ACB12B",CHICAGO,IL,60638,23,41,23-41,8,1006,"Retail Food Establishment",735,"Preparation of Food and Dining on Premise With Seating",2511412,RENEW,NULL,03/15/2019,05/01/2019,N,05/16/2019,07/15/2021,05/01/2019,05/02/2019,AAI,NULL,NULL,41.789329323,-87.741645644,"(41.789329323265385, -87.74164564419637)","2022-10-06 12:53:44",test,NULL,"2019-05-01 00:00:00","2019-05-16 00:00:00","2021-07-15 00:00:00","2019-05-02 00:00:00",NULL
2840941-20220412,2840941,484624,1,"W-SF GOLDFINGER OWNER VIII, L.L.C.","W-SF Goldfinger Owner VIII, L.L.C.","167 N GREEN ST 10 1001",CHICAGO,IL,60607,27,NULL,27-,NULL,1010,"Limited Business License",1078,"Property Management / Real Estate Management",2840941,ISSUE,04/06/2022,04/06/2022,04/11/2022,N,04/12/2022,04/15/2024,04/11/2022,04/12/2022,AAI,NULL,NULL,41.885044177,-87.648475907,"(41.88504417665877, -87.64847590715003)","2022-10-06 12:53:44",test,"2022-04-06 00:00:00","2022-04-11 00:00:00","2022-04-12 00:00:00","2024-04-15 00:00:00","2022-04-12 00:00:00",NULL
2717980-20220511,2717980,9584,5,"HORNBLOWER CRUISES AND EVENTS, LLC","SPIRIT OF NAVY PIER","600 E GRAND AVE  2600",CHICAGO,IL,60611,42,11,42-11,18,1006,"Retail Food Establishment",782,"Sale of Food Prepared Onsite Without Dining Area",2717980,ISSUE,02/25/2020,04/26/2022,04/26/2022,N,05/11/2022,03/15/2023,05/11/2022,05/11/2022,AAI,NULL,NULL,41.892094137,-87.611569884,"(41.892094136861786, -87.61156988394656)","2022-10-06 12:53:44",test,"2020-02-25 00:00:00","2022-04-26 00:00:00","2022-05-11 00:00:00","2023-03-15 00:00:00","2022-05-11 00:00:00",NULL
2863265-20220808,2863265,16105,21,"PARTY CITY CORPORATION","Halloween City","8133 S CICERO AVE",CHICAGO,IL,60652,18,NULL,18-,NULL,1010,"Limited Business License",904,"Retail Sales of General Merchandise",2863265,ISSUE,08/05/2022,08/05/2022,08/05/2022,N,08/08/2022,11/15/2023,08/05/2022,08/08/2022,AAI,NULL,NULL,41.744722105,-87.741060205,"(41.74472210502678, -87.74106020457465)","2022-10-06 12:53:44",test,"2022-08-05 00:00:00","2022-08-05 00:00:00","2022-08-08 00:00:00","2023-11-15 00:00:00","2022-08-08 00:00:00",NULL
2263778-20190616,2662258,381911,1,"A&J MUFFLERS AND BRAKES CORP.","ABY'S SHOP","4146-4148 S WESTERN AVE 1ST",CHICAGO,IL,60609,12,21,12-21,9,8340,"Motor Vehicle Services License",712,"Motor Vehicle Repair -  Engine and Transmission Work",2263778,RENEW,NULL,04/15/2019,06/27/2019,N,06/16/2019,07/15/2021,06/27/2019,06/27/2019,AAI,NULL,NULL,41.817928961,-87.6848298,"(41.81792896055436, -87.68482980036839)","2022-10-06 12:53:44",test,NULL,"2019-06-27 00:00:00","2019-06-16 00:00:00","2021-07-15 00:00:00","2019-06-27 00:00:00",NULL
2601379-20200616,2727930,428052,1,"NYM MERGER HOLDINGS LLC","Oak + Fort","1715 N DAMEN AVE",CHICAGO,IL,60647,32,36,32-36,14,1010,"Limited Business License",911,"Retail Sales of Clothing / Accessories / Shoes",2601379,RENEW,NULL,04/15/2020,02/23/2022,N,06/16/2020,06/15/2022,02/23/2022,05/11/2022,AAI,NULL,33,41.912750695,-87.677368344,"(41.91275069507496, -87.67736834388643)","2022-10-06 12:53:44",test,NULL,"2022-02-23 00:00:00","2020-06-16 00:00:00","2022-06-15 00:00:00","2022-05-11 00:00:00",NULL
62588-20030216,1334887,19763,2,"CHECKPOINT SECURITY SYSTEMS GR","CHECKPOINT SECURITIY SYSTEMS","6640  SHADY OAK RD  300","EDEN PRAIRIE",MN,55344,NULL,NULL,NULL,NULL,1010,"Limited Business License",NULL,NULL,62588,RENEW,NULL,02/20/2003,05/22/2003,N,02/16/2003,02/15/2004,05/27/2003,05/11/2010,AAI,NULL,NULL,NULL,NULL,NULL,"2022-10-06 12:53:44",test,NULL,"2003-05-22 00:00:00","2003-02-16 00:00:00","2004-02-15 00:00:00","2010-05-11 00:00:00",NULL
2840592-20220511,2840592,392906,25,"FOXTROT VENTURES, INCORPORATED",Foxtrot,"3649 N CLARK ST 1",CHICAGO,IL,60613,44,NULL,44-,NULL,1475,"Consumption on Premises - Incidental Activity","638 | 767 | 904","Consumption of Liquor on Premises | Retail Sales of General Merchandise and Non-Perishable Food | Retail Sales of General Merchandise",2840592,ISSUE,03/30/2022,04/01/2022,03/30/2022,N,05/11/2022,05/15/2024,05/11/2022,05/11/2022,AAI,NULL,17,41.948480847,-87.657372263,"(41.94848084659548, -87.65737226343279)","2022-10-06 12:53:44",test,"2022-03-30 00:00:00","2022-03-30 00:00:00","2022-05-11 00:00:00","2024-05-15 00:00:00","2022-05-11 00:00:00",NULL
2009390-20200616,2726248,349503,5,"CHICAGO CUBS BASEBALL CLUB, LLC","CHICAGO CUBS","1102 W WAVELAND AVE 1ST",CHICAGO,IL,60613,44,31,44-31,19,1003,"Commercial Garage",725,"Provide Parking Spaces For a Fee - Available and Advertised to the Public",2009390,RENEW,NULL,04/15/2020,08/07/2020,N,06/16/2020,06/15/2022,08/07/2020,05/11/2022,AAI,NULL,17,41.949112127,-87.656954796,"(41.94911212714381, -87.65695479567098)","2022-10-06 12:53:44",test,NULL,"2020-08-07 00:00:00","2020-06-16 00:00:00","2022-06-15 00:00:00","2022-05-11 00:00:00",NULL
2728172-20220516,2839654,467768,1,"Wharff Wellness, LLC","Wharff Wellness, LLC","11240 S WESTERN AVE",CHICAGO,IL,60643,19,NULL,19-,NULL,1010,"Limited Business License",767,"Retail Sales of General Merchandise and Non-Perishable Food",2728172,RENEW,NULL,03/15/2022,05/11/2022,N,05/16/2022,05/15/2024,05/11/2022,05/11/2022,AAI,NULL,20,41.688592862,-87.681201407,"(41.688592862415135, -87.68120140652782)","2022-10-06 12:53:44",test,NULL,"2022-05-11 00:00:00","2022-05-16 00:00:00","2024-05-15 00:00:00","2022-05-11 00:00:00",NULL
2594594-20190516,2657651,426783,1,"HALLE LEONARD","HALLE LEONARD","[REDACTED FOR PRIVACY]",CHICAGO,IL,60614,43,29,43-29,18,7009,"Pharmaceutical Representative",990,"Markets / Promotes Pharmaceuticals to Health Care Professionals and Conducts Business for More than 15 Calendar Days per Year",2594594,RENEW,NULL,03/15/2019,09/09/2019,N,05/16/2019,05/15/2020,09/09/2019,09/10/2019,AAI,NULL,NULL,NULL,NULL,NULL,"2022-10-06 12:53:44",test,NULL,"2019-09-09 00:00:00","2019-05-16 00:00:00","2020-05-15 00:00:00","2019-09-10 00:00:00",NULL
2009393-20200616,2726249,349503,6,"CHICAGO CUBS BASEBALL CLUB, LLC","CHICAGO CUBS","1052 W IRVING PARK RD 1ST",CHICAGO,IL,60613,46,27,46-27,19,1003,"Commercial Garage",725,"Provide Parking Spaces For a Fee - Available and Advertised to the Public",2009393,RENEW,NULL,04/15/2020,08/07/2020,N,06/16/2020,06/15/2022,08/07/2020,05/11/2022,AAI,NULL,34,41.954562747,-87.656585054,"(41.95456274724187, -87.65658505425583)","2022-10-06 12:53:44",test,NULL,"2020-08-07 00:00:00","2020-06-16 00:00:00","2022-06-15 00:00:00","2022-05-11 00:00:00",NULL
2263778-20210616,2784227,381911,1,"A&J MUFFLERS AND BRAKES CORP.","ABY'S SHOP","4146-4148 S WESTERN AVE 1ST",CHICAGO,IL,60609,12,21,12-21,9,8340,"Motor Vehicle Services License",712,"Motor Vehicle Repair -  Engine and Transmission Work",2263778,RENEW,NULL,04/15/2021,06/10/2021,N,06/16/2021,06/15/2023,06/10/2021,06/11/2021,AAI,NULL,NULL,41.817928961,-87.6848298,"(41.81792896055436, -87.68482980036839)","2022-10-06 12:53:44",test,NULL,"2021-06-10 00:00:00","2021-06-16 00:00:00","2023-06-15 00:00:00","2021-06-11 00:00:00",NULL
2214420-20220516,2836933,55946,1,"ZAHIR M. BAJWA","PRO TECH AUTO REBUILDERS & SALES","3700 S ASHLAND AVE  MAIN",CHICAGO,IL,60609,12,30,12-30,9,8340,"Motor Vehicle Services License","711 | 712 | 793","Motor Vehicle Repair - Engine and Body Work | Motor Vehicle Repair -  Engine and Transmission Work | Sales / Car Rental / Lease of Motorized Vehicles",2214420,RENEW,NULL,03/15/2022,04/19/2022,N,05/16/2022,05/15/2024,04/19/2022,05/11/2022,AAI,NULL,NULL,41.826821149,-87.665627882,"(41.826821149302965, -87.66562788158541)","2022-10-06 12:53:44",test,NULL,"2022-04-19 00:00:00","2022-05-16 00:00:00","2024-05-15 00:00:00","2022-05-11 00:00:00",NULL
60658-20220516,2836846,41507,1,"AMERICAN MARKETING SERVICES,","AMERICAN MARKETING SERV INC","527 S WELLS ST  400",CHICAGO,IL,60607,25,49,25-49,1,1010,"Limited Business License",703,"Advertising / Marketing / Sales Office",60658,RENEW,NULL,03/15/2022,05/10/2022,N,05/16/2022,05/15/2024,05/10/2022,05/11/2022,AAI,NULL,NULL,41.875089025,-87.633499163,"(41.8750890251206, -87.63349916261295)","2022-10-06 12:53:44",test,NULL,"2022-05-10 00:00:00","2022-05-16 00:00:00","2024-05-15 00:00:00","2022-05-11 00:00:00",NULL
1304246-20210916,2799172,256096,1,"FOUR A'S FOOD INC","FOUR A'S FOOD INC","603 S SACRAMENTO BLVD",CHICAGO,IL,60612,28,41,28-41,11,1781,Tobacco,763,"Retail Sale of Tobacco",1304246,RENEW,NULL,07/15/2021,09/07/2021,N,09/16/2021,09/15/2022,09/07/2021,09/08/2021,AAC,05/11/2022,NULL,41.873635148,-87.700862238,"(41.87363514754481, -87.70086223773322)","2022-10-06 12:53:44",test,NULL,"2021-09-07 00:00:00","2021-09-16 00:00:00","2022-09-15 00:00:00","2021-09-08 00:00:00","2022-05-11 00:00:00"
79075-20220616,2842384,86474,2,"THE WOODLAWN TAP, INC.","THE WOODLAWN TAP","1168 -1172 E 55TH ST 1ST",CHICAGO,IL,60615,5,3,5-3,2,1006,"Retail Food Establishment",775,"Retail Sales of Perishable Foods",79075,RENEW,NULL,04/15/2022,05/10/2022,N,06/16/2022,06/15/2024,05/10/2022,05/11/2022,AAI,NULL,NULL,41.795173028,-87.59685084,"(41.79517302761119, -87.59685083960005)","2022-10-06 12:53:44",test,NULL,"2022-05-10 00:00:00","2022-06-16 00:00:00","2024-06-15 00:00:00","2022-05-11 00:00:00",NULL
2758114-20201215,2758114,471554,1,"DOLCE KITCHEN LLC","KALA MODERN GREEK","2523 N CLARK ST 1",CHICAGO,IL,60614,43,27,43-27,19,1006,"Retail Food Establishment",735,"Preparation of Food and Dining on Premise With Seating",2758114,ISSUE,11/09/2020,11/09/2020,11/09/2020,N,12/15/2020,12/15/2022,12/14/2020,12/15/2020,AAI,NULL,23,41.928487374,-87.642044357,"(41.928487374216466, -87.64204435669477)","2022-10-06 12:53:44",test,"2020-11-09 00:00:00","2020-11-09 00:00:00","2020-12-15 00:00:00","2022-12-15 00:00:00","2020-12-15 00:00:00",NULL
2780708-20220516,2839286,424430,4,"MEHRAB MANAGEMENT, INC.","CHACHA MACHLIWALA","6348 N ARTESIAN AVE",CHICAGO,IL,60659,50,NULL,50-,NULL,1006,"Retail Food Establishment",781,"Sale of Food Prepared Onsite With Dining Area",2780708,RENEW,NULL,03/15/2022,05/10/2022,N,05/16/2022,05/15/2024,05/10/2022,05/11/2022,AAI,NULL,43,41.997334873,-87.691239617,"(41.997334872776214, -87.69123961702296)","2022-10-06 12:53:44",test,NULL,"2022-05-10 00:00:00","2022-05-16 00:00:00","2024-05-15 00:00:00","2022-05-11 00:00:00",NULL
2818013-20211214,2818013,480884,1,"NEW CHANGE, INC","CITY MART FOOD & TOBACCO","3035 W LAWRENCE AVE",CHICAGO,IL,60625,33,NULL,33-,17,1006,"Retail Food Establishment","767 | 775 | 904","Retail Sales of General Merchandise and Non-Perishable Food | Retail Sales of Perishable Foods | Retail Sales of General Merchandise",2818013,ISSUE,11/01/2021,11/01/2021,11/05/2021,N,12/14/2021,12/15/2023,11/22/2021,12/14/2021,AAI,NULL,60,41.968372954,-87.705025162,"(41.968372953872795, -87.7050251615327)","2022-10-06 12:53:44",test,"2021-11-01 00:00:00","2021-11-05 00:00:00","2021-12-14 00:00:00","2023-12-15 00:00:00","2021-12-14 00:00:00",NULL
2496643-20220516,2838973,401230,1,"SAPORI NAPOLETANI PIZZERIA RISTORANTE & BAR","SAPORI NAPOLETANI PIZZERIA RISTORANTE E BAR","6050 N NORTHWEST HWY",CHICAGO,IL,60631,41,35,41-35,16,1475,"Consumption on Premises - Incidental Activity",638,"Consumption of Liquor on Premises",2496643,RENEW,NULL,03/15/2022,05/10/2022,N,05/16/2022,05/15/2024,05/10/2022,05/11/2022,AAI,NULL,NULL,41.991136743,-87.797214431,"(41.991136743198716, -87.79721443074477)","2022-10-06 12:53:44",test,NULL,"2022-05-10 00:00:00","2022-05-16 00:00:00","2024-05-15 00:00:00","2022-05-11 00:00:00",NULL
2289988-20131009,2289988,385607,1,"360 CONSTRUCTION LLC","360 CONSTRUCTION LLC","1830 S ALLPORT ST",CHICAGO,IL,60608,25,28,25-28,12,4404,"Regulated Business License",674,"Home Repair Services (Home Based Business)",2289988,ISSUE,10/09/2013,10/09/2013,10/09/2013,N,10/09/2013,10/15/2015,10/09/2013,10/09/2013,AAI,NULL,NULL,41.856994657,-87.657769633,"(41.85699465721177, -87.6577696330932)","2022-10-06 12:53:44",test,"2013-10-09 00:00:00","2013-10-09 00:00:00","2013-10-09 00:00:00","2015-10-15 00:00:00","2013-10-09 00:00:00",NULL
2014223-20201216,2755705,350129,1,"PRETTY NAILS OF ILLINOIS, INC.","PRETTY NAILS","7131 S JEFFERY BLVD 1 J",CHICAGO,IL,60649,5,54,5-54,3,1010,"Limited Business License",895,"Nail Services",2014223,RENEW,NULL,10/15/2020,05/10/2022,N,12/16/2020,12/15/2022,05/10/2022,05/11/2022,AAI,NULL,42,41.765189524,-87.576133104,"(41.765189524327816, -87.57613310396634)","2022-10-06 12:53:44",test,NULL,"2022-05-10 00:00:00","2020-12-16 00:00:00","2022-12-15 00:00:00","2022-05-11 00:00:00",NULL
2728450-20220516,2839736,467952,1,"Goldfinch Construction LLC","Goldfinch Construction LLC","109  1ST ST",BLOOMINGDALE,IL,60108,NULL,NULL,NULL,NULL,4404,"Regulated Business License","673 | 754 | 914","Home Repair Services | Residential Construction / Minor Home Repair Services | Roof Repair and Installation",2728450,RENEW,NULL,03/15/2022,05/10/2022,N,05/16/2022,05/15/2024,05/10/2022,05/11/2022,AAI,NULL,NULL,NULL,NULL,NULL,"2022-10-06 12:53:44",test,NULL,"2022-05-10 00:00:00","2022-05-16 00:00:00","2024-05-15 00:00:00","2022-05-11 00:00:00",NULL
2124748-20150316,2377384,315020,2,"XTREME EDGE EXCAVATING, INC.","Xtreme Edge Excavating, Inc.","751 N BOLINGBROOK  DR  10",BOLINGBROOK,IL,60440,NULL,NULL,NULL,NULL,1010,"Limited Business License",NULL,NULL,2124748,RENEW,NULL,01/16/2015,02/18/2015,N,03/16/2015,03/15/2017,02/18/2015,02/19/2015,AAI,NULL,NULL,NULL,NULL,NULL,"2022-10-06 12:53:44",test,NULL,"2015-02-18 00:00:00","2015-03-16 00:00:00","2017-03-15 00:00:00","2015-02-19 00:00:00",NULL
2846052-20220511,2846052,485612,1,"Lucero Tapia Aragon","Lucero Tapia Aragon","4100 S ASHLAND AVE OUTDOOR 575",CHICAGO,IL,60609,12,NULL,12-,NULL,1010,"Limited Business License","904 | 911","Retail Sales of General Merchandise | Retail Sales of Clothing / Accessories / Shoes",2846052,ISSUE,05/09/2022,05/09/2022,05/10/2022,N,05/11/2022,05/15/2024,05/10/2022,05/11/2022,AAI,NULL,10,41.819441426,-87.665375545,"(41.81944142629576, -87.6653755449091)","2022-10-06 12:53:44",test,"2022-05-09 00:00:00","2022-05-10 00:00:00","2022-05-11 00:00:00","2024-05-15 00:00:00","2022-05-11 00:00:00",NULL
1272252-20220616,2842596,251103,1,"WING YIP INC","WING YIP RESTAURANT","537 W 26TH ST",CHICAGO,IL,60616,11,13,11-13,9,1006,"Retail Food Establishment",775,"Retail Sales of Perishable Foods",1272252,RENEW,NULL,04/15/2022,05/10/2022,N,06/16/2022,06/15/2024,05/10/2022,05/11/2022,AAI,NULL,NULL,41.845284104,-87.641495378,"(41.845284104251014, -87.64149537830836)","2022-10-06 12:53:44",test,NULL,"2022-05-10 00:00:00","2022-06-16 00:00:00","2024-06-15 00:00:00","2022-05-11 00:00:00",NULL
6735-20210916,2798345,25490,1,"STANLEY BROWN JEWELIST, LTD.","STANLEY BROWN JEWELIST LTD","4751 N LINCOLN AVE 1ST",CHICAGO,IL,60625,47,20,47-20,19,1010,"Limited Business License",NULL,NULL,6735,RENEW,NULL,07/15/2021,08/20/2021,N,09/16/2021,09/15/2023,08/20/2021,05/11/2022,AAI,NULL,21,41.968001608,-87.688006885,"(41.968001607809484, -87.6880068847022)","2022-10-06 12:53:44",test,NULL,"2021-08-20 00:00:00","2021-09-16 00:00:00","2023-09-15 00:00:00","2022-05-11 00:00:00",NULL
2839904-20220329,2839904,483969,1,"Sybil Dufour","Sybil Dufour","1857 N NEWLAND AVE",CHICAGO,IL,60707,29,NULL,29-,NULL,7008,"Shared Housing Unit Operator",981,"Shared Housing Operator - Host of More Than One Shared Housing Unit",2839904,ISSUE,03/16/2022,03/16/2022,NULL,N,03/29/2022,04/15/2024,03/29/2022,03/29/2022,AAI,NULL,NULL,41.91429851,-87.798467911,"(41.9142985103781, -87.7984679110882)","2022-10-06 12:53:44",test,"2022-03-16 00:00:00",NULL,"2022-03-29 00:00:00","2024-04-15 00:00:00","2022-03-29 00:00:00",NULL
2690340-20190913,2690340,462712,1,"ELVIRA TECALERO DEGANTE","ELVIRA TECALERO DEGANTE","4204 W ARMITAGE AVE  2F",CHICAGO,IL,60639,35,12,35-12,25,4406,"Peddler License",769,"Peddler- Retail Sales of General Merchandise, Whole Uncut Fruits/Vegetables, Flowers, Moving Along the Public Way",2690340,ISSUE,09/13/2019,09/13/2019,09/13/2019,N,09/13/2019,09/15/2021,NULL,09/13/2019,AAI,NULL,NULL,41.917208805,-87.731694374,"(41.91720880470793, -87.7316943738535)","2022-10-06 12:53:44",test,"2019-09-13 00:00:00","2019-09-13 00:00:00","2019-09-13 00:00:00","2021-09-15 00:00:00","2019-09-13 00:00:00",NULL
2846251-20220511,2846251,461483,5,"J & H DESIGNS INC.","DCI FURNITURE","2727 W DEVON AVE 1ST",CHICAGO,IL,60659,50,29,50-29,24,1010,"Limited Business License",900,"Sale of Furniture",2846251,C_LOC,05/11/2022,05/11/2022,05/11/2022,N,05/11/2022,08/15/2023,05/11/2022,05/11/2022,AAI,NULL,43,41.997473444,-87.698286252,"(41.99747344436516, -87.69828625157092)","2022-10-06 12:53:44",test,"2022-05-11 00:00:00","2022-05-11 00:00:00","2022-05-11 00:00:00","2023-08-15 00:00:00","2022-05-11 00:00:00",NULL
1899783-20150316,2377613,330192,1,"ELIAS A. KANELLOPOULOS","RITZ CLEANERS","200 E DELAWARE PL 1",CHICAGO,IL,60611,2,13,2-13,18,1010,"Limited Business License",648,"Dry Cleaning - Drop Off Location",1899783,RENEW,NULL,01/16/2015,02/27/2015,N,03/16/2015,03/15/2017,02/27/2015,03/03/2015,AAI,NULL,NULL,41.899354739,-87.621791302,"(41.89935473944382, -87.621791301926)","2022-10-06 12:53:44",test,NULL,"2015-02-27 00:00:00","2015-03-16 00:00:00","2017-03-15 00:00:00","2015-03-03 00:00:00",NULL
2845750-20220511,2845750,485397,1,"Sudsy Laundr-o-mat Inc.","Sudsy Laundr-o-mat Inc.","5926 S KEDZIE AVE 1",CHICAGO,IL,60629,23,NULL,23-,NULL,4404,"Regulated Business License","692 | 856","Laundromat - Self Service | Vending Machines (Sodas, Candy, Chips)",2845750,ISSUE,05/02/2022,05/02/2022,05/10/2022,N,05/11/2022,05/15/2024,05/10/2022,05/11/2022,AAI,NULL,59,41.785444028,-87.703471402,"(41.78544402757018, -87.7034714024709)","2022-10-06 12:53:44",test,"2022-05-02 00:00:00","2022-05-10 00:00:00","2022-05-11 00:00:00","2024-05-15 00:00:00","2022-05-11 00:00:00",NULL
2424089-20220516,2838974,401230,1,"SAPORI NAPOLETANI PIZZERIA RISTORANTE & BAR","SAPORI NAPOLETANI PIZZERIA RISTORANTE E BAR","6050 N NORTHWEST HWY",CHICAGO,IL,60631,41,35,41-35,16,1006,"Retail Food Establishment",735,"Preparation of Food and Dining on Premise With Seating",2424089,RENEW,NULL,03/15/2022,05/10/2022,N,05/16/2022,05/15/2024,05/10/2022,05/11/2022,AAI,NULL,NULL,41.991136743,-87.797214431,"(41.991136743198716, -87.79721443074477)","2022-10-06 12:53:44",test,NULL,"2022-05-10 00:00:00","2022-05-16 00:00:00","2024-05-15 00:00:00","2022-05-11 00:00:00",NULL
79076-20220616,2842383,86474,2,"THE WOODLAWN TAP, INC.","THE WOODLAWN TAP","1168 -1172 E 55TH ST 1ST",CHICAGO,IL,60615,5,3,5-3,2,1470,Tavern,829,"Tavern - Consumption of Liquor on Premise",79076,RENEW,NULL,04/15/2022,05/10/2022,N,06/16/2022,06/15/2024,05/10/2022,05/11/2022,AAI,NULL,NULL,41.795173028,-87.59685084,"(41.79517302761119, -87.59685083960005)","2022-10-06 12:53:44",test,NULL,"2022-05-10 00:00:00","2022-06-16 00:00:00","2024-06-15 00:00:00","2022-05-11 00:00:00",NULL
2846224-20220511,2846224,485690,1,"NESS CONSTRUCTION LLC","NESS CONSTRUCTION LLC","10336 S WESTERN AVE 1ST",CHICAGO,IL,60643,19,51,19-51,22,4404,"Regulated Business License","633 | 673 | 753","Commercial Janitorial Services | Home Repair Services | Residential Cleaning Services",2846224,ISSUE,05/11/2022,05/11/2022,05/11/2022,N,05/11/2022,05/15/2024,05/11/2022,05/11/2022,AAI,NULL,20,41.705264535,-87.681733009,"(41.70526453536262, -87.68173300878972)","2022-10-06 12:53:44",test,"2022-05-11 00:00:00","2022-05-11 00:00:00","2022-05-11 00:00:00","2024-05-15 00:00:00","2022-05-11 00:00:00",NULL
2845143-20220511,2845143,484974,1,"SPINDER INDUSTRIES, LLC","SPINDER INDUSTRIES, LLC","205 N MICHIGAN AVE  810",CHICAGO,IL,60601,42,42,42-42,1,7003,"Transportation Network Provider",940,"Transportation Network Provider",2845143,ISSUE,04/19/2022,05/10/2022,05/11/2022,N,05/11/2022,05/15/2023,05/11/2022,05/11/2022,AAI,NULL,NULL,41.88590606,-87.624371837,"(41.885906059506326, -87.62437183736003)","2022-10-06 12:53:44",test,"2022-04-19 00:00:00","2022-05-11 00:00:00","2022-05-11 00:00:00","2023-05-15 00:00:00","2022-05-11 00:00:00",NULL
2328612-20220616,2843891,390372,1,"BRAZZ BRAZILIAN SPA LLC","BRAZZ BRAZILIAN SPA LLC","866 N CLARK ST 1ST 103",CHICAGO,IL,60610,2,17,2-17,18,1010,"Limited Business License",144,"Hair, Nail, and Skin Care Services",2328612,RENEW,NULL,04/15/2022,05/10/2022,N,06/16/2022,06/15/2024,05/10/2022,05/11/2022,AAI,NULL,NULL,41.898628908,-87.631444082,"(41.89862890841485, -87.63144408234774)","2022-10-06 12:53:44",test,NULL,"2022-05-10 00:00:00","2022-06-16 00:00:00","2024-06-15 00:00:00","2022-05-11 00:00:00",NULL
2511413-20210516,2779687,413393,26,"SSP AMERICA, INC.","ORANGE LINE","5700 S CICERO AVE  CB12ACB12B",CHICAGO,IL,60638,23,41,23-41,8,1475,"Consumption on Premises - Incidental Activity",638,"Consumption of Liquor on Premises",2511413,RENEW,NULL,03/15/2021,04/16/2021,N,05/16/2021,05/15/2023,04/16/2021,04/19/2021,AAI,NULL,NULL,41.789329323,-87.741645644,"(41.789329323265385, -87.74164564419637)","2022-10-06 12:53:44",test,NULL,"2021-04-16 00:00:00","2021-05-16 00:00:00","2023-05-15 00:00:00","2021-04-19 00:00:00",NULL
2289988-20211016,2806127,385607,1,"360 CONSTRUCTION LLC","360 CONSTRUCTION LLC","1830 S ALLPORT ST",CHICAGO,IL,60608,25,28,25-28,12,4404,"Regulated Business License",674,"Home Repair Services (Home Based Business)",2289988,RENEW,NULL,08/15/2021,05/11/2022,N,10/16/2021,10/15/2023,05/11/2022,05/11/2022,AAI,NULL,NULL,41.856994657,-87.657769633,"(41.85699465721177, -87.6577696330932)","2022-10-06 12:53:44",test,NULL,"2022-05-11 00:00:00","2021-10-16 00:00:00","2023-10-15 00:00:00","2022-05-11 00:00:00",NULL
2575506-20220516,2837205,207671,35,"PARK ONE, INC.","PARK ONE, INC.","600 S CLARK ST",CHICAGO,IL,60605,4,1,4-1,1,1003,"Commercial Garage",725,"Provide Parking Spaces For a Fee - Available and Advertised to the Public",2575506,RENEW,NULL,03/15/2022,07/06/2022,N,05/16/2022,05/15/2024,07/06/2022,08/08/2022,AAI,NULL,NULL,41.874461384,-87.630820444,"(41.87446138354099, -87.63082044403447)","2022-10-06 12:53:44",test,NULL,"2022-07-06 00:00:00","2022-05-16 00:00:00","2024-05-15 00:00:00","2022-08-08 00:00:00",NULL
2319968-20220416,2833778,389064,1,"JOANISCA CORP.","MIS TACOS MEXICAN FOOD","4308-4310 W MARQUETTE RD 1ST",CHICAGO,IL,60629,13,5,13-5,8,1006,"Retail Food Establishment",735,"Preparation of Food and Dining on Premise With Seating",2319968,RENEW,NULL,02/15/2022,05/03/2022,N,04/16/2022,04/15/2024,05/03/2022,05/11/2022,AAI,NULL,NULL,41.771390589,-87.730317397,"(41.77139058907717, -87.7303173969806)","2022-10-06 12:53:44",test,NULL,"2022-05-03 00:00:00","2022-04-16 00:00:00","2024-04-15 00:00:00","2022-05-11 00:00:00",NULL
1816834-20220516,2837806,315804,1,"FLILLIAN CORPORATION",7-ELEVEN,"833 W VAN BUREN ST 1",CHICAGO,IL,60607,25,6,25-6,12,1474,"Package Goods",774,"Retail Sales of Packaged Liquor",1816834,RENEW,NULL,03/15/2022,05/10/2022,N,05/16/2022,05/15/2024,05/10/2022,05/11/2022,AAI,NULL,16,41.876543847,-87.648472222,"(41.876543846685756, -87.64847222242669)","2022-10-06 12:53:44",test,NULL,"2022-05-10 00:00:00","2022-05-16 00:00:00","2024-05-15 00:00:00","2022-05-11 00:00:00",NULL
1716740-20220816,2853533,304779,1,"CHICAGO ANODIZING COMPANY","CHICAGO ANODIZING COMPANY","4112 W LAKE ST 1",CHICAGO,IL,60624,28,24,28-24,11,1009,"Manufacturing Establishments",817,"Storage or Use of Hazardous Materials (MFG)",1716740,RENEW,NULL,06/15/2022,08/05/2022,N,08/16/2022,08/15/2024,08/05/2022,08/08/2022,AAI,NULL,NULL,41.885742095,-87.728833951,"(41.88574209472369, -87.7288339509947)","2022-10-06 12:53:44",test,NULL,"2022-08-05 00:00:00","2022-08-16 00:00:00","2024-08-15 00:00:00","2022-08-08 00:00:00",NULL
2212246-20220816,2853842,334772,2,"MIGUEL ANGEL DUARTE-SOLIS","MIGUEL ANGEL DUARTE-SOLIS","5015 S DAMEN AVE 1ST",CHICAGO,IL,60609,15,15,15-15,9,4406,"Peddler License",770,"Peddler (Over 65 Years of Age) - Retail Sales of General Merchandise, Whole Uncut Fruits/Vegetables, Flowers, Moving Along the Public Way",2212246,RENEW,NULL,06/15/2022,08/08/2022,N,08/16/2022,08/15/2024,NULL,08/08/2022,AAI,NULL,NULL,41.802569456,-87.674395755,"(41.802569455769735, -87.67439575456822)","2022-10-06 12:53:44",test,NULL,"2022-08-08 00:00:00","2022-08-16 00:00:00","2024-08-15 00:00:00","2022-08-08 00:00:00",NULL
1899783-20080414,1899783,330192,1,"ELIAS A. KANELLOPOULOS","RITZ CLEANERS","200 E DELAWARE PL 1",CHICAGO,IL,60611,2,13,2-13,18,1010,"Limited Business License",NULL,NULL,1899783,ISSUE,04/14/2008,04/14/2008,04/14/2008,N,04/14/2008,03/15/2009,04/14/2008,04/14/2008,AAI,NULL,NULL,41.899354739,-87.621791302,"(41.89935473944382, -87.621791301926)","2022-10-06 12:53:44",test,"2008-04-14 00:00:00","2008-04-14 00:00:00","2008-04-14 00:00:00","2009-03-15 00:00:00","2008-04-14 00:00:00",NULL
2216000-20220516,2837940,334776,2,"IT TAKES A VILLAGE AT RIVER CITY, LLC","IT TAKES A VILLAGE AT RIVER CITY","800 S WELLS ST 1 & 2 180/90",CHICAGO,IL,60607,25,1,25-1,1,1023,"Children's Services Facility License",820,"Supervision of, and Care for, Children 0-6 Years of Age, During the Day between 6am-9pm",2216000,RENEW,NULL,03/15/2022,03/18/2022,N,05/16/2022,05/15/2024,08/05/2022,08/08/2022,AAI,NULL,NULL,41.872086352,-87.633718468,"(41.87208635220723, -87.6337184683434)","2022-10-06 12:53:44",test,NULL,"2022-03-18 00:00:00","2022-05-16 00:00:00","2024-05-15 00:00:00","2022-08-08 00:00:00",NULL
2846145-20220511,2846145,461503,2,"MICHELE TAYLOR PHOTOGRAPHY LLC","MICHELE TAYLOR PHOTOGRAPHY","1641 W IRVING PARK RD",CHICAGO,IL,60613,47,NULL,47-,NULL,1010,"Limited Business License",476,"Photography Services",2846145,C_LOC,05/10/2022,05/10/2022,05/10/2022,N,05/11/2022,08/15/2023,05/10/2022,05/11/2022,AAI,NULL,NULL,41.954157699,-87.670602863,"(41.954157699151274, -87.67060286256373)","2022-10-06 12:53:44",test,"2022-05-10 00:00:00","2022-05-10 00:00:00","2022-05-11 00:00:00","2023-08-15 00:00:00","2022-05-11 00:00:00",NULL
1934-20220916,2858250,62544,18,"HYATT CORPORATION",STETSON'S,"151 E WACKER DR  PLAZA",CHICAGO,IL,60601,42,44,42-44,1,1477,"Outdoor Patio",784,"Sale of Liquor Outdoors on Private Property",1934,RENEW,NULL,07/15/2022,08/05/2022,N,09/16/2022,09/15/2024,08/05/2022,08/08/2022,AAI,NULL,NULL,NULL,NULL,NULL,"2022-10-06 12:53:44",test,NULL,"2022-08-05 00:00:00","2022-09-16 00:00:00","2024-09-15 00:00:00","2022-08-08 00:00:00",NULL
2670953-20210616,2785534,459527,1,"LUXE B STUDIO INC.","LUXE B STUDIO","358 E 47TH ST 1",CHICAGO,IL,60653,3,11,3-11,2,1010,"Limited Business License","476 | 602 | 904 | 1089","Photography Services | Administrative Commercial Office | Retail Sales of General Merchandise | Multi-Media Services",2670953,RENEW,NULL,04/15/2021,05/12/2021,N,06/16/2021,06/15/2023,05/12/2021,11/09/2021,AAI,NULL,56,41.809482509,-87.617253367,"(41.809482509227664, -87.61725336722702)","2022-10-06 12:53:44",test,NULL,"2021-05-12 00:00:00","2021-06-16 00:00:00","2023-06-15 00:00:00","2021-11-09 00:00:00",NULL
1926-20220916,2858235,62544,3,"HYATT CORPORATION","CRYSTAL BALLROOM/PLAZA BALLROOM","151 E WACKER DR  PLAZA",CHICAGO,IL,60601,42,44,42-44,1,1475,"Consumption on Premises - Incidental Activity",638,"Consumption of Liquor on Premises",1926,RENEW,NULL,07/15/2022,08/05/2022,N,09/16/2022,09/15/2024,08/05/2022,08/08/2022,AAI,NULL,NULL,NULL,NULL,NULL,"2022-10-06 12:53:44",test,NULL,"2022-08-05 00:00:00","2022-09-16 00:00:00","2024-09-15 00:00:00","2022-08-08 00:00:00",NULL
1647969-20220916,2857738,14479,2,"THE BUTLER DID IT INC.","ENTERTAINING COMPANY","1640 W WALNUT ST",CHICAGO,IL,60612,27,33,27-33,12,1006,"Retail Food Establishment",775,"Retail Sales of Perishable Foods",1647969,RENEW,NULL,07/15/2022,08/05/2022,N,09/16/2022,09/15/2024,08/05/2022,08/08/2022,AAI,NULL,NULL,41.886238989,-87.66859588,"(41.886238989108286, -87.66859587973032)","2022-10-06 12:53:44",test,NULL,"2022-08-05 00:00:00","2022-09-16 00:00:00","2024-09-15 00:00:00","2022-08-08 00:00:00",NULL
1801891-20150316,2377359,314399,1,"MUNICIPAL MARKING DISTRIBUTORS, INC.","MUNICIPAL MARKING DISTRIBUTORS, INC.","17  GALLIGAN RD 1ST 1",GILBERTS,IL,60136,NULL,NULL,NULL,NULL,1010,"Limited Business License",NULL,NULL,1801891,RENEW,NULL,01/16/2015,02/17/2015,N,03/16/2015,03/15/2017,02/17/2015,02/18/2015,AAI,NULL,NULL,NULL,NULL,NULL,"2022-10-06 12:53:44",test,NULL,"2015-02-17 00:00:00","2015-03-16 00:00:00","2017-03-15 00:00:00","2015-02-18 00:00:00",NULL
2027538-20220616,2841688,10726,5,"GRAHAM ENTERPRISE INC","Rock N Roll BP (GEI-157)","631-647 N LA SALLE DR",CHICAGO,IL,60654,42,46,42-46,18,1006,"Retail Food Establishment",775,"Retail Sales of Perishable Foods",2027538,RENEW,NULL,04/15/2022,05/10/2022,N,06/16/2022,06/15/2024,05/10/2022,05/11/2022,AAI,NULL,NULL,41.893251198,-87.632493012,"(41.89325119846543, -87.63249301222938)","2022-10-06 12:53:44",test,NULL,"2022-05-10 00:00:00","2022-06-16 00:00:00","2024-06-15 00:00:00","2022-05-11 00:00:00",NULL
2263778-20150616,2396858,381911,1,"A&J MUFFLERS AND BRAKES CORP.","ABY'S SHOP","4146-4148 S WESTERN AVE 1ST",CHICAGO,IL,60609,12,21,12-21,9,8340,"Motor Vehicle Services License",712,"Motor Vehicle Repair -  Engine and Transmission Work",2263778,RENEW,NULL,04/15/2015,05/13/2015,N,06/16/2015,06/15/2017,05/13/2015,05/14/2015,AAI,NULL,NULL,41.817928961,-87.6848298,"(41.81792896055436, -87.68482980036839)","2022-10-06 12:53:44",test,NULL,"2015-05-13 00:00:00","2015-06-16 00:00:00","2017-06-15 00:00:00","2015-05-14 00:00:00",NULL
2463242-20211216,2816218,405700,1,"3938 AVONDALE, LLC",CRAWFORDS,"3938-3942 W SCHOOL ST 1",CHICAGO,IL,60618,30,8,30-8,17,1006,"Retail Food Establishment",735,"Preparation of Food and Dining on Premise With Seating",2463242,RENEW,NULL,10/15/2021,11/13/2021,N,12/16/2021,12/15/2023,11/13/2021,05/11/2022,AAI,NULL,NULL,41.941035014,-87.726388279,"(41.941035014150735, -87.7263882793862)","2022-10-06 12:53:44",test,NULL,"2021-11-13 00:00:00","2021-12-16 00:00:00","2023-12-15 00:00:00","2022-05-11 00:00:00",NULL
2464000-20220516,2839163,405955,1,"WON BOK SEO","1130 VALET SHOP","1130 S MICHIGAN AVE GROUND",CHICAGO,IL,60605,4,8,4-8,1,1010,"Limited Business License",648,"Dry Cleaning - Drop Off Location",2464000,RENEW,NULL,03/15/2022,05/11/2022,N,05/16/2022,05/15/2024,05/11/2022,05/11/2022,AAI,NULL,NULL,41.868305012,-87.62425305,"(41.86830501171693, -87.62425305002378)","2022-10-06 12:53:44",test,NULL,"2022-05-11 00:00:00","2022-05-16 00:00:00","2024-05-15 00:00:00","2022-05-11 00:00:00",NULL
2802865-20220816,2856174,477167,1,"JANINA PIERCE","JANINA PIERCE","[REDACTED FOR PRIVACY]",CHICAGO,IL,60657,44,NULL,44-,NULL,7009,"Pharmaceutical Representative",990,"Markets / Promotes Pharmaceuticals to Health Care Professionals and Conducts Business for More than 15 Calendar Days per Year",2802865,RENEW,NULL,06/15/2022,08/05/2022,N,08/16/2022,08/15/2023,08/05/2022,08/08/2022,AAI,NULL,NULL,NULL,NULL,NULL,"2022-10-06 12:53:44",test,NULL,"2022-08-05 00:00:00","2022-08-16 00:00:00","2023-08-15 00:00:00","2022-08-08 00:00:00",NULL
1816835-20220516,2837807,315804,1,"FLILLIAN CORPORATION",7-ELEVEN,"833 W VAN BUREN ST 1",CHICAGO,IL,60607,25,6,25-6,12,1781,Tobacco,763,"Retail Sale of Tobacco",1816835,RENEW,NULL,03/15/2022,05/10/2022,N,05/16/2022,05/15/2023,05/10/2022,05/11/2022,AAI,NULL,16,41.876543847,-87.648472222,"(41.876543846685756, -87.64847222242669)","2022-10-06 12:53:44",test,NULL,"2022-05-10 00:00:00","2022-05-16 00:00:00","2023-05-15 00:00:00","2022-05-11 00:00:00",NULL
2074468-20110111,2074468,334772,2,"MIGUEL ANGEL DUARTE-SOLIS","MIGUEL ANGEL DUARTE-SOLIS","5015 S DAMEN AVE 1ST",CHICAGO,IL,60609,15,15,15-15,9,1607,"Peddler, non-food, special",NULL,NULL,2074468,ISSUE,01/11/2011,01/11/2011,01/11/2011,N,01/11/2011,08/15/2012,NULL,01/11/2011,AAI,NULL,NULL,41.802569456,-87.674395755,"(41.802569455769735, -87.67439575456822)","2022-10-06 12:53:44",test,"2011-01-11 00:00:00","2011-01-11 00:00:00","2011-01-11 00:00:00","2012-08-15 00:00:00","2011-01-11 00:00:00",NULL
2574977-20200616,2726250,349503,8,"CHICAGO CUBS BASEBALL CLUB, LLC","CHICAGO CUBS","3701-3709 N CLIFTON AVE 1ST",CHICAGO,IL,60613,44,31,44-31,19,1003,"Commercial Garage",726,"Provide Parking Spaces For a Fee - to Residents, Tenants, Users, Employees and/or Guests (Not Available or Advertised to the Public)",2574977,RENEW,NULL,04/15/2020,08/07/2020,N,06/16/2020,06/15/2022,08/07/2020,05/11/2022,AAI,NULL,17,41.949099559,-87.657370524,"(41.94909955903016, -87.65737052401707)","2022-10-06 12:53:44",test,NULL,"2020-08-07 00:00:00","2020-06-16 00:00:00","2022-06-15 00:00:00","2022-05-11 00:00:00",NULL
2464517-20220516,2839179,406199,1,"CHICAGO AUTO WAREHOUSE LLC","CHICAGO AUTO WAREHOUSE LLC","3325 W MONTROSE AVE 1ST",CHICAGO,IL,60618,33,20,33-20,17,1010,"Limited Business License",793,"Sales / Car Rental / Lease of Motorized Vehicles",2464517,RENEW,NULL,03/15/2022,05/10/2022,N,05/16/2022,05/15/2024,05/10/2022,05/11/2022,AAI,NULL,60,41.961037447,-87.711688068,"(41.96103744663017, -87.71168806849693)","2022-10-06 12:53:44",test,NULL,"2022-05-10 00:00:00","2022-05-16 00:00:00","2024-05-15 00:00:00","2022-05-11 00:00:00",NULL
2846138-20220511,2846138,485652,1,"SRX COMPOUNDING AND WELLNESS LLC","SRX COMPOUNDING AND WELLNESS","2450 W MONTROSE AVE",CHICAGO,IL,60618,47,NULL,47-,NULL,1010,"Limited Business License",904,"Retail Sales of General Merchandise",2846138,ISSUE,05/10/2022,05/10/2022,05/10/2022,N,05/11/2022,05/15/2024,05/10/2022,05/11/2022,AAI,NULL,NULL,41.961409498,-87.690658442,"(41.96140949818069, -87.6906584419477)","2022-10-06 12:53:44",test,"2022-05-10 00:00:00","2022-05-10 00:00:00","2022-05-11 00:00:00","2024-05-15 00:00:00","2022-05-11 00:00:00",NULL
2753332-20210816,2796410,461483,4,"J & H DESIGNS INC.","DCI Family Store","7205 N WESTERN AVE",CHICAGO,IL,60645,50,NULL,50-,NULL,4404,"Regulated Business License",621,"Buying and Reselling of Used Children's Products",2753332,RENEW,NULL,06/15/2021,05/11/2022,N,08/16/2021,08/15/2023,05/11/2022,05/11/2022,AAI,NULL,NULL,42.012484467,-87.690099447,"(42.01248446728101, -87.69009944671708)","2022-10-06 12:53:44",test,NULL,"2022-05-11 00:00:00","2021-08-16 00:00:00","2023-08-15 00:00:00","2022-05-11 00:00:00",NULL
2831016-20220127,2831016,482856,1,"YOU & COMPANY NAILS SALON LLC","YOU & COMPANY NAILS SALON","4612 N LINCOLN AVE 1",CHICAGO,IL,60625,47,42,47-42,19,1010,"Limited Business License",895,"Nail Services",2831016,ISSUE,01/27/2022,01/27/2022,01/27/2022,N,01/27/2022,02/15/2024,01/27/2022,01/27/2022,AAC,08/08/2022,21,41.965208654,-87.686477407,"(41.965208653887956, -87.68647740718738)","2022-10-06 12:53:44",test,"2022-01-27 00:00:00","2022-01-27 00:00:00","2022-01-27 00:00:00","2024-02-15 00:00:00","2022-01-27 00:00:00","2022-08-08 00:00:00"
2065345-20201116,2751806,357921,1,"Imperial Auto Sales, LLC","Imperial Auto Sales","3111-3123 N KNOX AVE 1, 2",CHICAGO,IL,60641,31,32,31-32,25,1010,"Limited Business License",NULL,NULL,2065345,RENEW,NULL,09/15/2020,11/12/2020,N,11/16/2020,11/15/2022,11/12/2020,11/13/2020,AAI,NULL,NULL,NULL,NULL,NULL,"2022-10-06 12:53:44",test,NULL,"2020-11-12 00:00:00","2020-11-16 00:00:00","2022-11-15 00:00:00","2020-11-13 00:00:00",NULL
2738095-20220501,2834793,468358,1,"JUST RIGHT BOATING LLC","JUST RIGHT BOATING LLC","1201 E MADISON PARK   1",CHICAGO,IL,60615,4,23,4-23,2,7020,"Commercial Passenger Vessel",1011,"Operation of a Commercial Passenger Vessel - Under 20 Passengers",2738095,RENEW,NULL,02/15/2022,04/18/2022,N,05/01/2022,04/30/2023,05/11/2022,05/11/2022,AAI,NULL,NULL,41.802934632,-87.596641832,"(41.80293463173875, -87.59664183166099)","2022-10-06 12:53:44",test,NULL,"2022-04-18 00:00:00","2022-05-01 00:00:00","2023-04-30 00:00:00","2022-05-11 00:00:00",NULL
2027541-20220616,2841686,10726,5,"GRAHAM ENTERPRISE INC","Rock N Roll BP (GEI-157)","631-647 N LA SALLE DR",CHICAGO,IL,60654,42,46,42-46,18,1781,Tobacco,763,"Retail Sale of Tobacco",2027541,RENEW,NULL,04/15/2022,05/10/2022,N,06/16/2022,06/15/2023,05/10/2022,05/11/2022,AAI,NULL,NULL,41.893251198,-87.632493012,"(41.89325119846543, -87.63249301222938)","2022-10-06 12:53:44",test,NULL,"2022-05-10 00:00:00","2022-06-16 00:00:00","2023-06-15 00:00:00","2022-05-11 00:00:00",NULL
1092523-20021114,1092523,64603,3,"LEOPARDO COMPANIES INC.","LEOPARDO COMPANIES INC","333 W WACKER DR  250",CHICAGO,IL,60606,42,9,42-9,1,1010,"Limited Business License",NULL,NULL,1092523,ISSUE,10/18/2000,10/29/2002,10/29/2002,N,11/14/2002,11/15/2001,11/12/2002,11/14/2002,AAI,NULL,NULL,41.886025413,-87.636297703,"(41.886025412541144, -87.63629770323044)","2022-10-06 12:53:44",test,"2000-10-18 00:00:00","2002-10-29 00:00:00","2002-11-14 00:00:00","2001-11-15 00:00:00","2002-11-14 00:00:00",NULL
1937-20220916,2858241,62544,8,"HYATT CORPORATION","THE GALLERY","151 E WACKER DR  SKYWA",CHICAGO,IL,60601,42,44,42-44,1,1006,"Retail Food Establishment",775,"Retail Sales of Perishable Foods",1937,RENEW,NULL,07/15/2022,08/05/2022,N,09/16/2022,09/15/2024,08/05/2022,08/08/2022,AAI,NULL,NULL,41.887999887,-87.622565133,"(41.88799988734853, -87.62256513255957)","2022-10-06 12:53:44",test,NULL,"2022-08-05 00:00:00","2022-09-16 00:00:00","2024-09-15 00:00:00","2022-08-08 00:00:00",NULL
1924-20220916,2858232,62544,2,"HYATT CORPORATION","BISTRO 151/BAR AT 151","151 E WACKER DR  PLAZA",CHICAGO,IL,60601,42,44,42-44,1,1475,"Consumption on Premises - Incidental Activity",638,"Consumption of Liquor on Premises",1924,RENEW,NULL,07/15/2022,08/05/2022,N,09/16/2022,09/15/2024,08/05/2022,08/08/2022,AAI,NULL,NULL,NULL,NULL,NULL,"2022-10-06 12:53:44",test,NULL,"2022-08-05 00:00:00","2022-09-16 00:00:00","2024-09-15 00:00:00","2022-08-08 00:00:00",NULL
2846115-20220511,2846115,485640,1,"TOTAL HOLISTIC CREAMERY INCORPORATED","TOTAL HOLISTIC CREAMERY","1948 W NORTH AVE",CHICAGO,IL,60622,2,25,2-25,14,1006,"Retail Food Establishment",1083,"Expedited Restaurant with On-Premises Consumption",2846115,ISSUE,05/09/2022,05/10/2022,05/10/2022,N,05/11/2022,05/15/2024,05/11/2022,05/11/2022,AAI,NULL,33,41.910603319,-87.677018127,"(41.91060331921216, -87.67701812652801)","2022-10-06 12:53:44",test,"2022-05-09 00:00:00","2022-05-10 00:00:00","2022-05-11 00:00:00","2024-05-15 00:00:00","2022-05-11 00:00:00",NULL
2749813-20220916,2862196,469955,1,"TIDY CARE SOLUTIONS","TIDY CARE","73 W MONROE ST 1 101",CHICAGO,IL,60603,42,NULL,42-,NULL,1010,"Limited Business License","628 | 633 | 753 | 852","Carpet Cleaning Services | Commercial Janitorial Services | Residential Cleaning Services | Upholstery Cleaning/Repair - Onsite",2749813,RENEW,NULL,07/15/2022,08/05/2022,N,09/16/2022,09/15/2024,08/05/2022,08/08/2022,AAI,NULL,NULL,41.880591048,-87.63050913,"(41.880591047641396, -87.6305091299425)","2022-10-06 12:53:44",test,NULL,"2022-08-05 00:00:00","2022-09-16 00:00:00","2024-09-15 00:00:00","2022-08-08 00:00:00",NULL
2584071-20200216,2707736,388164,1,"BRANDI NICOLE MOORE","TAXES R US","9223 S LOOMIS ST 1ST",CHICAGO,IL,60620,21,60,21-60,22,4404,"Regulated Business License",599,"Accounting / Tax Preparation (Home Based Business)",2584071,RENEW,NULL,12/15/2019,05/11/2022,N,02/16/2020,02/15/2022,05/11/2022,05/11/2022,AAI,NULL,NULL,41.726032882,-87.657783824,"(41.726032881867454, -87.65778382440575)","2022-10-06 12:53:44",test,NULL,"2022-05-11 00:00:00","2020-02-16 00:00:00","2022-02-15 00:00:00","2022-05-11 00:00:00",NULL
34859-20211016,2804189,14933,2,"CAPITAL COUNSELORS LIMITED","MIDWAY PARK SAVER","4607 W 59TH ST",CHICAGO,IL,60629,13,25,13-25,8,1003,"Commercial Garage",725,"Provide Parking Spaces For a Fee - Available and Advertised to the Public",34859,RENEW,NULL,08/15/2021,09/30/2021,N,10/16/2021,10/15/2023,09/30/2021,05/11/2022,AAI,NULL,NULL,41.785627961,-87.738042416,"(41.78562796054326, -87.73804241580194)","2022-10-06 12:53:44",test,NULL,"2021-09-30 00:00:00","2021-10-16 00:00:00","2023-10-15 00:00:00","2022-05-11 00:00:00",NULL
2862597-20220808,2862597,487852,1,"CC STOP SHOP DISCOUNT INC.","CC STOP SHOP DISCOUNT","15 S CICERO AVE",CHICAGO,IL,60644,28,NULL,28-,11,1006,"Retail Food Establishment","767 | 775 | 904","Retail Sales of General Merchandise and Non-Perishable Food | Retail Sales of Perishable Foods | Retail Sales of General Merchandise",2862597,ISSUE,07/22/2022,07/22/2022,07/25/2022,N,08/08/2022,08/15/2024,08/05/2022,08/08/2022,AAI,NULL,NULL,41.879967095,-87.745113382,"(41.87996709490372, -87.74511338225935)","2022-10-06 12:53:44",test,"2022-07-22 00:00:00","2022-07-25 00:00:00","2022-08-08 00:00:00","2024-08-15 00:00:00","2022-08-08 00:00:00",NULL
2744511-20220816,2855928,468912,1,"EDIFEL DESIGNS LLC","EDIFEL DESIGNS LLC","2414 W GRENSHAW ST 3 APT 3W",CHICAGO,IL,60612,28,NULL,28-,NULL,4404,"Regulated Business License",719,"Professional Consulting (Home Based Business)",2744511,RENEW,NULL,06/15/2022,08/06/2022,N,08/16/2022,08/15/2024,08/06/2022,08/08/2022,AAI,NULL,NULL,41.867624826,-87.686714144,"(41.86762482606775, -87.68671414420385)","2022-10-06 12:53:44",test,NULL,"2022-08-06 00:00:00","2022-08-16 00:00:00","2024-08-15 00:00:00","2022-08-08 00:00:00",NULL
2839854-20220808,2839854,397185,2,"HOP BUTCHER FOR THE WORLD LLC","Hop Butcher For the World","4253-4259 N LINCOLN AVE",CHICAGO,IL,60618,47,NULL,47-,NULL,1474,"Package Goods",774,"Retail Sales of Packaged Liquor",2839854,ISSUE,03/15/2022,03/15/2022,03/15/2022,Y,08/08/2022,08/15/2024,08/08/2022,08/08/2022,AAI,NULL,38,41.959233094,-87.682153253,"(41.95923309357485, -87.68215325256443)","2022-10-06 12:53:44",test,"2022-03-15 00:00:00","2022-03-15 00:00:00","2022-08-08 00:00:00","2024-08-15 00:00:00","2022-08-08 00:00:00",NULL
2846248-20220511,2846248,485716,1,"B2B GLOBAL USA, INC.","EXCLUSIVE MEDICAL SUPPLIES AND SERVICES","2763 W DEVON AVE 1ST",CHICAGO,IL,60659,50,29,50-29,24,1010,"Limited Business License",748,"Rental of General Merchandise",2846248,ISSUE,05/11/2022,05/11/2022,05/11/2022,N,05/11/2022,05/15/2024,05/11/2022,05/11/2022,AAI,NULL,43,41.997452094,-87.699578283,"(41.99745209378741, -87.69957828297817)","2022-10-06 12:53:44",test,"2022-05-11 00:00:00","2022-05-11 00:00:00","2022-05-11 00:00:00","2024-05-15 00:00:00","2022-05-11 00:00:00",NULL
34396-20200716,2728854,14839,1,"T AND T MEXICAN RESTAURANT, A CORPORATION","T & T MEXICAN RESTAURANT","8929 S COMMERCIAL AVE",CHICAGO,IL,60617,10,18,10-18,4,1006,"Retail Food Establishment",775,"Retail Sales of Perishable Foods",34396,RENEW,NULL,05/15/2020,07/30/2020,N,07/16/2020,07/15/2022,07/30/2020,05/11/2022,AAI,NULL,5,41.73284708,-87.551176144,"(41.732847079711306, -87.55117614380433)","2022-10-06 12:53:44",test,NULL,"2020-07-30 00:00:00","2020-07-16 00:00:00","2022-07-15 00:00:00","2022-05-11 00:00:00",NULL
2664136-20210516,2780330,458502,1,"MICRO HOSPITALITY LLC","HOTEL BNB","1316 S MICHIGAN AVE 1",CHICAGO,IL,60605,3,39,3-39,1,4404,"Regulated Business License",676,"Hotel - 7 or More Sleeping Rooms",2664136,RENEW,NULL,03/15/2021,04/17/2021,N,05/16/2021,05/15/2023,04/17/2021,05/11/2022,AAI,NULL,NULL,41.865268631,-87.624250463,"(41.86526863075303, -87.62425046286732)","2022-10-06 12:53:44",test,NULL,"2021-04-17 00:00:00","2021-05-16 00:00:00","2023-05-15 00:00:00","2022-05-11 00:00:00",NULL
2463243-20211216,2816217,405700,1,"3938 AVONDALE, LLC",CRAWFORDS,"3938-3942 W SCHOOL ST 1",CHICAGO,IL,60618,30,8,30-8,17,1475,"Consumption on Premises - Incidental Activity",638,"Consumption of Liquor on Premises",2463243,RENEW,NULL,10/15/2021,11/13/2021,N,12/16/2021,12/15/2023,11/13/2021,05/11/2022,AAI,NULL,NULL,41.941035014,-87.726388279,"(41.941035014150735, -87.7263882793862)","2022-10-06 12:53:44",test,NULL,"2021-11-13 00:00:00","2021-12-16 00:00:00","2023-12-15 00:00:00","2022-05-11 00:00:00",NULL
2354948-20220716,2848284,354342,2,"ARTNOR CO.","ARTNOR CO.","8900 W 101ST PL","PALOS HILLS",IL,60465,NULL,NULL,NULL,NULL,4404,"Regulated Business License",673,"Home Repair Services",2354948,RENEW,NULL,05/15/2022,08/07/2022,N,07/16/2022,07/15/2024,08/07/2022,08/08/2022,AAI,NULL,NULL,NULL,NULL,NULL,"2022-10-06 12:53:44",test,NULL,"2022-08-07 00:00:00","2022-07-16 00:00:00","2024-07-15 00:00:00","2022-08-08 00:00:00",NULL
2845164-20220511,2845164,484987,1,"ZAM ZAM TRADING INC.","WEST TOWN MARKET","1934 W CHICAGO AVE",CHICAGO,IL,60622,1,NULL,1-,NULL,1781,Tobacco,"776 | 936 | 937","Retail Sales of Tobacco Products | Retail Sales of Tobacco Accessories | Retail Sales of Tobacco and Flavored Tobacco Products",2845164,ISSUE,04/19/2022,04/19/2022,04/19/2022,N,05/11/2022,05/15/2023,05/10/2022,05/11/2022,AAI,NULL,29,41.89603921,-87.675980446,"(41.89603920994652, -87.67598044604722)","2022-10-06 12:53:44",test,"2022-04-19 00:00:00","2022-04-19 00:00:00","2022-05-11 00:00:00","2023-05-15 00:00:00","2022-05-11 00:00:00",NULL
2749818-20200915,2749818,469960,1,"THE SOLE INGREDIENT CATERING LLC","THE SOLE INGREDIENT CATERING LLC","1155 E 45TH ST",CHICAGO,IL,60653,4,NULL,4-,NULL,8344,"Shared Kitchen User (Long Term)",804,"Shared Kitchen User - Long Term",2749818,ISSUE,09/10/2020,09/10/2020,09/10/2020,N,09/15/2020,10/15/2022,NULL,09/15/2020,AAI,NULL,NULL,41.813173298,-87.597050291,"(41.81317329804011, -87.59705029076214)","2022-10-06 12:53:44",test,"2020-09-10 00:00:00","2020-09-10 00:00:00","2020-09-15 00:00:00","2022-10-15 00:00:00","2020-09-15 00:00:00",NULL
2708937-20210816,2796408,461483,2,"J & H DESIGNS INC.","DCI FURNITURE","2832 W DEVON AVE",CHICAGO,IL,60659,50,NULL,50-,NULL,1010,"Limited Business License",764,"Retail Sales of Carpet and/or Furniture",2708937,RENEW,NULL,06/15/2021,07/13/2021,N,08/16/2021,08/15/2023,07/13/2021,07/13/2021,AAC,05/11/2022,43,41.997647172,-87.700924545,"(41.99764717224947, -87.70092454522485)","2022-10-06 12:53:44",test,NULL,"2021-07-13 00:00:00","2021-08-16 00:00:00","2023-08-15 00:00:00","2021-07-13 00:00:00","2022-05-11 00:00:00"
2289988-20171016,2554810,385607,1,"360 CONSTRUCTION LLC","360 CONSTRUCTION LLC","1830 S ALLPORT ST",CHICAGO,IL,60608,25,28,25-28,12,4404,"Regulated Business License",674,"Home Repair Services (Home Based Business)",2289988,RENEW,NULL,08/31/2017,11/27/2017,N,10/16/2017,10/15/2019,11/27/2017,11/28/2017,AAI,NULL,NULL,41.856994657,-87.657769633,"(41.85699465721177, -87.6577696330932)","2022-10-06 12:53:44",test,NULL,"2017-11-27 00:00:00","2017-10-16 00:00:00","2019-10-15 00:00:00","2017-11-28 00:00:00",NULL
2578790-20220616,2843618,372449,2,"COMFORT CONTROL SERVICES, INC.","Comfort Control Services, Inc.","11729 W 194TH ST",MOKENA,IL,60448,NULL,NULL,NULL,NULL,4404,"Regulated Business License","673 | 901","Home Repair Services | Heating, Ventilation and Air Conditioning Services - Residential",2578790,RENEW,NULL,04/15/2022,05/10/2022,N,06/16/2022,06/15/2024,05/10/2022,05/11/2022,AAI,NULL,NULL,NULL,NULL,NULL,"2022-10-06 12:53:44",test,NULL,"2022-05-10 00:00:00","2022-06-16 00:00:00","2024-06-15 00:00:00","2022-05-11 00:00:00",NULL
2137440-20220516,2838290,369301,1,"2114 W. DIVISION STREET, LLC","OSTERIA RUSTICANA","2114 W DIVISION ST 1ST",CHICAGO,IL,60622,2,16,2-16,14,1475,"Consumption on Premises - Incidental Activity",638,"Consumption of Liquor on Premises",2137440,RENEW,NULL,03/15/2022,05/10/2022,N,05/16/2022,05/15/2024,05/10/2022,05/11/2022,AAI,NULL,33,41.903245759,-87.680355265,"(41.90324575893042, -87.68035526472148)","2022-10-06 12:53:44",test,NULL,"2022-05-10 00:00:00","2022-05-16 00:00:00","2024-05-15 00:00:00","2022-05-11 00:00:00",NULL
2813673-20220511,2813673,480044,1,"CACAOABUNGA LLC",CACAOABUNGA,"1400 W 46TH ST 2ND 203",CHICAGO,IL,60609,15,1,15-1,9,8343,"Food - Shared Kitchen - Supplemental",803,"Operation of a Shared Kitchen - Secondary to Primary Business (Supplemental)",2813673,ISSUE,10/05/2021,10/22/2021,10/22/2021,N,05/11/2022,01/15/2024,05/10/2022,05/11/2022,AAI,NULL,NULL,41.810601294,-87.660283259,"(41.81060129421089, -87.66028325873228)","2022-10-06 12:53:44",test,"2021-10-05 00:00:00","2021-10-22 00:00:00","2022-05-11 00:00:00","2024-01-15 00:00:00","2022-05-11 00:00:00",NULL
2615800-20220501,2834108,406792,1,"CHICAGO SCENIC CHARTERS LLC","CHICAGO SCENIC CHARTERS LLC","1161  ROBEY","DOWNERS GROVE",IL,60516,NULL,NULL,NULL,NULL,7020,"Commercial Passenger Vessel",1011,"Operation of a Commercial Passenger Vessel - Under 20 Passengers",2615800,RENEW,NULL,02/15/2022,02/15/2022,N,05/01/2022,04/30/2023,05/11/2022,05/11/2022,AAI,NULL,NULL,NULL,NULL,NULL,"2022-10-06 12:53:44",test,NULL,"2022-02-15 00:00:00","2022-05-01 00:00:00","2023-04-30 00:00:00","2022-05-11 00:00:00",NULL
2263778-20170616,2527325,381911,1,"A&J MUFFLERS AND BRAKES CORP.","ABY'S SHOP","4146-4148 S WESTERN AVE 1ST",CHICAGO,IL,60609,12,21,12-21,9,8340,"Motor Vehicle Services License",712,"Motor Vehicle Repair -  Engine and Transmission Work",2263778,RENEW,NULL,04/15/2017,05/09/2017,N,06/16/2017,06/15/2019,05/09/2017,05/10/2017,AAI,NULL,NULL,41.817928961,-87.6848298,"(41.81792896055436, -87.68482980036839)","2022-10-06 12:53:44",test,NULL,"2017-05-09 00:00:00","2017-06-16 00:00:00","2019-06-15 00:00:00","2017-05-10 00:00:00",NULL
61236-20220516,2837036,86347,1,"S&W CHICAGO, L.L.C.","SMITH & WOLLENSKY","318 N STATE ST LL + 1",CHICAGO,IL,60654,42,27,42-27,18,1475,"Consumption on Premises - Incidental Activity",638,"Consumption of Liquor on Premises",61236,RENEW,NULL,03/15/2022,07/14/2022,N,05/16/2022,05/15/2024,07/14/2022,08/08/2022,AAI,NULL,NULL,41.888040594,-87.628170663,"(41.88804059387871, -87.62817066340388)","2022-10-06 12:53:44",test,NULL,"2022-07-14 00:00:00","2022-05-16 00:00:00","2024-05-15 00:00:00","2022-08-08 00:00:00",NULL
25132-20210316,2767792,30221,1,"TEMPERATURE ENGINEERING INC.","TEMPERATURE ENG","7475 S MADISON ST",WILLOWBROOK,IL,60521,NULL,NULL,NULL,NULL,1010,"Limited Business License","901 | 902","Heating, Ventilation and Air Conditioning Services - Residential | Heating, Ventilation and Air Conditioning Services - Commercial",25132,RENEW,NULL,01/15/2021,02/04/2021,N,03/16/2021,03/15/2023,02/04/2021,05/11/2022,AAI,NULL,NULL,NULL,NULL,NULL,"2022-10-06 12:53:44",test,NULL,"2021-02-04 00:00:00","2021-03-16 00:00:00","2023-03-15 00:00:00","2022-05-11 00:00:00",NULL
2846230-20220511,2846230,388164,1,"BRANDI NICOLE MOORE","TAXES R US","9223 S LOOMIS ST 1ST",CHICAGO,IL,60620,21,60,21-60,22,4404,"Regulated Business License",599,"Accounting / Tax Preparation (Home Based Business)",2846230,ISSUE,05/11/2022,05/11/2022,05/11/2022,N,05/11/2022,02/15/2024,05/11/2022,05/11/2022,AAI,NULL,NULL,41.726032882,-87.657783824,"(41.726032881867454, -87.65778382440575)","2022-10-06 12:53:44",test,"2022-05-11 00:00:00","2022-05-11 00:00:00","2022-05-11 00:00:00","2024-02-15 00:00:00","2022-05-11 00:00:00",NULL
2270588-20210716,2789675,382742,1,"ALTUS RECEIVABLES MANAGEMENT, INC.","Altus Receivables Management, Inc.","2400  VETERANS BLVD  300",KENNER,LA,70062,NULL,NULL,NULL,NULL,4404,"Regulated Business License",912,"Debt Collecting - Administrative Commercial Office",2270588,RENEW,NULL,05/15/2021,06/28/2021,N,07/16/2021,07/15/2023,06/28/2021,06/29/2021,AAC,05/11/2022,NULL,NULL,NULL,NULL,"2022-10-06 12:53:44",test,NULL,"2021-06-28 00:00:00","2021-07-16 00:00:00","2023-07-15 00:00:00","2021-06-29 00:00:00","2022-05-11 00:00:00"
1899783-20130316,2228443,330192,1,"ELIAS A. KANELLOPOULOS","RITZ CLEANERS","200 E DELAWARE PL 1",CHICAGO,IL,60611,2,13,2-13,18,1010,"Limited Business License",648,"Dry Cleaning - Drop Off Location",1899783,RENEW,NULL,01/17/2013,03/04/2013,N,03/16/2013,03/15/2015,03/04/2013,03/05/2013,AAI,NULL,NULL,41.899354739,-87.621791302,"(41.89935473944382, -87.621791301926)","2022-10-06 12:53:44",test,NULL,"2013-03-04 00:00:00","2013-03-16 00:00:00","2015-03-15 00:00:00","2013-03-05 00:00:00",NULL
2204799-20220516,2836835,38685,2,"U.S.WATERPROOFING & CONSTRUCTION CO","U.S. WATERPROOFING & CONSTRUCTION CO.","5650  MEADOWBROOK","ROLLING MEADOWS",IL,60008,NULL,NULL,NULL,NULL,4404,"Regulated Business License",673,"Home Repair Services",2204799,RENEW,NULL,03/15/2022,05/10/2022,N,05/16/2022,05/15/2024,05/10/2022,05/11/2022,AAI,NULL,NULL,NULL,NULL,NULL,"2022-10-06 12:53:44",test,NULL,"2022-05-10 00:00:00","2022-05-16 00:00:00","2024-05-15 00:00:00","2022-05-11 00:00:00",NULL
2564426-20220216,2826383,422754,1,"EL RANCHITO TACOS CORP.","EL RANCHITO TACOS","2300 S THROOP ST",CHICAGO,IL,60608,25,2,25-2,12,4405,"Mobile Food License",734,"Preparation and Sale of Food (ONLY) from a Mobile Food Truck (Mobile Food Preparer)",2564426,RENEW,NULL,12/15/2021,01/10/2022,N,02/16/2022,02/15/2024,03/08/2022,05/11/2022,AAI,NULL,NULL,41.850451024,-87.658797856,"(41.85045102427, -87.65879785567869)","2022-10-06 12:53:44",test,NULL,"2022-01-10 00:00:00","2022-02-16 00:00:00","2024-02-15 00:00:00","2022-05-11 00:00:00",NULL
2617270-20220916,2857497,1611,6,"TTX COMPANY","TTX COMPANY","361 W 47TH ST",CHICAGO,IL,60609,3,NULL,3-,NULL,1010,"Limited Business License",708,"Miscellaneous Commercial Services",2617270,RENEW,NULL,07/15/2022,08/05/2022,N,09/16/2022,09/15/2024,08/05/2022,08/08/2022,AAI,NULL,NULL,41.808938504,-87.635719386,"(41.80893850393111, -87.63571938599527)","2022-10-06 12:53:44",test,NULL,"2022-08-05 00:00:00","2022-09-16 00:00:00","2024-09-15 00:00:00","2022-08-08 00:00:00",NULL
1816833-20220516,2837808,315804,1,"FLILLIAN CORPORATION",7-ELEVEN,"833 W VAN BUREN ST 1",CHICAGO,IL,60607,25,6,25-6,12,1006,"Retail Food Establishment",775,"Retail Sales of Perishable Foods",1816833,RENEW,NULL,03/15/2022,05/10/2022,N,05/16/2022,05/15/2024,05/10/2022,05/11/2022,AAI,NULL,16,41.876543847,-87.648472222,"(41.876543846685756, -87.64847222242669)","2022-10-06 12:53:44",test,NULL,"2022-05-10 00:00:00","2022-05-16 00:00:00","2024-05-15 00:00:00","2022-05-11 00:00:00",NULL
2289988-20151016,2422704,385607,1,"360 CONSTRUCTION LLC","360 CONSTRUCTION LLC","1830 S ALLPORT ST",CHICAGO,IL,60608,25,28,25-28,12,4404,"Regulated Business License",674,"Home Repair Services (Home Based Business)",2289988,RENEW,NULL,08/15/2015,10/29/2015,N,10/16/2015,10/15/2017,10/29/2015,10/29/2015,AAI,NULL,NULL,41.856994657,-87.657769633,"(41.85699465721177, -87.6577696330932)","2022-10-06 12:53:44",test,NULL,"2015-10-29 00:00:00","2015-10-16 00:00:00","2017-10-15 00:00:00","2015-10-29 00:00:00",NULL
2758229-20201215,2758229,471631,1,"TAQUERIA CHINGON LLC","TAQUERIA CHINGON LLC","2234 N WESTERN AVE",CHICAGO,IL,60647,1,NULL,1-,NULL,1006,"Retail Food Establishment","781 | 1050","Sale of Food Prepared Onsite With Dining Area | Preparation and Sale of Coffee and/or Drinks",2758229,ISSUE,11/12/2020,11/12/2020,11/17/2020,N,12/15/2020,12/15/2022,12/14/2020,12/15/2020,AAI,NULL,33,41.922650691,-87.687719672,"(41.92265069127367, -87.68771967162458)","2022-10-06 12:53:44",test,"2020-11-12 00:00:00","2020-11-17 00:00:00","2020-12-15 00:00:00","2022-12-15 00:00:00","2020-12-15 00:00:00",NULL
1645112-20210416,2772274,36700,2,"CUSTOM ENVIROMENTAL INC","CUSTOM ENVIROMENTAL INC.","477  SUNNYSIDE AVE",GURNEE,IL,60031,NULL,NULL,NULL,NULL,1010,"Limited Business License",NULL,NULL,1645112,RENEW,NULL,02/15/2021,03/14/2021,N,04/16/2021,04/15/2023,03/14/2021,03/15/2021,AAI,NULL,NULL,NULL,NULL,NULL,"2022-10-06 12:53:44",test,NULL,"2021-03-14 00:00:00","2021-04-16 00:00:00","2023-04-15 00:00:00","2021-03-15 00:00:00",NULL
1121869-20040216,1452052,23009,3,"CROWN BUILDING CONTRACTORS, INC.","CROWN BUILDING CONTRACTORS, INC.","15  SPINNING WHEEL RD  34",HINSDALE,IL,60521,NULL,NULL,NULL,NULL,1011,"Home Repair",NULL,NULL,1121869,RENEW,NULL,12/15/2003,01/12/2004,N,02/16/2004,02/15/2005,12/22/2003,05/09/2006,AAI,NULL,NULL,NULL,NULL,NULL,"2022-10-06 12:53:44",test,NULL,"2004-01-12 00:00:00","2004-02-16 00:00:00","2005-02-15 00:00:00","2006-05-09 00:00:00",NULL
24454-20040216,1453693,30050,1,"RONALD J WASHINGTON","HART REMODELING & HOME IMPROVE","3831 W 178 ST  1","COUNTRY CLUB HILLS",IL,60478,NULL,NULL,NULL,NULL,1011,"Home Repair",NULL,NULL,24454,RENEW,NULL,12/15/2003,01/21/2004,N,02/16/2004,02/15/2005,12/22/2003,07/07/2006,AAI,NULL,NULL,NULL,NULL,NULL,"2022-10-06 12:53:44",test,NULL,"2004-01-21 00:00:00","2004-02-16 00:00:00","2005-02-15 00:00:00","2006-07-07 00:00:00",NULL
2713180-20220216,2826983,466417,1,"ALAN JOSEPH SHOP LLC","ALAN JOSEPH SHOP LLC","5320 N SHERIDAN RD  2509",CHICAGO,IL,60640,48,NULL,48-,NULL,4404,"Regulated Business License",722,"Online Sales (Home Based Business)",2713180,RENEW,NULL,12/15/2021,08/06/2022,N,02/16/2022,02/15/2024,08/06/2022,08/08/2022,AAI,NULL,NULL,41.978888434,-87.655194639,"(41.978888433706665, -87.65519463880716)","2022-10-06 12:53:44",test,NULL,"2022-08-06 00:00:00","2022-02-16 00:00:00","2024-02-15 00:00:00","2022-08-08 00:00:00",NULL
2846126-20220511,2846126,398666,3,"SH ENTREPRISES, LLC","Chicago Metro North","4750 N SHERIDAN RD 4TH FLOOR 433",CHICAGO,IL,60640,46,NULL,46-,NULL,1010,"Limited Business License",464,"Provide Home Health Care Services",2846126,C_LOC,05/09/2022,05/09/2022,05/10/2022,N,05/11/2022,06/15/2023,05/10/2022,05/11/2022,AAI,NULL,34,41.96875259,-87.654963263,"(41.96875258991914, -87.65496326268006)","2022-10-06 12:53:44",test,"2022-05-09 00:00:00","2022-05-10 00:00:00","2022-05-11 00:00:00","2023-06-15 00:00:00","2022-05-11 00:00:00",NULL
2289988-20191016,2687515,385607,1,"360 CONSTRUCTION LLC","360 CONSTRUCTION LLC","1830 S ALLPORT ST",CHICAGO,IL,60608,25,28,25-28,12,4404,"Regulated Business License",674,"Home Repair Services (Home Based Business)",2289988,RENEW,NULL,08/15/2019,11/07/2019,N,10/16/2019,10/15/2021,11/07/2019,11/07/2019,AAI,NULL,NULL,41.856994657,-87.657769633,"(41.85699465721177, -87.6577696330932)","2022-10-06 12:53:44",test,NULL,"2019-11-07 00:00:00","2019-10-16 00:00:00","2021-10-15 00:00:00","2019-11-07 00:00:00",NULL
16652-20040216,1457305,51767,1,"TIP TOP BUILDERS INC","TIP TOP BUILDERS INC","8255  KIMBAL   1ST",SKOKIE,IL,60076,NULL,NULL,NULL,NULL,1010,"Limited Business License",NULL,NULL,16652,RENEW,NULL,12/15/2003,06/18/2009,N,02/16/2004,02/15/2005,12/22/2003,06/19/2009,AAI,NULL,NULL,NULL,NULL,NULL,"2022-10-06 12:53:44",test,NULL,"2009-06-18 00:00:00","2004-02-16 00:00:00","2005-02-15 00:00:00","2009-06-19 00:00:00",NULL
2807513-20220808,2807513,478046,1,"NEXT GENERATION GROUP CORP.","SONYAE'S CARING HANDS","8625 S COTTAGE GROVE AVE",CHICAGO,IL,60619,8,40,8-40,6,1023,"Children's Services Facility License","823 | 825","Supervision of, and Care for, Children 2-6 Years of Age, During the Day between 6am-9pm | Supervision of, and Care for, Children Under 2 Years of Age, During the Day between 6am-9pm",2807513,ISSUE,08/16/2021,03/17/2022,03/17/2022,N,08/08/2022,08/15/2024,08/08/2022,08/08/2022,AAI,NULL,51,41.737699471,-87.60470701,"(41.737699470982605, -87.60470700986774)","2022-10-06 12:53:44",test,"2021-08-16 00:00:00","2022-03-17 00:00:00","2022-08-08 00:00:00","2024-08-15 00:00:00","2022-08-08 00:00:00",NULL
1476068-20080916,1918051,64603,4,"LEOPARDO COMPANIES INC.","LEOPARDO COMPANIES INC","333 W WACKER DR 2ND 250",CHICAGO,IL,60606,42,NULL,42-,1,1010,"Limited Business License",NULL,NULL,1476068,RENEW,NULL,07/15/2008,08/28/2008,N,09/16/2008,09/15/2010,08/28/2008,08/29/2008,AAI,NULL,NULL,41.886025413,-87.636297703,"(41.886025412541144, -87.63629770323044)","2022-10-06 12:53:44",test,NULL,"2008-08-28 00:00:00","2008-09-16 00:00:00","2010-09-15 00:00:00","2008-08-29 00:00:00",NULL
2511413-20190516,2657182,413393,26,"SSP AMERICA, INC.","ORANGE LINE","5700 S CICERO AVE  CB12ACB12B",CHICAGO,IL,60638,23,41,23-41,8,1475,"Consumption on Premises - Incidental Activity",638,"Consumption of Liquor on Premises",2511413,RENEW,NULL,03/15/2019,05/01/2019,N,05/16/2019,07/15/2021,05/01/2019,05/02/2019,AAI,NULL,NULL,41.789329323,-87.741645644,"(41.789329323265385, -87.74164564419637)","2022-10-06 12:53:44",test,NULL,"2019-05-01 00:00:00","2019-05-16 00:00:00","2021-07-15 00:00:00","2019-05-02 00:00:00",NULL
2616260-20220816,2855512,429538,1,"VIP NAILS & SPA CHICAGO, INC.","VIP NAILS & SPA","1514 S WABASH AVE",CHICAGO,IL,60605,3,14,3-14,1,1010,"Limited Business License",895,"Nail Services",2616260,RENEW,NULL,06/15/2022,08/08/2022,N,08/16/2022,08/15/2024,08/08/2022,08/08/2022,AAI,NULL,NULL,41.861477991,-87.625839756,"(41.8614779911775, -87.6258397557745)","2022-10-06 12:53:44",test,NULL,"2022-08-08 00:00:00","2022-08-16 00:00:00","2024-08-15 00:00:00","2022-08-08 00:00:00",NULL
2589133-20220616,2844431,426197,1,"ANKEDO'S STYLE LLC","ANKEDO'S STYLE LLC","2024 W MONTROSE AVE",CHICAGO,IL,60618,47,28,47-28,19,1010,"Limited Business License",894,"Hair Services",2589133,RENEW,NULL,04/15/2022,05/10/2022,N,06/16/2022,06/15/2024,05/10/2022,05/11/2022,AAI,NULL,31,41.961553456,-87.680025365,"(41.96155345600176, -87.68002536541813)","2022-10-06 12:53:44",test,NULL,"2022-05-10 00:00:00","2022-06-16 00:00:00","2024-06-15 00:00:00","2022-05-11 00:00:00",NULL
1304245-20200916,2748969,256096,1,"FOUR A'S FOOD INC","FOUR A'S FOOD INC","603 S SACRAMENTO BLVD",CHICAGO,IL,60612,28,41,28-41,11,1006,"Retail Food Establishment",775,"Retail Sales of Perishable Foods",1304245,RENEW,NULL,08/18/2020,08/21/2020,N,09/16/2020,09/15/2022,08/21/2020,08/24/2020,AAC,05/11/2022,NULL,41.873635148,-87.700862238,"(41.87363514754481, -87.70086223773322)","2022-10-06 12:53:44",test,NULL,"2020-08-21 00:00:00","2020-09-16 00:00:00","2022-09-15 00:00:00","2020-08-24 00:00:00","2022-05-11 00:00:00"
2137439-20220516,2838289,369301,1,"2114 W. DIVISION STREET, LLC","OSTERIA RUSTICANA","2114 W DIVISION ST 1ST",CHICAGO,IL,60622,2,16,2-16,14,1006,"Retail Food Establishment",775,"Retail Sales of Perishable Foods",2137439,RENEW,NULL,03/15/2022,05/10/2022,N,05/16/2022,05/15/2024,05/10/2022,05/11/2022,AAI,NULL,33,41.903245759,-87.680355265,"(41.90324575893042, -87.68035526472148)","2022-10-06 12:53:44",test,NULL,"2022-05-10 00:00:00","2022-05-16 00:00:00","2024-05-15 00:00:00","2022-05-11 00:00:00",NULL
2840595-20220511,2840595,392906,25,"FOXTROT VENTURES, INCORPORATED",Foxtrot,"3649 N CLARK ST 1",CHICAGO,IL,60613,44,NULL,44-,NULL,1477,"Outdoor Patio",784,"Sale of Liquor Outdoors on Private Property",2840595,ISSUE,03/30/2022,04/01/2022,03/30/2022,N,05/11/2022,05/15/2024,05/11/2022,05/11/2022,AAI,NULL,17,41.948480847,-87.657372263,"(41.94848084659548, -87.65737226343279)","2022-10-06 12:53:44",test,"2022-03-30 00:00:00","2022-03-30 00:00:00","2022-05-11 00:00:00","2024-05-15 00:00:00","2022-05-11 00:00:00",NULL
1476068-20061116,1753620,64603,4,"LEOPARDO COMPANIES INC.","LEOPARDO COMPANIES INC","333 W WACKER DR 2ND 250",CHICAGO,IL,60606,42,NULL,42-,1,1010,"Limited Business License",NULL,NULL,1476068,RENEW,NULL,09/20/2006,11/03/2006,N,11/16/2006,11/15/2007,11/03/2006,11/06/2006,AAI,NULL,NULL,41.886025413,-87.636297703,"(41.886025412541144, -87.63629770323044)","2022-10-06 12:53:44",test,NULL,"2006-11-03 00:00:00","2006-11-16 00:00:00","2007-11-15 00:00:00","2006-11-06 00:00:00",NULL
2600655-20220616,2844533,427731,1,"THE GILDED LILY LLC","THE GILDED LILY LLC","2741 N SPAULDING AVE",CHICAGO,IL,60647,35,NULL,35-,NULL,1010,"Limited Business License","144 | 894 | 904","Hair, Nail, and Skin Care Services | Hair Services | Retail Sales of General Merchandise",2600655,RENEW,NULL,04/15/2022,05/10/2022,N,06/16/2022,06/15/2024,05/10/2022,05/11/2022,AAI,NULL,NULL,41.931181349,-87.710140766,"(41.931181348538416, -87.71014076619093)","2022-10-06 12:53:44",test,NULL,"2022-05-10 00:00:00","2022-06-16 00:00:00","2024-06-15 00:00:00","2022-05-11 00:00:00",NULL
2464244-20220116,2821608,406023,1,"MAK FUEL & MINI MART, INC.","AMSTAR FUEL & MINI MART","1900 S PULASKI RD 1ST",CHICAGO,IL,60623,24,45,24-45,10,1781,Tobacco,"936 | 937","Retail Sales of Tobacco Accessories | Retail Sales of Tobacco and Flavored Tobacco Products",2464244,RENEW,NULL,11/15/2021,04/27/2022,N,01/16/2022,01/15/2023,04/27/2022,05/11/2022,AAI,NULL,NULL,41.854983132,-87.724996483,"(41.85498313235789, -87.72499648315791)","2022-10-06 12:53:44",test,NULL,"2022-04-27 00:00:00","2022-01-16 00:00:00","2023-01-15 00:00:00","2022-05-11 00:00:00",NULL
1196871-20040216,1463648,222193,1,"TARGET AIRE INC","TARGET AIRE INC","31632 N ELLIS   105",VOLO,IL,60073,NULL,NULL,NULL,NULL,1010,"Limited Business License",NULL,NULL,1196871,RENEW,NULL,12/15/2003,02/04/2004,N,02/16/2004,02/15/2005,12/22/2003,05/11/2010,AAI,NULL,NULL,NULL,NULL,NULL,"2022-10-06 12:53:44",test,NULL,"2004-02-04 00:00:00","2004-02-16 00:00:00","2005-02-15 00:00:00","2010-05-11 00:00:00",NULL
21050-20220716,2846974,63320,2,"DANA LIQUORS, INC.","ROTHSCHILD LIQUORS","124 E PERSHING RD 1ST",CHICAGO,IL,60653,3,33,3-33,2,1781,Tobacco,763,"Retail Sale of Tobacco",21050,RENEW,NULL,05/15/2022,08/05/2022,N,07/16/2022,07/15/2023,08/05/2022,08/08/2022,AAI,NULL,NULL,41.823879687,-87.622029246,"(41.82387968683469, -87.62202924559631)","2022-10-06 12:53:44",test,NULL,"2022-08-05 00:00:00","2022-07-16 00:00:00","2023-07-15 00:00:00","2022-08-08 00:00:00",NULL
2263778-20130612,2263778,381911,1,"A&J MUFFLERS AND BRAKES CORP.","ABY'S SHOP","4146-4148 S WESTERN AVE 1ST",CHICAGO,IL,60609,12,21,12-21,9,8340,"Motor Vehicle Services License",712,"Motor Vehicle Repair -  Engine and Transmission Work",2263778,ISSUE,NULL,06/11/2013,06/11/2013,N,06/12/2013,06/15/2015,06/11/2013,06/12/2013,AAI,NULL,NULL,41.817928961,-87.6848298,"(41.81792896055436, -87.68482980036839)","2022-10-06 12:53:44",test,NULL,"2013-06-11 00:00:00","2013-06-12 00:00:00","2015-06-15 00:00:00","2013-06-12 00:00:00",NULL
2617141-20220816,2855559,429977,1,"MA DOLORES GONZALEZ","SALON LOLIS","9958 S COMMERCIAL AVE 1ST",CHICAGO,IL,60617,10,7,10-7,4,1010,"Limited Business License","894 | 904 | 956","Hair Services | Retail Sales of General Merchandise | Provide Waxing Services",2617141,RENEW,NULL,06/15/2022,08/06/2022,N,08/16/2022,08/15/2024,08/06/2022,08/08/2022,AAI,NULL,NULL,41.713715969,-87.551091672,"(41.71371596887936, -87.55109167232813)","2022-10-06 12:53:44",test,NULL,"2022-08-06 00:00:00","2022-08-16 00:00:00","2024-08-15 00:00:00","2022-08-08 00:00:00",NULL
2511413-20170511,2511413,413393,26,"SSP AMERICA, INC.","ORANGE LINE","5700 S CICERO AVE  CB12ACB12B",CHICAGO,IL,60638,23,41,23-41,8,1475,"Consumption on Premises - Incidental Activity",638,"Consumption of Liquor on Premises",2511413,ISSUE,02/01/2017,03/27/2017,03/27/2017,N,05/11/2017,05/15/2019,05/11/2017,05/11/2017,AAI,NULL,NULL,41.789329323,-87.741645644,"(41.789329323265385, -87.74164564419637)","2022-10-06 12:53:44",test,"2017-02-01 00:00:00","2017-03-27 00:00:00","2017-05-11 00:00:00","2019-05-15 00:00:00","2017-05-11 00:00:00",NULL
2179584-20140816,2340090,374703,1,"SAE INSTITUTE OF TECHNOLOGY (CHICAGO) CORP.","SAE INSTITUTE","820 N ORLEANS ST 1ST 125-135",CHICAGO,IL,60610,27,NULL,27-,NULL,1010,"Limited Business License",NULL,NULL,2179584,RENEW,NULL,06/15/2014,06/26/2014,N,08/16/2014,08/15/2016,06/26/2014,10/28/2015,AAI,NULL,NULL,41.897338047,-87.63734543,"(41.897338047455214, -87.63734543001038)","2022-10-06 12:53:44",test,NULL,"2014-06-26 00:00:00","2014-08-16 00:00:00","2016-08-15 00:00:00","2015-10-28 00:00:00",NULL
1046444-20220616,2842419,204116,1,"REAL TASTE NOODLE MFG, INC","REAL TASTE NOODLE MFG","1838 S CANAL ST",CHICAGO,IL,60616,25,14,25-14,12,1007,"Wholesale Food Establishment",864,"Wholesale Food Sales",1046444,RENEW,NULL,04/15/2022,05/10/2022,N,06/16/2022,06/15/2024,05/10/2022,05/11/2022,AAI,NULL,NULL,41.856544327,-87.639043324,"(41.856544327269404, -87.63904332403165)","2022-10-06 12:53:44",test,NULL,"2022-05-10 00:00:00","2022-06-16 00:00:00","2024-06-15 00:00:00","2022-05-11 00:00:00",NULL
21779-20150316,2375554,29359,1,"L MARSHALL INC","L MARSHALL INC","2100  LEHIGH AVE  1ST",GLENVIEW,IL,60025,NULL,NULL,NULL,NULL,1010,"Limited Business License",NULL,NULL,21779,RENEW,NULL,01/16/2015,02/18/2015,N,03/16/2015,03/15/2017,02/18/2015,02/19/2015,AAI,NULL,NULL,NULL,NULL,NULL,"2022-10-06 12:53:44",test,NULL,"2015-02-18 00:00:00","2015-03-16 00:00:00","2017-03-15 00:00:00","2015-02-19 00:00:00",NULL
1273915-20040216,1465322,251852,1,"PAPPAS TRANSPORT INC.","PAPPAS CONSTRUCTION CO.","8605 1/2 N LINCOLN AVE  B","MORTON GROVE",IL,60053,NULL,NULL,NULL,NULL,1010,"Limited Business License",NULL,NULL,1273915,RENEW,NULL,12/15/2003,06/22/2007,N,02/16/2004,02/15/2005,12/22/2003,06/22/2007,AAI,NULL,NULL,NULL,NULL,NULL,"2022-10-06 12:53:44",test,NULL,"2007-06-22 00:00:00","2004-02-16 00:00:00","2005-02-15 00:00:00","2007-06-22 00:00:00",NULL
2293835-20220516,2838575,386117,1,"FLYING SQUIRREL INDUSTRIES LLC","SLIPPERY SLOPE","2357 N MILWAUKEE AVE 1 & 2",CHICAGO,IL,60647,1,10,1-10,14,1006,"Retail Food Establishment",736,"Preparation of Food, Coffee or Drinks",2293835,RENEW,NULL,03/15/2022,05/11/2022,N,05/16/2022,05/15/2024,05/11/2022,05/11/2022,AAI,NULL,NULL,41.924150306,-87.699150883,"(41.92415030562805, -87.69915088269197)","2022-10-06 12:53:44",test,NULL,"2022-05-11 00:00:00","2022-05-16 00:00:00","2024-05-15 00:00:00","2022-05-11 00:00:00",NULL
1305272-20040216,1466144,256534,1,"D T N MARKET ACCESS, LLC","D T N MARKET ACCESS , LLC","9110 W DODGE RD  200",OMAHA,NE,68114,NULL,NULL,NULL,NULL,1010,"Limited Business License",NULL,NULL,1305272,RENEW,NULL,12/15/2003,03/23/2004,N,02/16/2004,02/15/2005,12/22/2003,12/26/2007,AAI,NULL,NULL,NULL,NULL,NULL,"2022-10-06 12:53:44",test,NULL,"2004-03-23 00:00:00","2004-02-16 00:00:00","2005-02-15 00:00:00","2007-12-26 00:00:00",NULL
2511412-20210516,2779688,413393,26,"SSP AMERICA, INC.","ORANGE LINE","5700 S CICERO AVE  CB12ACB12B",CHICAGO,IL,60638,23,41,23-41,8,1006,"Retail Food Establishment",735,"Preparation of Food and Dining on Premise With Seating",2511412,RENEW,NULL,03/15/2021,04/16/2021,N,05/16/2021,05/15/2023,04/16/2021,04/19/2021,AAI,NULL,NULL,41.789329323,-87.741645644,"(41.789329323265385, -87.74164564419637)","2022-10-06 12:53:44",test,NULL,"2021-04-16 00:00:00","2021-05-16 00:00:00","2023-05-15 00:00:00","2021-04-19 00:00:00",NULL
2846240-20220511,2846240,472572,2,"SPACED OUT STUDIO LTD.","Spaced Out Studio/ SharkGravy","3256 W BRYN MAWR AVE 1",CHICAGO,IL,60659,39,NULL,39-,NULL,1010,"Limited Business License",900,"Sale of Furniture",2846240,ISSUE,05/11/2022,05/11/2022,05/11/2022,N,05/11/2022,01/15/2023,05/11/2022,05/11/2022,AAI,NULL,NULL,41.983150562,-87.711163354,"(41.98315056155403, -87.71116335426046)","2022-10-06 12:53:44",test,"2022-05-11 00:00:00","2022-05-11 00:00:00","2022-05-11 00:00:00","2023-01-15 00:00:00","2022-05-11 00:00:00",NULL
1804341-20211116,2810606,315336,1,"SAI KRIPA IN CHICAGO INC.","CANDY'S GROCERY","1366 W OHIO ST 1",CHICAGO,IL,60642,1,41,1-41,12,1781,Tobacco,763,"Retail Sale of Tobacco",1804341,RENEW,NULL,09/15/2021,05/11/2022,N,11/16/2021,11/15/2022,05/11/2022,05/11/2022,AAI,NULL,NULL,41.892599705,-87.662148696,"(41.89259970453201, -87.66214869596973)","2022-10-06 12:53:44",test,NULL,"2022-05-11 00:00:00","2021-11-16 00:00:00","2022-11-15 00:00:00","2022-05-11 00:00:00",NULL
2863326-20220808,2863326,488350,1,"LUNA'S ENLIGHTENMENT LLC","LUNA ENLIGHTENMENT","2959 E 88TH ST",CHICAGO,IL,60617,10,18,10-18,4,1010,"Limited Business License","904 | 911","Retail Sales of General Merchandise | Retail Sales of Clothing / Accessories / Shoes",2863326,ISSUE,08/08/2022,08/08/2022,08/08/2022,N,08/08/2022,08/15/2024,08/08/2022,08/08/2022,AAI,NULL,5,41.735442877,-87.551788629,"(41.735442876520004, -87.55178862932071)","2022-10-06 12:53:44",test,"2022-08-08 00:00:00","2022-08-08 00:00:00","2022-08-08 00:00:00","2024-08-15 00:00:00","2022-08-08 00:00:00",NULL
2232177-20220816,2854068,355521,11,"BRIGHT HORIZONS CHILDREN'S CENTERS LLC","UCHICAGO CHILD DEVELOPMENT CENTER DREXEL","5610 S DREXEL AVE 1 1",CHICAGO,IL,60637,5,52,5-52,2,1023,"Children's Services Facility License",820,"Supervision of, and Care for, Children 0-6 Years of Age, During the Day between 6am-9pm",2232177,RENEW,NULL,06/15/2022,06/23/2022,N,08/16/2022,08/15/2024,08/05/2022,08/08/2022,AAI,NULL,NULL,41.792809098,-87.603924229,"(41.792809098366355, -87.60392422867632)","2022-10-06 12:53:44",test,NULL,"2022-06-23 00:00:00","2022-08-16 00:00:00","2024-08-15 00:00:00","2022-08-08 00:00:00",NULL
34397-20200716,2728855,14839,1,"T AND T MEXICAN RESTAURANT, A CORPORATION","T & T MEXICAN RESTAURANT","8929 S COMMERCIAL AVE",CHICAGO,IL,60617,10,18,10-18,4,1475,"Consumption on Premises - Incidental Activity",638,"Consumption of Liquor on Premises",34397,RENEW,NULL,05/15/2020,07/30/2020,N,07/16/2020,07/15/2022,07/30/2020,05/11/2022,AAI,NULL,5,41.73284708,-87.551176144,"(41.732847079711306, -87.55117614380433)","2022-10-06 12:53:44",test,NULL,"2020-07-30 00:00:00","2020-07-16 00:00:00","2022-07-15 00:00:00","2022-05-11 00:00:00",NULL
2511412-20170511,2511412,413393,26,"SSP AMERICA, INC.","ORANGE LINE","5700 S CICERO AVE  CB12ACB12B",CHICAGO,IL,60638,23,41,23-41,8,1006,"Retail Food Establishment",735,"Preparation of Food and Dining on Premise With Seating",2511412,ISSUE,02/01/2017,03/27/2017,03/27/2017,N,05/11/2017,05/15/2019,05/11/2017,05/11/2017,AAI,NULL,NULL,41.789329323,-87.741645644,"(41.789329323265385, -87.74164564419637)","2022-10-06 12:53:44",test,"2017-02-01 00:00:00","2017-03-27 00:00:00","2017-05-11 00:00:00","2019-05-15 00:00:00","2017-05-11 00:00:00",NULL
2690340-20210916,2802339,462712,1,"ELVIRA TECALERO DEGANTE","ELVIRA TECALERO DEGANTE","4204 W ARMITAGE AVE  2F",CHICAGO,IL,60639,35,12,35-12,25,4406,"Peddler License",769,"Peddler- Retail Sales of General Merchandise, Whole Uncut Fruits/Vegetables, Flowers, Moving Along the Public Way",2690340,RENEW,NULL,07/15/2021,05/11/2022,N,09/16/2021,09/15/2023,NULL,05/11/2022,AAI,NULL,NULL,41.917208805,-87.731694374,"(41.91720880470793, -87.7316943738535)","2022-10-06 12:53:44",test,NULL,"2022-05-11 00:00:00","2021-09-16 00:00:00","2023-09-15 00:00:00","2022-05-11 00:00:00",NULL
1245064-20160316,2443766,23154,3,"UNITED CONTRACTING INC","UNITED CONTRACTING","10996  FOUR SEASONS PL  100C","CROWN POINT",IN,46307,NULL,NULL,NULL,NULL,1010,"Limited Business License",NULL,NULL,1245064,RENEW,NULL,01/15/2016,03/14/2016,N,03/16/2016,03/15/2018,03/14/2016,03/29/2016,AAI,NULL,NULL,NULL,NULL,NULL,"2022-10-06 12:53:44",test,NULL,"2016-03-14 00:00:00","2016-03-16 00:00:00","2018-03-15 00:00:00","2016-03-29 00:00:00",NULL
1469981-20200816,2734095,51705,3,"R J MIMS & W E MIMS","HAIR DESIGN BY ROBERT & CO.","2101 S PULASKI RD",CHICAGO,IL,60623,24,40,24-40,10,1010,"Limited Business License",894,"Hair Services",1469981,RENEW,NULL,06/15/2020,05/10/2022,N,08/16/2020,08/15/2022,05/10/2022,05/11/2022,AAI,NULL,NULL,41.853373164,-87.724653461,"(41.85337316383233, -87.72465346125382)","2022-10-06 12:53:44",test,NULL,"2022-05-10 00:00:00","2020-08-16 00:00:00","2022-08-15 00:00:00","2022-05-11 00:00:00",NULL
1944-20220916,2858245,62544,12,"HYATT CORPORATION","PARKING GARAGE EAST/WEST","151 E WACKER DR  GARAG",CHICAGO,IL,60601,42,44,42-44,1,1003,"Commercial Garage",725,"Provide Parking Spaces For a Fee - Available and Advertised to the Public",1944,RENEW,NULL,07/15/2022,08/05/2022,N,09/16/2022,09/15/2024,08/05/2022,08/08/2022,AAI,NULL,NULL,41.887999887,-87.622565133,"(41.88799988734853, -87.62256513255957)","2022-10-06 12:53:44",test,NULL,"2022-08-05 00:00:00","2022-09-16 00:00:00","2024-09-15 00:00:00","2022-08-08 00:00:00",NULL
2663845-20210716,2790879,458314,1,"BOUTIQUE ENVIE LLC","BOUTIQUE ENVIE","215 E 47TH ST",CHICAGO,IL,60653,3,NULL,3-,NULL,1010,"Limited Business License",911,"Retail Sales of Clothing / Accessories / Shoes",2663845,RENEW,NULL,05/15/2021,05/10/2022,N,07/16/2021,07/15/2023,05/10/2022,05/11/2022,AAI,NULL,56,41.809210635,-87.620490495,"(41.809210635453205, -87.62049049493147)","2022-10-06 12:53:44",test,NULL,"2022-05-10 00:00:00","2021-07-16 00:00:00","2023-07-15 00:00:00","2022-05-11 00:00:00",NULL
2594594-20200516,2723045,426783,1,"HALLE LEONARD","HALLE LEONARD","[REDACTED FOR PRIVACY]",CHICAGO,IL,60614,43,29,43-29,18,7009,"Pharmaceutical Representative",990,"Markets / Promotes Pharmaceuticals to Health Care Professionals and Conducts Business for More than 15 Calendar Days per Year",2594594,RENEW,NULL,03/15/2020,05/05/2020,N,05/16/2020,05/15/2021,05/05/2020,05/06/2020,AAI,NULL,NULL,NULL,NULL,NULL,"2022-10-06 12:53:44",test,NULL,"2020-05-05 00:00:00","2020-05-16 00:00:00","2021-05-15 00:00:00","2020-05-06 00:00:00",NULL
1968628-20220616,2841683,10726,3,"GRAHAM ENTERPRISE INC","Chicago BP@Irving (GEI-152)","841 W IRVING PARK RD",CHICAGO,IL,60613,46,10,46-10,19,1275,"Filling Station",666,"Operation of a Fuel Filling Station",1968628,RENEW,NULL,04/15/2022,05/10/2022,N,06/16/2022,06/15/2024,05/10/2022,05/11/2022,AAI,NULL,18,41.954425019,-87.651324017,"(41.95442501861227, -87.65132401707042)","2022-10-06 12:53:44",test,NULL,"2022-05-10 00:00:00","2022-06-16 00:00:00","2024-06-15 00:00:00","2022-05-11 00:00:00",NULL
1334970-20220916,2858266,62544,29,"HYATT CORPORATION","Hyatt Business Center","151 E WACKER DR",CHICAGO,IL,60601,42,44,42-44,1,1010,"Limited Business License",NULL,NULL,1334970,RENEW,NULL,07/15/2022,08/05/2022,N,09/16/2022,09/15/2024,08/05/2022,08/08/2022,AAI,NULL,NULL,41.887999887,-87.622565133,"(41.88799988734853, -87.62256513255957)","2022-10-06 12:53:44",test,NULL,"2022-08-05 00:00:00","2022-09-16 00:00:00","2024-09-15 00:00:00","2022-08-08 00:00:00",NULL
2846265-20220511,2846265,485729,1,"NIA JOELLA SMALLS","NIA JOELLA SMALLS","1824 S NORMAL AVE  1",CHICAGO,IL,60616,25,14,25-14,12,4406,"Peddler License",819,"Street Performer, Moving Along the Public Way",2846265,ISSUE,05/11/2022,05/11/2022,05/11/2022,N,05/11/2022,05/15/2024,NULL,05/11/2022,AAI,NULL,NULL,41.856870562,-87.64008662,"(41.856870561689185, -87.6400866203433)","2022-10-06 12:53:44",test,"2022-05-11 00:00:00","2022-05-11 00:00:00","2022-05-11 00:00:00","2024-05-15 00:00:00","2022-05-11 00:00:00",NULL
1899783-20170316,2509391,330192,1,"ELIAS A. KANELLOPOULOS","RITZ CLEANERS","200 E DELAWARE PL 1",CHICAGO,IL,60611,2,13,2-13,18,1010,"Limited Business License",648,"Dry Cleaning - Drop Off Location",1899783,RENEW,NULL,01/15/2017,03/07/2017,N,03/16/2017,03/15/2019,03/07/2017,03/08/2017,AAI,NULL,NULL,41.899354739,-87.621791302,"(41.89935473944382, -87.621791301926)","2022-10-06 12:53:44",test,NULL,"2017-03-07 00:00:00","2017-03-16 00:00:00","2019-03-15 00:00:00","2017-03-08 00:00:00",NULL
41386-20220916,2858198,55248,1,"TRANSAGRA INTERNATIONAL INC.","TRANSAGRA INT'L INC","155 N MICHIGAN AVE  720",CHICAGO,IL,60601,42,44,42-44,1,1010,"Limited Business License",NULL,NULL,41386,RENEW,NULL,07/15/2022,08/05/2022,N,09/16/2022,09/15/2024,08/05/2022,08/08/2022,AAI,NULL,NULL,41.884636249,-87.624313887,"(41.88463624920333, -87.62431388722874)","2022-10-06 12:53:44",test,NULL,"2022-08-05 00:00:00","2022-09-16 00:00:00","2024-09-15 00:00:00","2022-08-08 00:00:00",NULL
2212246-20200816,2735504,334772,2,"MIGUEL ANGEL DUARTE-SOLIS","MIGUEL ANGEL DUARTE-SOLIS","5015 S DAMEN AVE 1ST",CHICAGO,IL,60609,15,15,15-15,9,4406,"Peddler License",770,"Peddler (Over 65 Years of Age) - Retail Sales of General Merchandise, Whole Uncut Fruits/Vegetables, Flowers, Moving Along the Public Way",2212246,RENEW,NULL,06/15/2020,08/17/2020,N,08/16/2020,08/15/2022,NULL,08/17/2020,AAI,NULL,NULL,41.802569456,-87.674395755,"(41.802569455769735, -87.67439575456822)","2022-10-06 12:53:44",test,NULL,"2020-08-17 00:00:00","2020-08-16 00:00:00","2022-08-15 00:00:00","2020-08-17 00:00:00",NULL
2535984-20220616,2844386,417442,1,"KDM OYSTER BAR LLC","Gussie's Handmade Italian","227 W NORTH AVE 1",CHICAGO,IL,60610,27,42,27-42,18,1475,"Consumption on Premises - Incidental Activity",638,"Consumption of Liquor on Premises",2535984,RENEW,NULL,04/15/2022,05/18/2022,N,06/16/2022,06/15/2024,05/18/2022,08/08/2022,AAI,NULL,48,41.911042317,-87.635825584,"(41.91104231688869, -87.63582558404093)","2022-10-06 12:53:44",test,NULL,"2022-05-18 00:00:00","2022-06-16 00:00:00","2024-06-15 00:00:00","2022-08-08 00:00:00",NULL
2206377-20220816,2853311,269745,1,"MIGUEL ANGEL","CERMAK APPLIANCE","3005 W CERMAK RD REAR",CHICAGO,IL,60623,12,22,12-22,10,4404,"Regulated Business License",673,"Home Repair Services",2206377,RENEW,NULL,06/15/2022,08/08/2022,N,08/16/2022,08/15/2024,08/08/2022,08/08/2022,AAI,NULL,NULL,41.851724804,-87.700603471,"(41.85172480372373, -87.7006034709872)","2022-10-06 12:53:44",test,NULL,"2022-08-08 00:00:00","2022-08-16 00:00:00","2024-08-15 00:00:00","2022-08-08 00:00:00",NULL
1383016-20220916,2858239,62544,5,"HYATT CORPORATION","REGENCY CATERERS","151 E WACKER DR  L",CHICAGO,IL,60601,42,44,42-44,1,1481,"Caterer's Liquor License",630,"Catering of Liquor To Events",1383016,RENEW,NULL,07/15/2022,08/05/2022,N,09/16/2022,09/15/2024,08/05/2022,08/08/2022,AAI,NULL,NULL,41.887999887,-87.622565133,"(41.88799988734853, -87.62256513255957)","2022-10-06 12:53:44",test,NULL,"2022-08-05 00:00:00","2022-09-16 00:00:00","2024-09-15 00:00:00","2022-08-08 00:00:00",NULL
2807865-20210830,2807865,478278,1,"DAY & NIGHT GROCERIES INC.","DAY NIGHT","6403 N OAKLEY AVE",CHICAGO,IL,60645,50,NULL,50-,NULL,1006,"Retail Food Establishment","767 | 775","Retail Sales of General Merchandise and Non-Perishable Food | Retail Sales of Perishable Foods",2807865,ISSUE,08/21/2021,08/21/2021,08/23/2021,N,08/30/2021,09/15/2023,08/27/2021,08/30/2021,AAI,NULL,43,41.997922816,-87.687305564,"(41.99792281606211, -87.68730556397804)","2022-10-06 12:53:44",test,"2021-08-21 00:00:00","2021-08-23 00:00:00","2021-08-30 00:00:00","2023-09-15 00:00:00","2021-08-30 00:00:00",NULL
2608411-20220716,2849554,428675,1,"Stilo Hair Salon","Stilo 3.0","1811 S ASHLAND AVE",CHICAGO,IL,60608,25,NULL,25-,NULL,1010,"Limited Business License",894,"Hair Services",2608411,RENEW,NULL,05/15/2022,08/05/2022,N,07/16/2022,07/15/2024,08/05/2022,08/08/2022,AAI,NULL,NULL,41.857435362,-87.66598691,"(41.857435362106585, -87.6659869100588)","2022-10-06 12:53:44",test,NULL,"2022-08-05 00:00:00","2022-07-16 00:00:00","2024-07-15 00:00:00","2022-08-08 00:00:00",NULL
1477372-20060109,1477372,245472,2,"ROBERT J. MEDER","Northwest Improvement Co.","1090  TAMARACK   477","MOUNT PROSPECT",IL,60056,NULL,NULL,NULL,NULL,1011,"Home Repair",NULL,NULL,1477372,C_LOC,02/18/2004,01/09/2006,01/09/2006,N,01/09/2006,02/15/2007,01/09/2006,01/09/2006,AAI,NULL,NULL,NULL,NULL,NULL,"2022-10-06 12:53:44",test,"2004-02-18 00:00:00","2006-01-09 00:00:00","2006-01-09 00:00:00","2007-02-15 00:00:00","2006-01-09 00:00:00",NULL
1618645-20200916,2740798,294172,1,"NU WAVE DIE CUTTING & FINISHING, LTD.","NU WAVE DIE CUTTING & FINISHING, LTD.","2733 W HARRISON ST",CHICAGO,IL,60612,28,33,28-33,11,1009,"Manufacturing Establishments",929,"Miscellaneous Manufacturing",1618645,RENEW,NULL,07/15/2020,07/29/2020,N,09/16/2020,09/15/2022,07/29/2020,09/09/2020,AAC,08/08/2022,NULL,41.873694392,-87.695001661,"(41.87369439209426, -87.69500166091245)","2022-10-06 12:53:44",test,NULL,"2020-07-29 00:00:00","2020-09-16 00:00:00","2022-09-15 00:00:00","2020-09-09 00:00:00","2022-08-08 00:00:00"
1473422-20060216,1669181,270878,1,"O'DONNELL BLDG SERVICES","O'DONNELL BLDG SERVICES","1669  LINDEN","DES PLAINES",IL,60018,NULL,NULL,NULL,NULL,1010,"Limited Business License",NULL,NULL,1473422,RENEW,NULL,12/21/2005,01/23/2006,N,02/16/2006,02/15/2007,01/23/2006,01/24/2006,AAI,NULL,NULL,NULL,NULL,NULL,"2022-10-06 12:53:44",test,NULL,"2006-01-23 00:00:00","2006-02-16 00:00:00","2007-02-15 00:00:00","2006-01-24 00:00:00",NULL
2411636-20220916,2858267,62544,34,"HYATT CORPORATION","MARKET CHICAGO","151 E WACKER DR 1",CHICAGO,IL,60601,42,44,42-44,1,1474,"Package Goods",774,"Retail Sales of Packaged Liquor",2411636,RENEW,NULL,07/15/2022,08/05/2022,N,09/16/2022,09/15/2024,08/05/2022,08/08/2022,AAI,NULL,NULL,41.887999887,-87.622565133,"(41.88799988734853, -87.62256513255957)","2022-10-06 12:53:44",test,NULL,"2022-08-05 00:00:00","2022-09-16 00:00:00","2024-09-15 00:00:00","2022-08-08 00:00:00",NULL
1694745-20071116,1857379,64603,5,"LEOPARDO COMPANIES INC.","LEOPARDO COMPANIES INC","1945 W HUBBARD ST  B",CHICAGO,IL,60622,27,27,27-27,12,1010,"Limited Business License",NULL,NULL,1694745,RENEW,NULL,09/21/2007,11/15/2007,N,11/16/2007,09/15/2008,11/15/2007,11/16/2007,AAI,NULL,NULL,41.889627703,-87.67623091,"(41.8896277030332, -87.67623090978807)","2022-10-06 12:53:44",test,NULL,"2007-11-15 00:00:00","2007-11-16 00:00:00","2008-09-15 00:00:00","2007-11-16 00:00:00",NULL
2570065-20211116,2811189,385896,5,"INMOTION ORD, LLC","InMotion Entertainment","10000 W OHARE ST CONCOURSE F TERMINAL 2",CHICAGO,IL,60666,41,NULL,41-,NULL,1010,"Limited Business License","772 | 922","Retail Sales of New Electronics and Accessories | Retail Sales of Cell Phones and Accessories",2570065,RENEW,NULL,09/15/2021,04/18/2022,N,11/16/2021,11/15/2023,04/18/2022,08/08/2022,AAI,NULL,NULL,41.976201139,-87.905309125,"(41.97620113902387, -87.90530912510346)","2022-10-06 12:53:44",test,NULL,"2022-04-18 00:00:00","2021-11-16 00:00:00","2023-11-15 00:00:00","2022-08-08 00:00:00",NULL
1476068-20100916,2044893,64603,4,"LEOPARDO COMPANIES INC.","LEOPARDO COMPANIES INC","333 W WACKER DR 2ND 250",CHICAGO,IL,60606,42,NULL,42-,1,1010,"Limited Business License",NULL,NULL,1476068,RENEW,NULL,07/15/2010,08/19/2010,N,09/16/2010,09/15/2012,08/19/2010,08/20/2010,AAI,NULL,NULL,41.886025413,-87.636297703,"(41.886025412541144, -87.63629770323044)","2022-10-06 12:53:44",test,NULL,"2010-08-19 00:00:00","2010-09-16 00:00:00","2012-09-15 00:00:00","2010-08-20 00:00:00",NULL
2857180-20220808,2857180,218538,97,"LINCOLN SQUARE RAVENSWOOD CHAMBER OF COMMERCE","LINCOLN SQUARE RAVENSWOOD CHAMBER OF COMMERCE","4505 N LINCOLN AVE  STOREFRONT",CHICAGO,IL,60625,47,42,47-42,19,4409,"Pop-Up Retail User",1027,"Organizer of a 1-5 Day Event w/ Pop-Up Retail Users at a Trade Show, Exhibition or Convention",2857180,ISSUE,07/08/2022,07/08/2022,08/08/2022,N,08/08/2022,08/20/2022,08/08/2022,08/08/2022,AAI,NULL,21,41.963424053,-87.684990788,"(41.963424053299256, -87.68499078804334)","2022-10-06 12:53:44",test,"2022-07-08 00:00:00","2022-08-08 00:00:00","2022-08-08 00:00:00","2022-08-20 00:00:00","2022-08-08 00:00:00",NULL
1985838-20211216,2815088,217453,2,"CHITOWN SPORTS FACILITIES, LLC","CHITOWN SPORTS FACILITIES","2343 S THROOP ST 2",CHICAGO,IL,60608,25,28,25-28,12,1475,"Consumption on Premises - Incidental Activity",638,"Consumption of Liquor on Premises",1985838,RENEW,NULL,10/15/2021,12/13/2021,N,12/16/2021,12/15/2023,12/13/2021,12/13/2021,AAC,08/08/2022,NULL,41.849377228,-87.658477318,"(41.849377228107315, -87.65847731791494)","2022-10-06 12:53:44",test,NULL,"2021-12-13 00:00:00","2021-12-16 00:00:00","2023-12-15 00:00:00","2021-12-13 00:00:00","2022-08-08 00:00:00"
73380-20220816,2852189,22048,2,"MCATEER'S IRISH PUB INCORPORATED","TRINITY PUB CHICAGO","5943 N NORTHWEST HWY",CHICAGO,IL,60631,41,21,41-21,16,1470,Tavern,829,"Tavern - Consumption of Liquor on Premise",73380,RENEW,NULL,06/15/2022,07/25/2022,N,08/16/2022,08/15/2024,07/25/2022,08/08/2022,AAI,NULL,NULL,41.98904253,-87.792979377,"(41.98904252993585, -87.79297937696374)","2022-10-06 12:53:44",test,NULL,"2022-07-25 00:00:00","2022-08-16 00:00:00","2024-08-15 00:00:00","2022-08-08 00:00:00",NULL
2205265-20220916,2858247,62544,17,"HYATT CORPORATION","HYATT REGENCY CHICAGO","151 E WACKER DR  LOBBY",CHICAGO,IL,60601,42,44,42-44,1,4404,"Regulated Business License",676,"Hotel - 7 or More Sleeping Rooms",2205265,RENEW,NULL,07/15/2022,08/05/2022,N,09/16/2022,09/15/2024,08/05/2022,08/08/2022,AAI,NULL,NULL,41.887999887,-87.622565133,"(41.88799988734853, -87.62256513255957)","2022-10-06 12:53:44",test,NULL,"2022-08-05 00:00:00","2022-09-16 00:00:00","2024-09-15 00:00:00","2022-08-08 00:00:00",NULL
42264-20220916,2858088,34733,1,"TECHNOMIC INC","TECHNOMIC INC","300 S RIVERSIDE PLZ  1600",CHICAGO,IL,60606,42,16,42-16,1,1010,"Limited Business License",703,"Advertising / Marketing / Sales Office",42264,RENEW,NULL,07/15/2022,08/05/2022,N,09/16/2022,09/15/2024,08/05/2022,08/08/2022,AAI,NULL,NULL,41.877975138,-87.638422171,"(41.87797513796852, -87.63842217104092)","2022-10-06 12:53:44",test,NULL,"2022-08-05 00:00:00","2022-09-16 00:00:00","2024-09-15 00:00:00","2022-08-08 00:00:00",NULL
1918-20220916,2858228,62544,1,"HYATT CORPORATION",BIG,"151 E WACKER DR  SKYWA",CHICAGO,IL,60601,42,44,42-44,1,1006,"Retail Food Establishment",775,"Retail Sales of Perishable Foods",1918,RENEW,NULL,07/15/2022,08/05/2022,N,09/16/2022,09/15/2024,08/05/2022,08/08/2022,AAI,NULL,NULL,41.887999887,-87.622565133,"(41.88799988734853, -87.62256513255957)","2022-10-06 12:53:44",test,NULL,"2022-08-05 00:00:00","2022-09-16 00:00:00","2024-09-15 00:00:00","2022-08-08 00:00:00",NULL
2863356-20220808,2863356,488440,1,"NATHANIEL RICHARDSON","NATHANIEL RICHARDSON","6208 S SEELEY AVE",CHICAGO,IL,60636,16,3,16-3,7,4406,"Peddler License",769,"Peddler- Retail Sales of General Merchandise, Whole Uncut Fruits/Vegetables, Flowers, Moving Along the Public Way",2863356,ISSUE,08/08/2022,08/08/2022,08/08/2022,N,08/08/2022,08/15/2024,NULL,08/08/2022,AAI,NULL,NULL,41.780821374,-87.675302367,"(41.7808213737418, -87.67530236741163)","2022-10-06 12:53:44",test,"2022-08-08 00:00:00","2022-08-08 00:00:00","2022-08-08 00:00:00","2024-08-15 00:00:00","2022-08-08 00:00:00",NULL
2549194-20220816,2855138,419421,1,"JOHN BARICH","JOHN BARICH","[REDACTED FOR PRIVACY]","GLEN ELLYN",IL,60137,NULL,NULL,NULL,NULL,7009,"Pharmaceutical Representative",990,"Markets / Promotes Pharmaceuticals to Health Care Professionals and Conducts Business for More than 15 Calendar Days per Year",2549194,RENEW,NULL,06/15/2022,08/05/2022,N,08/16/2022,08/15/2023,08/05/2022,08/08/2022,AAI,NULL,NULL,NULL,NULL,NULL,"2022-10-06 12:53:44",test,NULL,"2022-08-05 00:00:00","2022-08-16 00:00:00","2023-08-15 00:00:00","2022-08-08 00:00:00",NULL
2535983-20220616,2844385,417442,1,"KDM OYSTER BAR LLC","Gussie's Handmade Italian","227 W NORTH AVE 1",CHICAGO,IL,60610,27,42,27-42,18,1006,"Retail Food Establishment",735,"Preparation of Food and Dining on Premise With Seating",2535983,RENEW,NULL,04/15/2022,05/18/2022,N,06/16/2022,06/15/2024,05/18/2022,08/08/2022,AAI,NULL,48,41.911042317,-87.635825584,"(41.91104231688869, -87.63582558404093)","2022-10-06 12:53:44",test,NULL,"2022-05-18 00:00:00","2022-06-16 00:00:00","2024-06-15 00:00:00","2022-08-08 00:00:00",NULL
2708945-20220116,2822134,465392,1,"CHARLES GIPSON INVESTMENT & REAL ESTATE, LLC","CHARLES GIPSON INVESTMENT & REAL ESTATE HEAD QUARTERS","3406 W 79TH ST 1",CHICAGO,IL,60652,18,1,18-1,8,1010,"Limited Business License",602,"Administrative Commercial Office",2708945,RENEW,NULL,11/15/2021,08/08/2022,N,01/16/2022,01/15/2024,08/08/2022,08/08/2022,AAI,NULL,NULL,41.749895097,-87.707597529,"(41.74989509749944, -87.70759752903216)","2022-10-06 12:53:44",test,NULL,"2022-08-08 00:00:00","2022-01-16 00:00:00","2024-01-15 00:00:00","2022-08-08 00:00:00",NULL
6698-20220816,2851634,3669,2,"CHATCHILD SURACHAICHARN","BOOM FRIED RICE","356 S PULASKI RD",CHICAGO,IL,60624,28,59,28-59,11,1006,"Retail Food Establishment",775,"Retail Sales of Perishable Foods",6698,RENEW,NULL,06/15/2022,08/07/2022,N,08/16/2022,08/15/2024,08/07/2022,08/08/2022,AAI,NULL,NULL,41.875375016,-87.725634283,"(41.87537501581776, -87.72563428263534)","2022-10-06 12:53:44",test,NULL,"2022-08-07 00:00:00","2022-08-16 00:00:00","2024-08-15 00:00:00","2022-08-08 00:00:00",NULL
2863268-20220808,2863268,373202,8,"ONESTI ENTERTAINMENT CORPORATION","ONESTI ENTERTAINMENT CORPORATION dba ARCADA THEATRE","1300 W TAYLOR ST",CHICAGO,IL,60607,28,10,28-10,12,1476,"Special Event Liquor",996,"Special Event Beer, Wine & Spirits",2863268,ISSUE,08/05/2022,08/05/2022,08/05/2022,N,08/08/2022,08/14/2022,08/05/2022,08/08/2022,AAI,NULL,NULL,41.869487459,-87.659245148,"(41.86948745876939, -87.65924514797914)","2022-10-06 12:53:44",test,"2022-08-05 00:00:00","2022-08-05 00:00:00","2022-08-08 00:00:00","2022-08-14 00:00:00","2022-08-08 00:00:00",NULL
2215639-20220216,2824013,45084,7,"CHICAGO YOUTH CENTERS","REBECCA K. CROWN CHLD. DEV. CT","7601 S PHILLIPS AVE  1",CHICAGO,IL,60649,7,39,7-39,4,1023,"Children's Services Facility License",823,"Supervision of, and Care for, Children 2-6 Years of Age, During the Day between 6am-9pm",2215639,RENEW,NULL,12/15/2021,03/25/2022,N,02/16/2022,02/15/2024,08/05/2022,08/08/2022,AAI,NULL,NULL,41.757098777,-87.564978466,"(41.757098777020786, -87.5649784656571)","2022-10-06 12:53:44",test,NULL,"2022-03-25 00:00:00","2022-02-16 00:00:00","2024-02-15 00:00:00","2022-08-08 00:00:00",NULL
1923-20220916,2858233,62544,2,"HYATT CORPORATION","BISTRO 151/BAR AT 151","151 E WACKER DR  PLAZA",CHICAGO,IL,60601,42,44,42-44,1,1471,"Late Hour",785,"Sale of Liquor Until 4am, Monday - Saturday and 5am on Sunday",1923,RENEW,NULL,07/15/2022,08/05/2022,N,09/16/2022,09/15/2024,08/05/2022,08/08/2022,AAI,NULL,NULL,NULL,NULL,NULL,"2022-10-06 12:53:44",test,NULL,"2022-08-05 00:00:00","2022-09-16 00:00:00","2024-09-15 00:00:00","2022-08-08 00:00:00",NULL
1476068-20071116,1857378,64603,4,"LEOPARDO COMPANIES INC.","LEOPARDO COMPANIES INC","333 W WACKER DR 2ND 250",CHICAGO,IL,60606,42,NULL,42-,1,1010,"Limited Business License",NULL,NULL,1476068,RENEW,NULL,09/21/2007,11/15/2007,N,11/16/2007,09/15/2008,11/15/2007,11/16/2007,AAI,NULL,NULL,41.886025413,-87.636297703,"(41.886025412541144, -87.63629770323044)","2022-10-06 12:53:44",test,NULL,"2007-11-15 00:00:00","2007-11-16 00:00:00","2008-09-15 00:00:00","2007-11-16 00:00:00",NULL
1694745-20100916,2044894,64603,5,"LEOPARDO COMPANIES INC.","LEOPARDO COMPANIES INC","1945 W HUBBARD ST  B",CHICAGO,IL,60622,27,27,27-27,12,1010,"Limited Business License",NULL,NULL,1694745,RENEW,NULL,07/15/2010,08/19/2010,N,09/16/2010,09/15/2012,08/19/2010,08/20/2010,AAI,NULL,NULL,41.889627703,-87.67623091,"(41.8896277030332, -87.67623090978807)","2022-10-06 12:53:44",test,NULL,"2010-08-19 00:00:00","2010-09-16 00:00:00","2012-09-15 00:00:00","2010-08-20 00:00:00",NULL
1798463-20200416,2714953,257715,2,"RICHARD DECHOW","RICK'S SEWER & DRAINAGE","3614  JOHN ST",MCHENRY,IL,60050,NULL,NULL,NULL,NULL,1010,"Limited Business License",NULL,NULL,1798463,RENEW,NULL,02/15/2020,11/12/2020,N,04/16/2020,04/15/2022,11/12/2020,11/13/2020,AAI,NULL,NULL,NULL,NULL,NULL,"2022-10-06 12:53:44",test,NULL,"2020-11-12 00:00:00","2020-04-16 00:00:00","2022-04-15 00:00:00","2020-11-13 00:00:00",NULL
2368367-20220816,2853208,261064,2,"TOURANCE SMITH","S & S HOME REPAIR SERVICE","1475 W 77TH ST 2ND",CHICAGO,IL,60620,17,29,17-29,6,4404,"Regulated Business License",674,"Home Repair Services (Home Based Business)",2368367,RENEW,NULL,06/15/2022,08/07/2022,N,08/16/2022,08/15/2024,08/07/2022,08/08/2022,AAI,NULL,NULL,41.753911827,-87.661602814,"(41.75391182736269, -87.66160281418608)","2022-10-06 12:53:44",test,NULL,"2022-08-07 00:00:00","2022-08-16 00:00:00","2024-08-15 00:00:00","2022-08-08 00:00:00",NULL
2179584-20180816,2606015,374703,1,"SAE INSTITUTE OF TECHNOLOGY (CHICAGO) CORP.","SAE INSTITUTE","820 N ORLEANS ST 1ST 125-135",CHICAGO,IL,60610,27,NULL,27-,NULL,1010,"Limited Business License",NULL,NULL,2179584,RENEW,NULL,06/15/2018,06/18/2019,N,08/16/2018,07/15/2021,06/18/2019,06/20/2019,AAI,NULL,NULL,41.897338047,-87.63734543,"(41.897338047455214, -87.63734543001038)","2022-10-06 12:53:44",test,NULL,"2019-06-18 00:00:00","2018-08-16 00:00:00","2021-07-15 00:00:00","2019-06-20 00:00:00",NULL
1963938-20211216,2815089,217453,2,"CHITOWN SPORTS FACILITIES, LLC","CHITOWN SPORTS FACILITIES","2343 S THROOP ST 2",CHICAGO,IL,60608,25,28,25-28,12,1050,"Public Place of Amusement",743,"Provides Onsite Amusement or Entertainment",1963938,RENEW,NULL,10/15/2021,12/13/2021,N,12/16/2021,12/15/2023,12/13/2021,12/13/2021,AAI,NULL,NULL,41.849377228,-87.658477318,"(41.849377228107315, -87.65847731791494)","2022-10-06 12:53:44",test,NULL,"2021-12-13 00:00:00","2021-12-16 00:00:00","2023-12-15 00:00:00","2021-12-13 00:00:00",NULL
2212246-20121229,2212246,334772,2,"MIGUEL ANGEL DUARTE-SOLIS","MIGUEL ANGEL DUARTE-SOLIS","5015 S DAMEN AVE 1ST",CHICAGO,IL,60609,15,15,15-15,9,4406,"Peddler License",770,"Peddler (Over 65 Years of Age) - Retail Sales of General Merchandise, Whole Uncut Fruits/Vegetables, Flowers, Moving Along the Public Way",2212246,ISSUE,NULL,NULL,NULL,N,12/29/2012,08/15/2014,NULL,12/29/2012,AAI,NULL,NULL,41.802569456,-87.674395755,"(41.802569455769735, -87.67439575456822)","2022-10-06 12:53:44",test,NULL,NULL,"2012-12-29 00:00:00","2014-08-15 00:00:00","2012-12-29 00:00:00",NULL
2863270-20220808,2863270,488323,1,"CATERINA P GROUP INC.","CATERINA P GROUP INC.","7022 W ROSCOE ST",CHICAGO,IL,60634,38,4,38-4,16,4404,"Regulated Business License",674,"Home Repair Services (Home Based Business)",2863270,ISSUE,08/05/2022,08/08/2022,08/08/2022,N,08/08/2022,08/15/2024,08/08/2022,08/08/2022,AAI,NULL,NULL,41.941817381,-87.80230679,"(41.941817381411816, -87.80230679030826)","2022-10-06 12:53:44",test,"2022-08-05 00:00:00","2022-08-08 00:00:00","2022-08-08 00:00:00","2024-08-15 00:00:00","2022-08-08 00:00:00",NULL
2641855-20220916,2857499,1611,8,"TTX COMPANY","TTX Company","7540 S WESTERN AVE",CHICAGO,IL,60620,18,NULL,18-,NULL,1010,"Limited Business License",708,"Miscellaneous Commercial Services",2641855,RENEW,NULL,07/15/2022,08/05/2022,N,09/16/2022,09/15/2024,08/05/2022,08/08/2022,AAI,NULL,NULL,41.756140935,-87.683154198,"(41.7561409351624, -87.68315419754529)","2022-10-06 12:53:44",test,NULL,"2022-08-05 00:00:00","2022-09-16 00:00:00","2024-09-15 00:00:00","2022-08-08 00:00:00",NULL
2212246-20160816,2473745,334772,2,"MIGUEL ANGEL DUARTE-SOLIS","MIGUEL ANGEL DUARTE-SOLIS","5015 S DAMEN AVE 1ST",CHICAGO,IL,60609,15,15,15-15,9,4406,"Peddler License",770,"Peddler (Over 65 Years of Age) - Retail Sales of General Merchandise, Whole Uncut Fruits/Vegetables, Flowers, Moving Along the Public Way",2212246,RENEW,NULL,06/15/2016,08/26/2016,N,08/16/2016,08/15/2018,NULL,08/26/2016,AAI,NULL,NULL,41.802569456,-87.674395755,"(41.802569455769735, -87.67439575456822)","2022-10-06 12:53:44",test,NULL,"2016-08-26 00:00:00","2016-08-16 00:00:00","2018-08-15 00:00:00","2016-08-26 00:00:00",NULL
44096-20160416,2448043,35329,1,"E.C. BABILLA, INC.","E C BABILLA, INC.","3974  HARRISON ST  1ST",GARY,IN,46409,NULL,NULL,NULL,NULL,1010,"Limited Business License",NULL,NULL,44096,RENEW,NULL,02/15/2016,03/28/2016,N,04/16/2016,04/15/2018,03/28/2016,03/29/2016,AAI,NULL,NULL,NULL,NULL,NULL,"2022-10-06 12:53:44",test,NULL,"2016-03-28 00:00:00","2016-04-16 00:00:00","2018-04-15 00:00:00","2016-03-29 00:00:00",NULL
2863310-20220808,2863310,418838,3,"JACINTER ODEO LUMUMBA","HYSOPLUS CLEANING SERVICE","9426 S PARNELL AVE",CHICAGO,IL,60620,21,35,21-35,22,4404,"Regulated Business License",752,"Residential Cleaning (Home Based Business)",2863310,ISSUE,08/08/2022,08/08/2022,08/08/2022,N,08/08/2022,07/15/2023,08/08/2022,08/08/2022,AAI,NULL,NULL,41.722510441,-87.637333524,"(41.72251044068235, -87.63733352351687)","2022-10-06 12:53:44",test,"2022-08-08 00:00:00","2022-08-08 00:00:00","2022-08-08 00:00:00","2023-07-15 00:00:00","2022-08-08 00:00:00",NULL
2405444-20220616,2843858,388750,2,"J M D ENTERPRISES INC.","HAROLD'S CHICKEN","124 E 35TH ST  C",CHICAGO,IL,60616,3,53,3-53,2,1006,"Retail Food Establishment",782,"Sale of Food Prepared Onsite Without Dining Area",2405444,RENEW,NULL,04/15/2022,08/08/2022,N,06/16/2022,06/15/2024,08/08/2022,08/08/2022,AAI,NULL,NULL,41.831165134,-87.622109047,"(41.83116513402594, -87.62210904738643)","2022-10-06 12:53:44",test,NULL,"2022-08-08 00:00:00","2022-06-16 00:00:00","2024-06-15 00:00:00","2022-08-08 00:00:00",NULL
61234-20220516,2837034,86347,1,"S&W CHICAGO, L.L.C.","SMITH & WOLLENSKY","318 N STATE ST LL + 1",CHICAGO,IL,60654,42,27,42-27,18,1006,"Retail Food Establishment",775,"Retail Sales of Perishable Foods",61234,RENEW,NULL,03/15/2022,07/14/2022,N,05/16/2022,05/15/2024,07/14/2022,08/08/2022,AAI,NULL,NULL,41.888040594,-87.628170663,"(41.88804059387871, -87.62817066340388)","2022-10-06 12:53:44",test,NULL,"2022-07-14 00:00:00","2022-05-16 00:00:00","2024-05-15 00:00:00","2022-08-08 00:00:00",NULL
2212246-20140816,2338450,334772,2,"MIGUEL ANGEL DUARTE-SOLIS","MIGUEL ANGEL DUARTE-SOLIS","5015 S DAMEN AVE 1ST",CHICAGO,IL,60609,15,15,15-15,9,4406,"Peddler License",770,"Peddler (Over 65 Years of Age) - Retail Sales of General Merchandise, Whole Uncut Fruits/Vegetables, Flowers, Moving Along the Public Way",2212246,RENEW,NULL,06/15/2014,08/27/2014,N,08/16/2014,08/15/2016,NULL,08/28/2014,AAI,NULL,NULL,41.802569456,-87.674395755,"(41.802569455769735, -87.67439575456822)","2022-10-06 12:53:44",test,NULL,"2014-08-27 00:00:00","2014-08-16 00:00:00","2016-08-15 00:00:00","2014-08-28 00:00:00",NULL
2179584-20220816,2863352,374703,1,"SAE INSTITUTE OF TECHNOLOGY (CHICAGO) CORP.","SAE INSTITUTE","820 N ORLEANS ST 1ST 125-135",CHICAGO,IL,60610,27,NULL,27-,NULL,1010,"Limited Business License",NULL,NULL,2179584,RENEW,NULL,08/08/2022,08/08/2022,N,08/16/2022,08/15/2024,08/08/2022,08/08/2022,AAI,NULL,NULL,41.897338047,-87.63734543,"(41.897338047455214, -87.63734543001038)","2022-10-06 12:53:44",test,NULL,"2022-08-08 00:00:00","2022-08-16 00:00:00","2024-08-15 00:00:00","2022-08-08 00:00:00",NULL
2162411-20220716,2848527,373313,1,"JOSEPH ATSHO","JOEY'Z HAIR CUTZ","3953 W IRVING PARK RD 1 1",CHICAGO,IL,60618,45,27,45-27,17,1010,"Limited Business License",894,"Hair Services",2162411,RENEW,NULL,05/15/2022,08/07/2022,N,07/16/2022,07/15/2024,08/07/2022,08/08/2022,AAI,NULL,NULL,41.953544299,-87.727186424,"(41.95354429931296, -87.7271864240339)","2022-10-06 12:53:44",test,NULL,"2022-08-07 00:00:00","2022-07-16 00:00:00","2024-07-15 00:00:00","2022-08-08 00:00:00",NULL
2817847-20220516,2837929,332129,6,"DELI MANAGEMENT INC.","JASON'S DELI","350  PINE ST  1775",BEAUMONT,TX,77701,NULL,NULL,NULL,NULL,8344,"Shared Kitchen User (Long Term)",804,"Shared Kitchen User - Long Term",2817847,RENEW,NULL,03/15/2022,05/12/2022,N,05/16/2022,05/15/2024,NULL,05/12/2022,AAI,NULL,NULL,41.88717369,-87.763571339,"(41.88717369035997, -87.76357133863286)","2022-10-06 12:53:44",test,NULL,"2022-05-12 00:00:00","2022-05-16 00:00:00","2024-05-15 00:00:00","2022-05-12 00:00:00",NULL
1887918-20220516,2837204,207671,10,"PARK ONE, INC.","PARK ONE INC.","623 W MONROE ST",CHICAGO,IL,60661,42,12,42-12,1,1003,"Commercial Garage",725,"Provide Parking Spaces For a Fee - Available and Advertised to the Public",1887918,RENEW,NULL,03/15/2022,07/06/2022,N,05/16/2022,05/15/2024,07/06/2022,08/08/2022,AAI,NULL,NULL,41.880424982,-87.643654766,"(41.88042498152857, -87.64365476576403)","2022-10-06 12:53:44",test,NULL,"2022-07-06 00:00:00","2022-05-16 00:00:00","2024-05-15 00:00:00","2022-08-08 00:00:00",NULL
2341889-20220816,2854603,391837,1,"KAS TUTORIAL LLC","KAS TUTORIAL LLC","2324 E 75TH ST 1ST",CHICAGO,IL,60649,7,50,7-50,3,1023,"Children's Services Facility License",905,"After School Program / Tutoring Children Under 18 Years of Age",2341889,RENEW,NULL,06/15/2022,08/06/2022,N,08/16/2022,08/15/2024,08/06/2022,08/08/2022,AAI,NULL,49,41.759082398,-87.567738363,"(41.759082397928815, -87.56773836279858)","2022-10-06 12:53:44",test,NULL,"2022-08-06 00:00:00","2022-08-16 00:00:00","2024-08-15 00:00:00","2022-08-08 00:00:00",NULL
2775929-20211216,2816161,402671,3,"SIXT RENT A CAR, LLC","Sixt Rent A Car, LLC","714 S WABASH AVE",CHICAGO,IL,60605,4,NULL,4-,NULL,1010,"Limited Business License",1075,"Sales / Rental / Lease of Motorized Vehicles - Indoor Sales",2775929,RENEW,NULL,10/15/2021,11/11/2021,N,12/16/2021,12/15/2023,11/11/2021,08/08/2022,AAI,NULL,NULL,41.872852032,-87.626107219,"(41.87285203196901, -87.6261072188626)","2022-10-06 12:53:44",test,NULL,"2021-11-11 00:00:00","2021-12-16 00:00:00","2023-12-15 00:00:00","2022-08-08 00:00:00",NULL
2863328-20220808,2863328,488419,1,"XUYUN ZHENG","XUYUN ZHENG","200 E CHESTNUT ST 5TH 518",CHICAGO,IL,60611,2,18,2-18,18,4404,"Regulated Business License",691,"Language Interpreter, Translator (Home Based Business)",2863328,ISSUE,08/08/2022,08/08/2022,08/08/2022,N,08/08/2022,08/15/2024,08/08/2022,08/08/2022,AAI,NULL,NULL,41.898530344,-87.621777409,"(41.89853034425216, -87.62177740924473)","2022-10-06 12:53:44",test,"2022-08-08 00:00:00","2022-08-08 00:00:00","2022-08-08 00:00:00","2024-08-15 00:00:00","2022-08-08 00:00:00",NULL
2862483-20220722,2862483,487786,1,"DEMI ANTIONETTE LEE","DEMI ANTIONETTE LEE","1030  CELEBRATION DR",AURORA,IL,60504,NULL,NULL,NULL,NULL,4406,"Peddler License",769,"Peddler- Retail Sales of General Merchandise, Whole Uncut Fruits/Vegetables, Flowers, Moving Along the Public Way",2862483,ISSUE,07/20/2022,07/22/2022,07/22/2022,N,07/22/2022,08/15/2024,NULL,08/08/2022,AAI,NULL,NULL,NULL,NULL,NULL,"2022-10-06 12:53:44",test,"2022-07-20 00:00:00","2022-07-22 00:00:00","2022-07-22 00:00:00","2024-08-15 00:00:00","2022-08-08 00:00:00",NULL
1476068-20140916,2343716,64603,4,"LEOPARDO COMPANIES INC.","LEOPARDO COMPANIES INC","333 W WACKER DR 2ND 250",CHICAGO,IL,60606,42,NULL,42-,1,1010,"Limited Business License",708,"Miscellaneous Commercial Services",1476068,RENEW,NULL,07/15/2014,08/04/2016,N,09/16/2014,09/15/2016,08/04/2016,04/28/2017,AAI,NULL,NULL,41.886025413,-87.636297703,"(41.886025412541144, -87.63629770323044)","2022-10-06 12:53:44",test,NULL,"2016-08-04 00:00:00","2014-09-16 00:00:00","2016-09-15 00:00:00","2017-04-28 00:00:00",NULL
2863338-20220808,2863338,488425,1,"ARCKEY WASHINGTON","ARCKEY WASHINGTON","3711 S VINCENNES AVE",CHICAGO,IL,60653,4,30,4-30,2,4406,"Peddler License",769,"Peddler- Retail Sales of General Merchandise, Whole Uncut Fruits/Vegetables, Flowers, Moving Along the Public Way",2863338,ISSUE,08/08/2022,08/08/2022,08/08/2022,N,08/08/2022,08/15/2024,NULL,08/08/2022,AAI,NULL,NULL,41.827201897,-87.611569409,"(41.82720189707372, -87.61156940870792)","2022-10-06 12:53:44",test,"2022-08-08 00:00:00","2022-08-08 00:00:00","2022-08-08 00:00:00","2024-08-15 00:00:00","2022-08-08 00:00:00",NULL
2616616-20220916,2861575,429634,1,"POLISH PACZKI CAFE, LLC","POLISH PACZKI CAFE, LLC","7210 W FOSTER AVE GROUND",CHICAGO,IL,60656,41,36,41-36,16,1006,"Retail Food Establishment",782,"Sale of Food Prepared Onsite Without Dining Area",2616616,RENEW,NULL,07/15/2022,08/05/2022,N,09/16/2022,09/15/2024,08/05/2022,08/08/2022,AAI,NULL,NULL,41.974640557,-87.807556639,"(41.97464055685375, -87.80755663930223)","2022-10-06 12:53:44",test,NULL,"2022-08-05 00:00:00","2022-09-16 00:00:00","2024-09-15 00:00:00","2022-08-08 00:00:00",NULL
2863318-20220808,2863318,488411,1,"STEVEN GARFIELD WILSON","GARFIELD'S BARBERSHOP","4311 N RAVENSWOOD AVE 3RD 303",CHICAGO,IL,60613,47,39,47-39,19,1010,"Limited Business License",894,"Hair Services",2863318,ISSUE,08/08/2022,08/08/2022,08/08/2022,N,08/08/2022,08/15/2024,08/08/2022,08/08/2022,AAI,NULL,31,41.960080839,-87.673788053,"(41.96008083875137, -87.6737880529066)","2022-10-06 12:53:44",test,"2022-08-08 00:00:00","2022-08-08 00:00:00","2022-08-08 00:00:00","2024-08-15 00:00:00","2022-08-08 00:00:00",NULL
2835935-20220808,2835935,46936,4,"CHICAGO CITY THEATRE COMPANY","Joel Hall Dancers & Center","2951 W MONTROSE AVE",CHICAGO,IL,60618,33,NULL,33-,NULL,1010,"Limited Business License",953,"Instruction in Dance for Both Children and Adults (Less Than 40% Children)",2835935,C_LOC,03/10/2022,03/10/2022,03/12/2022,N,08/08/2022,07/15/2023,03/12/2022,08/08/2022,AAI,NULL,60,41.961111412,-87.702980422,"(41.96111141196727, -87.702980422379)","2022-10-06 12:53:44",test,"2022-03-10 00:00:00","2022-03-12 00:00:00","2022-08-08 00:00:00","2023-07-15 00:00:00","2022-08-08 00:00:00",NULL
2476029-20211116,2811188,385896,4,"INMOTION ORD, LLC","INMOTION ENTERTAINMENT","1000 W OHARE  TERMINAL 3 GATE K12",CHICAGO,IL,NULL,41,NULL,41-,NULL,1010,"Limited Business License",772,"Retail Sales of New Electronics and Accessories",2476029,RENEW,NULL,09/15/2021,04/18/2022,N,11/16/2021,11/15/2023,04/18/2022,08/08/2022,AAI,NULL,NULL,NULL,NULL,NULL,"2022-10-06 12:53:44",test,NULL,"2022-04-18 00:00:00","2021-11-16 00:00:00","2023-11-15 00:00:00","2022-08-08 00:00:00",NULL
2863266-20220808,2863266,488319,1,"THAI ORCHID SPA LLC","THAI ORCHID SPA","821 N MILWAUKEE AVE FLOOR 1",CHICAGO,IL,60642,27,NULL,27-,NULL,1010,"Limited Business License","767 | 896 | 956 | 999","Retail Sales of General Merchandise and Non-Perishable Food | Skincare Services | Provide Waxing Services | Provide Non-Invasive Cupping Therapy",2863266,ISSUE,08/05/2022,08/05/2022,08/05/2022,N,08/08/2022,08/15/2024,08/05/2022,08/08/2022,AAI,NULL,29,41.896756055,-87.655986646,"(41.896756055193975, -87.65598664623519)","2022-10-06 12:53:44",test,"2022-08-05 00:00:00","2022-08-05 00:00:00","2022-08-08 00:00:00","2024-08-15 00:00:00","2022-08-08 00:00:00",NULL
2483121-20220816,2854907,408486,1,"WINSIGHT, LLC","WINSIGHT, LLC","300 S RIVERSIDE PLZ 16TH 1600",CHICAGO,IL,60606,42,12,42-12,1,1010,"Limited Business License","602 | 668","Administrative Commercial Office | Graphic Design and Consultation",2483121,RENEW,NULL,06/15/2022,08/05/2022,N,08/16/2022,08/15/2024,08/05/2022,08/08/2022,AAI,NULL,NULL,41.877975138,-87.638422171,"(41.87797513796852, -87.63842217104092)","2022-10-06 12:53:44",test,NULL,"2022-08-05 00:00:00","2022-08-16 00:00:00","2024-08-15 00:00:00","2022-08-08 00:00:00",NULL
2863086-20220808,2863086,63608,17,"FREDDIE'S INC.","FABULOUS FREDDIE'S","701 W 31ST ST",CHICAGO,IL,60616,11,22,11-22,9,1329,"Special Event Food",942,"5 Day Single Event  - Special Event Food",2863086,ISSUE,08/02/2022,08/02/2022,08/02/2022,N,08/08/2022,08/14/2022,08/02/2022,08/08/2022,AAI,NULL,NULL,41.837965787,-87.643906727,"(41.83796578686669, -87.64390672735786)","2022-10-06 12:53:44",test,"2022-08-02 00:00:00","2022-08-02 00:00:00","2022-08-08 00:00:00","2022-08-14 00:00:00","2022-08-08 00:00:00",NULL
1922-20220916,2858234,62544,2,"HYATT CORPORATION","BISTRO 151/BAR AT 151","151 E WACKER DR  PLAZA",CHICAGO,IL,60601,42,44,42-44,1,1006,"Retail Food Establishment",775,"Retail Sales of Perishable Foods",1922,RENEW,NULL,07/15/2022,08/05/2022,N,09/16/2022,09/15/2024,08/05/2022,08/08/2022,AAI,NULL,NULL,NULL,NULL,NULL,"2022-10-06 12:53:44",test,NULL,"2022-08-05 00:00:00","2022-09-16 00:00:00","2024-09-15 00:00:00","2022-08-08 00:00:00",NULL
2156894-20220916,2860324,355755,2,"BT Wholesale Company","BT Wholesale Company","4404 W ANN LURIE PL GROUND",CHICAGO,IL,60632,14,NULL,14-,NULL,1007,"Wholesale Food Establishment",864,"Wholesale Food Sales",2156894,RENEW,NULL,07/15/2022,08/05/2022,N,09/16/2022,09/15/2024,08/05/2022,08/08/2022,AAI,NULL,NULL,41.81632283,-87.733743734,"(41.8163228301199, -87.7337437335622)","2022-10-06 12:53:44",test,NULL,"2022-08-05 00:00:00","2022-09-16 00:00:00","2024-09-15 00:00:00","2022-08-08 00:00:00",NULL
2749265-20200826,2749265,469596,1,"BTRAINERFITNESS II, LLC","BTRAINERFITNESS II","2248 W IRVING PARK RD",CHICAGO,IL,60618,47,NULL,47-,NULL,4404,"Regulated Business License",926,"Fitness Classes",2749265,ISSUE,08/25/2020,08/25/2020,08/25/2020,N,08/26/2020,09/15/2022,08/25/2020,08/26/2020,AAC,08/08/2022,38,41.954165596,-87.685564023,"(41.95416559591821, -87.68556402297023)","2022-10-06 12:53:44",test,"2020-08-25 00:00:00","2020-08-25 00:00:00","2020-08-26 00:00:00","2022-09-15 00:00:00","2020-08-26 00:00:00","2022-08-08 00:00:00"
1694745-20120916,2173796,64603,5,"LEOPARDO COMPANIES INC.","LEOPARDO COMPANIES INC","1945 W HUBBARD ST  B",CHICAGO,IL,60622,27,27,27-27,12,1010,"Limited Business License",NULL,NULL,1694745,RENEW,NULL,07/16/2012,01/04/2013,N,09/16/2012,09/15/2014,01/04/2013,01/08/2013,AAI,NULL,NULL,41.889627703,-87.67623091,"(41.8896277030332, -87.67623090978807)","2022-10-06 12:53:44",test,NULL,"2013-01-04 00:00:00","2012-09-16 00:00:00","2014-09-15 00:00:00","2013-01-08 00:00:00",NULL
2631256-20220916,2857498,1611,7,"TTX COMPANY","TTX Company","169 E 63RD ST",CHICAGO,IL,60637,20,NULL,20-,NULL,1010,"Limited Business License",708,"Miscellaneous Commercial Services",2631256,RENEW,NULL,07/15/2022,08/05/2022,N,09/16/2022,09/15/2024,08/05/2022,08/08/2022,AAI,NULL,NULL,41.779977977,-87.620537964,"(41.77997797650758, -87.62053796359407)","2022-10-06 12:53:44",test,NULL,"2022-08-05 00:00:00","2022-09-16 00:00:00","2024-09-15 00:00:00","2022-08-08 00:00:00",NULL
2179584-20200816,2736379,374703,1,"SAE INSTITUTE OF TECHNOLOGY (CHICAGO) CORP.","SAE INSTITUTE","820 N ORLEANS ST 1ST 125-135",CHICAGO,IL,60610,27,NULL,27-,NULL,1010,"Limited Business License",NULL,NULL,2179584,RENEW,NULL,06/15/2020,08/27/2021,N,08/16/2020,08/15/2022,08/27/2021,08/08/2022,AAI,NULL,NULL,41.897338047,-87.63734543,"(41.897338047455214, -87.63734543001038)","2022-10-06 12:53:44",test,NULL,"2021-08-27 00:00:00","2020-08-16 00:00:00","2022-08-15 00:00:00","2022-08-08 00:00:00",NULL
2863165-20220808,2863165,305048,15,"THE ORIGINAL SCOOPS CHICAGO INC.","THE ORIGINAL SCOOPS CHICAGO INC.","608 W 31ST ST",CHICAGO,IL,60616,11,18,11-18,9,1329,"Special Event Food",942,"5 Day Single Event  - Special Event Food",2863165,ISSUE,08/03/2022,08/03/2022,08/05/2022,N,08/08/2022,08/14/2022,08/05/2022,08/08/2022,AAI,NULL,NULL,41.838210544,-87.641818639,"(41.83821054421488, -87.64181863880087)","2022-10-06 12:53:44",test,"2022-08-03 00:00:00","2022-08-05 00:00:00","2022-08-08 00:00:00","2022-08-14 00:00:00","2022-08-08 00:00:00",NULL
2776117-20220316,2830599,473466,1,"GOLD STAR VP LLC","GOLD STAR VP","110 W HUBBARD ST",CHICAGO,IL,60654,42,32,42-32,18,2101,"Valet Parking Operator",855,"Valet Parking Operator",2776117,RENEW,NULL,01/15/2022,08/08/2022,N,03/16/2022,06/30/2023,08/08/2022,08/08/2022,AAI,NULL,NULL,41.890123938,-87.631596659,"(41.89012393802728, -87.63159665930549)","2022-10-06 12:53:44",test,NULL,"2022-08-08 00:00:00","2022-03-16 00:00:00","2023-06-30 00:00:00","2022-08-08 00:00:00",NULL
2856871-20220808,2856871,403201,5,"LITTLE SCHOLARS JOURNEY INC.","LSJ AFTERSCHOOL CENTER II","3324 S ARCHER AVE  C&D",CHICAGO,IL,60608,12,5,12-5,9,1006,"Retail Food Establishment",736,"Preparation of Food, Coffee or Drinks",2856871,ISSUE,06/30/2022,07/01/2022,07/01/2022,N,08/08/2022,07/15/2024,08/05/2022,08/08/2022,AAI,NULL,NULL,41.833535253,-87.67274903,"(41.83353525306673, -87.67274903031074)","2022-10-06 12:53:44",test,"2022-06-30 00:00:00","2022-07-01 00:00:00","2022-08-08 00:00:00","2024-07-15 00:00:00","2022-08-08 00:00:00",NULL
1476068-20160916,2583436,64603,4,"LEOPARDO COMPANIES INC.","LEOPARDO COMPANIES INC","333 W WACKER DR 2ND 250",CHICAGO,IL,60606,42,NULL,42-,1,1010,"Limited Business License",708,"Miscellaneous Commercial Services",1476068,RENEW,NULL,02/26/2018,02/26/2018,N,09/16/2016,09/15/2018,02/26/2018,02/26/2018,AAI,NULL,NULL,41.886025413,-87.636297703,"(41.886025412541144, -87.63629770323044)","2022-10-06 12:53:44",test,NULL,"2018-02-26 00:00:00","2016-09-16 00:00:00","2018-09-15 00:00:00","2018-02-26 00:00:00",NULL
2749607-20200904,2749607,469826,1,"EPM Zen Consulting LLC","EPM Zen Consulting LLC","331 S PEORIA ST  506",CHICAGO,IL,60607,25,NULL,25-,NULL,4404,"Regulated Business License",637,"Computer Consulting Services / Computer Automated Design (Home Based Business)",2749607,ISSUE,09/03/2020,09/03/2020,09/03/2020,N,09/04/2020,09/15/2022,09/03/2020,09/04/2020,AAC,08/08/2022,NULL,41.876944602,-87.649400198,"(41.87694460187624, -87.6494001983163)","2022-10-06 12:53:44",test,"2020-09-03 00:00:00","2020-09-03 00:00:00","2020-09-04 00:00:00","2022-09-15 00:00:00","2020-09-04 00:00:00","2022-08-08 00:00:00"
77671-20201116,2750381,22890,2,"SARGON INC.","SARGON COMPANY","6510 N KNOX AVE",LINCOLNWOOD,IL,60712,NULL,NULL,NULL,NULL,1010,"Limited Business License",NULL,NULL,77671,RENEW,NULL,09/15/2020,11/12/2020,N,11/16/2020,11/15/2022,11/12/2020,11/13/2020,AAI,NULL,NULL,NULL,NULL,NULL,"2022-10-06 12:53:44",test,NULL,"2020-11-12 00:00:00","2020-11-16 00:00:00","2022-11-15 00:00:00","2020-11-13 00:00:00",NULL
2641931-20210116,2761984,455553,1,"GC BY GEORGE CHARLES, INC","GC BY GEORGE CHARLES INC.","34 E OAK ST 3",CHICAGO,IL,60611,42,NULL,42-,NULL,1010,"Limited Business License","894 | 904","Hair Services | Retail Sales of General Merchandise",2641931,RENEW,NULL,11/15/2020,12/21/2020,N,01/16/2021,01/15/2023,12/21/2020,12/22/2020,AAI,NULL,NULL,41.900876076,-87.627071124,"(41.90087607617737, -87.62707112396201)","2022-10-06 12:53:44",test,NULL,"2020-12-21 00:00:00","2021-01-16 00:00:00","2023-01-15 00:00:00","2020-12-22 00:00:00",NULL
2863329-20220808,2863329,488422,1,"ADRIAN M. JASER","ADRIAN M JASER","3547 W AINSLIE ST",CHICAGO,IL,60625,33,7,33-7,17,4406,"Peddler License",915,"Street Performer, Moving Along the Public Way (Special)",2863329,ISSUE,08/08/2022,08/08/2022,08/08/2022,N,08/08/2022,08/15/2024,NULL,08/08/2022,AAI,NULL,NULL,41.970064511,-87.717768831,"(41.9700645106881, -87.71776883146563)","2022-10-06 12:53:44",test,"2022-08-08 00:00:00","2022-08-08 00:00:00","2022-08-08 00:00:00","2024-08-15 00:00:00","2022-08-08 00:00:00",NULL
85497-20050216,1561450,81615,1,"QUALITY URBAN INVESTORS AND DEVELOPERS INC.","QUID INC.","1131  LAKE ST  112","OAK PARK",IL,60301,NULL,NULL,NULL,NULL,1011,"Home Repair",NULL,NULL,85497,RENEW,NULL,12/20/2004,07/02/2007,N,02/16/2005,02/15/2006,NULL,07/02/2007,AAI,NULL,NULL,NULL,NULL,NULL,"2022-10-06 12:53:44",test,NULL,"2007-07-02 00:00:00","2005-02-16 00:00:00","2006-02-15 00:00:00","2007-07-02 00:00:00",NULL
1919-20220916,2858229,62544,1,"HYATT CORPORATION",BIG,"151 E WACKER DR  SKYWA",CHICAGO,IL,60601,42,44,42-44,1,1471,"Late Hour",785,"Sale of Liquor Until 4am, Monday - Saturday and 5am on Sunday",1919,RENEW,NULL,07/15/2022,08/05/2022,N,09/16/2022,09/15/2024,08/05/2022,08/08/2022,AAI,NULL,NULL,41.887999887,-87.622565133,"(41.88799988734853, -87.62256513255957)","2022-10-06 12:53:44",test,NULL,"2022-08-05 00:00:00","2022-09-16 00:00:00","2024-09-15 00:00:00","2022-08-08 00:00:00",NULL
1694745-20060511,1694745,64603,5,"LEOPARDO COMPANIES INC.","LEOPARDO COMPANIES INC","1945 W HUBBARD ST  B",CHICAGO,IL,60622,27,27,27-27,12,1010,"Limited Business License",NULL,NULL,1694745,ISSUE,03/30/2006,05/10/2006,05/10/2006,N,05/11/2006,11/15/2006,05/10/2006,05/11/2006,AAI,NULL,NULL,41.889627703,-87.67623091,"(41.8896277030332, -87.67623090978807)","2022-10-06 12:53:44",test,"2006-03-30 00:00:00","2006-05-10 00:00:00","2006-05-11 00:00:00","2006-11-15 00:00:00","2006-05-11 00:00:00",NULL
1946-20220916,2858246,62544,14,"HYATT CORPORATION","HYATT REGENCY CHICAGO(PARKING)","201 E WACKER DR  1",CHICAGO,IL,60601,42,44,42-44,1,1003,"Commercial Garage",725,"Provide Parking Spaces For a Fee - Available and Advertised to the Public",1946,RENEW,NULL,07/15/2022,08/05/2022,N,09/16/2022,09/15/2024,08/05/2022,08/08/2022,AAI,NULL,NULL,41.88796387,-87.622277761,"(41.8879638696515, -87.62227776109512)","2022-10-06 12:53:44",test,NULL,"2022-08-05 00:00:00","2022-09-16 00:00:00","2024-09-15 00:00:00","2022-08-08 00:00:00",NULL
2733042-20211216,2815770,368179,2,"CHAD EVAN ELWELL","CHAD EVAN ELWELL","4956 N MERRIMAC AVE",CHICAGO,IL,60630,45,NULL,45-,NULL,4406,"Peddler License",819,"Street Performer, Moving Along the Public Way",2733042,RENEW,NULL,10/15/2021,08/08/2022,N,12/16/2021,12/15/2023,NULL,08/08/2022,AAI,NULL,NULL,41.971822519,-87.784465729,"(41.971822519172896, -87.784465729102)","2022-10-06 12:53:44",test,NULL,"2022-08-08 00:00:00","2021-12-16 00:00:00","2023-12-15 00:00:00","2022-08-08 00:00:00",NULL
2863243-20220808,2863243,369631,31,"VIVA ENTERTAINMENT NETWORK, INC.","VIVA ENTERTAINMENT NETWORK, INC.","1106 W LAWRENCE AVE",CHICAGO,IL,60640,46,6,46-6,20,4409,"Pop-Up Retail User",1027,"Organizer of a 1-5 Day Event w/ Pop-Up Retail Users at a Trade Show, Exhibition or Convention",2863243,ISSUE,08/04/2022,08/04/2022,08/06/2022,N,08/08/2022,10/09/2022,08/06/2022,08/08/2022,AAI,NULL,34,41.969157897,-87.65793578,"(41.96915789659782, -87.65793578029242)","2022-10-06 12:53:44",test,"2022-08-04 00:00:00","2022-08-06 00:00:00","2022-08-08 00:00:00","2022-10-09 00:00:00","2022-08-08 00:00:00",NULL
1920-20220916,2858230,62544,1,"HYATT CORPORATION",BIG,"151 E WACKER DR  SKYWA",CHICAGO,IL,60601,42,44,42-44,1,1475,"Consumption on Premises - Incidental Activity",638,"Consumption of Liquor on Premises",1920,RENEW,NULL,07/15/2022,08/05/2022,N,09/16/2022,09/15/2024,08/05/2022,08/08/2022,AAI,NULL,NULL,41.887999887,-87.622565133,"(41.88799988734853, -87.62256513255957)","2022-10-06 12:53:44",test,NULL,"2022-08-05 00:00:00","2022-09-16 00:00:00","2024-09-15 00:00:00","2022-08-08 00:00:00",NULL
11590-20060216,1651513,5453,1,"SCANDINAVIAN BUILDERS LIMITED","SCANDINAVIAN BUILDERS LTD","2932  MALMO DR  1ST","ARLINGTON HEIGHTS",IL,60005,NULL,NULL,NULL,NULL,1010,"Limited Business License",NULL,NULL,11590,RENEW,NULL,12/21/2005,01/13/2006,N,02/16/2006,02/15/2007,01/13/2006,01/17/2006,AAI,NULL,NULL,NULL,NULL,NULL,"2022-10-06 12:53:44",test,NULL,"2006-01-13 00:00:00","2006-02-16 00:00:00","2007-02-15 00:00:00","2006-01-17 00:00:00",NULL
2827574-20220808,2827574,482301,1,"IN THE MIXX BOUTIQUE CORPORATION","IN THE MIXX BOUTIQUE","8225 1/2 S ASHLAND AVE 1ST",CHICAGO,IL,60620,21,26,21-26,6,1010,"Limited Business License",911,"Retail Sales of Clothing / Accessories / Shoes",2827574,ISSUE,01/04/2022,08/08/2022,08/08/2022,N,08/08/2022,08/15/2024,08/08/2022,08/08/2022,AAI,NULL,69,41.7441287,-87.663135331,"(41.744128700392686, -87.66313533103055)","2022-10-06 12:53:44",test,"2022-01-04 00:00:00","2022-08-08 00:00:00","2022-08-08 00:00:00","2024-08-15 00:00:00","2022-08-08 00:00:00",NULL
2334117-20220616,2843809,385373,1,"JUAN CARLOS HUERTA PARDO","MUFFLER MEN","11030-11038 S HALSTED ST 1ST",CHICAGO,IL,60628,34,43,34-43,22,8340,"Motor Vehicle Services License",712,"Motor Vehicle Repair -  Engine and Transmission Work",2334117,RENEW,NULL,04/15/2022,08/08/2022,N,06/16/2022,06/15/2024,08/08/2022,08/08/2022,AAI,NULL,45,41.693236073,-87.642552679,"(41.69323607289417, -87.64255267937406)","2022-10-06 12:53:44",test,NULL,"2022-08-08 00:00:00","2022-06-16 00:00:00","2024-06-15 00:00:00","2022-08-08 00:00:00",NULL
15136-20220816,2851744,6633,1,"HARLEM CORPORATION","NICK'S DRIVE INN","7216 N HARLEM AVE",CHICAGO,IL,60631,41,1,41-1,16,1006,"Retail Food Establishment",775,"Retail Sales of Perishable Foods",15136,RENEW,NULL,06/15/2022,08/05/2022,N,08/16/2022,08/15/2024,08/05/2022,08/08/2022,AAI,NULL,NULL,42.012255295,-87.806779122,"(42.012255295394226, -87.8067791219124)","2022-10-06 12:53:44",test,NULL,"2022-08-05 00:00:00","2022-08-16 00:00:00","2024-08-15 00:00:00","2022-08-08 00:00:00",NULL
2850195-20220808,2850195,483628,2,"X-GOLF CHICAGO LLC","X-GOLF WRIGLEYVILLE","3549 N SHEFFIELD AVE",CHICAGO,IL,60657,44,NULL,44-,19,1050,"Public Place of Amusement",746,"Public Place of Amusement, Provides Entertainment, Room Rentals and Charges a Fee",2850195,ISSUE,05/17/2022,05/17/2022,05/19/2022,N,08/08/2022,08/15/2024,08/08/2022,08/08/2022,AAI,NULL,17,41.946868052,-87.654170779,"(41.94686805180506, -87.65417077896993)","2022-10-06 12:53:44",test,"2022-05-17 00:00:00","2022-05-19 00:00:00","2022-08-08 00:00:00","2024-08-15 00:00:00","2022-08-08 00:00:00",NULL
73379-20220816,2852190,22048,2,"MCATEER'S IRISH PUB INCORPORATED","TRINITY PUB CHICAGO","5943 N NORTHWEST HWY",CHICAGO,IL,60631,41,21,41-21,16,1006,"Retail Food Establishment",775,"Retail Sales of Perishable Foods",73379,RENEW,NULL,06/15/2022,07/25/2022,N,08/16/2022,08/15/2024,07/25/2022,08/08/2022,AAI,NULL,NULL,41.98904253,-87.792979377,"(41.98904252993585, -87.79297937696374)","2022-10-06 12:53:44",test,NULL,"2022-07-25 00:00:00","2022-08-16 00:00:00","2024-08-15 00:00:00","2022-08-08 00:00:00",NULL
2446708-20220516,2839036,403880,1,"STANDING PASSENGERS INC.","STANDING PASSENGERS INC.","1458 W CHICAGO AVE 1ST",CHICAGO,IL,60642,1,32,1-32,12,1006,"Retail Food Establishment","781 | 904","Sale of Food Prepared Onsite With Dining Area | Retail Sales of General Merchandise",2446708,RENEW,NULL,03/15/2022,08/08/2022,N,05/16/2022,05/15/2024,08/08/2022,08/08/2022,AAI,NULL,29,41.896223264,-87.664721187,"(41.896223263877324, -87.66472118728599)","2022-10-06 12:53:44",test,NULL,"2022-08-08 00:00:00","2022-05-16 00:00:00","2024-05-15 00:00:00","2022-08-08 00:00:00",NULL
1694745-20080916,1918052,64603,5,"LEOPARDO COMPANIES INC.","LEOPARDO COMPANIES INC","1945 W HUBBARD ST  B",CHICAGO,IL,60622,27,27,27-27,12,1010,"Limited Business License",NULL,NULL,1694745,RENEW,NULL,07/15/2008,08/28/2008,N,09/16/2008,09/15/2010,08/28/2008,08/29/2008,AAI,NULL,NULL,41.889627703,-87.67623091,"(41.8896277030332, -87.67623090978807)","2022-10-06 12:53:44",test,NULL,"2008-08-28 00:00:00","2008-09-16 00:00:00","2010-09-15 00:00:00","2008-08-29 00:00:00",NULL
2293398-20211116,2811186,385896,1,"INMOTION ORD, LLC","INMOTION ENTERTAINMENT","11601 W TOUHY AVE TERMINAL 1  GATE B7 T1BU.78A",CHICAGO,IL,60666,41,27,41-27,16,1010,"Limited Business License",904,"Retail Sales of General Merchandise",2293398,RENEW,NULL,09/15/2021,04/18/2022,N,11/16/2021,11/15/2023,04/18/2022,08/08/2022,AAI,NULL,NULL,42.008536401,-87.914428439,"(42.008536400868735, -87.91442843927047)","2022-10-06 12:53:44",test,NULL,"2022-04-18 00:00:00","2021-11-16 00:00:00","2023-11-15 00:00:00","2022-08-08 00:00:00",NULL
2636565-20201216,2756920,454540,1,"STAR TAX & ACCOUNTING SERVICES INC.","STAR TAX & ACCOUNTING SERVICES INC.","2335 W DEVON AVE 2ND 208",CHICAGO,IL,60659,50,31,50-31,24,1010,"Limited Business License","197 | 708 | 897","Tax Preparation Services | Miscellaneous Commercial Services | Financial Services Commercial Office",2636565,RENEW,NULL,10/15/2020,08/05/2022,N,12/16/2020,12/15/2022,08/05/2022,08/08/2022,AAI,NULL,43,41.997637023,-87.688877434,"(41.997637023065984, -87.68887743371468)","2022-10-06 12:53:44",test,NULL,"2022-08-05 00:00:00","2020-12-16 00:00:00","2022-12-15 00:00:00","2022-08-08 00:00:00",NULL
2615950-20220816,2855495,429435,1,"ANNE WILLIS","ANNE WILLIS","[REDACTED FOR PRIVACY]",FRANKFORT,IL,60423,NULL,NULL,NULL,NULL,7009,"Pharmaceutical Representative",990,"Markets / Promotes Pharmaceuticals to Health Care Professionals and Conducts Business for More than 15 Calendar Days per Year",2615950,RENEW,NULL,06/15/2022,08/05/2022,N,08/16/2022,08/15/2023,08/05/2022,08/08/2022,AAI,NULL,NULL,NULL,NULL,NULL,"2022-10-06 12:53:44",test,NULL,"2022-08-05 00:00:00","2022-08-16 00:00:00","2023-08-15 00:00:00","2022-08-08 00:00:00",NULL
2293399-20211116,2811187,385896,3,"INMOTION ORD, LLC","INMOTION ENTERTAINMENT","11601 W TOUHY AVE TERMINAL 3",CHICAGO,IL,60666,41,27,41-27,16,1010,"Limited Business License",904,"Retail Sales of General Merchandise",2293399,RENEW,NULL,09/15/2021,04/18/2022,N,11/16/2021,11/15/2023,04/18/2022,08/08/2022,AAI,NULL,NULL,42.008536401,-87.914428439,"(42.008536400868735, -87.91442843927047)","2022-10-06 12:53:44",test,NULL,"2022-04-18 00:00:00","2021-11-16 00:00:00","2023-11-15 00:00:00","2022-08-08 00:00:00",NULL
2641931-20190107,2641931,455553,1,"GC BY GEORGE CHARLES, INC","GC BY GEORGE CHARLES INC.","34 E OAK ST 3",CHICAGO,IL,60611,42,NULL,42-,NULL,1010,"Limited Business License","894 | 904","Hair Services | Retail Sales of General Merchandise",2641931,ISSUE,01/04/2019,01/04/2019,01/04/2019,N,01/07/2019,01/15/2021,01/04/2019,01/07/2019,AAI,NULL,NULL,41.900876076,-87.627071124,"(41.90087607617737, -87.62707112396201)","2022-10-06 12:53:44",test,"2019-01-04 00:00:00","2019-01-04 00:00:00","2019-01-07 00:00:00","2021-01-15 00:00:00","2019-01-07 00:00:00",NULL
1928-20220916,2858238,62544,4,"HYATT CORPORATION","FAT EDDIE'S EMPLOYEE CAFETERIA","151 E WACKER DR  LOBBY",CHICAGO,IL,60601,42,44,42-44,1,1006,"Retail Food Establishment",775,"Retail Sales of Perishable Foods",1928,RENEW,NULL,07/15/2022,08/05/2022,N,09/16/2022,09/15/2024,08/05/2022,08/08/2022,AAI,NULL,NULL,41.887999887,-87.622565133,"(41.88799988734853, -87.62256513255957)","2022-10-06 12:53:44",test,NULL,"2022-08-05 00:00:00","2022-09-16 00:00:00","2024-09-15 00:00:00","2022-08-08 00:00:00",NULL
1925-20220916,2858236,62544,3,"HYATT CORPORATION","CRYSTAL BALLROOM/PLAZA BALLROOM","151 E WACKER DR  PLAZA",CHICAGO,IL,60601,42,44,42-44,1,1006,"Retail Food Establishment",775,"Retail Sales of Perishable Foods",1925,RENEW,NULL,07/15/2022,08/05/2022,N,09/16/2022,09/15/2024,08/05/2022,08/08/2022,AAI,NULL,NULL,NULL,NULL,NULL,"2022-10-06 12:53:44",test,NULL,"2022-08-05 00:00:00","2022-09-16 00:00:00","2024-09-15 00:00:00","2022-08-08 00:00:00",NULL
1597957-20211216,2814504,7103,3,"KEE SOON YANG","LAVANDARIA SUNSHINE","3448 W 26TH ST",CHICAGO,IL,60623,22,22,22-22,10,1010,"Limited Business License",NULL,NULL,1597957,RENEW,NULL,10/15/2021,11/28/2021,N,12/16/2021,12/15/2023,11/28/2021,06/01/2022,AAC,08/08/2022,25,41.844533372,-87.711869687,"(41.84453337185048, -87.71186968703314)","2022-10-06 12:53:44",test,NULL,"2021-11-28 00:00:00","2021-12-16 00:00:00","2023-12-15 00:00:00","2022-06-01 00:00:00","2022-08-08 00:00:00"
1476068-20120916,2173795,64603,4,"LEOPARDO COMPANIES INC.","LEOPARDO COMPANIES INC","333 W WACKER DR 2ND 250",CHICAGO,IL,60606,42,NULL,42-,1,1010,"Limited Business License",708,"Miscellaneous Commercial Services",1476068,RENEW,NULL,07/16/2012,08/06/2012,N,09/16/2012,09/15/2014,08/06/2012,08/07/2012,AAI,NULL,NULL,41.886025413,-87.636297703,"(41.886025412541144, -87.63629770323044)","2022-10-06 12:53:44",test,NULL,"2012-08-06 00:00:00","2012-09-16 00:00:00","2014-09-15 00:00:00","2012-08-07 00:00:00",NULL
39514-20220916,2857495,1611,1,"TTX COMPANY","TTX COMPANY","101 N WACKER DR  1ST",CHICAGO,IL,60606,42,9,42-9,1,1010,"Limited Business License",NULL,NULL,39514,RENEW,NULL,07/15/2022,08/05/2022,N,09/16/2022,09/15/2024,08/05/2022,08/08/2022,AAI,NULL,NULL,41.883234348,-87.636649062,"(41.88323434776848, -87.6366490618587)","2022-10-06 12:53:44",test,NULL,"2022-08-05 00:00:00","2022-09-16 00:00:00","2024-09-15 00:00:00","2022-08-08 00:00:00",NULL
1221590-20220816,2853037,223026,1,"CITY CREWS INC","THE TOUHY BARBER","7244 W TOUHY AVE",CHICAGO,IL,60631,41,1,41-1,16,1010,"Limited Business License",894,"Hair Services",1221590,RENEW,NULL,06/15/2022,08/05/2022,N,08/16/2022,08/15/2024,08/05/2022,08/08/2022,AAI,NULL,NULL,42.011782945,-87.808403047,"(42.011782945307175, -87.80840304651734)","2022-10-06 12:53:44",test,NULL,"2022-08-05 00:00:00","2022-08-16 00:00:00","2024-08-15 00:00:00","2022-08-08 00:00:00",NULL
5490-20220716,2846467,3424,1,"FRANCISCO ESPINOZA","FRANCISCO ESPINOZA","8827 S ESCANABA AVE",CHICAGO,IL,60617,10,43,10-43,4,1006,"Retail Food Establishment",775,"Retail Sales of Perishable Foods",5490,RENEW,NULL,05/15/2022,06/24/2022,N,07/16/2022,07/15/2024,06/24/2022,08/08/2022,AAI,NULL,NULL,41.734696131,-87.553990694,"(41.734696130919914, -87.55399069436419)","2022-10-06 12:53:44",test,NULL,"2022-06-24 00:00:00","2022-07-16 00:00:00","2024-07-15 00:00:00","2022-08-08 00:00:00",NULL
2862865-20220808,2862865,485651,1,"REINA'S CAKES, LLC","REINA'S CAKES","1646 N CALIFORNIA AVE 2ND 2",CHICAGO,IL,60647,1,30,1-30,14,8344,"Shared Kitchen User (Long Term)",804,"Shared Kitchen User - Long Term",2862865,ISSUE,07/28/2022,07/28/2022,07/28/2022,N,08/08/2022,08/15/2024,NULL,08/08/2022,AAI,NULL,NULL,41.911573297,-87.697171284,"(41.91157329666921, -87.69717128449659)","2022-10-06 12:53:44",test,"2022-07-28 00:00:00","2022-07-28 00:00:00","2022-08-08 00:00:00","2024-08-15 00:00:00","2022-08-08 00:00:00",NULL
2862857-20220808,2862857,488044,1,"ANASHA MANAGEMENT LLC","PREQUEL CAFE","1957 W CHICAGO AVE 1ST",CHICAGO,IL,60622,1,39,1-39,12,1006,"Retail Food Establishment","781 | 904 | 1050","Sale of Food Prepared Onsite With Dining Area | Retail Sales of General Merchandise | Preparation and Sale of Coffee and/or Drinks",2862857,ISSUE,07/28/2022,07/28/2022,07/28/2022,N,08/08/2022,08/15/2024,08/05/2022,08/08/2022,AAI,NULL,29,41.895804659,-87.676909029,"(41.895804659381085, -87.67690902890348)","2022-10-06 12:53:44",test,"2022-07-28 00:00:00","2022-07-28 00:00:00","2022-08-08 00:00:00","2024-08-15 00:00:00","2022-08-08 00:00:00",NULL
2148033-20220416,2832668,262394,3,"F.E. ROOFTEC CORPORATION","F.E. ROOFTEC CORPORATION","9126  MEDILL AVE","FRANKLIN PARK",IL,60131,NULL,NULL,NULL,NULL,1010,"Limited Business License",NULL,NULL,2148033,RENEW,NULL,02/15/2022,02/16/2022,N,04/16/2022,04/15/2024,02/16/2022,02/17/2022,AAC,08/08/2022,NULL,NULL,NULL,NULL,"2022-10-06 12:53:44",test,NULL,"2022-02-16 00:00:00","2022-04-16 00:00:00","2024-04-15 00:00:00","2022-02-17 00:00:00","2022-08-08 00:00:00"
2163193-20210416,2771705,470,4,"BENNETT & BROSSEAU ROOFING, INC.","Bennett & Brosseau Roofing, Inc.","535  ANDERSON DR",ROMEOVILLE,IL,60446,NULL,NULL,NULL,NULL,1010,"Limited Business License",NULL,NULL,2163193,RENEW,NULL,02/15/2021,03/12/2021,N,04/16/2021,04/15/2023,03/12/2021,03/15/2021,AAI,NULL,NULL,NULL,NULL,NULL,"2022-10-06 12:53:44",test,NULL,"2021-03-12 00:00:00","2021-04-16 00:00:00","2023-04-15 00:00:00","2021-03-15 00:00:00",NULL
1476068-20060511,1476068,64603,4,"LEOPARDO COMPANIES INC.","LEOPARDO COMPANIES INC","333 W WACKER DR 2ND 250",CHICAGO,IL,60606,42,NULL,42-,1,1010,"Limited Business License",NULL,NULL,1476068,ISSUE,02/05/2004,05/10/2006,05/10/2006,N,05/11/2006,11/15/2006,05/10/2006,05/11/2006,AAI,NULL,NULL,41.886025413,-87.636297703,"(41.886025412541144, -87.63629770323044)","2022-10-06 12:53:44",test,"2004-02-05 00:00:00","2006-05-10 00:00:00","2006-05-11 00:00:00","2006-11-15 00:00:00","2006-05-11 00:00:00",NULL
2863341-20220808,2863341,488427,1,"SUWAN CHOI","SUWAN CHOI","275  OAK CREEK DR 3RD 315",WHEELING,IL,60090,NULL,NULL,NULL,NULL,4406,"Peddler License",819,"Street Performer, Moving Along the Public Way",2863341,ISSUE,08/08/2022,08/08/2022,08/08/2022,N,08/08/2022,08/15/2024,NULL,08/08/2022,AAI,NULL,NULL,NULL,NULL,NULL,"2022-10-06 12:53:44",test,"2022-08-08 00:00:00","2022-08-08 00:00:00","2022-08-08 00:00:00","2024-08-15 00:00:00","2022-08-08 00:00:00",NULL
2632005-20210716,2789431,382200,5,"IMMEDIATE CREDIT RECOVERY, INC.",N/A,"2905  SHERWOOD WAY  100","SAN ANGELO",TX,76901,NULL,NULL,NULL,NULL,4404,"Regulated Business License",912,"Debt Collecting - Administrative Commercial Office",2632005,RENEW,NULL,05/15/2021,06/23/2021,N,07/16/2021,07/15/2023,06/23/2021,06/24/2021,AAC,08/08/2022,NULL,NULL,NULL,NULL,"2022-10-06 12:53:44",test,NULL,"2021-06-23 00:00:00","2021-07-16 00:00:00","2023-07-15 00:00:00","2021-06-24 00:00:00","2022-08-08 00:00:00"
2738503-20220716,2849954,468560,1,"BUREAU BAR AND RESTAURANT LLC","BUREAU BAR AND RESTAURANT","2115 S STATE ST 1ST",CHICAGO,IL,60616,3,NULL,3-,NULL,1006,"Retail Food Establishment",735,"Preparation of Food and Dining on Premise With Seating",2738503,RENEW,NULL,05/15/2022,08/08/2022,N,07/16/2022,07/15/2024,07/13/2022,07/20/2022,AAI,NULL,NULL,41.853768096,-87.62695736,"(41.85376809634427, -87.62695735958255)","2022-10-06 12:53:44",test,NULL,"2022-08-08 00:00:00","2022-07-16 00:00:00","2024-07-15 00:00:00","2022-07-20 00:00:00",NULL
2594659-20220416,2834104,405479,2,"BROTHERS STANDING TOGETHER, INC.","BROTHERS STANDING TOGETHER, INC.","459 W DIVISION ST 6TH 607",CHICAGO,IL,60610,27,48,27-48,18,4404,"Regulated Business License","674 | 690","Home Repair Services (Home Based Business) | Landscaping Services (Home Based Business)",2594659,RENEW,NULL,02/15/2022,06/08/2022,N,04/16/2022,04/15/2024,06/08/2022,08/08/2022,AAI,NULL,NULL,41.903648817,-87.640463219,"(41.903648817128776, -87.64046321927717)","2022-10-06 12:53:44",test,NULL,"2022-06-08 00:00:00","2022-04-16 00:00:00","2024-04-15 00:00:00","2022-08-08 00:00:00",NULL
2862719-20220808,2862719,477960,3,"MBC ROSEMONT, LLC","MBC ROSEMONT, LLC","9546  BALMORAL AVE",ROSEMONT,IL,60018,NULL,NULL,NULL,NULL,1329,"Special Event Food",942,"5 Day Single Event  - Special Event Food",2862719,ISSUE,07/25/2022,07/25/2022,08/08/2022,N,08/08/2022,08/15/2022,08/08/2022,08/08/2022,AAI,NULL,NULL,NULL,NULL,NULL,"2022-10-06 12:53:44",test,"2022-07-25 00:00:00","2022-08-08 00:00:00","2022-08-08 00:00:00","2022-08-15 00:00:00","2022-08-08 00:00:00",NULL
2863308-20220808,2863308,488381,1,"YOU AND COMPANY NAIL BOUTIQUE LLC","YOU AND COMPANY NAIL BOUTIQUE","4612 N LINCOLN AVE 1ST",CHICAGO,IL,60625,47,42,47-42,19,1010,"Limited Business License",895,"Nail Services",2863308,ISSUE,08/08/2022,08/08/2022,08/08/2022,N,08/08/2022,08/15/2024,08/08/2022,08/08/2022,AAI,NULL,21,41.965208654,-87.686477407,"(41.965208653887956, -87.68647740718738)","2022-10-06 12:53:44",test,"2022-08-08 00:00:00","2022-08-08 00:00:00","2022-08-08 00:00:00","2024-08-15 00:00:00","2022-08-08 00:00:00",NULL
2179584-20120808,2179584,374703,1,"SAE INSTITUTE OF TECHNOLOGY (CHICAGO) CORP.","SAE INSTITUTE","820 N ORLEANS ST 1ST 125-135",CHICAGO,IL,60610,27,NULL,27-,NULL,1010,"Limited Business License",NULL,NULL,2179584,ISSUE,NULL,08/07/2012,08/07/2012,N,08/08/2012,08/15/2014,08/07/2012,08/08/2012,AAI,NULL,NULL,41.897338047,-87.63734543,"(41.897338047455214, -87.63734543001038)","2022-10-06 12:53:44",test,NULL,"2012-08-07 00:00:00","2012-08-08 00:00:00","2014-08-15 00:00:00","2012-08-08 00:00:00",NULL
1476068-20180916,2610989,64603,4,"LEOPARDO COMPANIES INC.","LEOPARDO COMPANIES INC","333 W WACKER DR 2ND 250",CHICAGO,IL,60606,42,NULL,42-,1,1010,"Limited Business License",708,"Miscellaneous Commercial Services",1476068,RENEW,NULL,07/15/2018,08/22/2018,N,09/16/2018,09/15/2020,08/22/2018,08/22/2018,AAC,04/24/2019,NULL,41.886025413,-87.636297703,"(41.886025412541144, -87.63629770323044)","2022-10-06 12:53:44",test,NULL,"2018-08-22 00:00:00","2018-09-16 00:00:00","2020-09-15 00:00:00","2018-08-22 00:00:00","2019-04-24 00:00:00"
2841290-20220808,2841290,484766,1,"PPMG GATEWAY LLC","PITA PITA MEDITERRANEAN GRILL","705 S SEELEY AVE 1ST",CHICAGO,IL,60612,28,NULL,28-,12,1006,"Retail Food Establishment",781,"Sale of Food Prepared Onsite With Dining Area",2841290,ISSUE,04/11/2022,04/26/2022,06/13/2022,N,08/08/2022,08/15/2024,08/05/2022,08/08/2022,AAI,NULL,NULL,41.873097353,-87.677454943,"(41.87309735332711, -87.67745494311458)","2022-10-06 12:53:44",test,"2022-04-11 00:00:00","2022-06-13 00:00:00","2022-08-08 00:00:00","2024-08-15 00:00:00","2022-08-08 00:00:00",NULL
2355251-20200916,2742951,393359,1,"CYBERMEDIA VENTURES, LLC","BOSNA TV","5443 N LINCOLN AVE",CHICAGO,IL,60625,40,44,40-44,20,1010,"Limited Business License",602,"Administrative Commercial Office",2355251,RENEW,NULL,07/15/2020,09/24/2020,N,09/16/2020,09/15/2022,09/24/2020,09/25/2020,AAC,08/08/2022,NULL,41.980825542,-87.692649289,"(41.980825541724606, -87.69264928893908)","2022-10-06 12:53:44",test,NULL,"2020-09-24 00:00:00","2020-09-16 00:00:00","2022-09-15 00:00:00","2020-09-25 00:00:00","2022-08-08 00:00:00"
2074468-20120816,2161158,334772,2,"MIGUEL ANGEL DUARTE-SOLIS","MIGUEL ANGEL DUARTE-SOLIS","5015 S DAMEN AVE 1ST",CHICAGO,IL,60609,15,15,15-15,9,1607,"Peddler, non-food, special",NULL,NULL,2074468,RENEW,NULL,06/15/2012,08/16/2012,N,08/16/2012,08/15/2014,NULL,08/16/2012,AAC,12/29/2012,NULL,41.802569456,-87.674395755,"(41.802569455769735, -87.67439575456822)","2022-10-06 12:53:44",test,NULL,"2012-08-16 00:00:00","2012-08-16 00:00:00","2014-08-15 00:00:00","2012-08-16 00:00:00","2012-12-29 00:00:00"
2216812-20220816,2851938,10861,2,"BENCHMARK CONSTRUCTION CO INC","BENCHMARK CONSTRUCTION CO INC","3349 S KEDZIE AVE",CHICAGO,IL,60623,12,2,12-2,10,4404,"Regulated Business License",816,"Storage or Use of Hazardous Materials",2216812,RENEW,NULL,06/15/2022,06/15/2022,N,08/16/2022,08/15/2024,06/15/2022,08/08/2022,AAI,NULL,NULL,41.832018842,-87.704527387,"(41.83201884164434, -87.70452738722292)","2022-10-06 12:53:44",test,NULL,"2022-06-15 00:00:00","2022-08-16 00:00:00","2024-08-15 00:00:00","2022-08-08 00:00:00",NULL
61237-20220516,2837035,86347,1,"S&W CHICAGO, L.L.C.","SMITH & WOLLENSKY","318 N STATE ST LL + 1",CHICAGO,IL,60654,42,27,42-27,18,1477,"Outdoor Patio",784,"Sale of Liquor Outdoors on Private Property",61237,RENEW,NULL,03/15/2022,07/14/2022,N,05/16/2022,05/15/2024,07/14/2022,08/08/2022,AAI,NULL,NULL,41.888040594,-87.628170663,"(41.88804059387871, -87.62817066340388)","2022-10-06 12:53:44",test,NULL,"2022-07-14 00:00:00","2022-05-16 00:00:00","2024-05-15 00:00:00","2022-08-08 00:00:00",NULL
2862778-20220808,2862778,251379,3,"MCKISSACK & MCKISSACK MIDWEST, INC.","MCKISSACK & MCKISSACK MIDWEST, INC.","111 E WACKER DR  420",CHICAGO,IL,60615,42,NULL,42-,NULL,1010,"Limited Business License","602 | 619","Administrative Commercial Office | Business and Management Consulting",2862778,C_LOC,07/26/2022,07/26/2022,08/05/2022,N,08/08/2022,09/15/2024,08/05/2022,08/08/2022,AAI,NULL,NULL,41.888079426,-87.62404737,"(41.88807942610461, -87.62404736976374)","2022-10-06 12:53:44",test,"2022-07-26 00:00:00","2022-08-05 00:00:00","2022-08-08 00:00:00","2024-09-15 00:00:00","2022-08-08 00:00:00",NULL
2708944-20220116,2822133,465391,1,"CHARLES GIPSON PHOTOGRAPHY STUDIO, LLC","CHARLES GIPSON PHOTOGRAPHY STUDIO","3404 W 79TH ST 1",CHICAGO,IL,60652,18,1,18-1,8,1010,"Limited Business License",476,"Photography Services",2708944,RENEW,NULL,11/15/2021,08/08/2022,N,01/16/2022,01/15/2024,08/08/2022,08/08/2022,AAI,NULL,NULL,41.749898065,-87.707515964,"(41.74989806516498, -87.70751596360789)","2022-10-06 12:53:44",test,NULL,"2022-08-08 00:00:00","2022-01-16 00:00:00","2024-01-15 00:00:00","2022-08-08 00:00:00",NULL
28104-20150416,2381195,53236,1,"PRO-TECH COOLING CORP","PRO-TECH COOLING CORP","1099  BROWN ST  208",WAUCONDA,IL,60084,NULL,NULL,NULL,NULL,1010,"Limited Business License",NULL,NULL,28104,RENEW,NULL,02/15/2015,02/23/2015,N,04/16/2015,04/15/2017,02/23/2015,02/24/2015,AAI,NULL,NULL,NULL,NULL,NULL,"2022-10-06 12:53:44",test,NULL,"2015-02-23 00:00:00","2015-04-16 00:00:00","2017-04-15 00:00:00","2015-02-24 00:00:00",NULL
2579004-20220316,2830064,424893,1,"HIGHRISE RAILS, LLC","HIGHRISE RAILS, LLC","2525 N ELSTON AVE  D210",CHICAGO,IL,60647,32,37,32-37,14,1010,"Limited Business License",602,"Administrative Commercial Office",2579004,RENEW,NULL,01/15/2022,08/05/2022,N,03/16/2022,03/15/2024,08/05/2022,08/08/2022,AAI,NULL,NULL,41.927491952,-87.680787559,"(41.927491951779736, -87.68078755906367)","2022-10-06 12:53:44",test,NULL,"2022-08-05 00:00:00","2022-03-16 00:00:00","2024-03-15 00:00:00","2022-08-08 00:00:00",NULL
2863343-20220808,2863343,488430,1,"DEOKHWAN KIM","DEOKHWAN KIM","275  OAK CREEK",WHEELING,IL,60090,NULL,NULL,NULL,NULL,4406,"Peddler License",819,"Street Performer, Moving Along the Public Way",2863343,ISSUE,08/08/2022,08/08/2022,08/08/2022,N,08/08/2022,08/15/2024,NULL,08/08/2022,AAI,NULL,NULL,NULL,NULL,NULL,"2022-10-06 12:53:44",test,"2022-08-08 00:00:00","2022-08-08 00:00:00","2022-08-08 00:00:00","2024-08-15 00:00:00","2022-08-08 00:00:00",NULL
1921-20220916,2858231,62544,1,"HYATT CORPORATION",BIG,"151 E WACKER DR  SKYWA",CHICAGO,IL,60601,42,44,42-44,1,1781,Tobacco,763,"Retail Sale of Tobacco",1921,RENEW,NULL,07/15/2022,08/05/2022,N,09/16/2022,09/15/2023,08/05/2022,08/08/2022,AAI,NULL,NULL,41.887999887,-87.622565133,"(41.88799988734853, -87.62256513255957)","2022-10-06 12:53:44",test,NULL,"2022-08-05 00:00:00","2022-09-16 00:00:00","2023-09-15 00:00:00","2022-08-08 00:00:00",NULL
2488433-20220916,2859052,271670,2,"M K FILMS, CORP.","MK FILMS, CORP.","548 N SACRAMENTO BLVD GROUND",CHICAGO,IL,60612,27,49,27-49,12,1010,"Limited Business License",602,"Administrative Commercial Office",2488433,RENEW,NULL,07/15/2022,08/05/2022,N,09/16/2022,09/15/2024,08/05/2022,08/08/2022,AAI,NULL,NULL,41.891840378,-87.702143806,"(41.89184037779466, -87.70214380553007)","2022-10-06 12:53:44",test,NULL,"2022-08-05 00:00:00","2022-09-16 00:00:00","2024-09-15 00:00:00","2022-08-08 00:00:00",NULL
2863278-20220808,2863278,467312,7,"CHDG PHASE 1A1 SUB-LESSEE, LLC","HYATT HOUSE/HYATT PLACE AND FOOD CT","1835 W HARRISON ST",CHICAGO,IL,60612,27,10,27-10,12,1476,"Special Event Liquor",996,"Special Event Beer, Wine & Spirits",2863278,ISSUE,08/05/2022,08/05/2022,08/05/2022,N,08/08/2022,12/31/2022,08/05/2022,08/08/2022,AAI,NULL,NULL,41.873987953,-87.672997409,"(41.87398795331432, -87.67299740933659)","2022-10-06 12:53:44",test,"2022-08-05 00:00:00","2022-08-05 00:00:00","2022-08-08 00:00:00","2022-12-31 00:00:00","2022-08-08 00:00:00",NULL
27026-20150316,2375566,30658,1,"PRECISION CONTROL SYSTEMS","PRECISION CONTROL SYSTEMS","405 E RIDGE RD  1",GRIFFITH,IN,46319,NULL,NULL,NULL,NULL,1010,"Limited Business License",NULL,NULL,27026,RENEW,NULL,01/16/2015,02/19/2015,N,03/16/2015,03/15/2017,02/19/2015,02/20/2015,AAI,NULL,NULL,NULL,NULL,NULL,"2022-10-06 12:53:44",test,NULL,"2015-02-19 00:00:00","2015-03-16 00:00:00","2017-03-15 00:00:00","2015-02-20 00:00:00",NULL
1491848-20211216,2815090,217453,2,"CHITOWN SPORTS FACILITIES, LLC","CHITOWN SPORTS FACILITIES","2343 S THROOP ST 2",CHICAGO,IL,60608,25,28,25-28,12,1006,"Retail Food Establishment",775,"Retail Sales of Perishable Foods",1491848,RENEW,NULL,10/15/2021,12/13/2021,N,12/16/2021,12/15/2023,12/13/2021,12/13/2021,AAC,08/08/2022,NULL,41.849377228,-87.658477318,"(41.849377228107315, -87.65847731791494)","2022-10-06 12:53:44",test,NULL,"2021-12-13 00:00:00","2021-12-16 00:00:00","2023-12-15 00:00:00","2021-12-13 00:00:00","2022-08-08 00:00:00"
2179584-20160816,2474946,374703,1,"SAE INSTITUTE OF TECHNOLOGY (CHICAGO) CORP.","SAE INSTITUTE","820 N ORLEANS ST 1ST 125-135",CHICAGO,IL,60610,27,NULL,27-,NULL,1010,"Limited Business License",NULL,NULL,2179584,RENEW,NULL,06/15/2016,07/05/2016,N,08/16/2016,08/15/2018,07/05/2016,07/06/2016,AAI,NULL,NULL,41.897338047,-87.63734543,"(41.897338047455214, -87.63734543001038)","2022-10-06 12:53:44",test,NULL,"2016-07-05 00:00:00","2016-08-16 00:00:00","2018-08-15 00:00:00","2016-07-06 00:00:00",NULL
2863323-20220808,2863323,488415,1,"FUTURE NAILS 8, INC.","FUTURE NAILS","5217 W FULLERTON AVE 1ST",CHICAGO,IL,60639,36,25,36-25,25,1010,"Limited Business License",895,"Nail Services",2863323,ISSUE,08/08/2022,08/08/2022,08/08/2022,N,08/08/2022,08/15/2024,08/08/2022,08/08/2022,AAI,NULL,NULL,41.92398587,-87.756836012,"(41.923985870499244, -87.75683601207733)","2022-10-06 12:53:44",test,"2022-08-08 00:00:00","2022-08-08 00:00:00","2022-08-08 00:00:00","2024-08-15 00:00:00","2022-08-08 00:00:00",NULL
2749693-20220916,2862168,469870,1,"Constar Latam, LLC","Constar Latam, LLC","10400 N 25TH AVE  100",PHOENIX,AZ,85021,NULL,NULL,NULL,NULL,4404,"Regulated Business License",912,"Debt Collecting - Administrative Commercial Office",2749693,RENEW,NULL,07/15/2022,08/07/2022,N,09/16/2022,09/15/2024,08/07/2022,08/08/2022,AAI,NULL,NULL,NULL,NULL,NULL,"2022-10-06 12:53:44",test,NULL,"2022-08-07 00:00:00","2022-09-16 00:00:00","2024-09-15 00:00:00","2022-08-08 00:00:00",NULL
17791-20160516,2454169,63232,1,"LAPELUSA HOME IMPROVEMENT INC","LAPELUSA HOME IMPROVEMENT INC","6622 N MILWAUKEE   1",NILES,IL,60714,NULL,NULL,NULL,NULL,1010,"Limited Business License",NULL,NULL,17791,RENEW,NULL,03/15/2016,03/28/2016,N,05/16/2016,05/15/2018,03/28/2016,03/29/2016,AAI,NULL,NULL,NULL,NULL,NULL,"2022-10-06 12:53:44",test,NULL,"2016-03-28 00:00:00","2016-05-16 00:00:00","2018-05-15 00:00:00","2016-03-29 00:00:00",NULL
2192834-20220916,2858268,62544,34,"HYATT CORPORATION","MARKET CHICAGO","151 E WACKER DR 1",CHICAGO,IL,60601,42,44,42-44,1,1006,"Retail Food Establishment",775,"Retail Sales of Perishable Foods",2192834,RENEW,NULL,07/15/2022,08/05/2022,N,09/16/2022,09/15/2024,08/05/2022,08/08/2022,AAI,NULL,NULL,41.887999887,-87.622565133,"(41.88799988734853, -87.62256513255957)","2022-10-06 12:53:44",test,NULL,"2022-08-05 00:00:00","2022-09-16 00:00:00","2024-09-15 00:00:00","2022-08-08 00:00:00",NULL
1933-20220916,2858249,62544,18,"HYATT CORPORATION",STETSON'S,"151 E WACKER DR  PLAZA",CHICAGO,IL,60601,42,44,42-44,1,1475,"Consumption on Premises - Incidental Activity",638,"Consumption of Liquor on Premises",1933,RENEW,NULL,07/15/2022,08/05/2022,N,09/16/2022,09/15/2024,08/05/2022,08/08/2022,AAI,NULL,NULL,NULL,NULL,NULL,"2022-10-06 12:53:44",test,NULL,"2022-08-05 00:00:00","2022-09-16 00:00:00","2024-09-15 00:00:00","2022-08-08 00:00:00",NULL
2647849-20190423,2647849,64603,7,"LEOPARDO COMPANIES INC.","Leopardo Companies Inc","210 N CARPENTER ST 3RD FLOOR",CHICAGO,IL,60607,27,NULL,27-,NULL,1010,"Limited Business License",602,"Administrative Commercial Office",2647849,C_LOC,02/21/2019,02/21/2019,02/21/2019,N,04/23/2019,09/15/2020,02/21/2019,04/23/2019,AAI,NULL,NULL,41.885944958,-87.653461783,"(41.88594495760403, -87.65346178255953)","2022-10-06 12:53:44",test,"2019-02-21 00:00:00","2019-02-21 00:00:00","2019-04-23 00:00:00","2020-09-15 00:00:00","2019-04-23 00:00:00",NULL
1929-20220916,2858240,62544,5,"HYATT CORPORATION","REGENCY CATERERS","151 E WACKER DR  L",CHICAGO,IL,60601,42,44,42-44,1,1006,"Retail Food Establishment",775,"Retail Sales of Perishable Foods",1929,RENEW,NULL,07/15/2022,08/05/2022,N,09/16/2022,09/15/2024,08/05/2022,08/08/2022,AAI,NULL,NULL,41.887999887,-87.622565133,"(41.88799988734853, -87.62256513255957)","2022-10-06 12:53:44",test,NULL,"2022-08-05 00:00:00","2022-09-16 00:00:00","2024-09-15 00:00:00","2022-08-08 00:00:00",NULL
1575852-20050202,1575852,287183,1,"INTERUNITED TRUCKING CORPORATION","INTERUNITED TRUCKING CORPORATION","1626 S 61ST CT",CICERO,IL,60804,NULL,NULL,NULL,NULL,1010,"Limited Business License",NULL,NULL,1575852,ISSUE,02/02/2005,02/02/2005,02/02/2005,N,02/02/2005,02/15/2006,02/02/2005,02/02/2005,AAC,10/12/2005,NULL,NULL,NULL,NULL,"2022-10-06 12:53:44",test,"2005-02-02 00:00:00","2005-02-02 00:00:00","2005-02-02 00:00:00","2006-02-15 00:00:00","2005-02-02 00:00:00","2005-10-12 00:00:00"
1246062-20220716,2847343,247001,1,"KING DISCOUNT INC","KING DISCOUNT, INC","6301 S DR MARTIN LUTHER KING JR DR",CHICAGO,IL,60637,20,47,20-47,3,1781,Tobacco,763,"Retail Sale of Tobacco",1246062,RENEW,NULL,05/15/2022,06/01/2022,N,07/16/2022,07/15/2023,06/01/2022,08/08/2022,AAI,NULL,NULL,41.780215555,-87.615475046,"(41.780215555067095, -87.61547504609669)","2022-10-06 12:53:44",test,NULL,"2022-06-01 00:00:00","2022-07-16 00:00:00","2023-07-15 00:00:00","2022-08-08 00:00:00",NULL
2863319-20220808,2863319,488412,1,"HOUSEOFRACL LLC",HOUSEOFRACL,"1020 W LELAND AVE 1ST",CHICAGO,IL,60640,46,4,46-4,19,4404,"Regulated Business License","631 | 767","Clothing Alterations | Retail Sales of General Merchandise and Non-Perishable Food",2863319,ISSUE,08/08/2022,08/08/2022,08/08/2022,N,08/08/2022,08/15/2024,08/08/2022,08/08/2022,AAI,NULL,34,41.967362298,-87.655663213,"(41.96736229781675, -87.65566321282995)","2022-10-06 12:53:44",test,"2022-08-08 00:00:00","2022-08-08 00:00:00","2022-08-08 00:00:00","2024-08-15 00:00:00","2022-08-08 00:00:00",NULL
2594592-20220516,2839348,426780,1,"WAYNE CAVER","WAYNE CAVER","1225 W LUNT AVE  1B",CHICAGO,IL,60626,49,26,49-26,24,4406,"Peddler License",769,"Peddler- Retail Sales of General Merchandise, Whole Uncut Fruits/Vegetables, Flowers, Moving Along the Public Way",2594592,RENEW,NULL,03/15/2022,05/12/2022,N,05/16/2022,05/15/2024,NULL,05/12/2022,AAI,NULL,24,42.009061747,-87.662843562,"(42.00906174740222, -87.6628435619088)","2022-10-06 12:53:44",test,NULL,"2022-05-12 00:00:00","2022-05-16 00:00:00","2024-05-15 00:00:00","2022-05-12 00:00:00",NULL
2327015-20220516,2838660,389877,1,"ZAM ZAM MEDITERRANEAN GRILL, INC.","ZAM ZAM MIDDLE EASTERN GRILL","3461 N CLARK ST 1",CHICAGO,IL,60657,44,31,44-31,19,1006,"Retail Food Establishment",735,"Preparation of Food and Dining on Premise With Seating",2327015,RENEW,NULL,03/15/2022,05/12/2022,N,05/16/2022,05/15/2024,05/12/2022,05/12/2022,AAI,NULL,17,41.945080564,-87.654634712,"(41.9450805637441, -87.65463471229927)","2022-10-06 12:53:44",test,NULL,"2022-05-12 00:00:00","2022-05-16 00:00:00","2024-05-15 00:00:00","2022-05-12 00:00:00",NULL
2846336-20220512,2846336,485778,1,"SANDRA A. JACKSON","SOMETHING DIFFERENT","4100 S ASHLAND AVE  OUTDOOR",CHICAGO,IL,60609,12,19,12-19,9,1010,"Limited Business License","904 | 911","Retail Sales of General Merchandise | Retail Sales of Clothing / Accessories / Shoes",2846336,ISSUE,05/12/2022,05/12/2022,05/12/2022,N,05/12/2022,05/15/2024,05/12/2022,05/12/2022,AAI,NULL,10,41.819441426,-87.665375545,"(41.81944142629576, -87.6653755449091)","2022-10-06 12:53:44",test,"2022-05-12 00:00:00","2022-05-12 00:00:00","2022-05-12 00:00:00","2024-05-15 00:00:00","2022-05-12 00:00:00",NULL
2817580-20220512,2817580,480665,1,"PHAM SANTIAGO LLC","CHICAGO NAIL ROOM","1614 N WESTERN AVE 1ST",CHICAGO,IL,60647,1,27,1-27,14,1010,"Limited Business License",895,"Nail Services",2817580,ISSUE,10/22/2021,05/12/2022,05/12/2022,N,05/12/2022,05/15/2024,05/12/2022,05/12/2022,AAI,NULL,33,41.910802783,-87.687380722,"(41.91080278274865, -87.6873807217417)","2022-10-06 12:53:44",test,"2021-10-22 00:00:00","2022-05-12 00:00:00","2022-05-12 00:00:00","2024-05-15 00:00:00","2022-05-12 00:00:00",NULL
53884-20030516,1349499,64579,1,"CYNPAT, INC","Cielo Dulce","3504 S WESTERN AVE 1",CHICAGO,IL,60609,12,6,12-6,9,1006,"Retail Food Establishment",775,"Retail Sales of Perishable Foods",53884,RENEW,NULL,03/25/2003,04/17/2003,N,05/16/2003,05/15/2004,05/07/2003,05/07/2003,AAI,NULL,NULL,41.830073693,-87.68517427,"(41.830073693447986, -87.68517426995787)","2022-10-06 12:53:44",test,NULL,"2003-04-17 00:00:00","2003-05-16 00:00:00","2004-05-15 00:00:00","2003-05-07 00:00:00",NULL
53884-20070216,1783374,64579,1,"CYNPAT, INC","Cielo Dulce","3504 S WESTERN AVE 1",CHICAGO,IL,60609,12,6,12-6,9,1006,"Retail Food Establishment",775,"Retail Sales of Perishable Foods",53884,RENEW,NULL,12/20/2006,01/22/2007,N,02/16/2007,05/15/2008,01/22/2007,01/23/2007,AAI,NULL,NULL,41.830073693,-87.68517427,"(41.830073693447986, -87.68517426995787)","2022-10-06 12:53:44",test,NULL,"2007-01-22 00:00:00","2007-02-16 00:00:00","2008-05-15 00:00:00","2007-01-23 00:00:00",NULL
1358698-20050216,1568147,264677,1,"DYNAMIC RENOVATIONS","DYNAMIC RENOVATIONS INC","800 E NORTHWEST HWY  700",PALATINE,IL,60074,NULL,NULL,NULL,NULL,1011,"Home Repair",NULL,NULL,1358698,RENEW,NULL,12/20/2004,02/16/2005,N,02/16/2005,02/15/2006,NULL,07/19/2006,AAI,NULL,NULL,NULL,NULL,NULL,"2022-10-06 12:53:44",test,NULL,"2005-02-16 00:00:00","2005-02-16 00:00:00","2006-02-15 00:00:00","2006-07-19 00:00:00",NULL
2846055-20220512,2846055,485615,1,"Lauren R. Tucker LLC","Do What Matters","850 S CLARK ST 7 715",CHICAGO,IL,60605,4,NULL,4-,NULL,4404,"Regulated Business License",719,"Professional Consulting (Home Based Business)",2846055,ISSUE,05/09/2022,05/09/2022,05/11/2022,N,05/12/2022,05/15/2024,05/11/2022,05/12/2022,AAI,NULL,NULL,41.871350222,-87.630732811,"(41.871350222228244, -87.63073281141747)","2022-10-06 12:53:44",test,"2022-05-09 00:00:00","2022-05-11 00:00:00","2022-05-12 00:00:00","2024-05-15 00:00:00","2022-05-12 00:00:00",NULL
1649036-20060309,1649036,64579,1,"CYNPAT, INC","Cielo Dulce","3504 S WESTERN AVE 1",CHICAGO,IL,60609,12,6,12-6,9,1050,"Public Place of Amusement",743,"Provides Onsite Amusement or Entertainment",1649036,ISSUE,11/28/2005,12/13/2005,12/14/2005,N,03/09/2006,02/15/2007,03/08/2006,03/09/2006,AAI,NULL,NULL,41.830073693,-87.68517427,"(41.830073693447986, -87.68517426995787)","2022-10-06 12:53:44",test,"2005-11-28 00:00:00","2005-12-14 00:00:00","2006-03-09 00:00:00","2007-02-15 00:00:00","2006-03-09 00:00:00",NULL
7064-20220616,2841551,3742,1,"HARTHILL CORPORATION","GUTHRIES TAVERN","1300 W ADDISON ST 1",CHICAGO,IL,60613,44,11,44-11,19,1006,"Retail Food Establishment",775,"Retail Sales of Perishable Foods",7064,RENEW,NULL,04/15/2022,05/11/2022,N,06/16/2022,06/15/2024,05/11/2022,05/12/2022,AAI,NULL,NULL,41.947217002,-87.661659581,"(41.94721700234395, -87.66165958148052)","2022-10-06 12:53:44",test,NULL,"2022-05-11 00:00:00","2022-06-16 00:00:00","2024-06-15 00:00:00","2022-05-12 00:00:00",NULL
2846288-20220512,2846288,485746,1,"RICHARD R. RIAS","SOMETHING FOR SENIORS","1633 W MADISON ST  1905N",CHICAGO,IL,60612,27,10,27-10,12,4404,"Regulated Business License",719,"Professional Consulting (Home Based Business)",2846288,ISSUE,05/12/2022,05/12/2022,05/12/2022,N,05/12/2022,05/15/2024,05/12/2022,05/12/2022,AAI,NULL,NULL,41.881329061,-87.668049901,"(41.88132906065201, -87.66804990089578)","2022-10-06 12:53:44",test,"2022-05-12 00:00:00","2022-05-12 00:00:00","2022-05-12 00:00:00","2024-05-15 00:00:00","2022-05-12 00:00:00",NULL
2845766-20220512,2845766,485407,1,"OSCAR RODRIGUEZ","SWEET HUDSON","3730 N ST LOUIS AVE 2",CHICAGO,IL,60618,35,NULL,35-,NULL,4406,"Peddler License",819,"Street Performer, Moving Along the Public Way",2845766,ISSUE,05/02/2022,05/02/2022,05/12/2022,N,05/12/2022,05/15/2024,NULL,05/12/2022,AAI,NULL,NULL,41.949295485,-87.715387556,"(41.94929548544328, -87.71538755563643)","2022-10-06 12:53:44",test,"2022-05-02 00:00:00","2022-05-12 00:00:00","2022-05-12 00:00:00","2024-05-15 00:00:00","2022-05-12 00:00:00",NULL
2646530-20210216,2766309,456029,1,"TOP COAT NAIL SPA, INC.","TOP COAT NAIL SPA","507 N LA SALLE DR GROUND",CHICAGO,IL,60654,42,32,42-32,18,1010,"Limited Business License","895 | 956","Nail Services | Provide Waxing Services",2646530,RENEW,NULL,12/15/2020,05/11/2022,N,02/16/2021,02/15/2023,05/11/2022,05/12/2022,AAI,NULL,NULL,41.891061616,-87.632418544,"(41.891061615596975, -87.6324185438042)","2022-10-06 12:53:44",test,NULL,"2022-05-11 00:00:00","2021-02-16 00:00:00","2023-02-15 00:00:00","2022-05-12 00:00:00",NULL
2208844-20220616,2843408,353625,1,"ARCHITECTURAL SERVICES GROUP, INC.","ARCHITECTURAL SERVICES GROUP, INC.","3336 S CALUMET AVE 1",CHICAGO,IL,60616,4,31,4-31,2,4404,"Regulated Business License",724,"Other Home Based Businesses",2208844,RENEW,NULL,04/15/2022,05/11/2022,N,06/16/2022,06/15/2024,05/11/2022,05/12/2022,AAI,NULL,NULL,41.833774013,-87.618323693,"(41.8337740128329, -87.61832369278596)","2022-10-06 12:53:44",test,NULL,"2022-05-11 00:00:00","2022-06-16 00:00:00","2024-06-15 00:00:00","2022-05-12 00:00:00",NULL
53884-20120516,2144330,64579,1,"CYNPAT, INC","Cielo Dulce","3504 S WESTERN AVE 1",CHICAGO,IL,60609,12,6,12-6,9,1006,"Retail Food Establishment",775,"Retail Sales of Perishable Foods",53884,RENEW,NULL,03/15/2012,05/14/2012,N,05/16/2012,05/15/2014,05/14/2012,07/31/2012,AAI,NULL,NULL,41.830073693,-87.68517427,"(41.830073693447986, -87.68517426995787)","2022-10-06 12:53:44",test,NULL,"2012-05-14 00:00:00","2012-05-16 00:00:00","2014-05-15 00:00:00","2012-07-31 00:00:00",NULL
2152065-20220516,2838337,371498,1,"RAM MECHANICAL SERVICES INC","RAM MECHANICAL SERVICES INC","258 S WESTGATE  DR","CAROL STREAM",IL,60188,NULL,NULL,NULL,NULL,1010,"Limited Business License","901 | 902","Heating, Ventilation and Air Conditioning Services - Residential | Heating, Ventilation and Air Conditioning Services - Commercial",2152065,RENEW,NULL,03/15/2022,05/11/2022,N,05/16/2022,05/15/2024,05/11/2022,05/12/2022,AAI,NULL,NULL,NULL,NULL,NULL,"2022-10-06 12:53:44",test,NULL,"2022-05-11 00:00:00","2022-05-16 00:00:00","2024-05-15 00:00:00","2022-05-12 00:00:00",NULL
1875213-20180516,2585347,64579,1,"CYNPAT, INC","Cielo Dulce","3504 S WESTERN AVE 1",CHICAGO,IL,60609,12,6,12-6,9,1475,"Consumption on Premises - Incidental Activity",638,"Consumption of Liquor on Premises",1875213,RENEW,NULL,03/15/2018,12/17/2018,N,05/16/2018,07/15/2020,12/17/2018,12/17/2018,AAI,NULL,NULL,41.830073693,-87.68517427,"(41.830073693447986, -87.68517426995787)","2022-10-06 12:53:44",test,NULL,"2018-12-17 00:00:00","2018-05-16 00:00:00","2020-07-15 00:00:00","2018-12-17 00:00:00",NULL
2846326-20220512,2846326,485772,1,"DION ALLEN HARDEN","DION ALLEN HARDEN","7750 S SEELEY AVE  1",CHICAGO,IL,60620,18,20,18-20,6,4406,"Peddler License",769,"Peddler- Retail Sales of General Merchandise, Whole Uncut Fruits/Vegetables, Flowers, Moving Along the Public Way",2846326,ISSUE,05/12/2022,05/12/2022,05/12/2022,N,05/12/2022,05/15/2024,NULL,05/12/2022,AAI,NULL,NULL,41.752355254,-87.674557809,"(41.752355254141385, -87.67455780860026)","2022-10-06 12:53:44",test,"2022-05-12 00:00:00","2022-05-12 00:00:00","2022-05-12 00:00:00","2024-05-15 00:00:00","2022-05-12 00:00:00",NULL
7065-20220616,2841552,3742,1,"HARTHILL CORPORATION","GUTHRIES TAVERN","1300 W ADDISON ST 1",CHICAGO,IL,60613,44,11,44-11,19,1470,Tavern,829,"Tavern - Consumption of Liquor on Premise",7065,RENEW,NULL,04/15/2022,05/11/2022,N,06/16/2022,06/15/2024,05/11/2022,05/12/2022,AAI,NULL,NULL,41.947217002,-87.661659581,"(41.94721700234395, -87.66165958148052)","2022-10-06 12:53:44",test,NULL,"2022-05-11 00:00:00","2022-06-16 00:00:00","2024-06-15 00:00:00","2022-05-12 00:00:00",NULL
2583404-20220516,2836937,56254,1,"VILMA RAMOS","VILMA'S BEAUTY SALON","4100 S ASHLAND AVE INDOOR 299 - 300",CHICAGO,IL,60609,12,19,12-19,9,1010,"Limited Business License","894 | 904","Hair Services | Retail Sales of General Merchandise",2583404,RENEW,NULL,03/15/2022,05/12/2022,N,05/16/2022,05/15/2024,05/12/2022,05/12/2022,AAI,NULL,10,41.819441426,-87.665375545,"(41.81944142629576, -87.6653755449091)","2022-10-06 12:53:44",test,NULL,"2022-05-12 00:00:00","2022-05-16 00:00:00","2024-05-15 00:00:00","2022-05-12 00:00:00",NULL
2846181-20220512,2846181,349325,2,"AKPD Message and Media LLC","AKPD Message and Media LLC","405 W SUPERIOR ST  705",CHICAGO,IL,60654,42,NULL,42-,NULL,1010,"Limited Business License",703,"Advertising / Marketing / Sales Office",2846181,C_LOC,05/10/2022,05/10/2022,05/11/2022,N,05/12/2022,05/15/2024,05/11/2022,05/12/2022,AAI,NULL,NULL,41.895422139,-87.638793208,"(41.895422138635716, -87.63879320801375)","2022-10-06 12:53:44",test,"2022-05-10 00:00:00","2022-05-11 00:00:00","2022-05-12 00:00:00","2024-05-15 00:00:00","2022-05-12 00:00:00",NULL
86934-20050216,1561551,85252,2,"TRINISA INC","TRINISA INC","6845  LAVERGNE   1",SKOKIE,IL,60077,NULL,NULL,NULL,NULL,1010,"Limited Business License",NULL,NULL,86934,RENEW,NULL,12/20/2004,09/11/2006,N,02/16/2005,02/15/2006,NULL,09/11/2006,AAI,NULL,NULL,NULL,NULL,NULL,"2022-10-06 12:53:44",test,NULL,"2006-09-11 00:00:00","2005-02-16 00:00:00","2006-02-15 00:00:00","2006-09-11 00:00:00",NULL
1737399-20060623,1737399,306245,1,"JAN C. SASSANO","JAN C. SASSANO","355  BUENA VISTA AVE  401W","SAN FRANCISCO",CA,94117,NULL,NULL,NULL,NULL,1605,"Street Performer",NULL,NULL,1737399,ISSUE,06/23/2006,06/23/2006,06/23/2006,N,06/23/2006,02/15/2007,NULL,06/23/2006,AAI,NULL,NULL,NULL,NULL,NULL,"2022-10-06 12:53:44",test,"2006-06-23 00:00:00","2006-06-23 00:00:00","2006-06-23 00:00:00","2007-02-15 00:00:00","2006-06-23 00:00:00",NULL
57348-20100316,2015014,40239,1,"J.E.M. MORRIS CONSTRUCTION INC","J.E.M. MORRIS CONSTRUCTION INC","49 W 102 US ROUTE 30","BIG ROCK",IL,60511,NULL,NULL,NULL,NULL,1010,"Limited Business License",NULL,NULL,57348,RENEW,NULL,01/15/2010,04/20/2010,N,03/16/2010,03/15/2012,04/20/2010,04/20/2010,AAI,NULL,NULL,NULL,NULL,NULL,"2022-10-06 12:53:44",test,NULL,"2010-04-20 00:00:00","2010-03-16 00:00:00","2012-03-15 00:00:00","2010-04-20 00:00:00",NULL
52864-20220516,2836660,17716,1,"SCARLETT'S G.P., INC.","Deja Vu Showgirls","750 S CLINTON ST 2",CHICAGO,IL,60607,25,28,25-28,1,1050,"Public Place of Amusement",743,"Provides Onsite Amusement or Entertainment",52864,RENEW,NULL,03/15/2022,03/15/2022,N,05/16/2022,05/15/2024,05/12/2022,05/12/2022,AAI,NULL,NULL,41.872046267,-87.641024705,"(41.87204626658311, -87.64102470530548)","2022-10-06 12:53:44",test,NULL,"2022-03-15 00:00:00","2022-05-16 00:00:00","2024-05-15 00:00:00","2022-05-12 00:00:00",NULL
1649036-20200516,2719949,64579,1,"CYNPAT, INC","Cielo Dulce","3504 S WESTERN AVE 1",CHICAGO,IL,60609,12,6,12-6,9,1050,"Public Place of Amusement",743,"Provides Onsite Amusement or Entertainment",1649036,RENEW,NULL,03/15/2020,06/17/2020,N,05/16/2020,05/15/2022,04/13/2021,01/04/2022,AAI,NULL,NULL,41.830073693,-87.68517427,"(41.830073693447986, -87.68517426995787)","2022-10-06 12:53:44",test,NULL,"2020-06-17 00:00:00","2020-05-16 00:00:00","2022-05-15 00:00:00","2022-01-04 00:00:00",NULL
1246705-20050216,1565613,247364,1,"K & K DEVELOPMENT I INC.","K & K DEVELOPMENT I INC.","1953 S EUCLID AVE  105",BERWYN,IL,60402,NULL,NULL,NULL,NULL,1011,"Home Repair",NULL,NULL,1246705,RENEW,NULL,12/20/2004,04/27/2007,N,02/16/2005,02/15/2006,04/27/2007,07/02/2007,AAI,NULL,NULL,NULL,NULL,NULL,"2022-10-06 12:53:44",test,NULL,"2007-04-27 00:00:00","2005-02-16 00:00:00","2006-02-15 00:00:00","2007-07-02 00:00:00",NULL
2846202-20220512,2846202,485685,1,"Denver Electric LLC","Denver Electric LLC","613  7TH AVE",MAYWOOD,IL,60153,NULL,NULL,NULL,NULL,4404,"Regulated Business License",673,"Home Repair Services",2846202,ISSUE,05/11/2022,05/11/2022,05/11/2022,N,05/12/2022,05/15/2024,05/11/2022,05/12/2022,AAI,NULL,NULL,NULL,NULL,NULL,"2022-10-06 12:53:44",test,"2022-05-11 00:00:00","2022-05-11 00:00:00","2022-05-12 00:00:00","2024-05-15 00:00:00","2022-05-12 00:00:00",NULL
2152619-20220516,2838354,371691,1,"JOSE M LOPEZ","E&R SHOE REPAIR & ALTERATIONS","3364 S HALSTED ST",CHICAGO,IL,60608,11,16,11-16,9,1010,"Limited Business License",NULL,NULL,2152619,RENEW,NULL,03/15/2022,05/12/2022,N,05/16/2022,05/15/2024,05/12/2022,05/12/2022,AAI,NULL,NULL,41.832860537,-87.646301495,"(41.83286053695842, -87.64630149509793)","2022-10-06 12:53:44",test,NULL,"2022-05-12 00:00:00","2022-05-16 00:00:00","2024-05-15 00:00:00","2022-05-12 00:00:00",NULL
2665071-20190515,2665071,458597,1,"4851 PC INC.","PUBLIC CLOSEOUTS #3","4851 W CHICAGO AVE",CHICAGO,IL,60651,37,27,37-27,15,1006,"Retail Food Establishment","767 | 775 | 904","Retail Sales of General Merchandise and Non-Perishable Food | Retail Sales of Perishable Foods | Retail Sales of General Merchandise",2665071,ISSUE,05/07/2019,05/07/2019,05/07/2019,N,05/15/2019,07/15/2021,05/14/2019,05/15/2019,AAC,05/12/2022,NULL,41.894878247,-87.747829786,"(41.89487824738007, -87.74782978563464)","2022-10-06 12:53:44",test,"2019-05-07 00:00:00","2019-05-07 00:00:00","2019-05-15 00:00:00","2021-07-15 00:00:00","2019-05-15 00:00:00","2022-05-12 00:00:00"
2517738-20220516,2839199,414666,1,"PARADISE GROCERY INC.,","PARADISE GROCERY INC.,","8101 S COTTAGE GROVE AVE 1ST",CHICAGO,IL,60619,8,55,8-55,6,1781,Tobacco,"776 | 936 | 937","Retail Sales of Tobacco Products | Retail Sales of Tobacco Accessories | Retail Sales of Tobacco and Flavored Tobacco Products",2517738,RENEW,NULL,03/15/2022,04/07/2022,N,05/16/2022,05/15/2023,04/07/2022,05/12/2022,AAI,NULL,51,41.747538448,-87.604985731,"(41.747538448447344, -87.6049857308018)","2022-10-06 12:53:44",test,NULL,"2022-04-07 00:00:00","2022-05-16 00:00:00","2023-05-15 00:00:00","2022-05-12 00:00:00",NULL
2846144-20220512,2846144,35751,186,"CHICAGO RUNNING & SPECIAL EVENTS MANAGEMENT, INC.","CHICAGO RUNNING & SPECIAL EVENTS MANAGEMENT, INC.","2221 W 43RD ST",CHICAGO,IL,60609,12,21,12-21,9,4409,"Pop-Up Retail User",1027,"Organizer of a 1-5 Day Event w/ Pop-Up Retail Users at a Trade Show, Exhibition or Convention",2846144,ISSUE,05/10/2022,05/10/2022,05/12/2022,N,05/12/2022,05/30/2022,05/12/2022,05/12/2022,AAI,NULL,NULL,41.815621054,-87.680635833,"(41.81562105420659, -87.68063583315673)","2022-10-06 12:53:44",test,"2022-05-10 00:00:00","2022-05-12 00:00:00","2022-05-12 00:00:00","2022-05-30 00:00:00","2022-05-12 00:00:00",NULL
14820-20220516,2836875,51551,2,"R & V, INC.","CLUB ROYALE","9 W DIVISION ST  1",CHICAGO,IL,60610,2,36,2-36,18,1050,"Public Place of Amusement",743,"Provides Onsite Amusement or Entertainment",14820,RENEW,NULL,03/15/2022,04/07/2022,N,05/16/2022,05/15/2024,05/12/2022,05/12/2022,AAI,NULL,NULL,41.903825309,-87.629076389,"(41.9038253091784, -87.62907638861904)","2022-10-06 12:53:44",test,NULL,"2022-04-07 00:00:00","2022-05-16 00:00:00","2024-05-15 00:00:00","2022-05-12 00:00:00",NULL
53884-20100516,2024043,64579,1,"CYNPAT, INC","Cielo Dulce","3504 S WESTERN AVE 1",CHICAGO,IL,60609,12,6,12-6,9,1006,"Retail Food Establishment",775,"Retail Sales of Perishable Foods",53884,RENEW,NULL,03/15/2010,04/26/2010,N,05/16/2010,05/15/2012,04/26/2010,04/27/2010,AAI,NULL,NULL,41.830073693,-87.68517427,"(41.830073693447986, -87.68517426995787)","2022-10-06 12:53:44",test,NULL,"2010-04-26 00:00:00","2010-05-16 00:00:00","2012-05-15 00:00:00","2010-04-27 00:00:00",NULL
46929-20050216,1559226,56085,2,"GADBOIS CONSTRUCTION INC","GADBOIS CONSTRUCTION, INC.","21984  PEMBROOK DR  1ST",FRANKFORT,IL,60423,NULL,NULL,NULL,NULL,1010,"Limited Business License",NULL,NULL,46929,RENEW,NULL,12/20/2004,02/10/2006,N,02/16/2005,02/15/2006,NULL,02/10/2006,AAI,NULL,NULL,NULL,NULL,NULL,"2022-10-06 12:53:44",test,NULL,"2006-02-10 00:00:00","2005-02-16 00:00:00","2006-02-15 00:00:00","2006-02-10 00:00:00",NULL
2818380-20220512,2818380,481113,1,"CHABAD OF RIVER NORTH & FULTON MARKET","CHABAD DAY CARE","405 W SUPERIOR ST 1 1",CHICAGO,IL,60654,42,NULL,42-,NULL,1023,"Children's Services Facility License",820,"Supervision of, and Care for, Children 0-6 Years of Age, During the Day between 6am-9pm",2818380,ISSUE,11/09/2021,11/09/2021,11/24/2021,N,05/12/2022,05/15/2024,05/11/2022,05/12/2022,AAI,NULL,NULL,41.895422139,-87.638793208,"(41.895422138635716, -87.63879320801375)","2022-10-06 12:53:44",test,"2021-11-09 00:00:00","2021-11-24 00:00:00","2022-05-12 00:00:00","2024-05-15 00:00:00","2022-05-12 00:00:00",NULL
2158583-20220616,2843675,373197,1,"Vision I Computers, Inc","Vision I Computers, Inc","2416 S CANAL ST 1",CHICAGO,IL,60616,11,NULL,11-,NULL,1010,"Limited Business License",NULL,NULL,2158583,RENEW,NULL,04/15/2022,05/11/2022,N,06/16/2022,06/15/2024,05/11/2022,05/12/2022,AAI,NULL,NULL,41.848477865,-87.638565681,"(41.84847786531256, -87.63856568060417)","2022-10-06 12:53:44",test,NULL,"2022-05-11 00:00:00","2022-06-16 00:00:00","2024-06-15 00:00:00","2022-05-12 00:00:00",NULL
1649036-20160516,2454218,64579,1,"CYNPAT, INC","Cielo Dulce","3504 S WESTERN AVE 1",CHICAGO,IL,60609,12,6,12-6,9,1050,"Public Place of Amusement",743,"Provides Onsite Amusement or Entertainment",1649036,RENEW,NULL,03/15/2016,05/13/2016,N,05/16/2016,05/15/2018,05/17/2016,05/18/2016,AAI,NULL,NULL,41.830073693,-87.68517427,"(41.830073693447986, -87.68517426995787)","2022-10-06 12:53:44",test,NULL,"2016-05-13 00:00:00","2016-05-16 00:00:00","2018-05-15 00:00:00","2016-05-18 00:00:00",NULL
1649036-20120516,2144331,64579,1,"CYNPAT, INC","Cielo Dulce","3504 S WESTERN AVE 1",CHICAGO,IL,60609,12,6,12-6,9,1050,"Public Place of Amusement",743,"Provides Onsite Amusement or Entertainment",1649036,RENEW,NULL,03/15/2012,05/14/2012,N,05/16/2012,05/15/2014,05/16/2012,07/31/2012,AAI,NULL,NULL,41.830073693,-87.68517427,"(41.830073693447986, -87.68517426995787)","2022-10-06 12:53:44",test,NULL,"2012-05-14 00:00:00","2012-05-16 00:00:00","2014-05-15 00:00:00","2012-07-31 00:00:00",NULL
2780649-20220516,2838591,388023,2,"GOLDEN BROWN DELICIOUS LLC","GBD Cakes and Sweets","3412 W 79TH ST",CHICAGO,IL,60652,18,NULL,18-,NULL,1006,"Retail Food Establishment",782,"Sale of Food Prepared Onsite Without Dining Area",2780649,RENEW,NULL,03/15/2022,05/11/2022,N,05/16/2022,05/15/2024,05/11/2022,05/12/2022,AAI,NULL,NULL,41.749892079,-87.707845308,"(41.74989207889408, -87.70784530809324)","2022-10-06 12:53:44",test,NULL,"2022-05-11 00:00:00","2022-05-16 00:00:00","2024-05-15 00:00:00","2022-05-12 00:00:00",NULL
74923-20050216,1560468,63907,1,"SAMUEL HOWARD","OSCO CONSTRUCTION","15630 S ASHLAND AVE  1",HARVEY,IL,60426,NULL,NULL,NULL,NULL,1011,"Home Repair",NULL,NULL,74923,RENEW,NULL,12/20/2004,07/02/2007,N,02/16/2005,02/15/2006,NULL,07/02/2007,AAI,NULL,NULL,NULL,NULL,NULL,"2022-10-06 12:53:44",test,NULL,"2007-07-02 00:00:00","2005-02-16 00:00:00","2006-02-15 00:00:00","2007-07-02 00:00:00",NULL
85469-20050216,1560934,66344,2,"ADEL METTI","A B M SERVICE","1167  ALGONQUIN RD  REAR","DES PLAINES",IL,60016,NULL,NULL,NULL,NULL,1010,"Limited Business License",NULL,NULL,85469,RENEW,NULL,12/20/2004,03/21/2006,N,02/16/2005,02/15/2006,03/21/2006,03/22/2006,AAI,NULL,NULL,NULL,NULL,NULL,"2022-10-06 12:53:44",test,NULL,"2006-03-21 00:00:00","2005-02-16 00:00:00","2006-02-15 00:00:00","2006-03-22 00:00:00",NULL
32360-20220516,2836377,6324,1,"BERT'S PLACE, INC","CHEZ JOEL","1119 W TAYLOR ST  1ST",CHICAGO,IL,60607,25,27,25-27,12,1475,"Consumption on Premises - Incidental Activity",638,"Consumption of Liquor on Premises",32360,RENEW,NULL,03/15/2022,05/11/2022,N,05/16/2022,05/15/2024,05/11/2022,05/12/2022,AAI,NULL,NULL,41.869332279,-87.655106787,"(41.86933227916697, -87.65510678669794)","2022-10-06 12:53:44",test,NULL,"2022-05-11 00:00:00","2022-05-16 00:00:00","2024-05-15 00:00:00","2022-05-12 00:00:00",NULL
2423441-20220616,2844067,400943,1,"JOYA KING-HOOKS",ENJOYACORN,"3460 W 79TH ST GROUND",CHICAGO,IL,60652,18,2,18-2,8,1006,"Retail Food Establishment",782,"Sale of Food Prepared Onsite Without Dining Area",2423441,RENEW,NULL,04/15/2022,05/12/2022,N,06/16/2022,06/15/2024,05/12/2022,05/12/2022,AAI,NULL,NULL,41.749868558,-87.709653236,"(41.749868557847584, -87.70965323597203)","2022-10-06 12:53:44",test,NULL,"2022-05-12 00:00:00","2022-06-16 00:00:00","2024-06-15 00:00:00","2022-05-12 00:00:00",NULL
2594816-20220516,2839374,426928,1,"AVID VISA SERVICES, CORP.","AVID VISA SERVICES","1906 S WONG PKWY",CHICAGO,IL,60616,25,14,25-14,9,4404,"Regulated Business License",719,"Professional Consulting (Home Based Business)",2594816,RENEW,NULL,03/15/2022,05/11/2022,N,05/16/2022,05/15/2024,05/11/2022,05/12/2022,AAI,NULL,NULL,41.856287553,-87.63355137,"(41.8562875532611, -87.63355136957706)","2022-10-06 12:53:44",test,NULL,"2022-05-11 00:00:00","2022-05-16 00:00:00","2024-05-15 00:00:00","2022-05-12 00:00:00",NULL
53884-20200516,2719951,64579,1,"CYNPAT, INC","Cielo Dulce","3504 S WESTERN AVE 1",CHICAGO,IL,60609,12,6,12-6,9,1006,"Retail Food Establishment",775,"Retail Sales of Perishable Foods",53884,RENEW,NULL,03/15/2020,06/17/2020,N,05/16/2020,05/15/2022,06/17/2020,01/04/2022,AAI,NULL,NULL,41.830073693,-87.68517427,"(41.830073693447986, -87.68517426995787)","2022-10-06 12:53:44",test,NULL,"2020-06-17 00:00:00","2020-05-16 00:00:00","2022-05-15 00:00:00","2022-01-04 00:00:00",NULL
2665073-20190523,2665073,458597,1,"4851 PC INC.","PUBLIC CLOSEOUTS #3","4851 W CHICAGO AVE",CHICAGO,IL,60651,37,27,37-27,15,1781,Tobacco,"776 | 936 | 937","Retail Sales of Tobacco Products | Retail Sales of Tobacco Accessories | Retail Sales of Tobacco and Flavored Tobacco Products",2665073,ISSUE,05/07/2019,05/07/2019,05/07/2019,N,05/23/2019,07/15/2021,05/23/2019,05/23/2019,AAC,05/12/2022,NULL,41.894878247,-87.747829786,"(41.89487824738007, -87.74782978563464)","2022-10-06 12:53:44",test,"2019-05-07 00:00:00","2019-05-07 00:00:00","2019-05-23 00:00:00","2021-07-15 00:00:00","2019-05-23 00:00:00","2022-05-12 00:00:00"
1875213-20160516,2454217,64579,1,"CYNPAT, INC","Cielo Dulce","3504 S WESTERN AVE 1",CHICAGO,IL,60609,12,6,12-6,9,1475,"Consumption on Premises - Incidental Activity",638,"Consumption of Liquor on Premises",1875213,RENEW,NULL,03/15/2016,05/13/2016,N,05/16/2016,05/15/2018,05/13/2016,05/13/2016,AAI,NULL,NULL,41.830073693,-87.68517427,"(41.830073693447986, -87.68517426995787)","2022-10-06 12:53:44",test,NULL,"2016-05-13 00:00:00","2016-05-16 00:00:00","2018-05-15 00:00:00","2016-05-13 00:00:00",NULL
1494698-20220516,2836378,6324,1,"BERT'S PLACE, INC","CHEZ JOEL","1119 W TAYLOR ST  1ST",CHICAGO,IL,60607,25,27,25-27,12,1477,"Outdoor Patio",784,"Sale of Liquor Outdoors on Private Property",1494698,RENEW,NULL,03/15/2022,05/11/2022,N,05/16/2022,05/15/2024,05/11/2022,05/12/2022,AAI,NULL,NULL,41.869332279,-87.655106787,"(41.86933227916697, -87.65510678669794)","2022-10-06 12:53:44",test,NULL,"2022-05-11 00:00:00","2022-05-16 00:00:00","2024-05-15 00:00:00","2022-05-12 00:00:00",NULL
1875213-20200516,2719950,64579,1,"CYNPAT, INC","Cielo Dulce","3504 S WESTERN AVE 1",CHICAGO,IL,60609,12,6,12-6,9,1475,"Consumption on Premises - Incidental Activity",638,"Consumption of Liquor on Premises",1875213,RENEW,NULL,03/15/2020,06/17/2020,N,05/16/2020,05/15/2022,06/17/2020,01/04/2022,AAI,NULL,NULL,41.830073693,-87.68517427,"(41.830073693447986, -87.68517426995787)","2022-10-06 12:53:44",test,NULL,"2020-06-17 00:00:00","2020-05-16 00:00:00","2022-05-15 00:00:00","2022-01-04 00:00:00",NULL
2595364-20220516,2839417,427182,1,"QIUYU ZHANG","OCEAN SPA","450 W 23RD PL 1ST",CHICAGO,IL,60616,25,18,25-18,9,1010,"Limited Business License",998,"Provide Foot Massage - Fully Clothed/No Disrobing",2595364,RENEW,NULL,03/15/2022,04/11/2022,N,05/16/2022,05/15/2024,04/11/2022,04/12/2022,AAI,NULL,NULL,41.850082342,-87.638779111,"(41.8500823420962, -87.63877911097413)","2022-10-06 12:53:44",test,NULL,"2022-04-11 00:00:00","2022-05-16 00:00:00","2024-05-15 00:00:00","2022-04-12 00:00:00",NULL
2846337-20220512,2846337,485763,2,"SOPHIA J. TAN","SOPHIA J. TAN","600 N LAKE SHORE DR 34TH 3408",CHICAGO,IL,60611,42,7,42-7,18,4406,"Peddler License",769,"Peddler- Retail Sales of General Merchandise, Whole Uncut Fruits/Vegetables, Flowers, Moving Along the Public Way",2846337,ISSUE,05/12/2022,05/12/2022,05/12/2022,N,05/12/2022,05/15/2024,NULL,05/12/2022,AAI,NULL,NULL,41.892748209,-87.614686796,"(41.8927482092378, -87.6146867960138)","2022-10-06 12:53:44",test,"2022-05-12 00:00:00","2022-05-12 00:00:00","2022-05-12 00:00:00","2024-05-15 00:00:00","2022-05-12 00:00:00",NULL
1519562-20220516,2837503,281410,1,"COMCAST SPORTSNET CHICAGO, LLC","COMCAST SPORTSNET CHICAGO, LLC","350 N ORLEANS ST",CHICAGO,IL,60654,42,17,42-17,18,1010,"Limited Business License",NULL,NULL,1519562,RENEW,NULL,03/15/2022,05/12/2022,N,05/16/2022,05/15/2024,05/12/2022,05/12/2022,AAI,NULL,NULL,41.888741038,-87.637080541,"(41.888741038131876, -87.63708054058772)","2022-10-06 12:53:44",test,NULL,"2022-05-12 00:00:00","2022-05-16 00:00:00","2024-05-15 00:00:00","2022-05-12 00:00:00",NULL
1300059-20050216,1562576,201476,1,"WALSH BROTHERS CONSTRUCTION, INC.","WALSH BROTHERS CONSTRUCTION, INC.","310 N BUSSE HWY  237","PARK RIDGE",IL,60068,NULL,NULL,NULL,NULL,1011,"Home Repair",NULL,NULL,1300059,RENEW,NULL,12/20/2004,01/28/2005,N,02/16/2005,02/15/2006,03/31/2006,04/03/2006,AAI,NULL,NULL,NULL,NULL,NULL,"2022-10-06 12:53:44",test,NULL,"2005-01-28 00:00:00","2005-02-16 00:00:00","2006-02-15 00:00:00","2006-04-03 00:00:00",NULL
2214454-20210416,2772435,59107,1,"SACIT KARA","PAYLESS MUFFLER BRAKE","2219 S WESTERN AVE 1ST",CHICAGO,IL,60608,25,5,25-5,10,8340,"Motor Vehicle Services License",712,"Motor Vehicle Repair -  Engine and Transmission Work",2214454,RENEW,NULL,02/15/2021,03/11/2021,N,04/16/2021,04/15/2023,03/11/2021,05/12/2022,AAI,NULL,NULL,41.851371871,-87.685474667,"(41.851371871108725, -87.68547466734822)","2022-10-06 12:53:44",test,NULL,"2021-03-11 00:00:00","2021-04-16 00:00:00","2023-04-15 00:00:00","2022-05-12 00:00:00",NULL
53884-20080516,1896431,64579,1,"CYNPAT, INC","Cielo Dulce","3504 S WESTERN AVE 1",CHICAGO,IL,60609,12,6,12-6,9,1006,"Retail Food Establishment",775,"Retail Sales of Perishable Foods",53884,RENEW,NULL,03/24/2008,05/13/2008,N,05/16/2008,05/15/2010,05/13/2008,05/14/2008,AAI,NULL,NULL,41.830073693,-87.68517427,"(41.830073693447986, -87.68517426995787)","2022-10-06 12:53:44",test,NULL,"2008-05-13 00:00:00","2008-05-16 00:00:00","2010-05-15 00:00:00","2008-05-14 00:00:00",NULL
2846300-20220512,2846300,485709,1,"VICTOR MONDRAGON TELLES","VICTOR MONDRAGON TELLES","9515 S AVENUE N",CHICAGO,IL,60617,10,26,10-26,4,4406,"Peddler License",769,"Peddler- Retail Sales of General Merchandise, Whole Uncut Fruits/Vegetables, Flowers, Moving Along the Public Way",2846300,ISSUE,05/12/2022,05/12/2022,05/12/2022,N,05/12/2022,05/15/2024,NULL,05/12/2022,AAI,NULL,NULL,41.722441703,-87.538774378,"(41.72244170311266, -87.53877437808369)","2022-10-06 12:53:44",test,"2022-05-12 00:00:00","2022-05-12 00:00:00","2022-05-12 00:00:00","2024-05-15 00:00:00","2022-05-12 00:00:00",NULL
1649036-20080516,1896432,64579,1,"CYNPAT, INC","Cielo Dulce","3504 S WESTERN AVE 1",CHICAGO,IL,60609,12,6,12-6,9,1050,"Public Place of Amusement",743,"Provides Onsite Amusement or Entertainment",1649036,RENEW,NULL,03/24/2008,05/13/2008,N,05/16/2008,05/15/2010,06/03/2008,06/04/2008,AAI,NULL,NULL,41.830073693,-87.68517427,"(41.830073693447986, -87.68517426995787)","2022-10-06 12:53:44",test,NULL,"2008-05-13 00:00:00","2008-05-16 00:00:00","2010-05-15 00:00:00","2008-06-04 00:00:00",NULL
1594380-20220616,2842933,290719,1,"35TH STREET REDHOTS LLC","35TH STREET REDHOTS","500 W 35TH ST",CHICAGO,IL,60616,11,39,11-39,9,1006,"Retail Food Establishment",775,"Retail Sales of Perishable Foods",1594380,RENEW,NULL,04/15/2022,04/17/2022,N,06/16/2022,06/15/2024,04/17/2022,05/12/2022,AAI,NULL,NULL,41.830954434,-87.638866899,"(41.83095443385002, -87.63886689866528)","2022-10-06 12:53:44",test,NULL,"2022-04-17 00:00:00","2022-06-16 00:00:00","2024-06-15 00:00:00","2022-05-12 00:00:00",NULL
6313-20150416,2380913,25366,1,"O'HARE ENGINEERING, INC.","O'HARE ENGINEERING, INC.","55  MESSNER DR  1",WHEELING,IL,60090,NULL,NULL,NULL,NULL,1010,"Limited Business License",NULL,NULL,6313,RENEW,NULL,02/15/2015,02/26/2015,N,04/16/2015,04/15/2017,02/26/2015,02/27/2015,AAI,NULL,NULL,NULL,NULL,NULL,"2022-10-06 12:53:44",test,NULL,"2015-02-26 00:00:00","2015-04-16 00:00:00","2017-04-15 00:00:00","2015-02-27 00:00:00",NULL
1145421-20220516,2837219,216013,1,"VERNON PARK TAP L.L.C.,","TUFANO'S/VERNON PARK TAP","1073 W VERNON PARK PL",CHICAGO,IL,60607,25,25,25-25,12,1475,"Consumption on Premises - Incidental Activity",638,"Consumption of Liquor on Premises",1145421,RENEW,NULL,03/15/2022,05/11/2022,N,05/16/2022,05/15/2024,05/11/2022,05/12/2022,AAI,NULL,NULL,41.872904375,-87.654033036,"(41.872904374521134, -87.65403303613473)","2022-10-06 12:53:44",test,NULL,"2022-05-11 00:00:00","2022-05-16 00:00:00","2024-05-15 00:00:00","2022-05-12 00:00:00",NULL
2202679-20211016,2805882,366548,2,"EXPRESS SHOE'S, INC.","EXPRESS SHOE' S","3434 W 26TH ST 1ST",CHICAGO,IL,60623,22,22,22-22,10,1010,"Limited Business License",NULL,NULL,2202679,RENEW,NULL,08/15/2021,09/21/2021,N,10/16/2021,10/15/2023,09/21/2021,09/22/2021,AAC,05/12/2022,25,41.844541413,-87.711279136,"(41.84454141323846, -87.71127913640808)","2022-10-06 12:53:44",test,NULL,"2021-09-21 00:00:00","2021-10-16 00:00:00","2023-10-15 00:00:00","2021-09-22 00:00:00","2022-05-12 00:00:00"
2744224-20220616,2842934,290719,4,"35TH STREET REDHOTS LLC","Redhot Ranch","2449 W ARMITAGE AVE",CHICAGO,IL,60647,1,NULL,1-,NULL,1006,"Retail Food Establishment",782,"Sale of Food Prepared Onsite Without Dining Area",2744224,RENEW,NULL,04/15/2022,04/17/2022,N,06/16/2022,06/15/2024,04/17/2022,05/12/2022,AAI,NULL,33,41.917448845,-87.689355159,"(41.91744884537053, -87.68935515890212)","2022-10-06 12:53:44",test,NULL,"2022-04-17 00:00:00","2022-06-16 00:00:00","2024-06-15 00:00:00","2022-05-12 00:00:00",NULL
2845410-20220510,2845410,485183,1,"NOT BY BREAD ALONE ONE L.L.C.","NOT BY BREAD ALONE","6836 S PAXTON AVE 3RD",CHICAGO,IL,60649,5,40,5-40,3,8344,"Shared Kitchen User (Long Term)",804,"Shared Kitchen User - Long Term",2845410,ISSUE,04/26/2022,04/26/2022,04/26/2022,N,05/10/2022,05/15/2024,NULL,05/11/2022,AAI,NULL,NULL,41.77056617,-87.571676421,"(41.77056616981751, -87.57167642074168)","2022-10-06 12:53:44",test,"2022-04-26 00:00:00","2022-04-26 00:00:00","2022-05-10 00:00:00","2024-05-15 00:00:00","2022-05-11 00:00:00",NULL
2210656-20220516,2838402,372120,1,"A 1 OLSON CONSTRUCTION LLC","A 1 OLSON CONSTRUCTION LLC","3934 N NORDICA AVE 1ST",CHICAGO,IL,60634,38,3,38-3,16,4404,"Regulated Business License",673,"Home Repair Services",2210656,RENEW,NULL,03/15/2022,05/11/2022,N,05/16/2022,05/15/2024,05/11/2022,05/12/2022,AAI,NULL,NULL,41.951828454,-87.803714829,"(41.95182845419927, -87.80371482901829)","2022-10-06 12:53:44",test,NULL,"2022-05-11 00:00:00","2022-05-16 00:00:00","2024-05-15 00:00:00","2022-05-12 00:00:00",NULL
2732774-20220616,2844832,468202,1,"COTTAGE SHEET METAL LLC","COTTAGE SHEET METAL, LLC","6646 W 99TH ST","CHICAGO RIDGE",IL,60415,NULL,NULL,NULL,NULL,4404,"Regulated Business License",901,"Heating, Ventilation and Air Conditioning Services - Residential",2732774,RENEW,NULL,04/15/2022,05/12/2022,N,06/16/2022,06/15/2024,05/12/2022,05/12/2022,AAI,NULL,NULL,NULL,NULL,NULL,"2022-10-06 12:53:44",test,NULL,"2022-05-12 00:00:00","2022-06-16 00:00:00","2024-06-15 00:00:00","2022-05-12 00:00:00",NULL
82530-20220616,2842321,68186,1,"MUI'S FEIDA BAKERY CORP","FEIDA BAKERY","2228 S WENTWORTH AVE  1ST",CHICAGO,IL,60616,25,14,25-14,9,1006,"Retail Food Establishment",775,"Retail Sales of Perishable Foods",82530,RENEW,NULL,04/15/2022,05/11/2022,N,06/16/2022,06/15/2024,05/11/2022,05/12/2022,AAI,NULL,NULL,41.852068813,-87.632142931,"(41.852068812871245, -87.63214293138071)","2022-10-06 12:53:44",test,NULL,"2022-05-11 00:00:00","2022-06-16 00:00:00","2024-06-15 00:00:00","2022-05-12 00:00:00",NULL
2594609-20220516,2846294,389709,2,"DAVID'S AUTO, INC.","DAVID'S AUTO","2920 - 2924 W VAN BUREN ST",CHICAGO,IL,60612,27,14,27-14,11,8340,"Motor Vehicle Services License",712,"Motor Vehicle Repair -  Engine and Transmission Work",2594609,RENEW,NULL,05/12/2022,05/12/2022,N,05/16/2022,05/15/2024,05/12/2022,05/12/2022,AAI,NULL,NULL,41.876053206,-87.699520822,"(41.87605320575717, -87.69952082158169)","2022-10-06 12:53:44",test,NULL,"2022-05-12 00:00:00","2022-05-16 00:00:00","2024-05-15 00:00:00","2022-05-12 00:00:00",NULL
1875213-20080808,1875213,64579,1,"CYNPAT, INC","Cielo Dulce","3504 S WESTERN AVE 1",CHICAGO,IL,60609,12,6,12-6,9,1475,"Consumption on Premises - Incidental Activity",638,"Consumption of Liquor on Premises",1875213,ISSUE,11/19/2007,07/14/2008,06/19/2008,N,08/08/2008,05/15/2010,08/08/2008,08/08/2008,AAI,NULL,NULL,41.830073693,-87.68517427,"(41.830073693447986, -87.68517426995787)","2022-10-06 12:53:44",test,"2007-11-19 00:00:00","2008-06-19 00:00:00","2008-08-08 00:00:00","2010-05-15 00:00:00","2008-08-08 00:00:00",NULL
2059458-20201116,2751718,356626,1,"Book Chick, Inc. d/b/a Myopic Books","Myopic Books","1564 N MILWAUKEE AVE 1",CHICAGO,IL,60622,1,8,1-8,14,1010,"Limited Business License",NULL,NULL,2059458,RENEW,NULL,09/15/2020,10/07/2020,N,11/16/2020,11/15/2022,10/07/2020,10/08/2020,AAC,05/12/2022,33,41.90984445,-87.676858513,"(41.90984445023246, -87.67685851340516)","2022-10-06 12:53:44",test,NULL,"2020-10-07 00:00:00","2020-11-16 00:00:00","2022-11-15 00:00:00","2020-10-08 00:00:00","2022-05-12 00:00:00"
2846312-20220512,2846312,485763,1,"SOPHIA J. TAN","CRYSTAL'S GALLERY","309 W CHICAGO AVE 2 2",CHICAGO,IL,60654,42,15,42-15,18,1010,"Limited Business License",904,"Retail Sales of General Merchandise",2846312,ISSUE,05/12/2022,05/12/2022,05/12/2022,N,05/12/2022,05/15/2024,05/12/2022,05/12/2022,AAI,NULL,NULL,41.896457755,-87.636098042,"(41.8964577550414, -87.63609804227903)","2022-10-06 12:53:44",test,"2022-05-12 00:00:00","2022-05-12 00:00:00","2022-05-12 00:00:00","2024-05-15 00:00:00","2022-05-12 00:00:00",NULL
1305900-20220416,2832621,256808,1,"MOROCCO FISH & CHICKEN INC","J & J FISH","26 E ADAMS ST",CHICAGO,IL,60603,42,9,42-9,1,1006,"Retail Food Establishment",775,"Retail Sales of Perishable Foods",1305900,RENEW,NULL,02/15/2022,05/12/2022,N,04/16/2022,04/15/2024,05/12/2022,05/12/2022,AAI,NULL,1,41.879612214,-87.626785779,"(41.87961221387046, -87.62678577886467)","2022-10-06 12:53:44",test,NULL,"2022-05-12 00:00:00","2022-04-16 00:00:00","2024-04-15 00:00:00","2022-05-12 00:00:00",NULL
2846133-20220512,2846133,485648,1,"Chicago All Secured LLC","All secured rolling shutters","1461 S BLUE ISLAND AVE  228",CHICAGO,IL,60608,25,NULL,25-,NULL,4404,"Regulated Business License",674,"Home Repair Services (Home Based Business)",2846133,ISSUE,05/10/2022,05/10/2022,05/11/2022,N,05/12/2022,05/15/2024,05/11/2022,05/12/2022,AAI,NULL,NULL,41.861881176,-87.657558436,"(41.86188117554516, -87.65755843617394)","2022-10-06 12:53:44",test,"2022-05-10 00:00:00","2022-05-11 00:00:00","2022-05-12 00:00:00","2024-05-15 00:00:00","2022-05-12 00:00:00",NULL
1145420-20220516,2837220,216013,1,"VERNON PARK TAP L.L.C.,","TUFANO'S/VERNON PARK TAP","1073 W VERNON PARK PL",CHICAGO,IL,60607,25,25,25-25,12,1006,"Retail Food Establishment",775,"Retail Sales of Perishable Foods",1145420,RENEW,NULL,03/15/2022,05/11/2022,N,05/16/2022,05/15/2024,05/11/2022,05/12/2022,AAI,NULL,NULL,41.872904375,-87.654033036,"(41.872904374521134, -87.65403303613473)","2022-10-06 12:53:44",test,NULL,"2022-05-11 00:00:00","2022-05-16 00:00:00","2024-05-15 00:00:00","2022-05-12 00:00:00",NULL
2283171-20210916,2800919,384278,4,"ACCOUNT CONTROL TECHNOLOGY, INC.","ACCOUNT CONTROL TECHNOLOGY, INC.","5300  KINGS ISLAND",MASON,OH,45040,NULL,NULL,NULL,NULL,4404,"Regulated Business License",912,"Debt Collecting - Administrative Commercial Office",2283171,RENEW,NULL,07/15/2021,09/10/2021,N,09/16/2021,09/15/2023,09/10/2021,05/12/2022,AAI,NULL,NULL,NULL,NULL,NULL,"2022-10-06 12:53:44",test,NULL,"2021-09-10 00:00:00","2021-09-16 00:00:00","2023-09-15 00:00:00","2022-05-12 00:00:00",NULL
32359-20220516,2836376,6324,1,"BERT'S PLACE, INC","CHEZ JOEL","1119 W TAYLOR ST  1ST",CHICAGO,IL,60607,25,27,25-27,12,1006,"Retail Food Establishment",775,"Retail Sales of Perishable Foods",32359,RENEW,NULL,03/15/2022,05/11/2022,N,05/16/2022,05/15/2024,05/11/2022,05/12/2022,AAI,NULL,NULL,41.869332279,-87.655106787,"(41.86933227916697, -87.65510678669794)","2022-10-06 12:53:44",test,NULL,"2022-05-11 00:00:00","2022-05-16 00:00:00","2024-05-15 00:00:00","2022-05-12 00:00:00",NULL
1649036-20180516,2585348,64579,1,"CYNPAT, INC","Cielo Dulce","3504 S WESTERN AVE 1",CHICAGO,IL,60609,12,6,12-6,9,1050,"Public Place of Amusement",743,"Provides Onsite Amusement or Entertainment",1649036,RENEW,NULL,03/15/2018,05/18/2018,N,05/16/2018,07/15/2020,05/18/2018,05/18/2018,AAI,NULL,NULL,41.830073693,-87.68517427,"(41.830073693447986, -87.68517426995787)","2022-10-06 12:53:44",test,NULL,"2018-05-18 00:00:00","2018-05-16 00:00:00","2020-07-15 00:00:00","2018-05-18 00:00:00",NULL
2732678-20220616,2844802,468146,1,"DIAMOND COLLISION REPAIR LLC","DIAMOND COLLISION REPAIR LLC","6957-6959 W GRAND AVE",CHICAGO,IL,60707,36,NULL,36-,NULL,8340,"Motor Vehicle Services License",1040,"Engine and Body Work w/ Spray Booth",2732678,RENEW,NULL,04/15/2022,05/12/2022,N,06/16/2022,06/15/2024,05/12/2022,05/12/2022,AAI,NULL,NULL,41.923448837,-87.80017288,"(41.92344883736579, -87.80017288022414)","2022-10-06 12:53:44",test,NULL,"2022-05-12 00:00:00","2022-06-16 00:00:00","2024-06-15 00:00:00","2022-05-12 00:00:00",NULL
1875213-20120516,2144329,64579,1,"CYNPAT, INC","Cielo Dulce","3504 S WESTERN AVE 1",CHICAGO,IL,60609,12,6,12-6,9,1475,"Consumption on Premises - Incidental Activity",638,"Consumption of Liquor on Premises",1875213,RENEW,NULL,03/15/2012,05/14/2012,N,05/16/2012,05/15/2014,05/14/2012,07/31/2012,AAI,NULL,NULL,41.830073693,-87.68517427,"(41.830073693447986, -87.68517426995787)","2022-10-06 12:53:44",test,NULL,"2012-05-14 00:00:00","2012-05-16 00:00:00","2014-05-15 00:00:00","2012-07-31 00:00:00",NULL
2431768-20220516,2837632,304505,3,"POWL MIXED MARTIAL ARTS SCHOOL, INC.",POW!,"310 S RACINE AVE 1ST 1S",CHICAGO,IL,60607,28,16,28-16,12,1010,"Limited Business License","661 | 848","Fitness Training On and Off Premise | Training in The Arts of Combat and Self-Defense, Music, Art, Gymnastics, Dance for Children Under 18 Years of Age (Less Than 40% Children)",2431768,RENEW,NULL,03/15/2022,05/12/2022,N,05/16/2022,05/15/2024,05/12/2022,05/12/2022,AAI,NULL,NULL,41.877430702,-87.657157985,"(41.87743070168073, -87.6571579846684)","2022-10-06 12:53:44",test,NULL,"2022-05-12 00:00:00","2022-05-16 00:00:00","2024-05-15 00:00:00","2022-05-12 00:00:00",NULL
1964294-20220516,2838009,342154,1,"M & S FOOD MARKET, INC.","M & S FOOD MARKET, INC.","5615 W MADISON ST 1",CHICAGO,IL,60644,29,16,29-16,15,1781,Tobacco,763,"Retail Sale of Tobacco",1964294,RENEW,NULL,03/15/2022,04/11/2022,N,05/16/2022,05/15/2023,04/11/2022,05/12/2022,AAI,NULL,NULL,41.880126744,-87.765513817,"(41.88012674361977, -87.7655138171091)","2022-10-06 12:53:44",test,NULL,"2022-04-11 00:00:00","2022-05-16 00:00:00","2023-05-15 00:00:00","2022-05-12 00:00:00",NULL
2442970-20220216,2826231,403340,1,"VAN'S HAND CARWASH LLC","VAN'S HAND CAR WASH","5940 S ASHLAND AVE GROUND",CHICAGO,IL,60636,16,2,16-2,7,1010,"Limited Business License","708 | 930","Miscellaneous Commercial Services | Operation of a Hand Car Wash",2442970,RENEW,NULL,12/15/2021,05/12/2022,N,02/16/2022,02/15/2024,05/12/2022,05/12/2022,AAI,NULL,NULL,41.785526056,-87.664513201,"(41.7855260564644, -87.66451320099907)","2022-10-06 12:53:44",test,NULL,"2022-05-12 00:00:00","2022-02-16 00:00:00","2024-02-15 00:00:00","2022-05-12 00:00:00",NULL
2543180-20220516,2836392,7105,2,"M. K. INDUSTRIES, INC.","M K Industries, Inc.","998  FOREST EDGE DR","VERNON HILLS",IL,60061,NULL,NULL,NULL,NULL,4404,"Regulated Business License",901,"Heating, Ventilation and Air Conditioning Services - Residential",2543180,RENEW,NULL,03/15/2022,05/11/2022,N,05/16/2022,05/15/2024,05/11/2022,05/12/2022,AAI,NULL,NULL,NULL,NULL,NULL,"2022-10-06 12:53:44",test,NULL,"2022-05-11 00:00:00","2022-05-16 00:00:00","2024-05-15 00:00:00","2022-05-12 00:00:00",NULL
1649036-20100516,2024044,64579,1,"CYNPAT, INC","Cielo Dulce","3504 S WESTERN AVE 1",CHICAGO,IL,60609,12,6,12-6,9,1050,"Public Place of Amusement",743,"Provides Onsite Amusement or Entertainment",1649036,RENEW,NULL,03/15/2010,04/26/2010,N,05/16/2010,05/15/2012,05/20/2010,05/21/2010,AAI,NULL,NULL,41.830073693,-87.68517427,"(41.830073693447986, -87.68517426995787)","2022-10-06 12:53:44",test,NULL,"2010-04-26 00:00:00","2010-05-16 00:00:00","2012-05-15 00:00:00","2010-05-21 00:00:00",NULL
2589881-20220416,2834439,426605,1,"S N J CORP.","JASMINE STUDIO","2450 W DEVON AVE 1ST B",CHICAGO,IL,60659,50,19,50-19,24,1010,"Limited Business License",911,"Retail Sales of Clothing / Accessories / Shoes",2589881,RENEW,NULL,02/15/2022,05/12/2022,N,04/16/2022,04/15/2024,05/12/2022,05/12/2022,AAI,NULL,43,41.997807149,-87.691928071,"(41.99780714930879, -87.69192807077042)","2022-10-06 12:53:44",test,NULL,"2022-05-12 00:00:00","2022-04-16 00:00:00","2024-04-15 00:00:00","2022-05-12 00:00:00",NULL
1354954-20201116,2751033,256960,1,"RAMIREZ FAST FOOD CORP.","RAMIREZ FAST FOOD","1521 W GRAND AVE",CHICAGO,IL,60642,1,7,1-7,12,1006,"Retail Food Establishment",775,"Retail Sales of Perishable Foods",1354954,RENEW,NULL,09/15/2020,10/06/2020,N,11/16/2020,11/15/2022,10/06/2020,05/12/2022,AAI,NULL,NULL,41.89088178,-87.666409165,"(41.89088178023672, -87.66640916519835)","2022-10-06 12:53:44",test,NULL,"2020-10-06 00:00:00","2020-11-16 00:00:00","2022-11-15 00:00:00","2022-05-12 00:00:00",NULL
1798611-20211116,2810563,311779,1,"BARBIZON LIGHT OF NEW ENGLAND,INC.","BARBIZON CHICAGO","2525 N ELSTON AVE 2",CHICAGO,IL,60647,32,34,32-34,14,1010,"Limited Business License",NULL,NULL,1798611,RENEW,NULL,09/15/2021,09/16/2021,N,11/16/2021,11/15/2023,09/16/2021,09/17/2021,AAI,NULL,NULL,41.927491952,-87.680787559,"(41.927491951779736, -87.68078755906367)","2022-10-06 12:53:44",test,NULL,"2021-09-16 00:00:00","2021-11-16 00:00:00","2023-11-15 00:00:00","2021-09-17 00:00:00",NULL
2808716-20220512,2808716,478863,2,"LIL BUDDY'S, INC.","LIL BUDDY'S INC","2300 S THROOP ST",CHICAGO,IL,60608,25,2,25-2,12,4405,"Mobile Food License",734,"Preparation and Sale of Food (ONLY) from a Mobile Food Truck (Mobile Food Preparer)",2808716,ISSUE,09/07/2021,09/20/2021,09/20/2021,N,05/12/2022,10/15/2023,05/12/2022,05/12/2022,AAI,NULL,NULL,41.850451024,-87.658797856,"(41.85045102427, -87.65879785567869)","2022-10-06 12:53:44",test,"2021-09-07 00:00:00","2021-09-20 00:00:00","2022-05-12 00:00:00","2023-10-15 00:00:00","2022-05-12 00:00:00",NULL
1847538-20070914,1847538,89020,45,"FEDEX OFFICE AND PRINT SERVICES, INC.","FEDEX OFFICE AND PRINT SVCS, INC.","2301 S DR MARTIN LUTHER KING JR DR  SOUTH BL",CHICAGO,IL,60616,4,3,4-3,1,1010,"Limited Business License",NULL,NULL,1847538,ISSUE,09/07/2007,09/13/2007,09/14/2007,N,09/14/2007,01/15/2009,09/14/2007,09/14/2007,AAI,NULL,NULL,NULL,NULL,NULL,"2022-10-06 12:53:44",test,"2007-09-07 00:00:00","2007-09-14 00:00:00","2007-09-14 00:00:00","2009-01-15 00:00:00","2007-09-14 00:00:00",NULL
2846237-20220512,2846237,485708,1,"VICTOR BATREZ","EMPIRE CUTZ","3220 S ASHLAND AVE 1",CHICAGO,IL,60608,12,9,12-9,9,1010,"Limited Business License",894,"Hair Services",2846237,ISSUE,05/11/2022,05/12/2022,05/12/2022,N,05/12/2022,05/15/2024,05/12/2022,05/12/2022,AAI,NULL,NULL,41.834853559,-87.665817901,"(41.834853559096985, -87.66581790057461)","2022-10-06 12:53:44",test,"2022-05-11 00:00:00","2022-05-12 00:00:00","2022-05-12 00:00:00","2024-05-15 00:00:00","2022-05-12 00:00:00",NULL
2808774-20220303,2808774,478899,1,"DEBRA ANDERSON","Cruise Planners","8855 S BLACKSTONE AVE",CHICAGO,IL,60619,8,NULL,8-,NULL,4404,"Regulated Business License",849,"Travel Agency - No Ticket Printing (Home Based Business)",2808774,ISSUE,09/08/2021,09/08/2021,03/02/2022,N,03/03/2022,03/15/2024,03/02/2022,03/03/2022,AAI,NULL,NULL,41.733441873,-87.587910612,"(41.73344187340151, -87.58791061212501)","2022-10-06 12:53:44",test,"2021-09-08 00:00:00","2022-03-02 00:00:00","2022-03-03 00:00:00","2024-03-15 00:00:00","2022-03-03 00:00:00",NULL
1334397-20050216,1567157,259083,1,"DAVID M. DANIELS, SR.","D M D ELECTRICAL CONSTRUCTION LIGHTING AND MAINTENANCE CONTRACTOR","1187  WILMETTE AVE  279",WILMETTE,IL,60091,NULL,NULL,NULL,NULL,1010,"Limited Business License",NULL,NULL,1334397,RENEW,NULL,12/20/2004,06/06/2007,N,02/16/2005,02/15/2006,NULL,06/06/2007,AAI,NULL,NULL,NULL,NULL,NULL,"2022-10-06 12:53:44",test,NULL,"2007-06-06 00:00:00","2005-02-16 00:00:00","2006-02-15 00:00:00","2007-06-06 00:00:00",NULL
1334398-20050216,1567158,259083,1,"DAVID M. DANIELS, SR.","D M D ELECTRICAL CONSTRUCTION LIGHTING AND MAINTENANCE CONTRACTOR","1187  WILMETTE AVE  279",WILMETTE,IL,60091,NULL,NULL,NULL,NULL,1011,"Home Repair",NULL,NULL,1334398,RENEW,NULL,12/20/2004,06/06/2007,N,02/16/2005,02/15/2006,NULL,06/06/2007,AAI,NULL,NULL,NULL,NULL,NULL,"2022-10-06 12:53:44",test,NULL,"2007-06-06 00:00:00","2005-02-16 00:00:00","2006-02-15 00:00:00","2007-06-06 00:00:00",NULL
2845627-20220512,2845627,485312,1,"Nine Little Saw Chicago Inc.","Nine Little Saw Chicago","1162 W CULLERTON ST",CHICAGO,IL,60608,25,NULL,25-,NULL,4404,"Regulated Business License",724,"Other Home Based Businesses",2845627,ISSUE,04/29/2022,04/29/2022,05/11/2022,N,05/12/2022,05/15/2024,05/11/2022,05/12/2022,AAI,NULL,NULL,41.855321206,-87.655597983,"(41.855321205838806, -87.65559798305519)","2022-10-06 12:53:44",test,"2022-04-29 00:00:00","2022-05-11 00:00:00","2022-05-12 00:00:00","2024-05-15 00:00:00","2022-05-12 00:00:00",NULL
2089188-20171116,2557422,244084,3,"ENRIQUE AYALA","Ayala Store","3101 W 26TH ST 1 C-95,96",CHICAGO,IL,60623,12,NULL,12-,NULL,1010,"Limited Business License",NULL,NULL,2089188,RENEW,NULL,09/15/2017,11/02/2017,N,11/16/2017,11/15/2019,11/02/2017,11/03/2017,AAI,NULL,NULL,NULL,NULL,NULL,"2022-10-06 12:53:44",test,NULL,"2017-11-02 00:00:00","2017-11-16 00:00:00","2019-11-15 00:00:00","2017-11-03 00:00:00",NULL
2797336-20220512,2797336,457657,2,"CRN CONSULTING GROUP INC.","CRN Consulting Group Inc.","3325 N NOTTINGHAM AVE",CHICAGO,IL,60634,29,NULL,29-,NULL,4404,"Regulated Business License",719,"Professional Consulting (Home Based Business)",2797336,C_LOC,07/02/2021,07/02/2021,07/07/2021,N,05/12/2022,04/15/2023,07/07/2021,05/12/2022,AAI,NULL,NULL,41.940623504,-87.80421659,"(41.94062350414074, -87.80421659039294)","2022-10-06 12:53:44",test,"2021-07-02 00:00:00","2021-07-07 00:00:00","2022-05-12 00:00:00","2023-04-15 00:00:00","2022-05-12 00:00:00",NULL
2808970-20220516,2836349,1928,3,"COOK-DUPAGE TRANSPORTATION COMPANY, INC.","NATIONAL EXPRESS TRANS","4301 S PACKERS AVE",CHICAGO,IL,60609,11,NULL,11-,NULL,1010,"Limited Business License",708,"Miscellaneous Commercial Services",2808970,RENEW,NULL,03/15/2022,05/11/2022,N,05/16/2022,05/15/2024,05/11/2022,05/12/2022,AAI,NULL,13,41.815897667,-87.658503827,"(41.81589766744781, -87.6585038266102)","2022-10-06 12:53:44",test,NULL,"2022-05-11 00:00:00","2022-05-16 00:00:00","2024-05-15 00:00:00","2022-05-12 00:00:00",NULL
53884-20020516,1240877,64579,1,"CYNPAT, INC","Cielo Dulce","3504 S WESTERN AVE 1",CHICAGO,IL,60609,12,6,12-6,9,1006,"Retail Food Establishment",775,"Retail Sales of Perishable Foods",53884,RENEW,NULL,03/27/2002,04/18/2002,N,05/16/2002,05/15/2003,06/03/2002,06/04/2002,AAI,NULL,NULL,41.830073693,-87.68517427,"(41.830073693447986, -87.68517426995787)","2022-10-06 12:53:44",test,NULL,"2002-04-18 00:00:00","2002-05-16 00:00:00","2003-05-15 00:00:00","2002-06-04 00:00:00",NULL
2631045-20220516,2837303,251960,3,"FLORIN BENIUC","Hydronics, Inc","3871  SUNSET LN",NORTHBROOK,IL,60062,NULL,NULL,NULL,NULL,4404,"Regulated Business License","673 | 754 | 755","Home Repair Services | Residential Construction / Minor Home Repair Services | Residential Installations",2631045,RENEW,NULL,03/15/2022,05/11/2022,N,05/16/2022,05/15/2024,05/11/2022,05/12/2022,AAI,NULL,NULL,NULL,NULL,NULL,"2022-10-06 12:53:44",test,NULL,"2022-05-11 00:00:00","2022-05-16 00:00:00","2024-05-15 00:00:00","2022-05-12 00:00:00",NULL
1875213-20140516,2316540,64579,1,"CYNPAT, INC","Cielo Dulce","3504 S WESTERN AVE 1",CHICAGO,IL,60609,12,6,12-6,9,1475,"Consumption on Premises - Incidental Activity",638,"Consumption of Liquor on Premises",1875213,RENEW,NULL,03/15/2014,07/18/2014,N,05/16/2014,05/15/2016,07/18/2014,07/18/2014,AAI,NULL,NULL,41.830073693,-87.68517427,"(41.830073693447986, -87.68517426995787)","2022-10-06 12:53:44",test,NULL,"2014-07-18 00:00:00","2014-05-16 00:00:00","2016-05-15 00:00:00","2014-07-18 00:00:00",NULL
2831502-20220512,2831502,483107,1,"D & S MINI MART LLC","D & S MINI MART","6610 W NORTH AVE",CHICAGO,IL,60707,29,10,29-10,25,1781,Tobacco,"936 | 937","Retail Sales of Tobacco Accessories | Retail Sales of Tobacco and Flavored Tobacco Products",2831502,ISSUE,02/09/2022,03/08/2022,04/19/2022,N,05/12/2022,05/15/2023,05/12/2022,05/12/2022,AAI,NULL,NULL,41.909193383,-87.790501484,"(41.9091933829476, -87.7905014840963)","2022-10-06 12:53:44",test,"2022-02-09 00:00:00","2022-04-19 00:00:00","2022-05-12 00:00:00","2023-05-15 00:00:00","2022-05-12 00:00:00",NULL
1718675-20220516,2837564,289871,1,"ALHAMBRA PALACE RESTAURANT LLC","ALHAMBRA PALACE RESTAURANT","1240 W RANDOLPH ST 1, 2",CHICAGO,IL,60607,27,33,27-33,12,1050,"Public Place of Amusement",743,"Provides Onsite Amusement or Entertainment",1718675,RENEW,NULL,03/15/2022,03/30/2022,N,05/16/2022,05/15/2024,05/12/2022,05/12/2022,AAI,NULL,NULL,NULL,NULL,NULL,"2022-10-06 12:53:44",test,NULL,"2022-03-30 00:00:00","2022-05-16 00:00:00","2024-05-15 00:00:00","2022-05-12 00:00:00",NULL
53884-20160516,2454216,64579,1,"CYNPAT, INC","Cielo Dulce","3504 S WESTERN AVE 1",CHICAGO,IL,60609,12,6,12-6,9,1006,"Retail Food Establishment",775,"Retail Sales of Perishable Foods",53884,RENEW,NULL,03/15/2016,05/13/2016,N,05/16/2016,05/15/2018,05/13/2016,05/13/2016,AAI,NULL,NULL,41.830073693,-87.68517427,"(41.830073693447986, -87.68517426995787)","2022-10-06 12:53:44",test,NULL,"2016-05-13 00:00:00","2016-05-16 00:00:00","2018-05-15 00:00:00","2016-05-13 00:00:00",NULL
2333768-20220616,2843919,390690,1,"JADE PALACE, INC.","JADE PALACE","2551 S KEDZIE AVE 1ST",CHICAGO,IL,60623,12,15,12-15,10,1006,"Retail Food Establishment",735,"Preparation of Food and Dining on Premise With Seating",2333768,RENEW,NULL,04/15/2022,05/11/2022,N,06/16/2022,06/15/2024,05/11/2022,05/12/2022,AAI,NULL,25,41.84483539,-87.70489989,"(41.84483539012294, -87.70489988979249)","2022-10-06 12:53:44",test,NULL,"2022-05-11 00:00:00","2022-06-16 00:00:00","2024-06-15 00:00:00","2022-05-12 00:00:00",NULL
1908913-20220616,2842142,38148,2,"SOUTH WATER MARKET PRODUCE INC","SOUTH WATER MARKET PRODUCE, INC.","455 W 24TH ST 1 1",CHICAGO,IL,60616,11,18,11-18,9,1007,"Wholesale Food Establishment",864,"Wholesale Food Sales",1908913,RENEW,NULL,04/15/2022,05/11/2022,N,06/16/2022,06/15/2024,05/11/2022,05/12/2022,AAI,NULL,NULL,41.848951828,-87.638933773,"(41.848951827656535, -87.63893377344633)","2022-10-06 12:53:44",test,NULL,"2022-05-11 00:00:00","2022-06-16 00:00:00","2024-06-15 00:00:00","2022-05-12 00:00:00",NULL
2840616-20220428,2840616,484408,1,"PLANTX MIDWEST INC.",XMARKET,"804 W MONTROSE AVE 1 & MEZZ",CHICAGO,IL,60613,46,NULL,46-,NULL,1006,"Retail Food Establishment","640 | 736 | 760 | 766 | 767 | 775","Deli, Butcher or Bakery | Preparation of Food, Coffee or Drinks | Retail Sale of Food for Offsite Consumption | Retail Sales of Fresh Fruits and Vegetables (Leafy and Non Leafy Vegetables) | Retail Sales of General Merchandise and Non-Perishable Food | Retail Sales of Perishable Foods",2840616,ISSUE,03/30/2022,03/30/2022,03/31/2022,N,04/28/2022,05/15/2024,04/27/2022,04/28/2022,AAI,NULL,34,41.961950551,-87.650132051,"(41.96195055112621, -87.6501320506605)","2022-10-06 12:53:44",test,"2022-03-30 00:00:00","2022-03-31 00:00:00","2022-04-28 00:00:00","2024-05-15 00:00:00","2022-04-28 00:00:00",NULL
2718833-20220416,2834653,467428,1,"DIZA TACOS GARFIELD, LLC","TACO BELL","255 W GARFIELD BLVD",CHICAGO,IL,60621,3,36,3-36,7,1006,"Retail Food Establishment",735,"Preparation of Food and Dining on Premise With Seating",2718833,RENEW,NULL,02/15/2022,05/11/2022,N,04/16/2022,04/15/2024,05/11/2022,05/12/2022,AAI,NULL,NULL,41.794053855,-87.632760361,"(41.7940538545927, -87.63276036126142)","2022-10-06 12:53:44",test,NULL,"2022-05-11 00:00:00","2022-04-16 00:00:00","2024-04-15 00:00:00","2022-05-12 00:00:00",NULL
53884-20060216,1661693,64579,1,"CYNPAT, INC","Cielo Dulce","3504 S WESTERN AVE 1",CHICAGO,IL,60609,12,6,12-6,9,1006,"Retail Food Establishment",775,"Retail Sales of Perishable Foods",53884,RENEW,NULL,12/21/2005,01/23/2006,N,02/16/2006,02/15/2007,01/23/2006,01/24/2006,AAI,NULL,NULL,41.830073693,-87.68517427,"(41.830073693447986, -87.68517426995787)","2022-10-06 12:53:44",test,NULL,"2006-01-23 00:00:00","2006-02-16 00:00:00","2007-02-15 00:00:00","2006-01-24 00:00:00",NULL
53884-20140516,2316539,64579,1,"CYNPAT, INC","Cielo Dulce","3504 S WESTERN AVE 1",CHICAGO,IL,60609,12,6,12-6,9,1006,"Retail Food Establishment",775,"Retail Sales of Perishable Foods",53884,RENEW,NULL,03/15/2014,07/18/2014,N,05/16/2014,05/15/2016,07/18/2014,07/18/2014,AAI,NULL,NULL,41.830073693,-87.68517427,"(41.830073693447986, -87.68517426995787)","2022-10-06 12:53:44",test,NULL,"2014-07-18 00:00:00","2014-05-16 00:00:00","2016-05-15 00:00:00","2014-07-18 00:00:00",NULL
1997650-20220616,2843309,347343,1,"ORIGINAL TRIPLE CROWN RESTAURANT, INC.","ORIGINAL TRIPLE CROWN RESTAURANT, INC.","211 W 22ND PL 1ST",CHICAGO,IL,60616,25,14,25-14,9,1006,"Retail Food Establishment",775,"Retail Sales of Perishable Foods",1997650,RENEW,NULL,04/15/2022,05/11/2022,N,06/16/2022,06/15/2024,05/11/2022,05/12/2022,AAI,NULL,NULL,41.85205252,-87.632505281,"(41.852052519797155, -87.63250528112087)","2022-10-06 12:53:44",test,NULL,"2022-05-11 00:00:00","2022-06-16 00:00:00","2024-06-15 00:00:00","2022-05-12 00:00:00",NULL
1477258-20050216,1569903,273322,1,"ULTIMATE BUILDERS, INC.","ULTIMATE BUILDERS, INC.","600  MORSE   UNIT C",SCHAUMBURG,IL,60193,NULL,NULL,NULL,NULL,1010,"Limited Business License",NULL,NULL,1477258,RENEW,NULL,12/20/2004,06/29/2011,N,02/16/2005,02/15/2006,06/29/2011,06/30/2011,AAI,NULL,NULL,NULL,NULL,NULL,"2022-10-06 12:53:44",test,NULL,"2011-06-29 00:00:00","2005-02-16 00:00:00","2006-02-15 00:00:00","2011-06-30 00:00:00",NULL
2749783-20220512,2841178,469925,1,"SUPER SHOPPER INC","SUPER SHOPPER FOOD MART","1351 W 79TH ST",CHICAGO,IL,60620,17,NULL,17-,NULL,1006,"Retail Food Establishment","736 | 767 | 775","Preparation of Food, Coffee or Drinks | Retail Sales of General Merchandise and Non-Perishable Food | Retail Sales of Perishable Foods",2749783,C_SBA,04/08/2022,04/19/2022,NULL,N,05/12/2022,11/15/2022,05/11/2022,05/12/2022,AAI,NULL,32,41.750321121,-87.658189053,"(41.75032112057248, -87.65818905291597)","2022-10-06 12:53:44",test,"2022-04-08 00:00:00",NULL,"2022-05-12 00:00:00","2022-11-15 00:00:00","2022-05-12 00:00:00",NULL
2451718-20220416,2834012,404316,1,"NBM DEVELOPMENT LLC","NBM DEVELOPMENT LLC","1035 N DEARBORN ST 10TH 10E",CHICAGO,IL,60610,2,4,2-4,18,4404,"Regulated Business License",757,"Residential Real Estate Developer (Home Based Business)",2451718,RENEW,NULL,02/15/2022,05/11/2022,N,04/16/2022,04/15/2024,05/11/2022,05/12/2022,AAI,NULL,NULL,41.901679149,-87.62977237,"(41.90167914923734, -87.62977237044007)","2022-10-06 12:53:44",test,NULL,"2022-05-11 00:00:00","2022-04-16 00:00:00","2024-04-15 00:00:00","2022-05-12 00:00:00",NULL
2845960-20220512,2845960,485544,1,"BIG JOE'S BBQ LLC","BIG JOE'S BBQ LLC","5515 W 80TH PL",BURBANK,IL,60459,NULL,NULL,NULL,NULL,8345,"Shared Kitchen User (Short Term)",805,"Shared Kitchen User - Short Term (90 Days or Less - Not Renewable)",2845960,ISSUE,05/05/2022,05/05/2022,05/05/2022,N,05/12/2022,08/15/2022,NULL,05/12/2022,AAI,NULL,NULL,NULL,NULL,NULL,"2022-10-06 12:53:44",test,"2022-05-05 00:00:00","2022-05-05 00:00:00","2022-05-12 00:00:00","2022-08-15 00:00:00","2022-05-12 00:00:00",NULL
2208797-20220616,2843384,352695,1,"CANARY TELEHEALTH INC.","CANARY TELEHEALTH INC.","3151 S MICHIGAN AVE 1 1",CHICAGO,IL,60616,3,53,3-53,2,4404,"Regulated Business License",724,"Other Home Based Businesses",2208797,RENEW,NULL,04/15/2022,05/11/2022,N,06/16/2022,06/15/2024,05/11/2022,05/12/2022,AAI,NULL,NULL,41.83678663,-87.623259939,"(41.83678663046203, -87.6232599388145)","2022-10-06 12:53:44",test,NULL,"2022-05-11 00:00:00","2022-06-16 00:00:00","2024-06-15 00:00:00","2022-05-12 00:00:00",NULL
2846260-20220512,2846260,27692,2,"GRACE LEAVITT LIQUORS CORP.","GRACE LEAVITT FIRE ESCAPE","2157 W GRACE ST",CHICAGO,IL,60618,47,2,47-2,19,1476,"Special Event Liquor",996,"Special Event Beer, Wine & Spirits",2846260,ISSUE,05/11/2022,05/11/2022,05/11/2022,N,05/12/2022,11/08/2022,05/11/2022,05/12/2022,AAI,NULL,NULL,41.950337385,-87.683366374,"(41.950337385207895, -87.68336637393413)","2022-10-06 12:53:44",test,"2022-05-11 00:00:00","2022-05-11 00:00:00","2022-05-12 00:00:00","2022-11-08 00:00:00","2022-05-12 00:00:00",NULL
2658345-20220416,2834564,457566,1,"COLLEEN ROTHROCK","COLLEEN ROTHROCK","[REDACTED FOR PRIVACY]","CROWN POINT",IN,46307,NULL,NULL,NULL,NULL,7009,"Pharmaceutical Representative",990,"Markets / Promotes Pharmaceuticals to Health Care Professionals and Conducts Business for More than 15 Calendar Days per Year",2658345,RENEW,NULL,02/15/2022,05/11/2022,N,04/16/2022,04/15/2023,05/11/2022,05/12/2022,AAI,NULL,NULL,NULL,NULL,NULL,"2022-10-06 12:53:44",test,NULL,"2022-05-11 00:00:00","2022-04-16 00:00:00","2023-04-15 00:00:00","2022-05-12 00:00:00",NULL
1875213-20100516,2024045,64579,1,"CYNPAT, INC","Cielo Dulce","3504 S WESTERN AVE 1",CHICAGO,IL,60609,12,6,12-6,9,1475,"Consumption on Premises - Incidental Activity",638,"Consumption of Liquor on Premises",1875213,RENEW,NULL,03/15/2010,04/26/2010,N,05/16/2010,05/15/2012,04/26/2010,04/27/2010,AAI,NULL,NULL,41.830073693,-87.68517427,"(41.830073693447986, -87.68517426995787)","2022-10-06 12:53:44",test,NULL,"2010-04-26 00:00:00","2010-05-16 00:00:00","2012-05-15 00:00:00","2010-04-27 00:00:00",NULL
2732863-20220616,2844865,468249,1,"Glenda Lashley","Glenda L. Lashley","455 W WINNECONNA PKWY",CHICAGO,IL,60620,17,NULL,17-,NULL,4404,"Regulated Business License",719,"Professional Consulting (Home Based Business)",2732863,RENEW,NULL,04/15/2022,05/11/2022,N,06/16/2022,06/15/2024,05/11/2022,05/12/2022,AAI,NULL,32,41.751633621,-87.63584119,"(41.75163362057795, -87.63584119038063)","2022-10-06 12:53:44",test,NULL,"2022-05-11 00:00:00","2022-06-16 00:00:00","2024-06-15 00:00:00","2022-05-12 00:00:00",NULL
2147514-20220416,2846199,371170,1,"RED SUNS DISTRIBUTORS INC","RIDGE WAY TRADING","3737 W LAWRENCE AVE GROUND B",CHICAGO,IL,60625,35,24,35-24,17,1781,Tobacco,"763 | 767","Retail Sale of Tobacco | Retail Sales of General Merchandise and Non-Perishable Food",2147514,RENEW,NULL,05/11/2022,05/11/2022,N,04/16/2022,04/15/2023,05/11/2022,05/12/2022,AAI,NULL,NULL,41.968194856,-87.722270797,"(41.96819485557913, -87.72227079662382)","2022-10-06 12:53:44",test,NULL,"2022-05-11 00:00:00","2022-04-16 00:00:00","2023-04-15 00:00:00","2022-05-12 00:00:00",NULL
2595935-20220616,2844508,427531,1,"RIOS COMPLETE AUTO REPAIR INC.","GRAND AUTO","4547 W GRAND AVE",CHICAGO,IL,60639,37,22,37-22,25,8340,"Motor Vehicle Services License",711,"Motor Vehicle Repair - Engine and Body Work",2595935,RENEW,NULL,04/15/2022,05/11/2022,N,06/16/2022,06/15/2024,05/11/2022,05/12/2022,AAI,NULL,NULL,41.911525233,-87.740264358,"(41.91152523330641, -87.7402643583006)","2022-10-06 12:53:44",test,NULL,"2022-05-11 00:00:00","2022-06-16 00:00:00","2024-06-15 00:00:00","2022-05-12 00:00:00",NULL
2631034-20181019,2631034,432219,1,"PONTE CATRINA LLC","PONTE CATRINA LLC","2150 S CANALPORT AVE 5 5B",CHICAGO,IL,60608,25,NULL,25-,12,1010,"Limited Business License",894,"Hair Services",2631034,ISSUE,10/18/2018,10/18/2018,10/18/2018,N,10/19/2018,07/15/2021,10/18/2018,10/19/2018,AAI,NULL,NULL,41.853301464,-87.649929695,"(41.8533014640748, -87.649929695282)","2022-10-06 12:53:44",test,"2018-10-18 00:00:00","2018-10-18 00:00:00","2018-10-19 00:00:00","2021-07-15 00:00:00","2018-10-19 00:00:00",NULL
2846327-20220512,2846327,264025,2,"CRAIG WILLIAMS JR","CRAIG WILLIAMS JR","5145 N LINCOLN AVE 3RD 3 L",CHICAGO,IL,60625,40,12,40-12,20,4406,"Peddler License",819,"Street Performer, Moving Along the Public Way",2846327,ISSUE,05/12/2022,05/12/2022,05/12/2022,N,05/12/2022,08/15/2023,NULL,05/12/2022,AAI,NULL,NULL,41.975399073,-87.692172502,"(41.975399073294895, -87.6921725020227)","2022-10-06 12:53:44",test,"2022-05-12 00:00:00","2022-05-12 00:00:00","2022-05-12 00:00:00","2023-08-15 00:00:00","2022-05-12 00:00:00",NULL
53884-20040516,1418002,64579,1,"CYNPAT, INC","Cielo Dulce","3504 S WESTERN AVE 1",CHICAGO,IL,60609,12,6,12-6,9,1006,"Retail Food Establishment",775,"Retail Sales of Perishable Foods",53884,RENEW,NULL,03/17/2004,04/09/2004,N,05/16/2004,02/15/2005,04/13/2004,04/14/2004,AAI,NULL,NULL,41.830073693,-87.68517427,"(41.830073693447986, -87.68517426995787)","2022-10-06 12:53:44",test,NULL,"2004-04-09 00:00:00","2004-05-16 00:00:00","2005-02-15 00:00:00","2004-04-14 00:00:00",NULL
2846298-20220512,2846298,485752,1,"SHEAR FREAK STUDIOS, LLC","SHEAR FREAK STUDIO'S","5868 W LAKE ST",CHICAGO,IL,60644,29,26,29-26,15,1010,"Limited Business License",894,"Hair Services",2846298,ISSUE,05/12/2022,05/12/2022,05/12/2022,N,05/12/2022,05/15/2024,05/12/2022,05/12/2022,AAI,NULL,NULL,41.88804144,-87.771881964,"(41.8880414400753, -87.77188196443433)","2022-10-06 12:53:44",test,"2022-05-12 00:00:00","2022-05-12 00:00:00","2022-05-12 00:00:00","2024-05-15 00:00:00","2022-05-12 00:00:00",NULL
2762079-20201120,2762079,471691,1,"ANOTHER LEVEL LLC","ANOTHER LEVEL BEAUTY & BARBER SALON","5868 W LAKE ST 1",CHICAGO,IL,60644,29,NULL,29-,NULL,1010,"Limited Business License",894,"Hair Services",2762079,ISSUE,11/16/2020,11/16/2020,11/19/2020,N,11/20/2020,12/15/2022,11/19/2020,11/20/2020,AAC,05/12/2022,NULL,41.88804144,-87.771881964,"(41.8880414400753, -87.77188196443433)","2022-10-06 12:53:44",test,"2020-11-16 00:00:00","2020-11-19 00:00:00","2020-11-20 00:00:00","2022-12-15 00:00:00","2020-11-20 00:00:00","2022-05-12 00:00:00"
2704238-20220516,2839558,458482,2,"ARMED FORCES POST 8322, VETERANS OF FOREIGN WARS OF THE UNITED STATES, INC.","ARMED FORCES POST 8322, VETERANS OF FOREIGN WARS OF THE UNITED STATES, INC.","7173 W GRAND AVE GROUND",CHICAGO,IL,60707,29,38,29-38,25,1625,Raffles,720,"Not-For-Profit Selling Raffles for Prizes of $50 or More",2704238,RENEW,NULL,03/15/2022,05/11/2022,N,05/16/2022,05/15/2023,05/11/2022,05/12/2022,AAI,NULL,NULL,41.923767564,-87.805432792,"(41.9237675637846, -87.80543279195435)","2022-10-06 12:53:44",test,NULL,"2022-05-11 00:00:00","2022-05-16 00:00:00","2023-05-15 00:00:00","2022-05-12 00:00:00",NULL
2594594-20220516,2839349,426783,1,"HALLE LEONARD","HALLE LEONARD","[REDACTED FOR PRIVACY]",CHICAGO,IL,60614,43,29,43-29,18,7009,"Pharmaceutical Representative",990,"Markets / Promotes Pharmaceuticals to Health Care Professionals and Conducts Business for More than 15 Calendar Days per Year",2594594,RENEW,NULL,03/15/2022,05/11/2022,N,05/16/2022,05/15/2023,05/11/2022,05/12/2022,AAI,NULL,NULL,NULL,NULL,NULL,"2022-10-06 12:53:44",test,NULL,"2022-05-11 00:00:00","2022-05-16 00:00:00","2023-05-15 00:00:00","2022-05-12 00:00:00",NULL
2831501-20220512,2831501,483107,1,"D & S MINI MART LLC","D & S MINI MART","6610 W NORTH AVE",CHICAGO,IL,60707,29,10,29-10,25,1006,"Retail Food Establishment","767 | 775","Retail Sales of General Merchandise and Non-Perishable Food | Retail Sales of Perishable Foods",2831501,ISSUE,02/09/2022,03/08/2022,04/19/2022,N,05/12/2022,05/15/2024,05/10/2022,05/12/2022,AAI,NULL,NULL,41.909193383,-87.790501484,"(41.9091933829476, -87.7905014840963)","2022-10-06 12:53:44",test,"2022-02-09 00:00:00","2022-04-19 00:00:00","2022-05-12 00:00:00","2024-05-15 00:00:00","2022-05-12 00:00:00",NULL
53884-20050216,1560597,64579,1,"CYNPAT, INC","Cielo Dulce","3504 S WESTERN AVE 1",CHICAGO,IL,60609,12,6,12-6,9,1006,"Retail Food Establishment",775,"Retail Sales of Perishable Foods",53884,RENEW,NULL,12/20/2004,01/10/2005,N,02/16/2005,02/15/2006,01/10/2005,01/11/2005,AAI,NULL,NULL,41.830073693,-87.68517427,"(41.830073693447986, -87.68517426995787)","2022-10-06 12:53:44",test,NULL,"2005-01-10 00:00:00","2005-02-16 00:00:00","2006-02-15 00:00:00","2005-01-11 00:00:00",NULL
2709501-20220516,2839586,465758,1,"CHILD FIRST ACADEMY, INC.","CHILD FIRST ACADEMY","814-816 W DIVERSEY PKWY 1ST",CHICAGO,IL,60614,44,29,44-29,19,1023,"Children's Services Facility License",820,"Supervision of, and Care for, Children 0-6 Years of Age, During the Day between 6am-9pm",2709501,RENEW,NULL,03/15/2022,04/01/2022,N,05/16/2022,05/15/2024,05/11/2022,05/12/2022,AAI,NULL,8,41.932815892,-87.649619727,"(41.93281589180143, -87.64961972685818)","2022-10-06 12:53:44",test,NULL,"2022-04-01 00:00:00","2022-05-16 00:00:00","2024-05-15 00:00:00","2022-05-12 00:00:00",NULL
1519518-20050216,1572190,281392,1,"RONALD  GOLDE","KBR DESIGNS","3700  CAPRI CT  406",GLENVIEW,IL,60025,NULL,NULL,NULL,NULL,1010,"Limited Business License",NULL,NULL,1519518,RENEW,NULL,12/20/2004,02/14/2005,N,02/16/2005,02/15/2006,02/14/2005,06/16/2008,AAI,NULL,NULL,NULL,NULL,NULL,"2022-10-06 12:53:44",test,NULL,"2005-02-14 00:00:00","2005-02-16 00:00:00","2006-02-15 00:00:00","2008-06-16 00:00:00",NULL
75214-20200916,2739929,89306,2,"LINCOLN PROPERTY CO COMM INC","LINCOLN PROPERTY COMPANY","150 S WACKER DR  670",CHICAGO,IL,60606,42,12,42-12,1,1010,"Limited Business License",NULL,NULL,75214,RENEW,NULL,07/15/2020,08/20/2020,N,09/16/2020,09/15/2022,08/20/2020,05/12/2022,AAI,NULL,NULL,41.879410846,-87.637103957,"(41.8794108457744, -87.63710395748413)","2022-10-06 12:53:44",test,NULL,"2020-08-20 00:00:00","2020-09-16 00:00:00","2022-09-15 00:00:00","2022-05-12 00:00:00",NULL
2570378-20220616,2843370,351083,2,"KENNY'S CUSTOM AUTO DETAIL, INC.","CANTIC AUTO REPAIR","6249 N CLARK ST",CHICAGO,IL,60660,48,4,48-4,24,8340,"Motor Vehicle Services License",712,"Motor Vehicle Repair -  Engine and Transmission Work",2570378,RENEW,NULL,04/15/2022,05/11/2022,N,06/16/2022,06/15/2024,05/11/2022,05/12/2022,AAI,NULL,NULL,41.995914018,-87.670054347,"(41.99591401753204, -87.67005434737412)","2022-10-06 12:53:44",test,NULL,"2022-05-11 00:00:00","2022-06-16 00:00:00","2024-06-15 00:00:00","2022-05-12 00:00:00",NULL
2214756-20200816,2734857,264126,2,"NORWOOD AUTO SERVICE CENTER, INC.","NORWOOD AUTO SERVICE CENTER, INC.","6055 N NORTHWEST HWY",CHICAGO,IL,60631,41,19,41-19,16,8340,"Motor Vehicle Services License",712,"Motor Vehicle Repair -  Engine and Transmission Work",2214756,RENEW,NULL,06/15/2020,10/05/2020,N,08/16/2020,08/15/2022,10/05/2020,05/12/2022,AAI,NULL,NULL,41.991477624,-87.797324544,"(41.99147762381835, -87.79732454393123)","2022-10-06 12:53:44",test,NULL,"2020-10-05 00:00:00","2020-08-16 00:00:00","2022-08-15 00:00:00","2022-05-12 00:00:00",NULL
2451974-20220516,2836357,3530,11,"MANNY'S COFFEE SHOP, INC.","MANNYS COFFEE SHOP, INC.","1131-1141 S JEFFERSON ST",CHICAGO,IL,60607,25,28,25-28,1,1006,"Retail Food Establishment",735,"Preparation of Food and Dining on Premise With Seating",2451974,RENEW,NULL,03/15/2022,04/26/2022,N,05/16/2022,05/15/2024,04/26/2022,05/12/2022,AAI,NULL,NULL,41.868015128,-87.642070382,"(41.868015128224584, -87.64207038233704)","2022-10-06 12:53:44",test,NULL,"2022-04-26 00:00:00","2022-05-16 00:00:00","2024-05-15 00:00:00","2022-05-12 00:00:00",NULL
1803912-20150316,2377389,315159,1,"CONSTRUCTION TESTING AND INSTRUMENTATION, INCORPORATED","CONSTRUCTION TESTING AND INSTRUMENTATION, INCORPORATED","4262  OLD GRAND AVE  102",GURNEE,IL,60031,NULL,NULL,NULL,NULL,1010,"Limited Business License",NULL,NULL,1803912,RENEW,NULL,01/16/2015,02/20/2015,N,03/16/2015,03/15/2017,02/20/2015,02/23/2015,AAI,NULL,NULL,NULL,NULL,NULL,"2022-10-06 12:53:44",test,NULL,"2015-02-20 00:00:00","2015-03-16 00:00:00","2017-03-15 00:00:00","2015-02-23 00:00:00",NULL
2712482-20220216,2826858,465970,1,"HOOK UP ON 82ND, INC.","HOOK UP","8250 S COTTAGE GROVE AVE 1ST",CHICAGO,IL,60619,8,45,8-45,6,1010,"Limited Business License",772,"Retail Sales of New Electronics and Accessories",2712482,RENEW,NULL,12/15/2021,05/11/2022,N,02/16/2022,02/15/2024,05/11/2022,05/12/2022,AAI,NULL,51,41.744285954,-87.605189317,"(41.74428595417211, -87.60518931702806)","2022-10-06 12:53:44",test,NULL,"2022-05-11 00:00:00","2022-02-16 00:00:00","2024-02-15 00:00:00","2022-05-12 00:00:00",NULL
1649036-20070216,1783375,64579,1,"CYNPAT, INC","Cielo Dulce","3504 S WESTERN AVE 1",CHICAGO,IL,60609,12,6,12-6,9,1050,"Public Place of Amusement",743,"Provides Onsite Amusement or Entertainment",1649036,RENEW,NULL,12/20/2006,01/22/2007,N,02/16/2007,05/15/2008,01/22/2007,01/23/2007,AAI,NULL,NULL,41.830073693,-87.68517427,"(41.830073693447986, -87.68517426995787)","2022-10-06 12:53:44",test,NULL,"2007-01-22 00:00:00","2007-02-16 00:00:00","2008-05-15 00:00:00","2007-01-23 00:00:00",NULL
53884-20180516,2585346,64579,1,"CYNPAT, INC","Cielo Dulce","3504 S WESTERN AVE 1",CHICAGO,IL,60609,12,6,12-6,9,1006,"Retail Food Establishment",775,"Retail Sales of Perishable Foods",53884,RENEW,NULL,03/15/2018,05/18/2018,N,05/16/2018,07/15/2020,05/18/2018,05/18/2018,AAI,NULL,NULL,41.830073693,-87.68517427,"(41.830073693447986, -87.68517426995787)","2022-10-06 12:53:44",test,NULL,"2018-05-18 00:00:00","2018-05-16 00:00:00","2020-07-15 00:00:00","2018-05-18 00:00:00",NULL
2846299-20220512,2846299,485755,1,"BAD AT PETTING CATS LLC",TRASH,"1801 S RACINE AVE",CHICAGO,IL,60608,25,28,25-28,12,1010,"Limited Business License",911,"Retail Sales of Clothing / Accessories / Shoes",2846299,ISSUE,05/12/2022,05/12/2022,05/12/2022,N,05/12/2022,05/15/2024,05/12/2022,05/12/2022,AAI,NULL,NULL,41.857888101,-87.6562803,"(41.85788810064681, -87.65628029976024)","2022-10-06 12:53:44",test,"2022-05-12 00:00:00","2022-05-12 00:00:00","2022-05-12 00:00:00","2024-05-15 00:00:00","2022-05-12 00:00:00",NULL
2084514-20150316,2378131,360296,1,"PRECISION PLUMBING SERVICES INC","PRECISION PLUMBING SERVICES INC","1051 N MAIN  ST  E",LOMBARD,IL,60148,NULL,NULL,NULL,NULL,1010,"Limited Business License",NULL,NULL,2084514,RENEW,NULL,01/16/2015,02/20/2015,N,03/16/2015,03/15/2017,02/20/2015,02/23/2015,AAI,NULL,NULL,NULL,NULL,NULL,"2022-10-06 12:53:44",test,NULL,"2015-02-20 00:00:00","2015-03-16 00:00:00","2017-03-15 00:00:00","2015-02-23 00:00:00",NULL
1649036-20140516,2316538,64579,1,"CYNPAT, INC","Cielo Dulce","3504 S WESTERN AVE 1",CHICAGO,IL,60609,12,6,12-6,9,1050,"Public Place of Amusement",743,"Provides Onsite Amusement or Entertainment",1649036,RENEW,NULL,03/15/2014,07/18/2014,N,05/16/2014,05/15/2016,07/18/2014,07/18/2014,AAI,NULL,NULL,41.830073693,-87.68517427,"(41.830073693447986, -87.68517426995787)","2022-10-06 12:53:44",test,NULL,"2014-07-18 00:00:00","2014-05-16 00:00:00","2016-05-15 00:00:00","2014-07-18 00:00:00",NULL
23011-20210416,2772472,63414,2,"STARBUCKS CORPORATION","STARBUCKS COFFEE #221","400 W MADISON ST  TWO N",CHICAGO,IL,60606,42,21,42-21,1,1006,"Retail Food Establishment",775,"Retail Sales of Perishable Foods",23011,RENEW,NULL,02/15/2021,04/26/2021,N,04/16/2021,04/15/2023,04/26/2021,04/26/2021,AAC,05/12/2022,NULL,41.882007859,-87.638245404,"(41.882007858778465, -87.63824540361531)","2022-10-06 12:53:44",test,NULL,"2021-04-26 00:00:00","2021-04-16 00:00:00","2023-04-15 00:00:00","2021-04-26 00:00:00","2022-05-12 00:00:00"
2469258-20220616,2844298,406642,1,"KW MANAGEMENT, INC.","SALON O SIXTY-FIVE","3 E HURON ST 2ND",CHICAGO,IL,60611,42,56,42-56,18,1010,"Limited Business License","894 | 896 | 904","Hair Services | Skincare Services | Retail Sales of General Merchandise",2469258,RENEW,NULL,04/15/2022,05/11/2022,N,06/16/2022,06/15/2024,05/11/2022,05/12/2022,AAI,NULL,NULL,41.894768572,-87.627996585,"(41.89476857213306, -87.6279965854806)","2022-10-06 12:53:44",test,NULL,"2022-05-11 00:00:00","2022-06-16 00:00:00","2024-06-15 00:00:00","2022-05-12 00:00:00",NULL
48105-20200516,2719867,56261,1,"HALCON CORPORATION","HALCON CORPORATION","222 W MERCHANDISE MART PLZ 10TH 10-121",CHICAGO,IL,60654,42,14,42-14,18,1010,"Limited Business License",NULL,NULL,48105,RENEW,NULL,03/15/2020,02/21/2022,N,05/16/2020,05/15/2022,02/21/2022,05/12/2022,AAI,NULL,NULL,41.888074281,-87.634955203,"(41.8880742810662, -87.63495520292739)","2022-10-06 12:53:44",test,NULL,"2022-02-21 00:00:00","2020-05-16 00:00:00","2022-05-15 00:00:00","2022-05-12 00:00:00",NULL
2846209-20220512,2846209,485687,1,"AVS Clinical LLC","AVS Clinical LLC","1170 W FARWELL AVE  D",CHICAGO,IL,60626,49,NULL,49-,NULL,4404,"Regulated Business License",719,"Professional Consulting (Home Based Business)",2846209,ISSUE,05/11/2022,05/11/2022,05/11/2022,N,05/12/2022,05/15/2024,05/11/2022,05/12/2022,AAI,NULL,NULL,42.006882235,-87.660913904,"(42.00688223512057, -87.66091390366002)","2022-10-06 12:53:44",test,"2022-05-11 00:00:00","2022-05-11 00:00:00","2022-05-12 00:00:00","2024-05-15 00:00:00","2022-05-12 00:00:00",NULL
1574644-20060327,1574644,273121,2,"ALL-BRY CONSTRUCTION CO.","ALL-BRY CONSTRUCTION CO.","16W455 S FRONTAGE RD  111","BURR RIDGE",IL,60527,NULL,NULL,NULL,NULL,1010,"Limited Business License",NULL,NULL,1574644,ISSUE,01/19/2005,03/18/2005,03/24/2006,N,03/27/2006,02/15/2007,03/24/2006,03/27/2006,AAI,NULL,NULL,NULL,NULL,NULL,"2022-10-06 12:53:44",test,"2005-01-19 00:00:00","2006-03-24 00:00:00","2006-03-27 00:00:00","2007-02-15 00:00:00","2006-03-27 00:00:00",NULL
2664938-20220516,2839216,416351,4,"SIREN RETAIL CORPORATION","STARBUCKS RESERVE ROASTERY CHICAGO","646 N MICHIGAN AVE 1-5",CHICAGO,IL,60611,42,22,42-22,18,1050,"Public Place of Amusement",746,"Public Place of Amusement, Provides Entertainment, Room Rentals and Charges a Fee",2664938,RENEW,NULL,03/15/2022,04/08/2022,N,05/16/2022,05/15/2024,05/12/2022,05/12/2022,AAI,NULL,NULL,41.893973347,-87.624381519,"(41.89397334746711, -87.62438151862536)","2022-10-06 12:53:44",test,NULL,"2022-04-08 00:00:00","2022-05-16 00:00:00","2024-05-15 00:00:00","2022-05-12 00:00:00",NULL
2308919-20220216,2826113,388114,1,"VC MANAGEMENT, LLC","VC MANAGEMENT, LLC","10 S RIVERSIDE PLZ 14TH 1400",CHICAGO,IL,60606,42,12,42-12,1,1010,"Limited Business License",897,"Financial Services Commercial Office",2308919,RENEW,NULL,12/15/2021,02/14/2022,N,02/16/2022,02/15/2024,02/14/2022,05/12/2022,AAI,NULL,NULL,41.881664289,-87.638887444,"(41.881664289382925, -87.63888744408949)","2022-10-06 12:53:44",test,NULL,"2022-02-14 00:00:00","2022-02-16 00:00:00","2024-02-15 00:00:00","2022-05-12 00:00:00",NULL
2457715-20220616,2842122,35162,5,"CHICAGO ORIENTAL WHOLESALE MARKET, INC.","CHICAGO ORIENTAL WHOLESALE MARKET, INC.","1902 S LUMBER ST 1ST",CHICAGO,IL,60616,25,6,25-6,12,1007,"Wholesale Food Establishment","642 | 864","Direct Food Sales to Businesses | Wholesale Food Sales",2457715,RENEW,NULL,04/15/2022,05/12/2022,N,06/16/2022,06/15/2024,05/12/2022,05/12/2022,AAI,NULL,NULL,41.856718776,-87.637081637,"(41.85671877622936, -87.63708163715695)","2022-10-06 12:53:44",test,NULL,"2022-05-12 00:00:00","2022-06-16 00:00:00","2024-06-15 00:00:00","2022-05-12 00:00:00",NULL
11601-20060216,1651514,5457,2,"VIDEOTEC CORP","VIDEOTEC CORP","9801  SPRING   1","HIGHLAND PARK",IN,46322,NULL,NULL,NULL,NULL,1010,"Limited Business License",NULL,NULL,11601,RENEW,NULL,12/21/2005,02/15/2006,N,02/16/2006,02/15/2007,02/15/2006,02/16/2006,AAI,NULL,NULL,NULL,NULL,NULL,"2022-10-06 12:53:44",test,NULL,"2006-02-15 00:00:00","2006-02-16 00:00:00","2007-02-15 00:00:00","2006-02-16 00:00:00",NULL
24101-20150316,2375559,29956,1,"B.A.P. ENTERPRISES INC.","B.A.P. ENTERPRISES INC.","14235  COTTAGE GROVE   1",DOLTON,IL,60419,NULL,NULL,NULL,NULL,1010,"Limited Business License",NULL,NULL,24101,RENEW,NULL,01/16/2015,02/20/2015,N,03/16/2015,03/15/2017,02/20/2015,02/23/2015,AAI,NULL,NULL,NULL,NULL,NULL,"2022-10-06 12:53:44",test,NULL,"2015-02-20 00:00:00","2015-03-16 00:00:00","2017-03-15 00:00:00","2015-02-23 00:00:00",NULL
1769483-20210316,2768547,216171,2,"AMERICAN HOIST & MAN LIFT, INC.","AMERICAN HOIST & MAN LIFT, INC.","15811 S ANNICO DR  UNIT 5","HOMER GLEN",IL,60491,NULL,NULL,NULL,NULL,1010,"Limited Business License",NULL,NULL,1769483,RENEW,NULL,01/15/2021,03/04/2021,N,03/16/2021,03/15/2023,03/04/2021,03/16/2021,AAI,NULL,NULL,NULL,NULL,NULL,"2022-10-06 12:53:44",test,NULL,"2021-03-04 00:00:00","2021-03-16 00:00:00","2023-03-15 00:00:00","2021-03-16 00:00:00",NULL
2846419-20220513,2846419,485828,1,"DAVID E BOCK","DAVID E BOCK","401 S ELLIS",BENSENVILLE,IL,60106,NULL,NULL,NULL,NULL,4406,"Peddler License",819,"Street Performer, Moving Along the Public Way",2846419,ISSUE,05/13/2022,05/13/2022,05/13/2022,N,05/13/2022,05/15/2024,NULL,05/13/2022,AAI,NULL,NULL,NULL,NULL,NULL,"2022-10-06 12:53:44",test,"2022-05-13 00:00:00","2022-05-13 00:00:00","2022-05-13 00:00:00","2024-05-15 00:00:00","2022-05-13 00:00:00",NULL
55012-20070216,1775066,14028,2,"BBJ RENTALS INC","BBJ BOUTIQUE LINENS","7855  GROSS PT RD  G-6",SKOKIE,IL,60077,NULL,NULL,NULL,NULL,1010,"Limited Business License",NULL,NULL,55012,RENEW,NULL,12/20/2006,01/29/2007,N,02/16/2007,03/15/2008,01/29/2007,01/30/2007,AAI,NULL,NULL,NULL,NULL,NULL,"2022-10-06 12:53:44",test,NULL,"2007-01-29 00:00:00","2007-02-16 00:00:00","2008-03-15 00:00:00","2007-01-30 00:00:00",NULL
1357681-20210316,2768778,264135,1,"TANK TECH INC.","TANK TECH","3897  STATE HWY. H",BLODGETT,MO,63824,NULL,NULL,NULL,NULL,1010,"Limited Business License",NULL,NULL,1357681,RENEW,NULL,01/15/2021,03/15/2021,N,03/16/2021,03/15/2023,03/15/2021,03/16/2021,AAI,NULL,NULL,NULL,NULL,NULL,"2022-10-06 12:53:44",test,NULL,"2021-03-15 00:00:00","2021-03-16 00:00:00","2023-03-15 00:00:00","2021-03-16 00:00:00",NULL
1544018-20150416,2382611,283364,1,"MCMECHANICAL CONTRACTORS INC.","MCMECHANICAL CONTRACTORS","15774 S LAGRANGE RD  245","ORLAND PARK",IL,60462,NULL,NULL,NULL,NULL,1010,"Limited Business License",NULL,NULL,1544018,RENEW,NULL,02/15/2015,02/24/2015,N,04/16/2015,04/15/2017,02/24/2015,02/25/2015,AAI,NULL,NULL,NULL,NULL,NULL,"2022-10-06 12:53:44",test,NULL,"2015-02-24 00:00:00","2015-04-16 00:00:00","2017-04-15 00:00:00","2015-02-25 00:00:00",NULL
45443-20150416,2380716,16551,1,"CUSTOM CONTRACTING LIMITED","CUSTOM CONTRACTING LTD.","21020 N RAND RD  D","LAKE ZURICH",IL,60047,NULL,NULL,NULL,NULL,1010,"Limited Business License",NULL,NULL,45443,RENEW,NULL,02/15/2015,02/24/2015,N,04/16/2015,04/15/2017,02/24/2015,02/25/2015,AAI,NULL,NULL,NULL,NULL,NULL,"2022-10-06 12:53:44",test,NULL,"2015-02-24 00:00:00","2015-04-16 00:00:00","2017-04-15 00:00:00","2015-02-25 00:00:00",NULL
2397763-20200516,2721570,369504,13,"COFFEE HOUSE HOLDINGS, INC.","STARBUCKS COFFEE #11719","116 S HALSTED ST 1ST",CHICAGO,IL,60661,27,58,27-58,12,1006,"Retail Food Establishment",781,"Sale of Food Prepared Onsite With Dining Area",2397763,RENEW,NULL,03/15/2020,04/22/2020,N,05/16/2020,05/15/2022,04/22/2020,04/24/2020,AAC,05/13/2022,16,41.879942323,-87.647452744,"(41.8799423230123, -87.64745274382807)","2022-10-06 12:53:44",test,NULL,"2020-04-22 00:00:00","2020-05-16 00:00:00","2022-05-15 00:00:00","2020-04-24 00:00:00","2022-05-13 00:00:00"
2157525-20200516,2721563,369504,2,"COFFEE HOUSE HOLDINGS, INC.","STARBUCKS COFFEE #16309","200 S MICHIGAN AVE",CHICAGO,IL,60604,42,33,42-33,1,1006,"Retail Food Establishment",775,"Retail Sales of Perishable Foods",2157525,RENEW,NULL,03/15/2020,04/22/2020,N,05/16/2020,05/15/2022,04/22/2020,04/24/2020,AAC,05/13/2022,NULL,41.879489329,-87.624498125,"(41.87948932869769, -87.6244981249339)","2022-10-06 12:53:44",test,NULL,"2020-04-22 00:00:00","2020-05-16 00:00:00","2022-05-15 00:00:00","2020-04-24 00:00:00","2022-05-13 00:00:00"
2846426-20220513,2846426,485831,1,"SPELLBOUND GAMES LLC","SPELLBOUND GAMES","3321 W PIERCE AVE 1ST 1",CHICAGO,IL,60651,26,12,26-12,14,4404,"Regulated Business License",722,"Online Sales (Home Based Business)",2846426,ISSUE,05/13/2022,05/13/2022,05/13/2022,N,05/13/2022,05/15/2024,05/13/2022,05/13/2022,AAI,NULL,NULL,41.909041565,-87.710317319,"(41.90904156504746, -87.71031731911783)","2022-10-06 12:53:44",test,"2022-05-13 00:00:00","2022-05-13 00:00:00","2022-05-13 00:00:00","2024-05-15 00:00:00","2022-05-13 00:00:00",NULL
1517414-20100216,2011555,279319,1,"4301 N Sheridan, LLC","4301 N Sheridan, LLC","350 W HUBBARD  3 300",CHICAGO,IL,60610,42,67,42-67,18,1020,"Residential Real Estate Developer",NULL,NULL,1517414,RENEW,NULL,12/16/2009,03/19/2010,N,02/16/2010,02/15/2012,02/10/2010,06/16/2011,AAI,NULL,NULL,NULL,NULL,NULL,"2022-10-06 12:53:44",test,NULL,"2010-03-19 00:00:00","2010-02-16 00:00:00","2012-02-15 00:00:00","2011-06-16 00:00:00",NULL
2398562-20200516,2721572,369504,15,"COFFEE HOUSE HOLDINGS, INC.","STARBUCKS COFFEE #17743","6108 N WESTERN AVE 1",CHICAGO,IL,60659,40,8,40-8,24,1006,"Retail Food Establishment",735,"Preparation of Food and Dining on Premise With Seating",2398562,RENEW,NULL,03/15/2020,04/22/2020,N,05/16/2020,05/15/2022,04/22/2020,04/24/2020,AAC,05/13/2022,NULL,41.992587488,-87.689862154,"(41.99258748774938, -87.6898621543762)","2022-10-06 12:53:44",test,NULL,"2020-04-22 00:00:00","2020-05-16 00:00:00","2022-05-15 00:00:00","2020-04-24 00:00:00","2022-05-13 00:00:00"
2840994-20220419,2840994,455851,2,"XS TENNIS & EDUCATION FOUNDATION","BRIDGERTON THE QUEENS BALL","5336 S STATE ST",CHICAGO,IL,60609,3,16,3-16,2,1058,"Indoor Special Event",892,"Indoor Special Event",2840994,ISSUE,04/06/2022,04/08/2022,05/13/2022,N,04/19/2022,05/20/2022,04/19/2022,04/19/2022,AAI,NULL,NULL,41.797200279,-87.625913914,"(41.79720027934307, -87.62591391377782)","2022-10-06 12:53:44",test,"2022-04-06 00:00:00","2022-05-13 00:00:00","2022-04-19 00:00:00","2022-05-20 00:00:00","2022-04-19 00:00:00",NULL
1621352-20051116,1644756,294754,1,"CORKY, INC","CORKY, INC","7044 N CLARK ST",CHICAGO,IL,60626,49,3,49-3,24,1010,"Limited Business License",NULL,NULL,1621352,RENEW,NULL,09/22/2005,11/16/2005,N,11/16/2005,11/15/2006,11/16/2005,11/18/2005,AAI,NULL,24,42.010303018,-87.6744012,"(42.01030301777198, -87.67440119990874)","2022-10-06 12:53:44",test,NULL,"2005-11-16 00:00:00","2005-11-16 00:00:00","2006-11-15 00:00:00","2005-11-18 00:00:00",NULL
2218735-20121231,2218735,354360,1,"LIFE SPICE AND INGREDIENTS LLC","LIFE SPICE AND INGREDIENTS LLC","1150 N LAKE SHORE DR 24 24H",CHICAGO,IL,60611,2,NULL,2-,NULL,4404,"Regulated Business License",724,"Other Home Based Businesses",2218735,ISSUE,NULL,NULL,NULL,N,12/31/2012,07/15/2012,NULL,12/31/2012,AAI,NULL,NULL,41.903877323,-87.62511802,"(41.903877323452015, -87.6251180197913)","2022-10-06 12:53:44",test,NULL,NULL,"2012-12-31 00:00:00","2012-07-15 00:00:00","2012-12-31 00:00:00",NULL
52210-20220616,2841841,17610,1,"AGA DONUTS INC","DUNKIN DONUTS INC","1441 W MONTROSE AVE",CHICAGO,IL,60613,47,41,47-41,19,1006,"Retail Food Establishment",775,"Retail Sales of Perishable Foods",52210,RENEW,NULL,04/15/2022,05/12/2022,N,06/16/2022,06/15/2024,05/12/2022,05/13/2022,AAI,NULL,31,41.961517319,-87.666571611,"(41.96151731907338, -87.66657161086611)","2022-10-06 12:53:44",test,NULL,"2022-05-12 00:00:00","2022-06-16 00:00:00","2024-06-15 00:00:00","2022-05-13 00:00:00",NULL
2391629-20200516,2721568,369504,10,"COFFEE HOUSE HOLDINGS, INC.","STARBUCKS COFFEE # 272","2525 N CLARK ST 1",CHICAGO,IL,60614,43,27,43-27,19,1006,"Retail Food Establishment",781,"Sale of Food Prepared Onsite With Dining Area",2391629,RENEW,NULL,03/15/2020,04/22/2020,N,05/16/2020,05/15/2022,04/22/2020,04/24/2020,AAC,05/13/2022,23,41.92854129,-87.642076344,"(41.928541289666775, -87.64207634430801)","2022-10-06 12:53:44",test,NULL,"2020-04-22 00:00:00","2020-05-16 00:00:00","2022-05-15 00:00:00","2020-04-24 00:00:00","2022-05-13 00:00:00"
2142220-20200516,2721564,369504,3,"COFFEE HOUSE HOLDINGS, INC.","STARBUCKS COFFEE","1003-1005 N RUSH ST 1-2",CHICAGO,IL,60611,42,24,42-24,18,1006,"Retail Food Establishment",775,"Retail Sales of Perishable Foods",2142220,RENEW,NULL,03/15/2020,04/22/2020,N,05/16/2020,05/15/2022,04/22/2020,04/24/2020,AAC,05/13/2022,NULL,41.900886707,-87.627416234,"(41.9008867067491, -87.62741623392772)","2022-10-06 12:53:44",test,NULL,"2020-04-22 00:00:00","2020-05-16 00:00:00","2022-05-15 00:00:00","2020-04-24 00:00:00","2022-05-13 00:00:00"
2528883-20220516,2837835,315989,2,"THE STONE AND METAL GROUP LLC","THE STONE AND METAL GROUP, LLC","1624 S CLINTON ST 1",CHICAGO,IL,60616,25,6,25-6,12,1010,"Limited Business License",708,"Miscellaneous Commercial Services",2528883,RENEW,NULL,03/15/2022,05/13/2022,N,05/16/2022,05/15/2024,05/13/2022,05/13/2022,AAI,NULL,NULL,41.859237563,-87.641072153,"(41.85923756255329, -87.64107215304632)","2022-10-06 12:53:44",test,NULL,"2022-05-13 00:00:00","2022-05-16 00:00:00","2024-05-15 00:00:00","2022-05-13 00:00:00",NULL
2423089-20200516,2721576,369504,21,"COFFEE HOUSE HOLDINGS, INC.","STARBUCKS COFFEE #15683","8 N MICHIGAN AVE 1",CHICAGO,IL,60602,42,33,42-33,1,1006,"Retail Food Establishment",781,"Sale of Food Prepared Onsite With Dining Area",2423089,RENEW,NULL,03/15/2020,04/22/2020,N,05/16/2020,05/15/2022,04/22/2020,04/24/2020,AAC,05/13/2022,NULL,41.882288177,-87.624517791,"(41.882288176801794, -87.62451779096743)","2022-10-06 12:53:44",test,NULL,"2020-04-22 00:00:00","2020-05-16 00:00:00","2022-05-15 00:00:00","2020-04-24 00:00:00","2022-05-13 00:00:00"
2427703-20211016,2806340,401278,1,"NATALIE BIRDSONG & AVA SELMON","NATURAL GIRL HAIR IMPORTS","1507 S STATE ST",CHICAGO,IL,60605,3,54,3-54,1,1010,"Limited Business License",904,"Retail Sales of General Merchandise",2427703,RENEW,NULL,08/15/2021,05/13/2022,N,10/16/2021,10/15/2023,05/13/2022,05/13/2022,AAI,NULL,NULL,41.861720399,-87.627136303,"(41.861720399098324, -87.62713630255305)","2022-10-06 12:53:44",test,NULL,"2022-05-13 00:00:00","2021-10-16 00:00:00","2023-10-15 00:00:00","2022-05-13 00:00:00",NULL
1384312-20220216,2823851,19730,2,"CHICAGOLAND REMODELING INC","CHICAGOLAND REMODELING INC.","2130 N HARLEM AVE","ELMWOOD PARK",IL,60707,NULL,NULL,NULL,NULL,1010,"Limited Business License",NULL,NULL,1384312,RENEW,NULL,12/15/2021,05/12/2022,N,02/16/2022,02/15/2024,05/12/2022,05/13/2022,AAI,NULL,NULL,41.918965279,-87.806241259,"(41.91896527917429, -87.80624125859428)","2022-10-06 12:53:44",test,NULL,"2022-05-12 00:00:00","2022-02-16 00:00:00","2024-02-15 00:00:00","2022-05-13 00:00:00",NULL
2845614-20220502,2845614,256981,67,"CBRE, INC.","CBRE, INC.","400 N ABERDEEN ST",CHICAGO,IL,60642,27,NULL,27-,NULL,1010,"Limited Business License",1078,"Property Management / Real Estate Management",2845614,ISSUE,04/28/2022,04/28/2022,04/29/2022,N,05/02/2022,09/15/2023,04/29/2022,05/02/2022,AAI,NULL,NULL,41.889016769,-87.654715537,"(41.889016769101346, -87.65471553708831)","2022-10-06 12:53:44",test,"2022-04-28 00:00:00","2022-04-29 00:00:00","2022-05-02 00:00:00","2023-09-15 00:00:00","2022-05-02 00:00:00",NULL
1224198-20220616,2842568,230409,1,"AMK OF ILLINOIS, LTD.","SNAPPY CONVENIENCE CENTER #5","2477 S ARCHER AVE",CHICAGO,IL,60616,11,50,11-50,9,1275,"Filling Station",666,"Operation of a Fuel Filling Station",1224198,RENEW,NULL,04/15/2022,05/12/2022,N,06/16/2022,06/15/2024,05/12/2022,05/13/2022,AAI,NULL,NULL,41.84755805,-87.645495992,"(41.84755805016441, -87.64549599168248)","2022-10-06 12:53:44",test,NULL,"2022-05-12 00:00:00","2022-06-16 00:00:00","2024-06-15 00:00:00","2022-05-13 00:00:00",NULL
1892538-20220516,2837873,328301,1,"DESIGN INDUSTRIES FOUNDATION FIGHTING AIDS/CHICAGO, INC.","DESIGN INDUSTRIES FOUNDATION FIGHTING AIDS/CHICAGO, INC.","222 W MERCHANDISE MART PLZ 16TH 1647 A",CHICAGO,IL,60654,42,14,42-14,18,1625,Raffles,720,"Not-For-Profit Selling Raffles for Prizes of $50 or More",1892538,RENEW,NULL,03/15/2022,05/12/2022,N,05/16/2022,05/15/2023,05/12/2022,05/13/2022,AAI,NULL,NULL,41.888074281,-87.634955203,"(41.8880742810662, -87.63495520292739)","2022-10-06 12:53:44",test,NULL,"2022-05-12 00:00:00","2022-05-16 00:00:00","2023-05-15 00:00:00","2022-05-13 00:00:00",NULL
23230-20220616,2842048,29693,1,"SUPERIOR FRESH INC","SUPERIOR FRESH INC","1800 S CANAL ST  1",CHICAGO,IL,60616,25,6,25-6,12,1010,"Limited Business License",925,"Miscellaneous Wholesale",23230,RENEW,NULL,04/15/2022,05/13/2022,N,06/16/2022,06/15/2024,05/13/2022,05/13/2022,AAI,NULL,NULL,41.857564071,-87.639078911,"(41.8575640708192, -87.63907891057912)","2022-10-06 12:53:44",test,NULL,"2022-05-13 00:00:00","2022-06-16 00:00:00","2024-06-15 00:00:00","2022-05-13 00:00:00",NULL
2205792-20220616,2842501,213476,1,"LAKE SHORE HOSPITALITY INC.","Best Western Plus  Chicago Lake Shore / Lake Shore Cafe","4900 S CHICAGO BEACH DR 1-4",CHICAGO,IL,60615,5,22,5-22,2,4404,"Regulated Business License",676,"Hotel - 7 or More Sleeping Rooms",2205792,RENEW,NULL,04/15/2022,05/12/2022,N,06/16/2022,06/15/2024,05/12/2022,05/13/2022,AAI,NULL,NULL,41.806170388,-87.585799573,"(41.806170387632804, -87.58579957251453)","2022-10-06 12:53:44",test,NULL,"2022-05-12 00:00:00","2022-06-16 00:00:00","2024-06-15 00:00:00","2022-05-13 00:00:00",NULL
2846436-20220513,2846436,485836,1,"SERGIO I RODRIGUEZ","SERGIO I RODRIGUEZ","3640 W 66TH PL",CHICAGO,IL,60629,13,30,13-30,8,4406,"Peddler License",819,"Street Performer, Moving Along the Public Way",2846436,ISSUE,05/13/2022,05/13/2022,05/13/2022,N,05/13/2022,05/15/2024,NULL,05/13/2022,AAI,NULL,NULL,41.772518934,-87.71439741,"(41.77251893402597, -87.71439740981813)","2022-10-06 12:53:44",test,"2022-05-13 00:00:00","2022-05-13 00:00:00","2022-05-13 00:00:00","2024-05-15 00:00:00","2022-05-13 00:00:00",NULL
1336349-20220516,2837345,260124,1,"FABRICUT INC.","FABRICUT INC.","222 W MERCHANDISE MART PLZ  6-152",CHICAGO,IL,60654,42,14,42-14,18,1010,"Limited Business License",NULL,NULL,1336349,RENEW,NULL,03/15/2022,05/12/2022,N,05/16/2022,05/15/2024,05/12/2022,05/13/2022,AAI,NULL,NULL,41.888074281,-87.634955203,"(41.8880742810662, -87.63495520292739)","2022-10-06 12:53:44",test,NULL,"2022-05-12 00:00:00","2022-05-16 00:00:00","2024-05-15 00:00:00","2022-05-13 00:00:00",NULL
1909063-20220516,2837928,332129,1,"DELI MANAGEMENT INC.","JASON'S DELI","1258 S CANAL ST 1ST",CHICAGO,IL,60607,11,28,11-28,1,1006,"Retail Food Establishment",775,"Retail Sales of Perishable Foods",1909063,RENEW,NULL,03/15/2022,05/12/2022,N,05/16/2022,05/15/2024,05/12/2022,05/13/2022,AAI,NULL,NULL,41.865651182,-87.639344631,"(41.86565118211974, -87.63934463078186)","2022-10-06 12:53:44",test,NULL,"2022-05-12 00:00:00","2022-05-16 00:00:00","2024-05-15 00:00:00","2022-05-13 00:00:00",NULL
2846201-20220513,2846201,485683,1,"PLS Investment Property of Illinois, LLC","PLS Investment Property of Illinois","1 S WACKER DR 36 36",CHICAGO,IL,60606,42,NULL,42-,NULL,1010,"Limited Business License","602 | 1078","Administrative Commercial Office | Property Management / Real Estate Management",2846201,ISSUE,05/11/2022,05/11/2022,05/13/2022,N,05/13/2022,05/15/2024,05/13/2022,05/13/2022,AAI,NULL,NULL,41.881886227,-87.63661833,"(41.88188622746245, -87.63661833048015)","2022-10-06 12:53:44",test,"2022-05-11 00:00:00","2022-05-13 00:00:00","2022-05-13 00:00:00","2024-05-15 00:00:00","2022-05-13 00:00:00",NULL
2846286-20220513,2846286,30009,4,"MESIROW FINANCIAL, INC",Mesirow,"353 N CLARK ST 9TH",CHICAGO,IL,60654,42,NULL,42-,NULL,1010,"Limited Business License",619,"Business and Management Consulting",2846286,C_LOC,05/12/2022,05/12/2022,05/13/2022,N,05/13/2022,05/15/2024,05/13/2022,05/13/2022,AAI,NULL,NULL,41.888961957,-87.630906772,"(41.88896195675864, -87.63090677238614)","2022-10-06 12:53:44",test,"2022-05-12 00:00:00","2022-05-13 00:00:00","2022-05-13 00:00:00","2024-05-15 00:00:00","2022-05-13 00:00:00",NULL
52844-20220516,2836991,64554,1,"CEZERINA, INC.","SIDE STREET SALOON","1456 W GEORGE ST 1ST",CHICAGO,IL,60657,32,18,32-18,19,1470,Tavern,829,"Tavern - Consumption of Liquor on Premise",52844,RENEW,NULL,03/15/2022,05/12/2022,N,05/16/2022,05/15/2024,05/12/2022,05/13/2022,AAI,NULL,NULL,41.934372222,-87.665856521,"(41.93437222240679, -87.66585652139575)","2022-10-06 12:53:44",test,NULL,"2022-05-12 00:00:00","2022-05-16 00:00:00","2024-05-15 00:00:00","2022-05-13 00:00:00",NULL
2841206-20220513,2841206,484748,1,"CHRISTINE WELLS","JOSIE JADE","617 W CORNELIA AVE  APT. G",CHICAGO,IL,60657,46,NULL,46-,NULL,4404,"Regulated Business License",724,"Other Home Based Businesses",2841206,ISSUE,04/11/2022,04/11/2022,05/12/2022,N,05/13/2022,05/15/2024,05/12/2022,05/13/2022,AAI,NULL,8,41.945584029,-87.645529479,"(41.94558402872796, -87.64552947856247)","2022-10-06 12:53:44",test,"2022-04-11 00:00:00","2022-05-12 00:00:00","2022-05-13 00:00:00","2024-05-15 00:00:00","2022-05-13 00:00:00",NULL
2042061-20100623,2042061,354360,1,"LIFE SPICE AND INGREDIENTS LLC","LIFE SPICE AND INGREDIENTS LLC","1150 N LAKE SHORE DR 24 24H",CHICAGO,IL,60611,2,NULL,2-,NULL,1012,"Home Occupation",NULL,NULL,2042061,ISSUE,NULL,06/21/2010,06/21/2010,N,06/23/2010,07/15/2012,06/21/2010,06/23/2010,AAC,12/31/2012,NULL,41.903877323,-87.62511802,"(41.903877323452015, -87.6251180197913)","2022-10-06 12:53:44",test,NULL,"2010-06-21 00:00:00","2010-06-23 00:00:00","2012-07-15 00:00:00","2010-06-23 00:00:00","2012-12-31 00:00:00"
2589789-20220516,2839324,426548,1,"4929 GROUP INC.","TATAS TACOS","4929 W IRVING PARK RD 1ST",CHICAGO,IL,60641,45,8,45-8,16,1006,"Retail Food Establishment",782,"Sale of Food Prepared Onsite Without Dining Area",2589789,RENEW,NULL,03/15/2022,05/13/2022,N,05/16/2022,05/15/2024,05/13/2022,05/13/2022,AAI,NULL,28,41.953263831,-87.751091996,"(41.953263831201625, -87.7510919961523)","2022-10-06 12:53:44",test,NULL,"2022-05-13 00:00:00","2022-05-16 00:00:00","2024-05-15 00:00:00","2022-05-13 00:00:00",NULL
1875213-20220516,2836994,64579,1,"CYNPAT, INC","Cielo Dulce","3504 S WESTERN AVE 1",CHICAGO,IL,60609,12,6,12-6,9,1475,"Consumption on Premises - Incidental Activity",638,"Consumption of Liquor on Premises",1875213,RENEW,NULL,03/15/2022,05/13/2022,N,05/16/2022,05/15/2024,05/13/2022,05/13/2022,AAI,NULL,NULL,41.830073693,-87.68517427,"(41.830073693447986, -87.68517426995787)","2022-10-06 12:53:44",test,NULL,"2022-05-13 00:00:00","2022-05-16 00:00:00","2024-05-15 00:00:00","2022-05-13 00:00:00",NULL
2210676-20220516,2838423,372313,1,"NIKKI EVANS BRONIARCZYK","NIKKI INTERNATIONAL DETOXIFICATION","1212 S MICHIGAN AVE 23RD 2311",CHICAGO,IL,60605,3,40,3-40,1,4404,"Regulated Business License",724,"Other Home Based Businesses",2210676,RENEW,NULL,03/15/2022,05/13/2022,N,05/16/2022,05/15/2024,05/13/2022,05/13/2022,AAI,NULL,NULL,41.867061453,-87.624291557,"(41.86706145293373, -87.62429155657351)","2022-10-06 12:53:44",test,NULL,"2022-05-13 00:00:00","2022-05-16 00:00:00","2024-05-15 00:00:00","2022-05-13 00:00:00",NULL
1694688-20220516,2837626,302687,1,"CPS #2 LLC","EPPLES RESTAURANT","554 W ROOSEVELT RD",CHICAGO,IL,60607,25,28,25-28,1,1006,"Retail Food Establishment",775,"Retail Sales of Perishable Foods",1694688,RENEW,NULL,03/15/2022,05/12/2022,N,05/16/2022,05/15/2024,05/12/2022,05/13/2022,AAI,NULL,NULL,41.867341496,-87.641414141,"(41.86734149567995, -87.64141414130435)","2022-10-06 12:53:44",test,NULL,"2022-05-12 00:00:00","2022-05-16 00:00:00","2024-05-15 00:00:00","2022-05-13 00:00:00",NULL
2846249-20220513,2846249,330259,3,"SUGAR BLISS LLC","Sugar Bliss","122 S WABASH AVE",CHICAGO,IL,60603,42,NULL,42-,NULL,1010,"Limited Business License",602,"Administrative Commercial Office",2846249,C_LOC,05/11/2022,05/11/2022,05/12/2022,N,05/13/2022,03/15/2024,05/12/2022,05/13/2022,AAI,NULL,1,41.880220782,-87.626301096,"(41.88022078245181, -87.62630109611023)","2022-10-06 12:53:44",test,"2022-05-11 00:00:00","2022-05-12 00:00:00","2022-05-13 00:00:00","2024-03-15 00:00:00","2022-05-13 00:00:00",NULL
2846435-20220513,2846435,485835,1,"CHRISTIAN TOMAS GOMEZ","CHRISTIAN TOMAS GOMEZ","6035 S ALBANY AVE",CHICAGO,IL,60629,16,32,16-32,8,4406,"Peddler License",819,"Street Performer, Moving Along the Public Way",2846435,ISSUE,05/13/2022,05/13/2022,05/13/2022,N,05/13/2022,05/15/2024,NULL,05/13/2022,AAI,NULL,NULL,41.783417058,-87.700680198,"(41.78341705784127, -87.70068019790774)","2022-10-06 12:53:44",test,"2022-05-13 00:00:00","2022-05-13 00:00:00","2022-05-13 00:00:00","2024-05-15 00:00:00","2022-05-13 00:00:00",NULL
2846328-20220513,2846328,485775,1,"LOUISE ARMSTRONG",LOVELYLOOKLOUISE.COM,"30 W CERMAK RD 2ND 205",CHICAGO,IL,60616,3,3,3-3,1,4404,"Regulated Business License",722,"Online Sales (Home Based Business)",2846328,ISSUE,05/12/2022,05/13/2022,05/13/2022,N,05/13/2022,05/15/2024,05/13/2022,05/13/2022,AAI,NULL,NULL,41.85301339,-87.628232211,"(41.85301339020496, -87.62823221103599)","2022-10-06 12:53:44",test,"2022-05-12 00:00:00","2022-05-13 00:00:00","2022-05-13 00:00:00","2024-05-15 00:00:00","2022-05-13 00:00:00",NULL
2637093-20211016,2805800,362227,4,"ADIDAS AMERICA, INC.","Adidas Store #6579","845 N MICHIGAN AVE  4065",CHICAGO,IL,60611,2,NULL,2-,NULL,1010,"Limited Business License",911,"Retail Sales of Clothing / Accessories / Shoes",2637093,RENEW,NULL,08/15/2021,09/13/2021,N,10/16/2021,10/15/2023,09/13/2021,05/13/2022,AAI,NULL,NULL,41.898079921,-87.623945706,"(41.898079920503314, -87.6239457056618)","2022-10-06 12:53:44",test,NULL,"2021-09-13 00:00:00","2021-10-16 00:00:00","2023-10-15 00:00:00","2022-05-13 00:00:00",NULL
2147404-20200516,2721565,369504,4,"COFFEE HOUSE HOLDINGS, INC.","STARBUCKS COFFEE","600 N STATE ST 1",CHICAGO,IL,60654,42,20,42-20,18,1006,"Retail Food Establishment",775,"Retail Sales of Perishable Foods",2147404,RENEW,NULL,03/15/2020,04/22/2020,N,05/16/2020,05/15/2022,04/22/2020,04/24/2020,AAC,05/13/2022,NULL,41.892501167,-87.628242738,"(41.89250116694964, -87.62824273781878)","2022-10-06 12:53:44",test,NULL,"2020-04-22 00:00:00","2020-05-16 00:00:00","2022-05-15 00:00:00","2020-04-24 00:00:00","2022-05-13 00:00:00"
2846338-20220513,2846338,58695,3,"SOUTH TOWN REFRIGERATION","Southwest Town Mechanical","22349 S COMMERCE PKWY",FRANKFORT,IL,60423,NULL,NULL,NULL,NULL,4404,"Regulated Business License",901,"Heating, Ventilation and Air Conditioning Services - Residential",2846338,C_LOC,05/12/2022,05/12/2022,05/13/2022,N,05/13/2022,04/15/2024,05/13/2022,05/13/2022,AAI,NULL,NULL,NULL,NULL,NULL,"2022-10-06 12:53:44",test,"2022-05-12 00:00:00","2022-05-13 00:00:00","2022-05-13 00:00:00","2024-04-15 00:00:00","2022-05-13 00:00:00",NULL
2205204-20220516,2836940,57136,1,"WATER WORKS PLUMBING AND SEWERS, INC.","WATER WORKS PLUMBING & SEWERS","7100 W 107 ST 1ST",WORTH,IL,60482,NULL,NULL,NULL,NULL,4404,"Regulated Business License",673,"Home Repair Services",2205204,RENEW,NULL,03/15/2022,05/12/2022,N,05/16/2022,05/15/2024,05/12/2022,05/13/2022,AAI,NULL,NULL,NULL,NULL,NULL,"2022-10-06 12:53:44",test,NULL,"2022-05-12 00:00:00","2022-05-16 00:00:00","2024-05-15 00:00:00","2022-05-13 00:00:00",NULL
2419455-20220616,2843614,372417,5,"THE JIBARITO STOP, LLC","THE JIBARITO STOP","1646 W 18TH ST 1",CHICAGO,IL,60608,25,19,25-19,12,1006,"Retail Food Establishment",735,"Preparation of Food and Dining on Premise With Seating",2419455,RENEW,NULL,04/15/2022,05/12/2022,N,06/16/2022,06/15/2024,05/12/2022,05/13/2022,AAI,NULL,NULL,41.857873459,-87.668122088,"(41.85787345940653, -87.66812208797606)","2022-10-06 12:53:44",test,NULL,"2022-05-12 00:00:00","2022-06-16 00:00:00","2024-06-15 00:00:00","2022-05-13 00:00:00",NULL
2846391-20220513,2846391,485812,1,"GALLERY AUTO GROUP COMPANY","GALLERY AUTO GROUP","4013 S ARCHER AVE",CHICAGO,IL,60632,12,13,12-13,9,1010,"Limited Business License",1075,"Sales / Rental / Lease of Motorized Vehicles - Indoor Sales",2846391,ISSUE,05/13/2022,05/13/2022,05/13/2022,N,05/13/2022,05/15/2024,05/13/2022,05/13/2022,AAI,NULL,NULL,41.820716282,-87.693210805,"(41.82071628230612, -87.69321080544493)","2022-10-06 12:53:44",test,"2022-05-13 00:00:00","2022-05-13 00:00:00","2022-05-13 00:00:00","2024-05-15 00:00:00","2022-05-13 00:00:00",NULL
1980425-20211016,2805586,345089,1,"GANPATI SUB, INC.",SUBWAY,"3551 N CENTRAL AVE",CHICAGO,IL,60634,36,39,36-39,16,1006,"Retail Food Establishment",775,"Retail Sales of Perishable Foods",1980425,RENEW,NULL,08/15/2021,08/30/2021,N,10/16/2021,10/15/2023,08/30/2021,05/13/2022,AAI,NULL,NULL,41.945598987,-87.766599243,"(41.945598987087536, -87.7665992429523)","2022-10-06 12:53:44",test,NULL,"2021-08-30 00:00:00","2021-10-16 00:00:00","2023-10-15 00:00:00","2022-05-13 00:00:00",NULL
2385998-20200516,2721567,369504,9,"COFFEE HOUSE HOLDINGS, INC.","STARBUCKS COFFEE #7948","2730 N NARRAGANSETT AVE 1ST",CHICAGO,IL,60639,36,10,36-10,25,1006,"Retail Food Establishment",781,"Sale of Food Prepared Onsite With Dining Area",2385998,RENEW,NULL,03/15/2020,04/22/2020,N,05/16/2020,05/15/2022,04/22/2020,04/24/2020,AAC,05/13/2022,NULL,41.930110626,-87.785823503,"(41.93011062600186, -87.78582350333859)","2022-10-06 12:53:44",test,NULL,"2020-04-22 00:00:00","2020-05-16 00:00:00","2022-05-15 00:00:00","2020-04-24 00:00:00","2022-05-13 00:00:00"
2846343-20220513,2846343,461272,3,"M & V FURNITURE INC.","M & V MATTRESS AND FURNITURE","2944 W 63RD ST",CHICAGO,IL,60629,16,13,16-13,8,1010,"Limited Business License","900 | 904","Sale of Furniture | Retail Sales of General Merchandise",2846343,ISSUE,05/13/2022,05/13/2022,05/13/2022,N,05/13/2022,08/15/2023,05/13/2022,05/13/2022,AAI,NULL,3,41.779164006,-87.697617158,"(41.77916400557751, -87.69761715828864)","2022-10-06 12:53:44",test,"2022-05-13 00:00:00","2022-05-13 00:00:00","2022-05-13 00:00:00","2023-08-15 00:00:00","2022-05-13 00:00:00",NULL
2718798-20200605,2718798,467395,1,"EVERYTHING MELODY LLC","EVERYTHING MELODY LLC","5942 W NORTH AVE",CHICAGO,IL,60639,29,NULL,29-,25,1023,"Children's Services Facility License","749 | 904 | 911","Rental of Location for Children's Birthday Parties | Retail Sales of General Merchandise | Retail Sales of Clothing / Accessories / Shoes",2718798,ISSUE,03/12/2020,03/12/2020,03/17/2020,N,06/05/2020,06/15/2022,06/02/2020,06/05/2020,AAI,NULL,NULL,41.90937746,-87.774455052,"(41.909377459873035, -87.7744550524687)","2022-10-06 12:53:44",test,"2020-03-12 00:00:00","2020-03-17 00:00:00","2020-06-05 00:00:00","2022-06-15 00:00:00","2020-06-05 00:00:00",NULL
2776544-20220616,2842996,308966,16,"RICOBENE'S ON 26TH STREET LLC",Ricobene's,"258-260 W 26TH ST 1",CHICAGO,IL,60616,11,NULL,11-,NULL,1006,"Retail Food Establishment",782,"Sale of Food Prepared Onsite Without Dining Area",2776544,RENEW,NULL,04/15/2022,05/12/2022,N,06/16/2022,06/15/2024,05/12/2022,05/13/2022,AAI,NULL,NULL,41.845603372,-87.634091523,"(41.84560337224738, -87.63409152264352)","2022-10-06 12:53:44",test,NULL,"2022-05-12 00:00:00","2022-06-16 00:00:00","2024-06-15 00:00:00","2022-05-13 00:00:00",NULL
2718798-20220616,2844715,467395,1,"EVERYTHING MELODY LLC","EVERYTHING MELODY LLC","5942 W NORTH AVE",CHICAGO,IL,60639,29,NULL,29-,25,1023,"Children's Services Facility License","749 | 904 | 911","Rental of Location for Children's Birthday Parties | Retail Sales of General Merchandise | Retail Sales of Clothing / Accessories / Shoes",2718798,RENEW,NULL,04/15/2022,05/09/2022,N,06/16/2022,06/15/2024,05/09/2022,05/10/2022,AAI,NULL,NULL,41.90937746,-87.774455052,"(41.909377459873035, -87.7744550524687)","2022-10-06 12:53:44",test,NULL,"2022-05-09 00:00:00","2022-06-16 00:00:00","2024-06-15 00:00:00","2022-05-10 00:00:00",NULL
1675481-20220616,2842972,299473,1,"Z.H.M. ENTERPRISE, INC.","ZHM ENTERPRISE INC","2146 S ARCHER AVE  A",CHICAGO,IL,60616,25,16,25-16,9,1010,"Limited Business License",NULL,NULL,1675481,RENEW,NULL,04/15/2022,05/12/2022,N,06/16/2022,06/15/2024,05/12/2022,05/13/2022,AAI,NULL,NULL,41.853544153,-87.633679805,"(41.85354415301929, -87.6336798054652)","2022-10-06 12:53:44",test,NULL,"2022-05-12 00:00:00","2022-06-16 00:00:00","2024-06-15 00:00:00","2022-05-13 00:00:00",NULL
74794-20220616,2841962,22316,1,"KARAM FOODS INC","DUNKIN DONUTS / BASKIN ROBBINS","1755 W ADDISON ST 1ST",CHICAGO,IL,60613,47,22,47-22,19,1006,"Retail Food Establishment",775,"Retail Sales of Perishable Foods",74794,RENEW,NULL,04/15/2022,05/12/2022,N,06/16/2022,06/15/2024,05/12/2022,05/13/2022,AAI,NULL,27,41.946818742,-87.673564918,"(41.946818741778436, -87.67356491808366)","2022-10-06 12:53:44",test,NULL,"2022-05-12 00:00:00","2022-06-16 00:00:00","2024-06-15 00:00:00","2022-05-13 00:00:00",NULL
2749592-20200903,2749592,469820,1,"H&D Nail Spa Salon, Inc.","H&D Nail Spa Salon, Inc.","6500 W IRVING PARK RD  ABC",CHICAGO,IL,60634,38,NULL,38-,16,1010,"Limited Business License","895 | 956","Nail Services | Provide Waxing Services",2749592,ISSUE,09/02/2020,09/02/2020,09/02/2020,N,09/03/2020,09/15/2022,09/02/2020,09/03/2020,AAI,NULL,NULL,41.952984203,-87.789083831,"(41.95298420287931, -87.78908383095457)","2022-10-06 12:53:44",test,"2020-09-02 00:00:00","2020-09-02 00:00:00","2020-09-03 00:00:00","2022-09-15 00:00:00","2020-09-03 00:00:00",NULL
2261998-20220516,2838523,381229,1,"CHICAGO PAWNBROKER INC.","CHICAGO PAWNBROKER INC.","5 S WABASH AVE 7 716",CHICAGO,IL,60603,42,9,42-9,1,1594,Pawnbroker,"732 | 767","Pledging of Property for Money (Pawnbroker / Pawn Shop) | Retail Sales of General Merchandise and Non-Perishable Food",2261998,RENEW,NULL,03/15/2022,05/12/2022,N,05/16/2022,05/15/2024,05/12/2022,05/13/2022,AAI,NULL,NULL,41.881921563,-87.62606306,"(41.88192156256051, -87.62606305984501)","2022-10-06 12:53:44",test,NULL,"2022-05-12 00:00:00","2022-05-16 00:00:00","2024-05-15 00:00:00","2022-05-13 00:00:00",NULL
2658191-20201216,2755483,314971,1,"PAT'S PASTRIES LLC","BULL DOG BAKERY II","3207 N ELSTON AVE 1ST FLOOR 1",CHICAGO,IL,60618,33,9,33-9,17,8343,"Food - Shared Kitchen - Supplemental",803,"Operation of a Shared Kitchen - Secondary to Primary Business (Supplemental)",2658191,RENEW,NULL,10/15/2020,10/28/2020,N,12/16/2020,12/15/2022,10/28/2020,10/29/2020,AAC,05/13/2022,NULL,41.939646611,-87.698479014,"(41.939646610904056, -87.69847901358345)","2022-10-06 12:53:44",test,NULL,"2020-10-28 00:00:00","2020-12-16 00:00:00","2022-12-15 00:00:00","2020-10-29 00:00:00","2022-05-13 00:00:00"
49360-20220516,2836939,56453,1,"HYO JING/YOUNG HEE SUK","LASALLE CLEANERS","770 N LA SALLE DR 1ST",CHICAGO,IL,60610,2,57,2-57,18,1010,"Limited Business License",648,"Dry Cleaning - Drop Off Location",49360,RENEW,NULL,03/15/2022,05/13/2022,N,05/16/2022,05/15/2024,05/13/2022,05/13/2022,AAI,NULL,NULL,41.89656175,-87.632855483,"(41.896561750165205, -87.6328554826329)","2022-10-06 12:53:44",test,NULL,"2022-05-13 00:00:00","2022-05-16 00:00:00","2024-05-15 00:00:00","2022-05-13 00:00:00",NULL
1299747-20220616,2842631,254010,1,"NICKY'S CHINESE FOOD INC.","NICKY'S CHINESE FOOD","5231 S WOODLAWN AVE",CHICAGO,IL,60615,4,1,4-1,2,1006,"Retail Food Establishment",775,"Retail Sales of Perishable Foods",1299747,RENEW,NULL,04/15/2022,05/13/2022,N,06/16/2022,06/15/2024,05/13/2022,05/13/2022,AAI,NULL,61,41.799952228,-87.596505917,"(41.79995222840709, -87.59650591702139)","2022-10-06 12:53:44",test,NULL,"2022-05-13 00:00:00","2022-06-16 00:00:00","2024-06-15 00:00:00","2022-05-13 00:00:00",NULL
2846442-20220513,2846442,485841,1,"ARI ON THE MOVE LLC","HOUSING ADVOCATE","3801 W NORTH AVE 1 2",CHICAGO,IL,60647,26,16,26-16,25,1010,"Limited Business License",602,"Administrative Commercial Office",2846442,ISSUE,05/13/2022,05/13/2022,05/13/2022,N,05/13/2022,05/15/2024,05/13/2022,05/13/2022,AAI,NULL,NULL,41.909826164,-87.72172132,"(41.909826163903105, -87.72172132037602)","2022-10-06 12:53:44",test,"2022-05-13 00:00:00","2022-05-13 00:00:00","2022-05-13 00:00:00","2024-05-15 00:00:00","2022-05-13 00:00:00",NULL
2846017-20220513,2846017,485588,1,"John Walsh","John Walsh","1506 W POLK ST 3 3F",CHICAGO,IL,60607,28,NULL,28-,NULL,7008,"Shared Housing Unit Operator",981,"Shared Housing Operator - Host of More Than One Shared Housing Unit",2846017,ISSUE,05/06/2022,05/06/2022,05/06/2022,N,05/13/2022,05/15/2024,05/12/2022,05/13/2022,AAI,NULL,NULL,41.871766688,-87.664509679,"(41.871766688226565, -87.66450967935562)","2022-10-06 12:53:44",test,"2022-05-06 00:00:00","2022-05-06 00:00:00","2022-05-13 00:00:00","2024-05-15 00:00:00","2022-05-13 00:00:00",NULL
2684135-20210816,2796320,461207,1,"KRISTA K MUHAMMAD","KRISTA K MUHAMMAD","4554 S DREXEL BLVD 104",CHICAGO,IL,60653,4,34,4-34,2,4406,"Peddler License",769,"Peddler- Retail Sales of General Merchandise, Whole Uncut Fruits/Vegetables, Flowers, Moving Along the Public Way",2684135,RENEW,NULL,06/15/2021,05/13/2022,N,08/16/2021,08/15/2023,NULL,05/13/2022,AAI,NULL,47,41.81158453,-87.6045627,"(41.81158453022803, -87.60456269953292)","2022-10-06 12:53:44",test,NULL,"2022-05-13 00:00:00","2021-08-16 00:00:00","2023-08-15 00:00:00","2022-05-13 00:00:00",NULL
1737399-20070216,1796426,306245,1,"JAN C. SASSANO","JAN C. SASSANO","355  BUENA VISTA AVE  401W","SAN FRANCISCO",CA,94117,NULL,NULL,NULL,NULL,1605,"Street Performer",NULL,NULL,1737399,RENEW,NULL,12/20/2006,02/02/2007,N,02/16/2007,02/15/2009,NULL,02/02/2007,AAI,NULL,NULL,NULL,NULL,NULL,"2022-10-06 12:53:44",test,NULL,"2007-02-02 00:00:00","2007-02-16 00:00:00","2009-02-15 00:00:00","2007-02-02 00:00:00",NULL
2846233-20220513,2846233,485695,1,"MATTHEW POTHAST","MATTHEW POTHAST","[REDACTED FOR PRIVACY]","PARK RIDGE",IL,60068,NULL,NULL,NULL,NULL,7009,"Pharmaceutical Representative",990,"Markets / Promotes Pharmaceuticals to Health Care Professionals and Conducts Business for More than 15 Calendar Days per Year",2846233,ISSUE,05/11/2022,05/11/2022,05/12/2022,N,05/13/2022,05/15/2023,05/12/2022,05/13/2022,AAI,NULL,NULL,NULL,NULL,NULL,"2022-10-06 12:53:44",test,"2022-05-11 00:00:00","2022-05-12 00:00:00","2022-05-13 00:00:00","2023-05-15 00:00:00","2022-05-13 00:00:00",NULL
2385460-20200516,2721153,330372,2,"CLAREO PARTNERS LLC","Clareo Partners LLC","20 N WACKER DR 20 2230",CHICAGO,IL,60606,42,NULL,42-,NULL,1010,"Limited Business License","619 | 708","Business and Management Consulting | Miscellaneous Commercial Services",2385460,RENEW,NULL,03/15/2020,04/14/2020,N,05/16/2020,05/15/2022,04/14/2020,04/15/2020,AAC,05/13/2022,NULL,41.882410906,-87.63717471,"(41.88241090648542, -87.63717471046387)","2022-10-06 12:53:44",test,NULL,"2020-04-14 00:00:00","2020-05-16 00:00:00","2022-05-15 00:00:00","2020-04-15 00:00:00","2022-05-13 00:00:00"
1899043-20211016,2804954,256742,2,"AUDITORIUM THEATRE OF ROOSEVELT UNIVERSITY, INC.","AUDITORIUM THEATRE OF ROOSEVELT UNIVERSITY","50 E IDA B. WELLS DR",CHICAGO,IL,60605,42,33,42-33,1,1625,Raffles,720,"Not-For-Profit Selling Raffles for Prizes of $50 or More",1899043,RENEW,NULL,08/15/2021,10/07/2021,N,10/16/2021,10/15/2022,10/07/2021,05/13/2022,AAI,NULL,NULL,41.875802599,-87.625734412,"(41.87580259928508, -87.62573441226577)","2022-10-06 12:53:44",test,NULL,"2021-10-07 00:00:00","2021-10-16 00:00:00","2022-10-15 00:00:00","2022-05-13 00:00:00",NULL
2138252-20200516,2721562,369504,1,"COFFEE HOUSE HOLDINGS, INC.","STARBUCKS COFFEE","1000-1002 W DIVERSEY PKWY  C102",CHICAGO,IL,60614,44,40,44-40,19,1006,"Retail Food Establishment",775,"Retail Sales of Perishable Foods",2138252,RENEW,NULL,03/15/2020,04/22/2020,N,05/16/2020,05/15/2022,04/22/2020,04/24/2020,AAC,05/13/2022,17,41.932746527,-87.653928731,"(41.93274652745159, -87.65392873099422)","2022-10-06 12:53:44",test,NULL,"2020-04-22 00:00:00","2020-05-16 00:00:00","2022-05-15 00:00:00","2020-04-24 00:00:00","2022-05-13 00:00:00"
2397760-20200516,2721569,369504,12,"COFFEE HOUSE HOLDINGS, INC.","STARBUCKS COFFEE #22423","1230 N WELLS ST 1ST",CHICAGO,IL,60610,2,30,2-30,18,1006,"Retail Food Establishment",781,"Sale of Food Prepared Onsite With Dining Area",2397760,RENEW,NULL,03/15/2020,04/22/2020,N,05/16/2020,05/15/2022,04/22/2020,04/24/2020,AAC,05/13/2022,NULL,41.904829526,-87.634661055,"(41.90482952578996, -87.63466105494275)","2022-10-06 12:53:44",test,NULL,"2020-04-22 00:00:00","2020-05-16 00:00:00","2022-05-15 00:00:00","2020-04-24 00:00:00","2022-05-13 00:00:00"
2671528-20220516,2839325,426548,1,"4929 GROUP INC.","TATAS TACOS","4929 W IRVING PARK RD 1ST",CHICAGO,IL,60641,45,8,45-8,16,1475,"Consumption on Premises - Incidental Activity",638,"Consumption of Liquor on Premises",2671528,RENEW,NULL,03/15/2022,05/13/2022,N,05/16/2022,05/15/2024,05/13/2022,05/13/2022,AAI,NULL,28,41.953263831,-87.751091996,"(41.953263831201625, -87.7510919961523)","2022-10-06 12:53:44",test,NULL,"2022-05-13 00:00:00","2022-05-16 00:00:00","2024-05-15 00:00:00","2022-05-13 00:00:00",NULL
2121222-20160716,2467896,354360,2,"LIFE SPICE AND INGREDIENTS LLC","LIFE SPICE AND INGREDIENTS LLC","216 W CHICAGO AVE 2ND",CHICAGO,IL,60654,27,28,27-28,18,1010,"Limited Business License",NULL,NULL,2121222,RENEW,NULL,05/15/2016,05/18/2016,N,07/16/2016,07/15/2018,05/18/2016,05/19/2016,AAI,NULL,NULL,41.896694078,-87.634951862,"(41.89669407786378, -87.63495186198773)","2022-10-06 12:53:44",test,NULL,"2016-05-18 00:00:00","2016-07-16 00:00:00","2018-07-15 00:00:00","2016-05-19 00:00:00",NULL
2204448-20220216,2823852,19730,2,"CHICAGOLAND REMODELING INC","CHICAGOLAND REMODELING INC.","2130 N HARLEM AVE","ELMWOOD PARK",IL,60707,NULL,NULL,NULL,NULL,4404,"Regulated Business License",673,"Home Repair Services",2204448,RENEW,NULL,12/15/2021,05/12/2022,N,02/16/2022,02/15/2024,05/12/2022,05/13/2022,AAI,NULL,NULL,41.918965279,-87.806241259,"(41.91896527917429, -87.80624125859428)","2022-10-06 12:53:44",test,NULL,"2022-05-12 00:00:00","2022-02-16 00:00:00","2024-02-15 00:00:00","2022-05-13 00:00:00",NULL
2845848-20220513,2845848,485464,1,"GUAU DOG GROOMING INC.","GUAU DOG GROOMING INC.","4037 W 63RD ST",CHICAGO,IL,60629,23,NULL,23-,NULL,1032,"Animal Care License",611,"Provide Animal Grooming Services",2845848,ISSUE,05/04/2022,05/04/2022,05/04/2022,N,05/13/2022,05/15/2024,05/12/2022,05/13/2022,AAI,NULL,3,41.778529294,-87.7241994,"(41.77852929369152, -87.72419940042575)","2022-10-06 12:53:44",test,"2022-05-04 00:00:00","2022-05-04 00:00:00","2022-05-13 00:00:00","2024-05-15 00:00:00","2022-05-13 00:00:00",NULL
2422996-20200516,2721575,369504,19,"COFFEE HOUSE HOLDINGS, INC.","STARBUCKS COFFEE #2510","414 N ORLEANS ST 1",CHICAGO,IL,60654,42,67,42-67,18,1006,"Retail Food Establishment",781,"Sale of Food Prepared Onsite With Dining Area",2422996,RENEW,NULL,03/15/2020,04/22/2020,N,05/16/2020,05/15/2022,04/22/2020,04/24/2020,AAC,05/13/2022,NULL,41.889682961,-87.637120956,"(41.889682960687374, -87.63712095614753)","2022-10-06 12:53:44",test,NULL,"2020-04-22 00:00:00","2020-05-16 00:00:00","2022-05-15 00:00:00","2020-04-24 00:00:00","2022-05-13 00:00:00"
2845171-20220513,2845171,484991,1,"DG BEAUTY & PERMANENT MAKE UP LLC","DG BEAUTY & PERMANENT MAKE UP LLC","3966 N ELSTON AVE 1",CHICAGO,IL,60618,45,NULL,45-,NULL,4404,"Regulated Business License",828,"Tattoo / Permanent Body Art and Make-Up / Micro Blading",2845171,ISSUE,04/19/2022,04/19/2022,04/19/2022,N,05/13/2022,05/15/2024,05/13/2022,05/13/2022,AAI,NULL,NULL,41.953287135,-87.718735212,"(41.95328713452427, -87.71873521216257)","2022-10-06 12:53:44",test,"2022-04-19 00:00:00","2022-04-19 00:00:00","2022-05-13 00:00:00","2024-05-15 00:00:00","2022-05-13 00:00:00",NULL
2712278-20220516,2839587,465848,1,"MANA GOURMET PRODUCTS, LLC",MANA,"434 E 71ST ST 1",CHICAGO,IL,60619,6,7,6-7,3,1006,"Retail Food Establishment","766 | 767","Retail Sales of Fresh Fruits and Vegetables (Leafy and Non Leafy Vegetables) | Retail Sales of General Merchandise and Non-Perishable Food",2712278,RENEW,NULL,03/15/2022,05/12/2022,N,05/16/2022,05/15/2024,05/12/2022,05/13/2022,AAI,NULL,NULL,41.765844215,-87.613914965,"(41.76584421474714, -87.61391496525177)","2022-10-06 12:53:44",test,NULL,"2022-05-12 00:00:00","2022-05-16 00:00:00","2024-05-15 00:00:00","2022-05-13 00:00:00",NULL
2845879-20220513,2845879,485496,1,"Flour Power Pasta LLC","Flour Power Pasta","1642 W CHICAGO AVE",CHICAGO,IL,60622,1,NULL,1-,NULL,1006,"Retail Food Establishment","767 | 782","Retail Sales of General Merchandise and Non-Perishable Food | Sale of Food Prepared Onsite Without Dining Area",2845879,ISSUE,05/04/2022,05/04/2022,05/04/2022,N,05/13/2022,05/15/2024,05/13/2022,05/13/2022,AAI,NULL,29,41.896156328,-87.668914725,"(41.896156327938414, -87.66891472541245)","2022-10-06 12:53:44",test,"2022-05-04 00:00:00","2022-05-04 00:00:00","2022-05-13 00:00:00","2024-05-15 00:00:00","2022-05-13 00:00:00",NULL
2470233-20220616,2844348,407185,1,"COMPUTER PRODIGIES, INC.","COMPUTER PRODIGIES, INC.","5034 S ARCHER AVE 1",CHICAGO,IL,60632,14,28,14-28,8,1010,"Limited Business License","652 | 767","Electronic Equipment Repair | Retail Sales of General Merchandise and Non-Perishable Food",2470233,RENEW,NULL,04/15/2022,05/12/2022,N,06/16/2022,06/15/2024,05/12/2022,05/13/2022,AAI,NULL,39,41.801477607,-87.725502373,"(41.801477606997246, -87.72550237289114)","2022-10-06 12:53:44",test,NULL,"2022-05-12 00:00:00","2022-06-16 00:00:00","2024-06-15 00:00:00","2022-05-13 00:00:00",NULL
2845263-20220513,2845263,485064,1,"AFGHAN SARAY, INC.","AFGHAN SARAY","6141 N BROADWAY",CHICAGO,IL,60660,48,32,48-32,24,1006,"Retail Food Establishment",735,"Preparation of Food and Dining on Premise With Seating",2845263,ISSUE,04/21/2022,04/29/2022,05/02/2022,N,05/13/2022,05/15/2024,05/11/2022,05/13/2022,AAI,NULL,26,41.993475854,-87.660227305,"(41.99347585382477, -87.66022730506967)","2022-10-06 12:53:44",test,"2022-04-21 00:00:00","2022-05-02 00:00:00","2022-05-13 00:00:00","2024-05-15 00:00:00","2022-05-13 00:00:00",NULL
1846828-20220616,2843106,321839,1,"CHI CAFE, LLC","CHI CAFE, LLC","2160 S ARCHER AVE 1ST A",CHICAGO,IL,60616,25,16,25-16,9,1006,"Retail Food Establishment",775,"Retail Sales of Perishable Foods",1846828,RENEW,NULL,04/15/2022,05/12/2022,N,06/16/2022,06/15/2024,05/12/2022,05/13/2022,AAI,NULL,NULL,41.853304512,-87.634176883,"(41.853304512106995, -87.63417688344653)","2022-10-06 12:53:44",test,NULL,"2022-05-12 00:00:00","2022-06-16 00:00:00","2024-06-15 00:00:00","2022-05-13 00:00:00",NULL
1227719-20060216,1652500,10805,2,"CARDI ASPHALT PAVING CO.","CARDI ASPHALT PAVING COMPANY","1098 S MILWAUKEE   303C",WHEELING,IL,60090,NULL,NULL,NULL,NULL,1010,"Limited Business License",NULL,NULL,1227719,RENEW,NULL,12/21/2005,02/03/2006,N,02/16/2006,02/15/2007,02/03/2006,02/06/2006,AAI,NULL,NULL,NULL,NULL,NULL,"2022-10-06 12:53:44",test,NULL,"2006-02-03 00:00:00","2006-02-16 00:00:00","2007-02-15 00:00:00","2006-02-06 00:00:00",NULL
2493022-20220516,2838212,360406,3,"BETTER BOYS FOUNDATION","BBF FAMILY SERVICES","1512 S PULASKI RD 1ST&2ND",CHICAGO,IL,60623,24,36,24-36,10,1023,"Children's Services Facility License","602 | 905","Administrative Commercial Office | After School Program / Tutoring Children Under 18 Years of Age",2493022,RENEW,NULL,03/15/2022,05/13/2022,N,05/16/2022,05/15/2024,05/13/2022,05/13/2022,AAI,NULL,NULL,41.860260981,-87.725142602,"(41.86026098144286, -87.72514260165443)","2022-10-06 12:53:44",test,NULL,"2022-05-13 00:00:00","2022-05-16 00:00:00","2024-05-15 00:00:00","2022-05-13 00:00:00",NULL
1575785-20220616,2842569,230409,2,"AMK OF ILLINOIS, LTD.","SNAPPY CAR WASH #5","2484 S ARCHER AVE",CHICAGO,IL,60616,11,50,11-50,9,1010,"Limited Business License",NULL,NULL,1575785,RENEW,NULL,04/15/2022,05/12/2022,N,06/16/2022,06/15/2024,05/12/2022,05/13/2022,AAI,NULL,NULL,41.847614647,-87.645919865,"(41.8476146472423, -87.64591986501965)","2022-10-06 12:53:44",test,NULL,"2022-05-12 00:00:00","2022-06-16 00:00:00","2024-06-15 00:00:00","2022-05-13 00:00:00",NULL
44127-20220616,2842210,55648,1,"KWANG SOO PARK","SMILE CLEANERS","1849 W ADDISON ST 1ST",CHICAGO,IL,60613,47,47,47-47,19,1010,"Limited Business License",648,"Dry Cleaning - Drop Off Location",44127,RENEW,NULL,04/15/2022,05/12/2022,N,06/16/2022,06/15/2024,05/12/2022,05/13/2022,AAI,NULL,NULL,41.946789682,-87.675875113,"(41.94678968239612, -87.67587511300516)","2022-10-06 12:53:44",test,NULL,"2022-05-12 00:00:00","2022-06-16 00:00:00","2024-06-15 00:00:00","2022-05-13 00:00:00",NULL
2451975-20220516,2836356,3530,11,"MANNY'S COFFEE SHOP, INC.","MANNYS COFFEE SHOP, INC.","1131-1141 S JEFFERSON ST",CHICAGO,IL,60607,25,28,25-28,1,1475,"Consumption on Premises - Incidental Activity",638,"Consumption of Liquor on Premises",2451975,RENEW,NULL,03/15/2022,04/26/2022,N,05/16/2022,05/15/2024,04/26/2022,05/13/2022,AAI,NULL,NULL,41.868015128,-87.642070382,"(41.868015128224584, -87.64207038233704)","2022-10-06 12:53:44",test,NULL,"2022-04-26 00:00:00","2022-05-16 00:00:00","2024-05-15 00:00:00","2022-05-13 00:00:00",NULL
2723414-20200916,2845984,207412,30,"BUCK MANAGEMENT GROUP LLC","Buck Management Group LLC","209 S LA SALLE ST",CHICAGO,IL,60604,42,NULL,42-,NULL,1010,"Limited Business License",602,"Administrative Commercial Office",2723414,RENEW,NULL,05/06/2022,05/13/2022,N,09/16/2020,09/15/2022,05/13/2022,05/13/2022,AAI,NULL,NULL,41.87911455,-87.63213674,"(41.87911455044448, -87.63213673978143)","2022-10-06 12:53:44",test,NULL,"2022-05-13 00:00:00","2020-09-16 00:00:00","2022-09-15 00:00:00","2022-05-13 00:00:00",NULL
1884100-20220616,2843122,325993,1,"HYDE PARK PRODUCE LTD.","HYDE PARK PRODUCE, LTD","1226 E 53RD ST STROE FRONT",CHICAGO,IL,60615,4,1,4-1,2,1006,"Retail Food Establishment",775,"Retail Sales of Perishable Foods",1884100,RENEW,NULL,04/15/2022,05/12/2022,N,06/16/2022,06/15/2024,05/12/2022,05/13/2022,AAI,NULL,61,41.799576802,-87.595512922,"(41.79957680216707, -87.5955129218999)","2022-10-06 12:53:44",test,NULL,"2022-05-12 00:00:00","2022-06-16 00:00:00","2024-06-15 00:00:00","2022-05-13 00:00:00",NULL
2846439-20220513,2846439,485839,1,"ANDREW CARLSON SCHUMM","ANDREW C SCHUMM","5732 N OLEANDER AVE",CHICAGO,IL,60631,41,43,41-43,16,4406,"Peddler License",819,"Street Performer, Moving Along the Public Way",2846439,ISSUE,05/13/2022,05/13/2022,05/13/2022,N,05/13/2022,05/15/2024,NULL,05/13/2022,AAI,NULL,NULL,41.98429073,-87.816091783,"(41.98429073001646, -87.81609178274309)","2022-10-06 12:53:44",test,"2022-05-13 00:00:00","2022-05-13 00:00:00","2022-05-13 00:00:00","2024-05-15 00:00:00","2022-05-13 00:00:00",NULL
2846339-20220513,2846339,53112,3,"DEBORAH EPSTEIN","FANCY THAT","3550 N LAKE SHORE DR  712",CHICAGO,IL,60657,46,NULL,46-,NULL,4404,"Regulated Business License",724,"Other Home Based Businesses",2846339,C_LOC,05/12/2022,05/12/2022,05/12/2022,N,05/13/2022,06/15/2024,05/12/2022,05/13/2022,AAI,NULL,NULL,41.948130464,-87.643323857,"(41.94813046439078, -87.64332385698383)","2022-10-06 12:53:44",test,"2022-05-12 00:00:00","2022-05-12 00:00:00","2022-05-13 00:00:00","2024-06-15 00:00:00","2022-05-13 00:00:00",NULL
2840618-20220513,2840618,484408,1,"PLANTX MIDWEST INC.",XMARKET,"804 W MONTROSE AVE 1 & MEZZ",CHICAGO,IL,60613,46,NULL,46-,NULL,1475,"Consumption on Premises - Incidental Activity",638,"Consumption of Liquor on Premises",2840618,ISSUE,03/30/2022,04/26/2022,03/31/2022,N,05/13/2022,05/15/2024,05/13/2022,05/13/2022,AAI,NULL,34,41.961950551,-87.650132051,"(41.96195055112621, -87.6501320506605)","2022-10-06 12:53:44",test,"2022-03-30 00:00:00","2022-03-31 00:00:00","2022-05-13 00:00:00","2024-05-15 00:00:00","2022-05-13 00:00:00",NULL
2446548-20201216,2755484,314971,2,"PAT'S PASTRIES LLC","BULLDOG BAKERY","800  DEERFIELD RD 1ST 102","HIGHLAND PARK",IL,60035,NULL,NULL,NULL,NULL,8344,"Shared Kitchen User (Long Term)",804,"Shared Kitchen User - Long Term",2446548,RENEW,NULL,10/15/2020,10/01/2021,N,12/16/2020,12/15/2022,NULL,10/01/2021,AAC,05/13/2022,NULL,NULL,NULL,NULL,"2022-10-06 12:53:44",test,NULL,"2021-10-01 00:00:00","2020-12-16 00:00:00","2022-12-15 00:00:00","2021-10-01 00:00:00","2022-05-13 00:00:00"
2327388-20220516,2838679,390011,1,"POWER HOUR FITNESS, INC.","THE BOXING CLUB","313 S PEORIA ST GROUND",CHICAGO,IL,60607,25,6,25-6,12,4404,"Regulated Business License",926,"Fitness Classes",2327388,RENEW,NULL,03/15/2022,05/13/2022,N,05/16/2022,05/15/2024,05/13/2022,05/13/2022,AAI,NULL,NULL,41.877487653,-87.64941767,"(41.87748765277285, -87.64941766997082)","2022-10-06 12:53:44",test,NULL,"2022-05-13 00:00:00","2022-05-16 00:00:00","2024-05-15 00:00:00","2022-05-13 00:00:00",NULL
2398517-20220516,2838664,389931,1,"FESS TRADING INC.","DOLLAR PLUS VARIETY","5156 W FULLERTON AVE GROUND",CHICAGO,IL,60639,31,NULL,31-,NULL,1006,"Retail Food Establishment",775,"Retail Sales of Perishable Foods",2398517,RENEW,NULL,03/15/2022,05/12/2022,N,05/16/2022,05/15/2024,05/12/2022,05/13/2022,AAI,NULL,NULL,41.924220295,-87.755949852,"(41.92422029538042, -87.75594985199125)","2022-10-06 12:53:44",test,NULL,"2022-05-12 00:00:00","2022-05-16 00:00:00","2024-05-15 00:00:00","2022-05-13 00:00:00",NULL
2840619-20220513,2840619,484408,1,"PLANTX MIDWEST INC.",XMARKET,"804 W MONTROSE AVE 1 & MEZZ",CHICAGO,IL,60613,46,NULL,46-,NULL,1481,"Caterer's Liquor License",630,"Catering of Liquor To Events",2840619,ISSUE,03/30/2022,04/26/2022,03/31/2022,N,05/13/2022,05/15/2024,05/13/2022,05/13/2022,AAI,NULL,34,41.961950551,-87.650132051,"(41.96195055112621, -87.6501320506605)","2022-10-06 12:53:44",test,"2022-03-30 00:00:00","2022-03-31 00:00:00","2022-05-13 00:00:00","2024-05-15 00:00:00","2022-05-13 00:00:00",NULL
2334706-20190516,2656362,391052,1,"SHEFFIELD CHICAGO, LLC","BAR COCINA","2901 N SHEFFIELD AVE 1",CHICAGO,IL,60657,44,29,44-29,19,1050,"Public Place of Amusement",746,"Public Place of Amusement, Provides Entertainment, Room Rentals and Charges a Fee",2334706,RENEW,NULL,03/15/2019,04/15/2019,N,05/16/2019,05/15/2021,05/12/2022,05/13/2022,AAI,NULL,17,41.934500538,-87.653775491,"(41.93450053757158, -87.65377549058545)","2022-10-06 12:53:44",test,NULL,"2019-04-15 00:00:00","2019-05-16 00:00:00","2021-05-15 00:00:00","2022-05-13 00:00:00",NULL
2846416-20220513,2846416,381162,2,"JOHN M. DONATOWICZ","JOHN M. DONATOWICZ","421 W WISCONSIN","OAK PARK",IL,60302,NULL,NULL,NULL,NULL,4406,"Peddler License",819,"Street Performer, Moving Along the Public Way",2846416,ISSUE,05/13/2022,05/13/2022,05/13/2022,N,05/13/2022,06/15/2023,NULL,05/13/2022,AAI,NULL,NULL,41.916387038,-87.639658716,"(41.91638703821149, -87.63965871573951)","2022-10-06 12:53:44",test,"2022-05-13 00:00:00","2022-05-13 00:00:00","2022-05-13 00:00:00","2023-06-15 00:00:00","2022-05-13 00:00:00",NULL
2728345-20220516,2839706,467887,1,"UNIVERSITY COWORK LLC","UNIVERSITY COWORK","6127 S UNIVERSITY AVE  1",CHICAGO,IL,60637,20,NULL,20-,NULL,1010,"Limited Business License",602,"Administrative Commercial Office",2728345,RENEW,NULL,03/15/2022,05/13/2022,N,05/16/2022,05/15/2024,05/13/2022,05/13/2022,AAI,NULL,NULL,41.783322958,-87.597744841,"(41.78332295812876, -87.59774484142953)","2022-10-06 12:53:44",test,NULL,"2022-05-13 00:00:00","2022-05-16 00:00:00","2024-05-15 00:00:00","2022-05-13 00:00:00",NULL
2476761-20211016,2805799,362227,3,"ADIDAS AMERICA, INC.",ADIDAS,"1532 N MILWAUKEE AVE",CHICAGO,IL,60622,1,8,1-8,14,1010,"Limited Business License",911,"Retail Sales of Clothing / Accessories / Shoes",2476761,RENEW,NULL,08/15/2021,09/13/2021,N,10/16/2021,10/15/2023,09/13/2021,05/13/2022,AAI,NULL,33,41.909278559,-87.675973941,"(41.9092785587561, -87.67597394097034)","2022-10-06 12:53:44",test,NULL,"2021-09-13 00:00:00","2021-10-16 00:00:00","2023-10-15 00:00:00","2022-05-13 00:00:00",NULL
1742949-20220616,2842994,308966,1,"RICOBENE'S ON 26TH STREET LLC","RICOBENE'S ON 26TH STREET","252 W 26TH ST 1",CHICAGO,IL,60616,11,36,11-36,9,1006,"Retail Food Establishment",775,"Retail Sales of Perishable Foods",1742949,RENEW,NULL,04/15/2022,05/12/2022,N,06/16/2022,06/15/2024,05/12/2022,05/13/2022,AAI,NULL,NULL,41.845606501,-87.633885614,"(41.84560650077872, -87.6338856144627)","2022-10-06 12:53:44",test,NULL,"2022-05-12 00:00:00","2022-06-16 00:00:00","2024-06-15 00:00:00","2022-05-13 00:00:00",NULL
2846283-20220513,2846283,378861,2,"SOLBERG DISTILLING LLC","RHINE HALL","2010 W FULTON ST",CHICAGO,IL,60612,27,43,27-43,12,1476,"Special Event Liquor",996,"Special Event Beer, Wine & Spirits",2846283,ISSUE,05/12/2022,05/12/2022,05/12/2022,N,05/13/2022,11/08/2022,05/12/2022,05/13/2022,AAI,NULL,NULL,41.88687434,-87.677296056,"(41.88687433960174, -87.67729605577165)","2022-10-06 12:53:44",test,"2022-05-12 00:00:00","2022-05-12 00:00:00","2022-05-13 00:00:00","2022-11-08 00:00:00","2022-05-13 00:00:00",NULL
1140862-20220616,2842500,213476,1,"LAKE SHORE HOSPITALITY INC.","Best Western Plus  Chicago Lake Shore / Lake Shore Cafe","4900 S CHICAGO BEACH DR 1-4",CHICAGO,IL,60615,5,22,5-22,2,1006,"Retail Food Establishment",775,"Retail Sales of Perishable Foods",1140862,RENEW,NULL,04/15/2022,05/12/2022,N,06/16/2022,06/15/2024,05/12/2022,05/13/2022,AAI,NULL,NULL,41.806170388,-87.585799573,"(41.806170387632804, -87.58579957251453)","2022-10-06 12:53:44",test,NULL,"2022-05-12 00:00:00","2022-06-16 00:00:00","2024-06-15 00:00:00","2022-05-13 00:00:00",NULL
2208837-20220616,2843396,353426,1,"Fusion Integrated Solutions, LLC","Fusion Integrated Solutions, LLC","4842 S CORNELL AVE 2ND 200",CHICAGO,IL,60615,5,NULL,5-,NULL,4404,"Regulated Business License",724,"Other Home Based Businesses",2208837,RENEW,NULL,04/15/2022,05/12/2022,N,06/16/2022,06/15/2024,05/12/2022,05/13/2022,AAI,NULL,NULL,41.806148145,-87.587101861,"(41.80614814528715, -87.58710186118863)","2022-10-06 12:53:44",test,NULL,"2022-05-12 00:00:00","2022-06-16 00:00:00","2024-06-15 00:00:00","2022-05-13 00:00:00",NULL
49274-20220516,2836656,17155,2,"HYGIENEERING INC","HYGIENEERING, INC.","7575  PLAZA CT  MAIN",WILLOWBROOK,IL,60527,NULL,NULL,NULL,NULL,1010,"Limited Business License",NULL,NULL,49274,RENEW,NULL,03/15/2022,03/29/2022,N,05/16/2022,05/15/2024,03/29/2022,05/13/2022,AAI,NULL,NULL,NULL,NULL,NULL,"2022-10-06 12:53:44",test,NULL,"2022-03-29 00:00:00","2022-05-16 00:00:00","2024-05-15 00:00:00","2022-05-13 00:00:00",NULL
2615893-20220501,2832917,290709,2,"CHICAGO WATERCRAFT","CHICAGO WATERCRAFT INC.","517 E LAKE SHORE DR",CULVER,IN,46511,NULL,NULL,NULL,NULL,7020,"Commercial Passenger Vessel",1011,"Operation of a Commercial Passenger Vessel - Under 20 Passengers",2615893,RENEW,NULL,02/15/2022,05/13/2022,N,05/01/2022,04/30/2023,05/13/2022,05/13/2022,AAI,NULL,NULL,NULL,NULL,NULL,"2022-10-06 12:53:44",test,NULL,"2022-05-13 00:00:00","2022-05-01 00:00:00","2023-04-30 00:00:00","2022-05-13 00:00:00",NULL
1224197-20220616,2842566,230409,1,"AMK OF ILLINOIS, LTD.","SNAPPY CONVENIENCE CENTER #5","2477 S ARCHER AVE",CHICAGO,IL,60616,11,50,11-50,9,1781,Tobacco,763,"Retail Sale of Tobacco",1224197,RENEW,NULL,04/15/2022,05/12/2022,N,06/16/2022,06/15/2023,05/12/2022,05/13/2022,AAI,NULL,NULL,41.84755805,-87.645495992,"(41.84755805016441, -87.64549599168248)","2022-10-06 12:53:44",test,NULL,"2022-05-12 00:00:00","2022-06-16 00:00:00","2023-06-15 00:00:00","2022-05-13 00:00:00",NULL
2845384-20220513,2845384,485158,1,"Archipelago Group LLC","Archipelago Design","1500 W HOOD AVE",CHICAGO,IL,60660,48,NULL,48-,NULL,4404,"Regulated Business License",687,"Interior Design / Consulting Services (Home Based Business)",2845384,ISSUE,04/25/2022,04/25/2022,05/12/2022,N,05/13/2022,05/15/2024,05/12/2022,05/13/2022,AAI,NULL,NULL,41.9936448,-87.667812385,"(41.99364480025862, -87.6678123849824)","2022-10-06 12:53:44",test,"2022-04-25 00:00:00","2022-05-12 00:00:00","2022-05-13 00:00:00","2024-05-15 00:00:00","2022-05-13 00:00:00",NULL
2522370-20220616,2844185,402613,1,"VAPES & PIPES, INC.","MARY JANES SMOKE SHOP","5407 S HARLEM AVE 1ST",CHICAGO,IL,60638,23,52,23-52,8,1781,Tobacco,"767 | 776 | 936 | 937 | 967","Retail Sales of General Merchandise and Non-Perishable Food | Retail Sales of Tobacco Products | Retail Sales of Tobacco Accessories | Retail Sales of Tobacco and Flavored Tobacco Products | Sampling of Vaping Products on Premises",2522370,RENEW,NULL,04/15/2022,05/12/2022,N,06/16/2022,06/15/2023,05/12/2022,05/13/2022,AAI,NULL,NULL,41.79370535,-87.801435558,"(41.79370534975334, -87.80143555792121)","2022-10-06 12:53:44",test,NULL,"2022-05-12 00:00:00","2022-06-16 00:00:00","2023-06-15 00:00:00","2022-05-13 00:00:00",NULL
2846393-20220513,2846393,485813,1,"HMT GROUP LLC","LAD'S BARBER SHOP","2862 W 38TH ST 1",CHICAGO,IL,60632,12,12,12-12,9,1010,"Limited Business License",894,"Hair Services",2846393,ISSUE,05/13/2022,05/13/2022,05/13/2022,N,05/13/2022,05/15/2024,05/13/2022,05/13/2022,AAI,NULL,NULL,41.824676887,-87.696917127,"(41.82467688685519, -87.69691712734425)","2022-10-06 12:53:44",test,"2022-05-13 00:00:00","2022-05-13 00:00:00","2022-05-13 00:00:00","2024-05-15 00:00:00","2022-05-13 00:00:00",NULL
2846377-20220513,2846377,485790,1,"PLAYCO CAPITAL LLC","STRETCHLAB LINCOLN SQUARE","2317 W LAWRENCE AVE 1ST",CHICAGO,IL,60625,47,20,47-20,19,4404,"Regulated Business License","904 | 926 | 927","Retail Sales of General Merchandise | Fitness Classes | Yoga Instruction",2846377,ISSUE,05/13/2022,05/13/2022,05/13/2022,N,05/13/2022,05/15/2024,05/13/2022,05/13/2022,AAI,NULL,21,41.968527341,-87.687156436,"(41.96852734126258, -87.68715643626427)","2022-10-06 12:53:44",test,"2022-05-13 00:00:00","2022-05-13 00:00:00","2022-05-13 00:00:00","2024-05-15 00:00:00","2022-05-13 00:00:00",NULL
84149-20160416,2448419,80962,2,"MERRILL IRON & STEEL INC","MERRILL IRON & STEEL INC","900  ALDERSON ST  1",SCHOFIELD,WI,54476,NULL,NULL,NULL,NULL,1010,"Limited Business License",NULL,NULL,84149,RENEW,NULL,02/15/2016,03/29/2016,N,04/16/2016,04/15/2018,03/29/2016,03/30/2016,AAI,NULL,NULL,NULL,NULL,NULL,"2022-10-06 12:53:44",test,NULL,"2016-03-29 00:00:00","2016-04-16 00:00:00","2018-04-15 00:00:00","2016-03-30 00:00:00",NULL
2802969-20210730,2802969,477215,1,"NECA FOOD AND LIQUOR, CORP.","NECA FOOD AND LIQUOR, CORP.","2625 W 79TH ST STOREFRONT",CHICAGO,IL,60652,18,NULL,18-,8,1010,"Limited Business License","767 | 904","Retail Sales of General Merchandise and Non-Perishable Food | Retail Sales of General Merchandise",2802969,ISSUE,07/27/2021,07/27/2021,07/29/2021,N,07/30/2021,08/15/2023,07/29/2021,07/30/2021,AAI,NULL,NULL,41.749840439,-87.688900524,"(41.74984043875308, -87.68890052386799)","2022-10-06 12:53:44",test,"2021-07-27 00:00:00","2021-07-29 00:00:00","2021-07-30 00:00:00","2023-08-15 00:00:00","2021-07-30 00:00:00",NULL
2320857-20220516,2838618,389419,1,"YUSEF HOOD","YUSEF HOOD","10057 S MORGAN ST",CHICAGO,IL,60643,34,34,34-34,22,4406,"Peddler License",769,"Peddler- Retail Sales of General Merchandise, Whole Uncut Fruits/Vegetables, Flowers, Moving Along the Public Way",2320857,RENEW,NULL,03/15/2022,05/13/2022,N,05/16/2022,05/15/2024,NULL,05/13/2022,AAI,NULL,NULL,41.71059849,-87.647646608,"(41.71059849042711, -87.64764660752569)","2022-10-06 12:53:44",test,NULL,"2022-05-13 00:00:00","2022-05-16 00:00:00","2024-05-15 00:00:00","2022-05-13 00:00:00",NULL
2121222-20111019,2121222,354360,2,"LIFE SPICE AND INGREDIENTS LLC","LIFE SPICE AND INGREDIENTS LLC","216 W CHICAGO AVE 2ND",CHICAGO,IL,60654,27,28,27-28,18,1010,"Limited Business License",NULL,NULL,2121222,ISSUE,10/11/2011,10/18/2011,10/18/2011,N,10/19/2011,07/15/2012,10/18/2011,10/19/2011,AAI,NULL,NULL,41.896694078,-87.634951862,"(41.89669407786378, -87.63495186198773)","2022-10-06 12:53:44",test,"2011-10-11 00:00:00","2011-10-18 00:00:00","2011-10-19 00:00:00","2012-07-15 00:00:00","2011-10-19 00:00:00",NULL
2446668-20220516,2839035,403862,1,"THE SONO CHICAGO LLC","THE SONO CHICAGO LLC","[REDACTED FOR PRIVACY]",CHICAGO,IL,60610,2,9,2-9,18,4404,"Regulated Business License",615,"Bed and Breakfast Establishment, Owner-Occupied, 11 or Fewer Sleeping Rooms Available for Rent for Transient Occupancy by Registered Guests",2446668,RENEW,NULL,03/15/2022,04/08/2022,N,05/16/2022,05/15/2024,05/13/2022,05/13/2022,AAI,NULL,NULL,NULL,NULL,NULL,"2022-10-06 12:53:44",test,NULL,"2022-04-08 00:00:00","2022-05-16 00:00:00","2024-05-15 00:00:00","2022-05-13 00:00:00",NULL
2569279-20211216,2816546,423213,1,"ACCOUNTING & BUSINESS CONSULTING LLC","ACCOUNTING & BUSINESS CONSULTING LLC","2412 W NORTH AVE 2 200",CHICAGO,IL,60647,1,NULL,1-,NULL,4404,"Regulated Business License","601 | 737","Acquisition and Improvement of Land/Residential Buildings (Residential Real Estate Developer) | Preparation of License, Certificate or Permit Applications for Compensation (Expediter Company)",2569279,RENEW,NULL,10/15/2021,05/12/2022,N,12/16/2021,12/15/2023,05/12/2022,05/13/2022,AAI,NULL,33,41.910423585,-87.687791748,"(41.910423585331024, -87.68779174763705)","2022-10-06 12:53:44",test,NULL,"2022-05-12 00:00:00","2021-12-16 00:00:00","2023-12-15 00:00:00","2022-05-13 00:00:00",NULL
4324-20220616,2841543,3213,1,"SUN SUN TONG INC","SUN SUN TONG CO","2260 S WENTWORTH AVE",CHICAGO,IL,60616,25,14,25-14,9,1006,"Retail Food Establishment",775,"Retail Sales of Perishable Foods",4324,RENEW,NULL,04/15/2022,05/12/2022,N,06/16/2022,06/15/2024,05/12/2022,05/13/2022,AAI,NULL,NULL,41.851092073,-87.632124026,"(41.85109207268169, -87.63212402601312)","2022-10-06 12:53:44",test,NULL,"2022-05-12 00:00:00","2022-06-16 00:00:00","2024-06-15 00:00:00","2022-05-13 00:00:00",NULL
2845377-20220513,2845377,485154,1,"Little Bon Bons Boutique LLC","Little Bonbons Boutique & Spa","6007 W BELMONT AVE",CHICAGO,IL,60634,30,NULL,30-,NULL,1032,"Animal Care License","611 | 904 | 954","Provide Animal Grooming Services | Retail Sales of General Merchandise | Retail Sales of Animal Treats and Animal Food",2845377,ISSUE,04/25/2022,04/25/2022,04/25/2022,N,05/13/2022,05/15/2024,05/12/2022,05/13/2022,AAI,NULL,NULL,41.93833373,-87.776559686,"(41.93833372992286, -87.77655968561727)","2022-10-06 12:53:44",test,"2022-04-25 00:00:00","2022-04-25 00:00:00","2022-05-13 00:00:00","2024-05-15 00:00:00","2022-05-13 00:00:00",NULL
2846323-20220513,2846323,311800,5,"MUNSTER TAVERNS, INC.","WILDE BAR & RESTAURANT","3130 N BROADWAY",CHICAGO,IL,60657,44,21,44-21,19,1476,"Special Event Liquor",996,"Special Event Beer, Wine & Spirits",2846323,ISSUE,05/12/2022,05/12/2022,05/12/2022,N,05/13/2022,07/14/2022,05/12/2022,05/13/2022,AAI,NULL,8,41.93858895,-87.644497266,"(41.93858894953284, -87.64449726642948)","2022-10-06 12:53:44",test,"2022-05-12 00:00:00","2022-05-12 00:00:00","2022-05-13 00:00:00","2022-07-14 00:00:00","2022-05-13 00:00:00",NULL
2121222-20180716,2598638,354360,2,"LIFE SPICE AND INGREDIENTS LLC","LIFE SPICE AND INGREDIENTS LLC","216 W CHICAGO AVE 2ND",CHICAGO,IL,60654,27,28,27-28,18,1010,"Limited Business License",NULL,NULL,2121222,RENEW,NULL,05/15/2018,06/25/2018,N,07/16/2018,07/15/2020,06/25/2018,06/26/2018,AAI,NULL,NULL,41.896694078,-87.634951862,"(41.89669407786378, -87.63495186198773)","2022-10-06 12:53:44",test,NULL,"2018-06-25 00:00:00","2018-07-16 00:00:00","2020-07-15 00:00:00","2018-06-26 00:00:00",NULL
2846415-20220513,2846415,431509,2,"PAUL ASARO","PAUL ASARO","1515 W ROSEMONT AVE  1",CHICAGO,IL,60660,48,20,48-20,24,4406,"Peddler License",819,"Street Performer, Moving Along the Public Way",2846415,ISSUE,05/13/2022,05/13/2022,05/13/2022,N,05/13/2022,10/15/2022,NULL,05/13/2022,AAI,NULL,NULL,41.996300501,-87.668434591,"(41.99630050050864, -87.6684345913177)","2022-10-06 12:53:44",test,"2022-05-13 00:00:00","2022-05-13 00:00:00","2022-05-13 00:00:00","2022-10-15 00:00:00","2022-05-13 00:00:00",NULL
1742950-20220616,2842995,308966,1,"RICOBENE'S ON 26TH STREET LLC","RICOBENE'S ON 26TH STREET","252 W 26TH ST 1",CHICAGO,IL,60616,11,36,11-36,9,1475,"Consumption on Premises - Incidental Activity",638,"Consumption of Liquor on Premises",1742950,RENEW,NULL,04/15/2022,05/12/2022,N,06/16/2022,06/15/2024,05/12/2022,05/13/2022,AAI,NULL,NULL,41.845606501,-87.633885614,"(41.84560650077872, -87.6338856144627)","2022-10-06 12:53:44",test,NULL,"2022-05-12 00:00:00","2022-06-16 00:00:00","2024-06-15 00:00:00","2022-05-13 00:00:00",NULL
2398567-20200516,2721574,369504,17,"COFFEE HOUSE HOLDINGS, INC.","STARBUCKS COFFEE #226","1530 E 53RD ST 1",CHICAGO,IL,60615,4,47,4-47,2,1006,"Retail Food Establishment",735,"Preparation of Food and Dining on Premise With Seating",2398567,RENEW,NULL,03/15/2020,04/22/2020,N,05/16/2020,05/15/2022,04/22/2020,04/24/2020,AAC,05/13/2022,61,41.799667123,-87.587814524,"(41.79966712287017, -87.58781452378159)","2022-10-06 12:53:44",test,NULL,"2020-04-22 00:00:00","2020-05-16 00:00:00","2022-05-15 00:00:00","2020-04-24 00:00:00","2022-05-13 00:00:00"
2653041-20201216,2755482,314971,1,"PAT'S PASTRIES LLC","BULL DOG BAKERY II","3207 N ELSTON AVE 1ST FLOOR 1",CHICAGO,IL,60618,33,9,33-9,17,1006,"Retail Food Establishment",781,"Sale of Food Prepared Onsite With Dining Area",2653041,RENEW,NULL,10/15/2020,10/28/2020,N,12/16/2020,12/15/2022,10/28/2020,10/29/2020,AAC,05/13/2022,NULL,41.939646611,-87.698479014,"(41.939646610904056, -87.69847901358345)","2022-10-06 12:53:44",test,NULL,"2020-10-28 00:00:00","2020-12-16 00:00:00","2022-12-15 00:00:00","2020-10-29 00:00:00","2022-05-13 00:00:00"
2802677-20210813,2802677,477052,1,"SKYLA BEAUTY LLC","SKYLA BEAUTY NAIL SALON","2862 W 38TH ST GROUND STORE FT",CHICAGO,IL,60632,12,NULL,12-,NULL,1010,"Limited Business License","895 | 896 | 904","Nail Services | Skincare Services | Retail Sales of General Merchandise",2802677,ISSUE,07/20/2021,07/20/2021,08/12/2021,N,08/13/2021,08/15/2023,08/12/2021,08/13/2021,AAC,05/13/2022,NULL,41.824676887,-87.696917127,"(41.82467688685519, -87.69691712734425)","2022-10-06 12:53:44",test,"2021-07-20 00:00:00","2021-08-12 00:00:00","2021-08-13 00:00:00","2023-08-15 00:00:00","2021-08-13 00:00:00","2022-05-13 00:00:00"
2818158-20220513,2818158,393494,1,"La VIVA inc","La VIVAKITCHEN","4425 W MONTROSE AVE 1ST",CHICAGO,IL,60641,39,3,39-3,17,8343,"Food - Shared Kitchen - Supplemental",803,"Operation of a Shared Kitchen - Secondary to Primary Business (Supplemental)",2818158,ISSUE,11/04/2021,05/03/2022,05/03/2022,N,05/13/2022,10/15/2022,05/12/2022,05/13/2022,AAI,NULL,NULL,41.960704655,-87.739569354,"(41.960704654894684, -87.73956935358164)","2022-10-06 12:53:44",test,"2021-11-04 00:00:00","2022-05-03 00:00:00","2022-05-13 00:00:00","2022-10-15 00:00:00","2022-05-13 00:00:00",NULL
2451936-20220516,2839056,404408,1,"MIANTRANS L.L.C.",AAMCO,"12307 S HALSTED ST 1ST",CHICAGO,IL,60628,34,29,34-29,5,8340,"Motor Vehicle Services License","712 | 779","Motor Vehicle Repair -  Engine and Transmission Work | Sale and Storage of Tires (100 - 1000)",2451936,RENEW,NULL,03/15/2022,05/13/2022,N,05/16/2022,05/15/2024,05/13/2022,05/13/2022,AAI,NULL,NULL,41.670281173,-87.64150994,"(41.67028117322463, -87.64150994009101)","2022-10-06 12:53:44",test,NULL,"2022-05-13 00:00:00","2022-05-16 00:00:00","2024-05-15 00:00:00","2022-05-13 00:00:00",NULL
2840617-20220513,2840617,484408,1,"PLANTX MIDWEST INC.",XMARKET,"804 W MONTROSE AVE 1 & MEZZ",CHICAGO,IL,60613,46,NULL,46-,NULL,1474,"Package Goods",774,"Retail Sales of Packaged Liquor",2840617,ISSUE,03/30/2022,04/26/2022,03/31/2022,N,05/13/2022,05/15/2024,05/13/2022,05/13/2022,AAI,NULL,34,41.961950551,-87.650132051,"(41.96195055112621, -87.6501320506605)","2022-10-06 12:53:44",test,"2022-03-30 00:00:00","2022-03-31 00:00:00","2022-05-13 00:00:00","2024-05-15 00:00:00","2022-05-13 00:00:00",NULL
53884-20220516,2836992,64579,1,"CYNPAT, INC","Cielo Dulce","3504 S WESTERN AVE 1",CHICAGO,IL,60609,12,6,12-6,9,1006,"Retail Food Establishment",775,"Retail Sales of Perishable Foods",53884,RENEW,NULL,03/15/2022,05/13/2022,N,05/16/2022,05/15/2024,05/13/2022,05/13/2022,AAI,NULL,NULL,41.830073693,-87.68517427,"(41.830073693447986, -87.68517426995787)","2022-10-06 12:53:44",test,NULL,"2022-05-13 00:00:00","2022-05-16 00:00:00","2024-05-15 00:00:00","2022-05-13 00:00:00",NULL
71712-20060216,1654380,21667,2,"MICHAEL TANGNEY","TANGNEY SEWERS","39420  ROUTE 59   4-D","LAKE VILLA",IL,60046,NULL,NULL,NULL,NULL,1011,"Home Repair",NULL,NULL,71712,RENEW,NULL,12/21/2005,01/23/2006,N,02/16/2006,02/15/2007,02/14/2006,02/15/2006,AAI,NULL,NULL,NULL,NULL,NULL,"2022-10-06 12:53:44",test,NULL,"2006-01-23 00:00:00","2006-02-16 00:00:00","2007-02-15 00:00:00","2006-02-15 00:00:00",NULL
2121222-20140716,2332057,354360,2,"LIFE SPICE AND INGREDIENTS LLC","LIFE SPICE AND INGREDIENTS LLC","216 W CHICAGO AVE 2ND",CHICAGO,IL,60654,27,28,27-28,18,1010,"Limited Business License",NULL,NULL,2121222,RENEW,NULL,05/15/2014,05/21/2014,N,07/16/2014,07/15/2016,05/21/2014,08/07/2014,AAI,NULL,NULL,41.896694078,-87.634951862,"(41.89669407786378, -87.63495186198773)","2022-10-06 12:53:44",test,NULL,"2014-05-21 00:00:00","2014-07-16 00:00:00","2016-07-15 00:00:00","2014-08-07 00:00:00",NULL
2664753-20220516,2839560,458665,1,"SCOTT BUNNER","SCOTT BUNNER","[REDACTED FOR PRIVACY]",CHICAGO,IL,60622,26,33,26-33,12,7009,"Pharmaceutical Representative",990,"Markets / Promotes Pharmaceuticals to Health Care Professionals and Conducts Business for More than 15 Calendar Days per Year",2664753,RENEW,NULL,03/15/2022,05/13/2022,N,05/16/2022,05/15/2023,05/13/2022,05/13/2022,AAI,NULL,NULL,NULL,NULL,NULL,"2022-10-06 12:53:44",test,NULL,"2022-05-13 00:00:00","2022-05-16 00:00:00","2023-05-15 00:00:00","2022-05-13 00:00:00",NULL
1166992-20150316,2376538,217137,1,"CEC EMPLOYEE GROUP LLC","CEC EMPLOYEE GROUP LLC","2895  GREENSPOINT PKWY  600","HOFFMAN ESTATES",IL,60195,NULL,NULL,NULL,NULL,1010,"Limited Business License",NULL,NULL,1166992,RENEW,NULL,01/16/2015,02/25/2015,N,03/16/2015,03/15/2017,02/25/2015,02/26/2015,AAI,NULL,NULL,NULL,NULL,NULL,"2022-10-06 12:53:44",test,NULL,"2015-02-25 00:00:00","2015-03-16 00:00:00","2017-03-15 00:00:00","2015-02-26 00:00:00",NULL
1224196-20220616,2842567,230409,1,"AMK OF ILLINOIS, LTD.","SNAPPY CONVENIENCE CENTER #5","2477 S ARCHER AVE",CHICAGO,IL,60616,11,50,11-50,9,1006,"Retail Food Establishment",775,"Retail Sales of Perishable Foods",1224196,RENEW,NULL,04/15/2022,05/12/2022,N,06/16/2022,06/15/2024,05/12/2022,05/13/2022,AAI,NULL,NULL,41.84755805,-87.645495992,"(41.84755805016441, -87.64549599168248)","2022-10-06 12:53:44",test,NULL,"2022-05-12 00:00:00","2022-06-16 00:00:00","2024-06-15 00:00:00","2022-05-13 00:00:00",NULL
2121222-20120716,2156271,354360,2,"LIFE SPICE AND INGREDIENTS LLC","LIFE SPICE AND INGREDIENTS LLC","216 W CHICAGO AVE 2ND",CHICAGO,IL,60654,27,28,27-28,18,1010,"Limited Business License",NULL,NULL,2121222,RENEW,NULL,05/15/2012,05/17/2012,N,07/16/2012,07/15/2014,05/17/2012,05/18/2012,AAI,NULL,NULL,41.896694078,-87.634951862,"(41.89669407786378, -87.63495186198773)","2022-10-06 12:53:44",test,NULL,"2012-05-17 00:00:00","2012-07-16 00:00:00","2014-07-15 00:00:00","2012-05-18 00:00:00",NULL
2374684-20200516,2721566,369504,8,"COFFEE HOUSE HOLDINGS, INC.","STARBUCKS COFFEE # 9426","520 N OGDEN AVE 1",CHICAGO,IL,60642,1,40,1-40,12,1006,"Retail Food Establishment",781,"Sale of Food Prepared Onsite With Dining Area",2374684,RENEW,NULL,03/15/2020,04/22/2020,N,05/16/2020,05/15/2022,04/22/2020,04/24/2020,AAC,05/13/2022,NULL,41.891769778,-87.658604614,"(41.89176977820589, -87.65860461424934)","2022-10-06 12:53:44",test,NULL,"2020-04-22 00:00:00","2020-05-16 00:00:00","2022-05-15 00:00:00","2020-04-24 00:00:00","2022-05-13 00:00:00"
2569656-20220516,2837341,258541,3,"NEDA'S HEALING TOUCH INC.","NEDA'S SPA","1814 W BELMONT AVE 1ST",CHICAGO,IL,60657,47,42,47-42,19,4404,"Regulated Business License","745 | 896","Provide Full Body Massage Services | Skincare Services",2569656,RENEW,NULL,03/15/2022,05/13/2022,N,05/16/2022,05/15/2024,05/13/2022,05/13/2022,AAI,NULL,NULL,41.939727033,-87.674606499,"(41.939727032555474, -87.67460649945811)","2022-10-06 12:53:44",test,NULL,"2022-05-13 00:00:00","2022-05-16 00:00:00","2024-05-15 00:00:00","2022-05-13 00:00:00",NULL
1170712-20150416,2380824,22227,1,"HERMAN/STEWART CONSTRUCTION","HERMAN/STEWART CONSTRUCTION","4550  FORBES BLVD  200",LANHAM,MD,20706,NULL,NULL,NULL,NULL,1010,"Limited Business License",NULL,NULL,1170712,RENEW,NULL,02/15/2015,02/25/2015,N,04/16/2015,04/15/2017,02/25/2015,02/26/2015,AAI,NULL,NULL,NULL,NULL,NULL,"2022-10-06 12:53:44",test,NULL,"2015-02-25 00:00:00","2015-04-16 00:00:00","2017-04-15 00:00:00","2015-02-26 00:00:00",NULL
2152267-20220516,2838349,371608,1,"DEBORAH J. RIDDLE","DEBBIE'S SOUTHERN CUISINE","100 E 14TH ST 12TH 1207",CHICAGO,IL,60605,3,60,3-60,1,8344,"Shared Kitchen User (Long Term)",804,"Shared Kitchen User - Long Term",2152267,RENEW,NULL,03/15/2022,05/15/2022,N,05/16/2022,05/15/2024,NULL,05/15/2022,AAI,NULL,NULL,41.864224258,-87.624074561,"(41.86422425830418, -87.62407456094904)","2022-10-06 12:53:44",test,NULL,"2022-05-15 00:00:00","2022-05-16 00:00:00","2024-05-15 00:00:00","2022-05-15 00:00:00",NULL
1547085-20220716,2847292,217360,1,"MIGUEL MIRANDA","MICHOACAN IRON WORKS","10047 S COMMERCIAL AVE",CHICAGO,IL,60617,10,30,10-30,4,1009,"Manufacturing Establishments",929,"Miscellaneous Manufacturing",1547085,RENEW,NULL,05/15/2022,05/15/2022,N,07/16/2022,07/15/2024,05/15/2022,05/16/2022,AAI,NULL,NULL,41.711945476,-87.551326055,"(41.711945475755186, -87.5513260554934)","2022-10-06 12:53:44",test,NULL,"2022-05-15 00:00:00","2022-07-16 00:00:00","2024-07-15 00:00:00","2022-05-16 00:00:00",NULL
77833-20060216,1654639,22930,1,"PEDRO DIAZ","HVAC COMFORT DIAZ","860 E OLD WILLOW RD  238","PROSPECT HEIGHTS",IL,60070,NULL,NULL,NULL,NULL,1010,"Limited Business License",NULL,NULL,77833,RENEW,NULL,12/21/2005,05/11/2006,N,02/16/2006,02/15/2007,05/11/2006,05/12/2006,AAI,NULL,NULL,NULL,NULL,NULL,"2022-10-06 12:53:44",test,NULL,"2006-05-11 00:00:00","2006-02-16 00:00:00","2007-02-15 00:00:00","2006-05-12 00:00:00",NULL
52680-20150316,2375808,57039,1,"J S R ENTERPRISES, INC.","J S R ENTERPRISES INC","4931 W 173 ST  F","COUNTRY CLUB HILLS",IL,60478,NULL,NULL,NULL,NULL,1010,"Limited Business License",NULL,NULL,52680,RENEW,NULL,01/16/2015,02/25/2015,N,03/16/2015,03/15/2017,02/25/2015,02/26/2015,AAI,NULL,NULL,NULL,NULL,NULL,"2022-10-06 12:53:44",test,NULL,"2015-02-25 00:00:00","2015-03-16 00:00:00","2017-03-15 00:00:00","2015-02-26 00:00:00",NULL
34093-20150416,2381022,32537,1,"J.D. & SONS ROOFING CO","J.D. & SONS ROOFING CO, INC","1010 S CHESTER   1ST","PARK RIDGE",IL,60068,NULL,NULL,NULL,NULL,1010,"Limited Business License",NULL,NULL,34093,RENEW,NULL,02/15/2015,02/25/2015,N,04/16/2015,04/15/2017,02/25/2015,02/26/2015,AAI,NULL,NULL,NULL,NULL,NULL,"2022-10-06 12:53:44",test,NULL,"2015-02-25 00:00:00","2015-04-16 00:00:00","2017-04-15 00:00:00","2015-02-26 00:00:00",NULL
35322-20150416,2381238,54233,1,"A-GREEN PLUS","A-GREEN PLUS","9120 S KEDVALE AVE  1ST","OAK LAWN",IL,60454,NULL,NULL,NULL,NULL,1010,"Limited Business License",NULL,NULL,35322,RENEW,NULL,02/15/2015,02/25/2015,N,04/16/2015,04/15/2017,02/25/2015,02/26/2015,AAI,NULL,NULL,NULL,NULL,NULL,"2022-10-06 12:53:44",test,NULL,"2015-02-25 00:00:00","2015-04-16 00:00:00","2017-04-15 00:00:00","2015-02-26 00:00:00",NULL
53873-20150416,2381293,57247,1,"WILTJER EXCAVATING INC","WILTJER EXCAVATING","18317  HARPER   1",LANSING,IL,60438,NULL,NULL,NULL,NULL,1010,"Limited Business License",NULL,NULL,53873,RENEW,NULL,02/15/2015,02/27/2015,N,04/16/2015,04/15/2017,02/27/2015,03/03/2015,AAI,NULL,NULL,NULL,NULL,NULL,"2022-10-06 12:53:44",test,NULL,"2015-02-27 00:00:00","2015-04-16 00:00:00","2017-04-15 00:00:00","2015-03-03 00:00:00",NULL
2157726-20150416,2382482,277127,2,"BLACKHAWK PAVING, INC.","BLACKHAWK PAVING, INC.","19148 S 104TH AVE 1 1",MOKENA,IL,60448,NULL,NULL,NULL,NULL,1010,"Limited Business License",NULL,NULL,2157726,RENEW,NULL,02/15/2015,02/25/2015,N,04/16/2015,04/15/2017,02/25/2015,02/26/2015,AAI,NULL,NULL,NULL,NULL,NULL,"2022-10-06 12:53:44",test,NULL,"2015-02-25 00:00:00","2015-04-16 00:00:00","2017-04-15 00:00:00","2015-02-26 00:00:00",NULL
27709-20150316,2375568,30841,1,"CROWTHER RFG & SHEET METAL","CROWTHER RFG & SHEET METAL","18958  AIRPORT RD  1ST",LOCKPORT,IL,60441,NULL,NULL,NULL,NULL,1010,"Limited Business License",NULL,NULL,27709,RENEW,NULL,01/16/2015,02/25/2015,N,03/16/2015,03/15/2017,02/25/2015,02/26/2015,AAI,NULL,NULL,NULL,NULL,NULL,"2022-10-06 12:53:44",test,NULL,"2015-02-25 00:00:00","2015-03-16 00:00:00","2017-03-15 00:00:00","2015-02-26 00:00:00",NULL
66701-20020816,1258836,43749,1,"CAROLINA'S SILVER INCORPORATED","CAROLINA'S SILVER INCORPORATED","3115 W 26TH ST  313,229F2",CHICAGO,IL,60623,12,6,12-6,10,1010,"Limited Business License",NULL,NULL,66701,RENEW,NULL,06/28/2002,09/18/2002,N,08/16/2002,08/15/2003,09/18/2002,09/19/2002,AAI,NULL,NULL,NULL,NULL,NULL,"2022-10-06 12:53:44",test,NULL,"2002-09-18 00:00:00","2002-08-16 00:00:00","2003-08-15 00:00:00","2002-09-19 00:00:00",NULL
61060-20060216,1653966,19256,2,"MITCH KROLCZYK","General Mechanical Heating and Cooling","7522 N NORA AVE  1",NILES,IL,60714,NULL,NULL,NULL,NULL,1010,"Limited Business License",NULL,NULL,61060,RENEW,NULL,12/21/2005,01/23/2006,N,02/16/2006,02/15/2007,01/23/2006,01/24/2006,AAI,NULL,NULL,NULL,NULL,NULL,"2022-10-06 12:53:44",test,NULL,"2006-01-23 00:00:00","2006-02-16 00:00:00","2007-02-15 00:00:00","2006-01-24 00:00:00",NULL
2109883-20150416,2381559,67759,6,"CHICAGO INSTRUCTIONAL TECHNOLOGY FOUNDATION, INC.","Voqal Chicago","655 S SUNSET ST  A",LONGMONT,CO,80501,NULL,NULL,NULL,NULL,1010,"Limited Business License",NULL,NULL,2109883,RENEW,NULL,02/15/2015,02/27/2015,N,04/16/2015,04/15/2017,02/27/2015,03/03/2015,AAI,NULL,NULL,NULL,NULL,NULL,"2022-10-06 12:53:44",test,NULL,"2015-02-27 00:00:00","2015-04-16 00:00:00","2017-04-15 00:00:00","2015-03-03 00:00:00",NULL
17483-20060216,1655873,28332,1,"TRI-NORTH BUILDERS, INC.","TRI-NORTH BUILDERS","717  POST RD  1ST",MADISON,WI,53713,NULL,NULL,NULL,NULL,1010,"Limited Business License",NULL,NULL,17483,RENEW,NULL,12/21/2005,01/27/2006,N,02/16/2006,02/15/2007,01/27/2006,01/30/2006,AAI,NULL,NULL,NULL,NULL,NULL,"2022-10-06 12:53:44",test,NULL,"2006-01-27 00:00:00","2006-02-16 00:00:00","2007-02-15 00:00:00","2006-01-30 00:00:00",NULL
2033016-20220516,2837023,85600,2,"KNICKERBOCKER ROOFING & PAVING","KNICKERBOCKER ROOFING & PAVING","16851 S LATHROP AVE",HARVEY,IL,60426,NULL,NULL,NULL,NULL,1010,"Limited Business License",NULL,NULL,2033016,RENEW,NULL,03/15/2022,05/05/2022,N,05/16/2022,05/15/2024,05/05/2022,05/06/2022,AAI,NULL,NULL,NULL,NULL,NULL,"2022-10-06 12:53:44",test,NULL,"2022-05-05 00:00:00","2022-05-16 00:00:00","2024-05-15 00:00:00","2022-05-06 00:00:00",NULL
2214502-20140716,2329877,65792,2,"PAUL D DOOLEY","DOOLEY BROS TOWING & AUTO REP","8517 S VINCENNES AVE 1ST",CHICAGO,IL,60620,21,2,21-2,6,8340,"Motor Vehicle Services License",712,"Motor Vehicle Repair -  Engine and Transmission Work",2214502,RENEW,NULL,05/15/2014,06/15/2014,N,07/16/2014,07/15/2016,06/15/2014,06/16/2014,AAI,NULL,NULL,41.739354952,-87.63983969,"(41.739354951667266, -87.63983968969981)","2022-10-06 12:53:44",test,NULL,"2014-06-15 00:00:00","2014-07-16 00:00:00","2016-07-15 00:00:00","2014-06-16 00:00:00",NULL
2390992-20151016,2421925,361790,4,"JS FORT GROUP, INC","JIMMY JOHN'S","1557 N MILWAUKEE AVE 1ST",CHICAGO,IL,60622,1,NULL,1-,NULL,1006,"Retail Food Establishment",781,"Sale of Food Prepared Onsite With Dining Area",2390992,RENEW,NULL,08/15/2015,09/09/2015,N,10/16/2015,10/15/2017,09/09/2015,09/10/2015,AAI,NULL,33,41.909889788,-87.676477576,"(41.90988978788182, -87.67647757629045)","2022-10-06 12:53:44",test,NULL,"2015-09-09 00:00:00","2015-10-16 00:00:00","2017-10-15 00:00:00","2015-09-10 00:00:00",NULL
2602032-20220916,2861552,428379,1,"BAHA RESTAURANT, INC.","BAHA RESTAURANT","4842-4846 W DIVERSEY AVE",CHICAGO,IL,60639,31,27,31-27,25,1475,"Consumption on Premises - Incidental Activity",638,"Consumption of Liquor on Premises",2602032,RENEW,NULL,07/15/2022,08/08/2022,N,09/16/2022,09/15/2024,08/08/2022,08/09/2022,AAI,NULL,NULL,41.93162026,-87.748324563,"(41.93162026012076, -87.74832456297335)","2022-10-06 12:53:44",test,NULL,"2022-08-08 00:00:00","2022-09-16 00:00:00","2024-09-15 00:00:00","2022-08-09 00:00:00",NULL
2744801-20220916,2861960,469082,1,"Gonzalez Industries LLC","Parlor 710","2623 W ARMITAGE AVE 1",CHICAGO,IL,60647,1,NULL,1-,NULL,1010,"Limited Business License","144 | 767","Hair, Nail, and Skin Care Services | Retail Sales of General Merchandise and Non-Perishable Food",2744801,RENEW,NULL,07/15/2022,08/08/2022,N,09/16/2022,09/15/2024,08/08/2022,08/09/2022,AAI,NULL,NULL,41.917412861,-87.693298403,"(41.91741286068091, -87.6932984030238)","2022-10-06 12:53:44",test,NULL,"2022-08-08 00:00:00","2022-09-16 00:00:00","2024-09-15 00:00:00","2022-08-09 00:00:00",NULL
2093646-20131016,2282512,361790,1,"JS FORT GROUP, INC","JIMMY JOHN'S","2231 N LINCOLN AVE FIRST",CHICAGO,IL,60614,43,NULL,43-,NULL,1006,"Retail Food Establishment",775,"Retail Sales of Perishable Foods",2093646,RENEW,NULL,08/15/2013,08/29/2013,N,10/16/2013,10/15/2015,08/29/2013,08/30/2013,AAI,NULL,35,41.92268911,-87.644693336,"(41.92268910988196, -87.64469333563137)","2022-10-06 12:53:44",test,NULL,"2013-08-29 00:00:00","2013-10-16 00:00:00","2015-10-15 00:00:00","2013-08-30 00:00:00",NULL
2744684-20220916,2859138,285772,3,"UCG ASSOCIATES, INC","UCG Associates, Inc.","150 N MICHIGAN AVE 29 2930",CHICAGO,IL,60601,42,NULL,42-,NULL,1010,"Limited Business License",619,"Business and Management Consulting",2744684,RENEW,NULL,07/15/2022,08/08/2022,N,09/16/2022,09/15/2024,08/08/2022,08/09/2022,AAI,NULL,NULL,41.884530964,-87.624602045,"(41.88453096378336, -87.62460204460082)","2022-10-06 12:53:44",test,NULL,"2022-08-08 00:00:00","2022-09-16 00:00:00","2024-09-15 00:00:00","2022-08-09 00:00:00",NULL
1937618-20140616,2322681,64478,3,"RON HOY","HOYPOLOI O'HARE","11601 W TOUHY AVE TERMINAL T1 B6",CHICAGO,IL,60666,41,27,41-27,16,1010,"Limited Business License",NULL,NULL,1937618,RENEW,NULL,04/15/2014,06/04/2014,N,06/16/2014,06/15/2016,06/04/2014,06/13/2014,AAI,NULL,NULL,42.008536401,-87.914428439,"(42.008536400868735, -87.91442843927047)","2022-10-06 12:53:44",test,NULL,"2014-06-04 00:00:00","2014-06-16 00:00:00","2016-06-15 00:00:00","2014-06-13 00:00:00",NULL
1937618-20160616,2460001,64478,3,"RON HOY","HOYPOLOI O'HARE","11601 W TOUHY AVE TERMINAL T1 B6",CHICAGO,IL,60666,41,27,41-27,16,1010,"Limited Business License",NULL,NULL,1937618,RENEW,NULL,04/15/2016,05/18/2016,N,06/16/2016,06/15/2018,05/18/2016,05/19/2016,AAI,NULL,NULL,42.008536401,-87.914428439,"(42.008536400868735, -87.91442843927047)","2022-10-06 12:53:44",test,NULL,"2016-05-18 00:00:00","2016-06-16 00:00:00","2018-06-15 00:00:00","2016-05-19 00:00:00",NULL
1681578-20190916,2680266,302020,1,"CHICAGO JIUJITSU, INC","Redzovic Jiu Jitsu","4900 N LINCOLN AVE",CHICAGO,IL,60625,40,3,40-3,20,1010,"Limited Business License",NULL,NULL,1681578,RENEW,NULL,07/15/2019,06/27/2020,N,09/16/2019,09/15/2021,06/27/2020,06/29/2020,AAI,NULL,21,41.970812027,-87.690108461,"(41.970812027202975, -87.69010846133787)","2022-10-06 12:53:44",test,NULL,"2020-06-27 00:00:00","2019-09-16 00:00:00","2021-09-15 00:00:00","2020-06-29 00:00:00",NULL
2690038-20220816,2855205,420052,2,"CAROLINE BOYE HAYFORD","CAROLINE BOYE HAYFORD","[REDACTED FOR PRIVACY]",PLAINFIELD,IL,60586,NULL,NULL,NULL,NULL,7009,"Pharmaceutical Representative",990,"Markets / Promotes Pharmaceuticals to Health Care Professionals and Conducts Business for More than 15 Calendar Days per Year",2690038,RENEW,NULL,06/15/2022,08/08/2022,N,08/16/2022,08/15/2023,08/08/2022,08/09/2022,AAI,NULL,NULL,NULL,NULL,NULL,"2022-10-06 12:53:44",test,NULL,"2022-08-08 00:00:00","2022-08-16 00:00:00","2023-08-15 00:00:00","2022-08-09 00:00:00",NULL
2157599-20220816,2854081,355642,2,"BARBARA&BARBARA INC.",BARBARA&BARBARA,"2925 W DIVERSEY AVE 1ST",CHICAGO,IL,60647,32,27,32-27,14,1010,"Limited Business License",894,"Hair Services",2157599,RENEW,NULL,06/15/2022,08/08/2022,N,08/16/2022,08/15/2024,08/08/2022,08/09/2022,AAI,NULL,NULL,41.931962664,-87.701078367,"(41.93196266352052, -87.70107836706708)","2022-10-06 12:53:44",test,NULL,"2022-08-08 00:00:00","2022-08-16 00:00:00","2024-08-15 00:00:00","2022-08-09 00:00:00",NULL
2835625-20220809,2835625,345673,36,"DG RETAIL, LLC","Dollar General Store #20597","7443 S RACINE AVE",CHICAGO,IL,60636,17,NULL,17-,NULL,1006,"Retail Food Establishment","767 | 775 | 904","Retail Sales of General Merchandise and Non-Perishable Food | Retail Sales of Perishable Foods | Retail Sales of General Merchandise",2835625,ISSUE,03/02/2022,03/02/2022,03/03/2022,N,08/09/2022,12/15/2022,08/09/2022,08/09/2022,AAI,NULL,NULL,41.75835601,-87.653795953,"(41.758356009696634, -87.65379595285543)","2022-10-06 12:53:44",test,"2022-03-02 00:00:00","2022-03-03 00:00:00","2022-08-09 00:00:00","2022-12-15 00:00:00","2022-08-09 00:00:00",NULL
1964818-20220916,2860086,342403,1,"WYNNDALCO ENTERPRISES, LLC","WYNNDALCO ENTERPRISES, LLC","55 W WACKER DR 9TH 950",CHICAGO,IL,60601,42,9,42-9,1,1010,"Limited Business License",NULL,NULL,1964818,RENEW,NULL,07/15/2022,08/08/2022,N,09/16/2022,09/15/2024,08/08/2022,08/09/2022,AAI,NULL,NULL,41.886706932,-87.63006619,"(41.88670693228625, -87.63006619014621)","2022-10-06 12:53:44",test,NULL,"2022-08-08 00:00:00","2022-09-16 00:00:00","2024-09-15 00:00:00","2022-08-09 00:00:00",NULL
2536685-20210116,2761164,377114,2,"BARK N BITES CO.","BARK N' BUBBLES","556 W 37TH ST 1ST",CHICAGO,IL,60609,11,22,11-22,9,1032,"Animal Care License","611 | 904","Provide Animal Grooming Services | Retail Sales of General Merchandise",2536685,RENEW,NULL,11/15/2020,01/15/2021,N,01/16/2021,01/15/2023,01/15/2021,08/09/2022,AAI,NULL,NULL,41.827277874,-87.640999231,"(41.82727787410544, -87.6409992314425)","2022-10-06 12:53:44",test,NULL,"2021-01-15 00:00:00","2021-01-16 00:00:00","2023-01-15 00:00:00","2022-08-09 00:00:00",NULL
2556060-20220916,2861443,421389,1,"ANNETTE HENRY","ANNETTE HENRY","[REDACTED FOR PRIVACY]","LAGRANGE PARK",IL,60526,NULL,NULL,NULL,NULL,7009,"Pharmaceutical Representative",990,"Markets / Promotes Pharmaceuticals to Health Care Professionals and Conducts Business for More than 15 Calendar Days per Year",2556060,RENEW,NULL,07/15/2022,08/08/2022,N,09/16/2022,09/15/2023,08/08/2022,08/09/2022,AAI,NULL,NULL,NULL,NULL,NULL,"2022-10-06 12:53:44",test,NULL,"2022-08-08 00:00:00","2022-09-16 00:00:00","2023-09-15 00:00:00","2022-08-09 00:00:00",NULL
2549598-20220816,2855164,419701,1,"JOHANNA CASSADAY","JOHANNA CASSADAY","[REDACTED FOR PRIVACY]",MCHENRY,IL,60050,NULL,NULL,NULL,NULL,7009,"Pharmaceutical Representative",990,"Markets / Promotes Pharmaceuticals to Health Care Professionals and Conducts Business for More than 15 Calendar Days per Year",2549598,RENEW,NULL,06/15/2022,08/08/2022,N,08/16/2022,08/15/2023,08/08/2022,08/09/2022,AAI,NULL,NULL,NULL,NULL,NULL,"2022-10-06 12:53:44",test,NULL,"2022-08-08 00:00:00","2022-08-16 00:00:00","2023-08-15 00:00:00","2022-08-09 00:00:00",NULL
2125738-20150316,2377106,292403,2,"SUPERIOR OVERHEAD DOOR INC.","SUPERIOR OVERHEAD DOOR INC.","8733  RIDGEFIELD RD 1ST UNIT B","CRYSTAL LAKE",IL,60012,NULL,NULL,NULL,NULL,1010,"Limited Business License",NULL,NULL,2125738,RENEW,NULL,01/16/2015,02/26/2015,N,03/16/2015,03/15/2017,02/26/2015,02/27/2015,AAI,NULL,NULL,NULL,NULL,NULL,"2022-10-06 12:53:44",test,NULL,"2015-02-26 00:00:00","2015-03-16 00:00:00","2017-03-15 00:00:00","2015-02-27 00:00:00",NULL
2753317-20220916,2862198,469958,1,"EVA THORPE","BAGZ LADYE, EVA THORPE","5500 S SHORE DR 11 1110",CHICAGO,IL,60637,5,NULL,5-,NULL,4406,"Peddler License",770,"Peddler (Over 65 Years of Age) - Retail Sales of General Merchandise, Whole Uncut Fruits/Vegetables, Flowers, Moving Along the Public Way",2753317,RENEW,NULL,07/15/2022,08/08/2022,N,09/16/2022,09/15/2024,NULL,08/08/2022,AAI,NULL,NULL,41.795185016,-87.580597772,"(41.79518501605705, -87.58059777168157)","2022-10-06 12:53:44",test,NULL,"2022-08-08 00:00:00","2022-09-16 00:00:00","2024-09-15 00:00:00","2022-08-08 00:00:00",NULL
2689649-20211016,2805798,361790,11,"JS FORT GROUP, INC","JIMMY JOHN'S 561","7329 W IRVING PARK RD",CHICAGO,IL,60634,38,NULL,38-,NULL,1006,"Retail Food Establishment",781,"Sale of Food Prepared Onsite With Dining Area",2689649,RENEW,NULL,08/15/2021,08/18/2021,N,10/16/2021,10/15/2023,08/18/2021,01/24/2022,AAI,NULL,NULL,41.952565641,-87.811274296,"(41.95256564111005, -87.81127429615809)","2022-10-06 12:53:44",test,NULL,"2021-08-18 00:00:00","2021-10-16 00:00:00","2023-10-15 00:00:00","2022-01-24 00:00:00",NULL
2839845-20220318,2839845,483954,1,"MARIA DELOS ANGELES IZQUIERDO-ESPITIA","MARIA DELOS ANGELES IZQUIERDO","4100 S ASHLAND AVE OUTDOOR 201",CHICAGO,IL,60609,12,NULL,12-,NULL,1010,"Limited Business License","904 | 911","Retail Sales of General Merchandise | Retail Sales of Clothing / Accessories / Shoes",2839845,ISSUE,03/15/2022,03/15/2022,03/17/2022,N,03/18/2022,04/15/2024,03/17/2022,03/18/2022,AAI,NULL,10,41.819441426,-87.665375545,"(41.81944142629576, -87.6653755449091)","2022-10-06 12:53:44",test,"2022-03-15 00:00:00","2022-03-17 00:00:00","2022-03-18 00:00:00","2024-04-15 00:00:00","2022-03-18 00:00:00",NULL
2326536-20211016,2805791,361790,2,"JS FORT GROUP, INC","JIMMY JOHN'S","1431 N KINGSBURY ST 1ST",CHICAGO,IL,60642,27,46,27-46,18,1006,"Retail Food Establishment",735,"Preparation of Food and Dining on Premise With Seating",2326536,RENEW,NULL,08/15/2021,08/18/2021,N,10/16/2021,10/15/2023,08/18/2021,01/24/2022,AAI,NULL,NULL,41.906930028,-87.650645064,"(41.9069300282082, -87.6506450643109)","2022-10-06 12:53:44",test,NULL,"2021-08-18 00:00:00","2021-10-16 00:00:00","2023-10-15 00:00:00","2022-01-24 00:00:00",NULL
44759-20220916,2857847,16473,1,"BOCKWINKEL'S FRESH EXPRESS",BOCKWINKEL'S,"155 N HARBOR DR 1ST",CHICAGO,IL,60601,42,6,42-6,1,1006,"Retail Food Establishment",775,"Retail Sales of Perishable Foods",44759,RENEW,NULL,07/15/2022,08/08/2022,N,09/16/2022,09/15/2024,08/08/2022,08/09/2022,AAI,NULL,NULL,41.884750538,-87.615603956,"(41.884750538499375, -87.61560395647253)","2022-10-06 12:53:44",test,NULL,"2022-08-08 00:00:00","2022-09-16 00:00:00","2024-09-15 00:00:00","2022-08-09 00:00:00",NULL
2483427-20220816,2854930,408652,1,"THIET T. PHUNG & LE K DANG","THE NAILS SPOT","2754 N CLYBOURN AVE 1",CHICAGO,IL,60614,32,24,32-24,19,1010,"Limited Business License",895,"Nail Services",2483427,RENEW,NULL,06/15/2022,06/20/2022,N,08/16/2022,08/15/2024,06/20/2022,08/09/2022,AAI,NULL,NULL,41.931187334,-87.677055595,"(41.931187333954206, -87.6770555951477)","2022-10-06 12:53:44",test,NULL,"2022-06-20 00:00:00","2022-08-16 00:00:00","2024-08-15 00:00:00","2022-08-09 00:00:00",NULL
2511697-,2511697,361790,6,"JS FORT GROUP, INC","JIMMY JOHN'S","3506 S STATE ST 1ST FLOOR 1B",CHICAGO,IL,60609,3,23,3-23,2,1006,"Retail Food Establishment",735,"Preparation of Food and Dining on Premise With Seating",2511697,ISSUE,02/07/2017,02/07/2017,02/08/2017,N,NULL,10/15/2017,NULL,08/08/2018,AAI,NULL,NULL,41.830782181,-87.626790176,"(41.83078218057412, -87.62679017621963)","2022-10-06 12:53:44",test,"2017-02-07 00:00:00","2017-02-08 00:00:00",NULL,"2017-10-15 00:00:00","2018-08-08 00:00:00",NULL
10997-20150316,2375505,26614,1,"R. E. BURKE SHEET METAL CO., INC.","R. E. BURKE SHEET METAL CO., INC.","7667  GROSS POINT RD  1",SKOKIE,IL,60077,NULL,NULL,NULL,NULL,1010,"Limited Business License",NULL,NULL,10997,RENEW,NULL,01/16/2015,02/26/2015,N,03/16/2015,03/15/2017,02/26/2015,02/27/2015,AAI,NULL,NULL,NULL,NULL,NULL,"2022-10-06 12:53:44",test,NULL,"2015-02-26 00:00:00","2015-03-16 00:00:00","2017-03-15 00:00:00","2015-02-27 00:00:00",NULL
2728470-20220516,2839741,467967,1,"QUEEN VISION LLC","QUEEN NOIR BODY WAXING","908 E 47TH ST",CHICAGO,IL,60653,4,NULL,4-,NULL,1010,"Limited Business License","896 | 956","Skincare Services | Provide Waxing Services",2728470,RENEW,NULL,03/15/2022,08/09/2022,N,05/16/2022,05/15/2024,08/09/2022,08/09/2022,AAI,NULL,47,41.809679126,-87.603542837,"(41.809679126207364, -87.60354283710049)","2022-10-06 12:53:44",test,NULL,"2022-08-09 00:00:00","2022-05-16 00:00:00","2024-05-15 00:00:00","2022-08-09 00:00:00",NULL
2463579-20191016,2687053,361790,5,"JS FORT GROUP, INC","JIMMY JOHN'S","3328 N CLARK ST 1ST",CHICAGO,IL,60657,44,20,44-20,19,1006,"Retail Food Establishment",781,"Sale of Food Prepared Onsite With Dining Area",2463579,RENEW,NULL,08/15/2019,08/30/2019,N,10/16/2019,10/15/2021,08/30/2019,09/03/2019,AAI,NULL,17,41.942396127,-87.652823894,"(41.942396126778384, -87.65282389448343)","2022-10-06 12:53:44",test,NULL,"2019-08-30 00:00:00","2019-10-16 00:00:00","2021-10-15 00:00:00","2019-09-03 00:00:00",NULL
2555695-20220916,2861426,421174,1,"JOSEPH GUTHRIE","JOSEPH GUTHRIE","[REDACTED FOR PRIVACY]","SOUTH HOLLAND",IL,60473,NULL,NULL,NULL,NULL,7009,"Pharmaceutical Representative",990,"Markets / Promotes Pharmaceuticals to Health Care Professionals and Conducts Business for More than 15 Calendar Days per Year",2555695,RENEW,NULL,07/15/2022,08/08/2022,N,09/16/2022,09/15/2023,08/08/2022,08/09/2022,AAI,NULL,NULL,NULL,NULL,NULL,"2022-10-06 12:53:44",test,NULL,"2022-08-08 00:00:00","2022-09-16 00:00:00","2023-09-15 00:00:00","2022-08-09 00:00:00",NULL
53874-20210116,2759705,57248,1,"FARAZ INC","J BEES CASUAL & SPORTSWEAR","232 E 47TH ST 1ST",CHICAGO,IL,60653,3,35,3-35,2,1010,"Limited Business License",911,"Retail Sales of Clothing / Accessories / Shoes",53874,RENEW,NULL,11/15/2020,11/25/2020,N,01/16/2021,01/15/2023,11/25/2020,08/09/2022,AAI,NULL,56,41.809444339,-87.619677059,"(41.80944433866003, -87.61967705933807)","2022-10-06 12:53:44",test,NULL,"2020-11-25 00:00:00","2021-01-16 00:00:00","2023-01-15 00:00:00","2022-08-09 00:00:00",NULL
2093646-20211016,2805790,361790,1,"JS FORT GROUP, INC","JIMMY JOHN'S","2231 N LINCOLN AVE FIRST",CHICAGO,IL,60614,43,NULL,43-,NULL,1006,"Retail Food Establishment",775,"Retail Sales of Perishable Foods",2093646,RENEW,NULL,08/15/2021,08/18/2021,N,10/16/2021,10/15/2023,08/18/2021,01/24/2022,AAI,NULL,35,41.92268911,-87.644693336,"(41.92268910988196, -87.64469333563137)","2022-10-06 12:53:44",test,NULL,"2021-08-18 00:00:00","2021-10-16 00:00:00","2023-10-15 00:00:00","2022-01-24 00:00:00",NULL
84804-20100716,2034264,65792,2,"PAUL D DOOLEY","DOOLEY BROS TOWING & AUTO REP","8517 S VINCENNES AVE 1ST",CHICAGO,IL,60620,21,2,21-2,6,1569,"Motor Vehicle Repair : Engine Only (Class II)",NULL,NULL,84804,RENEW,NULL,05/17/2010,07/07/2010,N,07/16/2010,07/15/2012,07/07/2010,07/08/2010,AAI,NULL,NULL,41.739354952,-87.63983969,"(41.739354951667266, -87.63983968969981)","2022-10-06 12:53:44",test,NULL,"2010-07-07 00:00:00","2010-07-16 00:00:00","2012-07-15 00:00:00","2010-07-08 00:00:00",NULL
2652791-20211216,2816658,424126,1,"YIP INC.","SHU TIN XIA","2428-2436 S WALLACE ST 1",CHICAGO,IL,60616,11,37,11-37,9,1475,"Consumption on Premises - Incidental Activity",638,"Consumption of Liquor on Premises",2652791,RENEW,NULL,10/15/2021,07/12/2022,N,12/16/2021,03/15/2024,07/12/2022,08/09/2022,AAI,NULL,NULL,41.848386251,-87.641960078,"(41.84838625123219, -87.64196007758322)","2022-10-06 12:53:44",test,NULL,"2022-07-12 00:00:00","2021-12-16 00:00:00","2024-03-15 00:00:00","2022-08-09 00:00:00",NULL
19756-20150316,2375548,28862,1,"JNS INC","JNS INC","127 N WOOD DALE RD  1","WOOD DALE",IL,60191,NULL,NULL,NULL,NULL,1010,"Limited Business License",NULL,NULL,19756,RENEW,NULL,01/16/2015,02/26/2015,N,03/16/2015,03/15/2017,02/26/2015,02/27/2015,AAI,NULL,NULL,NULL,NULL,NULL,"2022-10-06 12:53:44",test,NULL,"2015-02-26 00:00:00","2015-03-16 00:00:00","2017-03-15 00:00:00","2015-02-27 00:00:00",NULL
2684873-20191231,2684873,361790,10,"JS FORT GROUP, INC","JIMMY JOHN'S 3106","721 S SEELEY AVE",CHICAGO,IL,60612,28,NULL,28-,NULL,1006,"Retail Food Establishment",781,"Sale of Food Prepared Onsite With Dining Area",2684873,ISSUE,08/14/2019,08/14/2019,08/30/2019,N,12/31/2019,10/15/2021,12/31/2019,12/31/2019,AAI,NULL,NULL,41.872527531,-87.677441696,"(41.87252753139634, -87.67744169620713)","2022-10-06 12:53:44",test,"2019-08-14 00:00:00","2019-08-30 00:00:00","2019-12-31 00:00:00","2021-10-15 00:00:00","2019-12-31 00:00:00",NULL
2185459-20220916,2858384,66224,3,"YONG S LEE","A Plus Flowers INC","227 W MONROE ST 1ST",CHICAGO,IL,60606,42,49,42-49,1,1010,"Limited Business License",NULL,NULL,2185459,RENEW,NULL,07/15/2022,08/08/2022,N,09/16/2022,09/15/2024,08/08/2022,08/09/2022,AAI,NULL,NULL,41.88053925,-87.634592464,"(41.88053924995021, -87.63459246351388)","2022-10-06 12:53:44",test,NULL,"2022-08-08 00:00:00","2022-09-16 00:00:00","2024-09-15 00:00:00","2022-08-09 00:00:00",NULL
1937618-20220616,2863410,64478,3,"RON HOY","HOYPOLOI O'HARE","11601 W TOUHY AVE TERMINAL T1 B6",CHICAGO,IL,60666,41,27,41-27,16,1010,"Limited Business License",NULL,NULL,1937618,RENEW,NULL,08/09/2022,08/09/2022,N,06/16/2022,06/15/2024,08/09/2022,08/09/2022,AAI,NULL,NULL,42.008536401,-87.914428439,"(42.008536400868735, -87.91442843927047)","2022-10-06 12:53:44",test,NULL,"2022-08-09 00:00:00","2022-06-16 00:00:00","2024-06-15 00:00:00","2022-08-09 00:00:00",NULL
49347-20220816,2852107,17164,1,"CLUB PARADISE","PARADISE CLUB","4300 W CERMAK RD",CHICAGO,IL,60623,24,58,24-58,10,1473,"Not-For-Profit Club",639,"Consumption of Liquor on Premises - Not for Profit",49347,RENEW,NULL,06/15/2022,08/08/2022,N,08/16/2022,08/15/2024,08/08/2022,08/09/2022,AAI,NULL,NULL,41.851543684,-87.732199832,"(41.851543684489044, -87.7321998316158)","2022-10-06 12:53:44",test,NULL,"2022-08-08 00:00:00","2022-08-16 00:00:00","2024-08-15 00:00:00","2022-08-09 00:00:00",NULL
2595122-20211016,2805795,361790,7,"JS FORT GROUP, INC","JIMMY JOHN'S","2810 N CLARK ST 1",CHICAGO,IL,60657,44,NULL,44-,NULL,1006,"Retail Food Establishment",781,"Sale of Food Prepared Onsite With Dining Area",2595122,RENEW,NULL,08/15/2021,08/18/2021,N,10/16/2021,10/15/2023,08/18/2021,01/24/2022,AAI,NULL,8,41.933059384,-87.645265843,"(41.93305938442793, -87.64526584295888)","2022-10-06 12:53:44",test,NULL,"2021-08-18 00:00:00","2021-10-16 00:00:00","2023-10-15 00:00:00","2022-01-24 00:00:00",NULL
2621924-20220916,2861697,430664,1,"Stanley Chan","Stan Chan Consulting","864 W ROSCOE ST 1",CHICAGO,IL,60657,44,NULL,44-,NULL,4404,"Regulated Business License",719,"Professional Consulting (Home Based Business)",2621924,RENEW,NULL,07/15/2022,08/08/2022,N,09/16/2022,09/15/2024,08/08/2022,08/09/2022,AAI,NULL,18,41.943690792,-87.651813432,"(41.94369079201355, -87.6518134324388)","2022-10-06 12:53:44",test,NULL,"2022-08-08 00:00:00","2022-09-16 00:00:00","2024-09-15 00:00:00","2022-08-09 00:00:00",NULL
2863370-20220809,2863370,346743,5,"TEJAS YOGA INC.","TEJAS YOGA","141 W JACKSON BLVD  750",CHICAGO,IL,60604,42,9,42-9,1,4404,"Regulated Business License",927,"Yoga Instruction",2863370,C_LOC,08/09/2022,08/09/2022,08/09/2022,N,08/09/2022,10/15/2024,08/09/2022,08/09/2022,AAI,NULL,NULL,41.878025655,-87.632062286,"(41.878025655260835, -87.63206228626693)","2022-10-06 12:53:44",test,"2022-08-09 00:00:00","2022-08-09 00:00:00","2022-08-09 00:00:00","2024-10-15 00:00:00","2022-08-09 00:00:00",NULL
2622807-20220916,2861751,431042,1,"MICHAEL HARRIS","MICHAEL HARRIS","[REDACTED FOR PRIVACY]",CHICAGO,IL,60649,5,32,5-32,3,7009,"Pharmaceutical Representative",990,"Markets / Promotes Pharmaceuticals to Health Care Professionals and Conducts Business for More than 15 Calendar Days per Year",2622807,RENEW,NULL,07/15/2022,08/08/2022,N,09/16/2022,09/15/2023,08/08/2022,08/09/2022,AAI,NULL,NULL,NULL,NULL,NULL,"2022-10-06 12:53:44",test,NULL,"2022-08-08 00:00:00","2022-09-16 00:00:00","2023-09-15 00:00:00","2022-08-09 00:00:00",NULL
2713301-20220316,2830346,466476,1,"Global Grill Group LLC","Outpost Mexican Eatery","520 W HARRISON ST",CHICAGO,IL,60607,25,NULL,25-,NULL,1006,"Retail Food Establishment",781,"Sale of Food Prepared Onsite With Dining Area",2713301,RENEW,NULL,01/15/2022,08/09/2022,N,03/16/2022,03/15/2024,08/09/2022,08/09/2022,AAI,NULL,NULL,41.874505,-87.640466414,"(41.874504999844035, -87.64046641424397)","2022-10-06 12:53:44",test,NULL,"2022-08-09 00:00:00","2022-03-16 00:00:00","2024-03-15 00:00:00","2022-08-09 00:00:00",NULL
2549922-20220916,2861375,419898,1,"AMY EGAN","AMY EGAN","[REDACTED FOR PRIVACY]","ORLAND PARK",IL,60462,NULL,NULL,NULL,NULL,7009,"Pharmaceutical Representative",990,"Markets / Promotes Pharmaceuticals to Health Care Professionals and Conducts Business for More than 15 Calendar Days per Year",2549922,RENEW,NULL,07/15/2022,08/08/2022,N,09/16/2022,09/15/2023,08/08/2022,08/09/2022,AAI,NULL,NULL,NULL,NULL,NULL,"2022-10-06 12:53:44",test,NULL,"2022-08-08 00:00:00","2022-09-16 00:00:00","2023-09-15 00:00:00","2022-08-09 00:00:00",NULL
2463579-20171206,2463579,361790,5,"JS FORT GROUP, INC","JIMMY JOHN'S","3328 N CLARK ST 1ST",CHICAGO,IL,60657,44,20,44-20,19,1006,"Retail Food Establishment",781,"Sale of Food Prepared Onsite With Dining Area",2463579,ISSUE,04/26/2016,04/26/2016,04/26/2016,N,12/06/2017,10/15/2019,12/05/2017,12/06/2017,AAI,NULL,17,41.942396127,-87.652823894,"(41.942396126778384, -87.65282389448343)","2022-10-06 12:53:44",test,"2016-04-26 00:00:00","2016-04-26 00:00:00","2017-12-06 00:00:00","2019-10-15 00:00:00","2017-12-06 00:00:00",NULL
2354004-20220816,2854695,392882,1,"1910 NORTH MILWAUKEE OPERATIONS, LLC",REMEDY,"1910 N MILWAUKEE AVE",CHICAGO,IL,60647,32,31,32-31,14,1470,Tavern,829,"Tavern - Consumption of Liquor on Premise",2354004,RENEW,NULL,06/15/2022,08/08/2022,N,08/16/2022,08/15/2024,08/08/2022,08/09/2022,AAI,NULL,33,41.916111429,-87.686539654,"(41.916111429177185, -87.68653965381526)","2022-10-06 12:53:44",test,NULL,"2022-08-08 00:00:00","2022-08-16 00:00:00","2024-08-15 00:00:00","2022-08-09 00:00:00",NULL
66701-20100816,2038871,43749,1,"CAROLINA'S SILVER INCORPORATED","CAROLINA'S SILVER INCORPORATED","3115 W 26TH ST  313,229F2",CHICAGO,IL,60623,12,6,12-6,10,1010,"Limited Business License",NULL,NULL,66701,RENEW,NULL,06/15/2010,08/14/2010,N,08/16/2010,08/15/2012,08/14/2010,08/16/2010,AAI,NULL,NULL,NULL,NULL,NULL,"2022-10-06 12:53:44",test,NULL,"2010-08-14 00:00:00","2010-08-16 00:00:00","2012-08-15 00:00:00","2010-08-16 00:00:00",NULL
2446881-20220916,2859783,324864,2,"TRADESTATION SECURITIES, INC.","TRADESTATION SECURITIES, INC.","120 S RIVERSIDE PLZ 16TH 1650",CHICAGO,IL,60606,42,12,42-12,1,1010,"Limited Business License",708,"Miscellaneous Commercial Services",2446881,RENEW,NULL,07/15/2022,08/08/2022,N,09/16/2022,09/15/2024,08/08/2022,08/09/2022,AAI,NULL,NULL,41.879923306,-87.638802539,"(41.8799233059124, -87.63880253891776)","2022-10-06 12:53:44",test,NULL,"2022-08-08 00:00:00","2022-09-16 00:00:00","2024-09-15 00:00:00","2022-08-09 00:00:00",NULL
2142540-20220916,2859729,320196,2,"COMPREHENSIVE CONSTRUCTION CONSULTING, INC.","COMPREHENSIVE CONSTRUCTION CONSULTING, INC.","53 W JACKSON BLVD 9TH 915",CHICAGO,IL,60604,4,21,4-21,1,1010,"Limited Business License",NULL,NULL,2142540,RENEW,NULL,07/15/2022,08/08/2022,N,09/16/2022,09/15/2024,08/08/2022,08/09/2022,AAI,NULL,NULL,41.878050681,-87.629781008,"(41.878050680824906, -87.62978100842273)","2022-10-06 12:53:44",test,NULL,"2022-08-08 00:00:00","2022-09-16 00:00:00","2024-09-15 00:00:00","2022-08-09 00:00:00",NULL
2831103-20220916,2857855,16678,6,"BEAU'S INC","Tri-Star Catering","1629 W GRAND AVE 1",CHICAGO,IL,60622,1,NULL,1-,NULL,1006,"Retail Food Establishment",760,"Retail Sale of Food for Offsite Consumption",2831103,RENEW,NULL,07/15/2022,08/08/2022,N,09/16/2022,09/15/2024,08/08/2022,08/09/2022,AAI,NULL,NULL,41.890855515,-87.668302898,"(41.89085551482435, -87.66830289784055)","2022-10-06 12:53:44",test,NULL,"2022-08-08 00:00:00","2022-09-16 00:00:00","2024-09-15 00:00:00","2022-08-09 00:00:00",NULL
2065300-20220916,2859778,324608,2,"MILK & HONEY GRANOLA, LLC","MILK & HONEY GRANOLA","627 N ALBANY AVE 1ST 170",CHICAGO,IL,60612,27,49,27-49,12,1007,"Wholesale Food Establishment",864,"Wholesale Food Sales",2065300,RENEW,NULL,07/15/2022,08/08/2022,N,09/16/2022,09/15/2024,08/08/2022,08/09/2022,AAI,NULL,NULL,41.892754104,-87.703860269,"(41.89275410387521, -87.70386026922512)","2022-10-06 12:53:44",test,NULL,"2022-08-08 00:00:00","2022-09-16 00:00:00","2024-09-15 00:00:00","2022-08-09 00:00:00",NULL
2120056-20140616,2322682,64478,4,"RON HOY","HOYPOLOI O'HARE","11601 W TOUHY AVE TERMINAL T2-E5",CHICAGO,IL,60666,41,27,41-27,16,1010,"Limited Business License",NULL,NULL,2120056,RENEW,NULL,04/15/2014,06/04/2014,N,06/16/2014,06/15/2016,06/04/2014,06/13/2014,AAI,NULL,NULL,42.008536401,-87.914428439,"(42.008536400868735, -87.91442843927047)","2022-10-06 12:53:44",test,NULL,"2014-06-04 00:00:00","2014-06-16 00:00:00","2016-06-15 00:00:00","2014-06-13 00:00:00",NULL
2776428-20220516,2839783,473703,1,"KOSTNER BANDAR, INC.","KOSTNER BANDAR","400 S KOSTNER AVE",CHICAGO,IL,60624,28,NULL,28-,NULL,1781,Tobacco,"776 | 936 | 937","Retail Sales of Tobacco Products | Retail Sales of Tobacco Accessories | Retail Sales of Tobacco and Flavored Tobacco Products",2776428,RENEW,NULL,03/15/2022,08/08/2022,N,05/16/2022,05/15/2023,08/08/2022,08/09/2022,AAI,NULL,NULL,41.875096255,-87.735429919,"(41.875096254529815, -87.7354299190151)","2022-10-06 12:53:44",test,NULL,"2022-08-08 00:00:00","2022-05-16 00:00:00","2023-05-15 00:00:00","2022-08-09 00:00:00",NULL
1879920-20220916,2859790,325064,1,"SPRI PARTNERS, LLC","SPR Consulting","233 S WACKER DR 35 3500",CHICAGO,IL,60606,42,12,42-12,1,1010,"Limited Business License",NULL,NULL,1879920,RENEW,NULL,07/15/2022,08/08/2022,N,09/16/2022,09/15/2024,08/08/2022,08/09/2022,AAI,NULL,NULL,41.878560154,-87.636523872,"(41.87856015362371, -87.63652387205532)","2022-10-06 12:53:44",test,NULL,"2022-08-08 00:00:00","2022-09-16 00:00:00","2024-09-15 00:00:00","2022-08-09 00:00:00",NULL
1576601-20220916,2859089,276156,1,"BOCKWINKEL'S AT PARK MILLENNIUM, INC.",BOCKWINKELS,"222 N COLUMBUS DR 1ST",CHICAGO,IL,60601,42,44,42-44,1,1474,"Package Goods",774,"Retail Sales of Packaged Liquor",1576601,RENEW,NULL,07/15/2022,08/08/2022,N,09/16/2022,09/15/2024,08/08/2022,08/09/2022,AAI,NULL,NULL,41.886339416,-87.62083615,"(41.886339416011204, -87.62083614995649)","2022-10-06 12:53:44",test,NULL,"2022-08-08 00:00:00","2022-09-16 00:00:00","2024-09-15 00:00:00","2022-08-09 00:00:00",NULL
2125164-20220916,2859555,313307,3,"CAREERS IN NONPROFITS, INC.","CAREERS IN NONPROFITS","33 N DEARBORN ST 16 1610",CHICAGO,IL,60602,42,9,42-9,1,1010,"Limited Business License",NULL,NULL,2125164,RENEW,NULL,07/15/2022,08/08/2022,N,09/16/2022,09/15/2024,08/08/2022,08/09/2022,AAI,NULL,1,41.882806227,-87.629281496,"(41.88280622661767, -87.62928149568309)","2022-10-06 12:53:44",test,NULL,"2022-08-08 00:00:00","2022-09-16 00:00:00","2024-09-15 00:00:00","2022-08-09 00:00:00",NULL
2622824-20220916,2861754,431049,1,"Jon Taccona","Outlier Audio","5342 N NORTHWEST HWY",CHICAGO,IL,60630,45,NULL,45-,NULL,1010,"Limited Business License",652,"Electronic Equipment Repair",2622824,RENEW,NULL,07/15/2022,08/08/2022,N,09/16/2022,09/15/2024,08/08/2022,08/09/2022,AAI,NULL,NULL,41.977464175,-87.772745738,"(41.977464175215516, -87.77274573784965)","2022-10-06 12:53:44",test,NULL,"2022-08-08 00:00:00","2022-09-16 00:00:00","2024-09-15 00:00:00","2022-08-09 00:00:00",NULL
2862494-20220809,2862494,487792,1,"Mandala Cafe, LLC","Mandala Cafe","1641 W 18TH ST",CHICAGO,IL,60608,25,NULL,25-,NULL,1006,"Retail Food Establishment",781,"Sale of Food Prepared Onsite With Dining Area",2862494,ISSUE,07/20/2022,07/20/2022,07/20/2022,N,08/09/2022,08/15/2024,08/09/2022,08/09/2022,AAI,NULL,NULL,41.857657044,-87.667893985,"(41.85765704388003, -87.66789398532075)","2022-10-06 12:53:44",test,"2022-07-20 00:00:00","2022-07-20 00:00:00","2022-08-09 00:00:00","2024-08-15 00:00:00","2022-08-09 00:00:00",NULL
66701-20040816,1502973,43749,1,"CAROLINA'S SILVER INCORPORATED","CAROLINA'S SILVER INCORPORATED","3115 W 26TH ST  313,229F2",CHICAGO,IL,60623,12,6,12-6,10,1010,"Limited Business License",NULL,NULL,66701,RENEW,NULL,06/30/2004,08/16/2004,N,08/16/2004,08/15/2005,08/16/2004,08/17/2004,AAI,NULL,NULL,NULL,NULL,NULL,"2022-10-06 12:53:44",test,NULL,"2004-08-16 00:00:00","2004-08-16 00:00:00","2005-08-15 00:00:00","2004-08-17 00:00:00",NULL
2677225-20220124,2677225,361790,9,"JS FORT GROUP, INC","JIMMY JOHN'S","1519 E 55TH ST",CHICAGO,IL,60615,5,NULL,5-,NULL,1006,"Retail Food Establishment",781,"Sale of Food Prepared Onsite With Dining Area",2677225,ISSUE,06/20/2019,06/20/2019,06/20/2019,N,01/24/2022,10/15/2021,08/19/2021,01/24/2022,AAI,NULL,61,41.795082532,-87.588312939,"(41.795082532364255, -87.58831293902966)","2022-10-06 12:53:44",test,"2019-06-20 00:00:00","2019-06-20 00:00:00","2022-01-24 00:00:00","2021-10-15 00:00:00","2022-01-24 00:00:00",NULL
1046974-20150416,2381694,88608,2,"CHAMPION ROOFING, INC.","CHAMPION ROOFING, INC.","6515 N MONTICELLO AVE  1ST",LINCOLNWOOD,IL,60712,NULL,NULL,NULL,NULL,1010,"Limited Business License",NULL,NULL,1046974,RENEW,NULL,02/15/2015,03/02/2015,N,04/16/2015,04/15/2017,03/02/2015,03/03/2015,AAI,NULL,NULL,NULL,NULL,NULL,"2022-10-06 12:53:44",test,NULL,"2015-03-02 00:00:00","2015-04-16 00:00:00","2017-04-15 00:00:00","2015-03-03 00:00:00",NULL
2463985-20220816,2854762,403643,1,"NATIONAL MARKETPLACE LLC","REVIVAL FOOD HALL","125 S CLARK ST",CHICAGO,IL,60603,42,9,42-9,1,1474,"Package Goods",774,"Retail Sales of Packaged Liquor",2463985,RENEW,NULL,06/15/2022,08/08/2022,N,08/16/2022,08/15/2024,08/08/2022,08/09/2022,AAI,NULL,NULL,41.879988513,-87.630688841,"(41.87998851304621, -87.63068884103124)","2022-10-06 12:53:44",test,NULL,"2022-08-08 00:00:00","2022-08-16 00:00:00","2024-08-15 00:00:00","2022-08-09 00:00:00",NULL
2840021-20220809,2840021,484014,1,"WEST JACKSON ORD5 LLC","FOOD ROCKET","901 W JACKSON BLVD  103",CHICAGO,IL,60607,25,3,25-3,12,1006,"Retail Food Establishment","640 | 736 | 775","Deli, Butcher or Bakery | Preparation of Food, Coffee or Drinks | Retail Sales of Perishable Foods",2840021,ISSUE,03/17/2022,07/15/2022,07/28/2022,N,08/09/2022,08/15/2024,08/09/2022,08/09/2022,AAI,NULL,NULL,41.877799273,-87.649633928,"(41.87779927285466, -87.64963392770662)","2022-10-06 12:53:44",test,"2022-03-17 00:00:00","2022-07-28 00:00:00","2022-08-09 00:00:00","2024-08-15 00:00:00","2022-08-09 00:00:00",NULL
2215436-20220916,2860594,374923,1,"SAPO LLC","DANIEL'S BODY SHOP","3417-3419 W CERMAK RD GROUND",CHICAGO,IL,60623,22,22,22-22,10,8340,"Motor Vehicle Services License",711,"Motor Vehicle Repair - Engine and Body Work",2215436,RENEW,NULL,07/15/2022,08/08/2022,N,09/16/2022,09/15/2024,08/08/2022,08/09/2022,AAI,NULL,NULL,41.851545503,-87.71081698,"(41.85154550293371, -87.71081698014888)","2022-10-06 12:53:44",test,NULL,"2022-08-08 00:00:00","2022-09-16 00:00:00","2024-09-15 00:00:00","2022-08-09 00:00:00",NULL
2641411-20220816,2851712,6214,2,"MORENO'S DISCOUNT LIQUORS, INC.","OSITO'S TAP","2553 S RIDGEWAY AVE 1",CHICAGO,IL,60623,22,13,22-13,10,1470,Tavern,"767 | 829 | 904","Retail Sales of General Merchandise and Non-Perishable Food | Tavern - Consumption of Liquor on Premise | Retail Sales of General Merchandise",2641411,RENEW,NULL,06/15/2022,08/08/2022,N,08/16/2022,08/15/2024,08/08/2022,08/09/2022,AAI,NULL,25,41.844597188,-87.718312551,"(41.84459718759861, -87.71831255053898)","2022-10-06 12:53:44",test,NULL,"2022-08-08 00:00:00","2022-08-16 00:00:00","2024-08-15 00:00:00","2022-08-09 00:00:00",NULL
2595122-20180807,2595122,361790,7,"JS FORT GROUP, INC","JIMMY JOHN'S","2810 N CLARK ST 1",CHICAGO,IL,60657,44,NULL,44-,NULL,1006,"Retail Food Establishment",781,"Sale of Food Prepared Onsite With Dining Area",2595122,ISSUE,04/24/2018,04/24/2018,04/25/2018,N,08/07/2018,10/15/2019,08/06/2018,08/07/2018,AAI,NULL,8,41.933059384,-87.645265843,"(41.93305938442793, -87.64526584295888)","2022-10-06 12:53:44",test,"2018-04-24 00:00:00","2018-04-25 00:00:00","2018-08-07 00:00:00","2019-10-15 00:00:00","2018-08-07 00:00:00",NULL
1798504-20220916,2857584,7043,4,"THE AUTO CLUB GROUP","AAA CHICAGO","307 N MICHIGAN AVE  104",CHICAGO,IL,60601,42,44,42-44,1,1010,"Limited Business License",NULL,NULL,1798504,RENEW,NULL,07/15/2022,08/08/2022,N,09/16/2022,09/15/2024,08/08/2022,08/09/2022,AAI,NULL,NULL,41.887004423,-87.624394657,"(41.88700442325107, -87.62439465711454)","2022-10-06 12:53:44",test,NULL,"2022-08-08 00:00:00","2022-09-16 00:00:00","2024-09-15 00:00:00","2022-08-09 00:00:00",NULL
2863351-20220809,2863351,7103,3,"KEE SOON YANG","LAVANDARIA SUNSHINE","3448 W 26TH ST",CHICAGO,IL,60623,22,22,22-22,10,4404,"Regulated Business License",692,"Laundromat - Self Service",2863351,ISSUE,NULL,08/08/2022,NULL,N,08/09/2022,12/15/2023,08/08/2022,08/09/2022,AAI,NULL,25,41.844533372,-87.711869687,"(41.84453337185048, -87.71186968703314)","2022-10-06 12:53:44",test,NULL,NULL,"2022-08-09 00:00:00","2023-12-15 00:00:00","2022-08-09 00:00:00",NULL
1520584-20220916,2858595,223265,2,"HARRINGTON TECHNOLOGY ASSOCIATES, INC.","HTA TECHNOLOGY SECURITY CONSULTING","30 S WACKER DR 22ND",CHICAGO,IL,60606,42,12,42-12,1,1010,"Limited Business License",NULL,NULL,1520584,RENEW,NULL,07/15/2022,08/08/2022,N,09/16/2022,09/15/2024,08/08/2022,08/09/2022,AAI,NULL,NULL,41.881407212,-87.637155093,"(41.88140721163485, -87.63715509324663)","2022-10-06 12:53:44",test,NULL,"2022-08-08 00:00:00","2022-09-16 00:00:00","2024-09-15 00:00:00","2022-08-09 00:00:00",NULL
1921530-20220916,2859945,334763,1,"RIVERSIDE PLAZA DEVELOPMENT, INC.","JIMMY JOHNS","2 N RIVERSIDE PLZ 2ND",CHICAGO,IL,60606,42,21,42-21,1,1006,"Retail Food Establishment",775,"Retail Sales of Perishable Foods",1921530,RENEW,NULL,07/15/2022,08/08/2022,N,09/16/2022,09/15/2024,08/08/2022,08/09/2022,AAI,NULL,NULL,41.881977048,-87.63887584,"(41.88197704758362, -87.63887583987513)","2022-10-06 12:53:44",test,NULL,"2022-08-08 00:00:00","2022-09-16 00:00:00","2024-09-15 00:00:00","2022-08-09 00:00:00",NULL
46781-20220916,2858448,86227,2,"USG ITALIAN MARKETCAFFE LLC","SOPRAFFINA MARKETCAFFE","222 W ADAMS ST",CHICAGO,IL,60606,42,49,42-49,1,1006,"Retail Food Establishment",775,"Retail Sales of Perishable Foods",46781,RENEW,NULL,07/15/2022,08/08/2022,N,09/16/2022,09/15/2024,08/08/2022,08/09/2022,AAI,NULL,NULL,41.879487754,-87.634442228,"(41.879487753534356, -87.63444222788623)","2022-10-06 12:53:44",test,NULL,"2022-08-08 00:00:00","2022-09-16 00:00:00","2024-09-15 00:00:00","2022-08-09 00:00:00",NULL
1548226-20220916,2859139,285852,1,"NORTH STAR INVESTMENT SERVICES INC","NORTH STAR INVEST. SER.","20 N WACKER DR  1416",CHICAGO,IL,60606,42,9,42-9,1,1010,"Limited Business License",NULL,NULL,1548226,RENEW,NULL,07/15/2022,08/08/2022,N,09/16/2022,09/15/2024,08/08/2022,08/09/2022,AAI,NULL,NULL,41.882410906,-87.63717471,"(41.88241090648542, -87.63717471046387)","2022-10-06 12:53:44",test,NULL,"2022-08-08 00:00:00","2022-09-16 00:00:00","2024-09-15 00:00:00","2022-08-09 00:00:00",NULL
2511697-20191016,2687054,361790,6,"JS FORT GROUP, INC","JIMMY JOHN'S","3506 S STATE ST 1ST FLOOR 1B",CHICAGO,IL,60609,3,23,3-23,2,1006,"Retail Food Establishment",735,"Preparation of Food and Dining on Premise With Seating",2511697,RENEW,NULL,08/15/2019,08/30/2019,N,10/16/2019,10/15/2021,08/30/2019,09/03/2019,AAI,NULL,NULL,41.830782181,-87.626790176,"(41.83078218057412, -87.62679017621963)","2022-10-06 12:53:44",test,NULL,"2019-08-30 00:00:00","2019-10-16 00:00:00","2021-10-15 00:00:00","2019-09-03 00:00:00",NULL
1495885-20220816,2853368,278541,1,"ROSA MARTINEZ","ANDY'S GROCERY","2300 S TROY ST",CHICAGO,IL,60623,12,57,12-57,10,1006,"Retail Food Establishment",775,"Retail Sales of Perishable Foods",1495885,RENEW,NULL,06/15/2022,08/08/2022,N,08/16/2022,08/15/2024,08/08/2022,08/09/2022,AAI,NULL,NULL,41.849873984,-87.704117377,"(41.849873983973254, -87.70411737665296)","2022-10-06 12:53:44",test,NULL,"2022-08-08 00:00:00","2022-08-16 00:00:00","2024-08-15 00:00:00","2022-08-09 00:00:00",NULL
1043396-20150416,2381719,202329,1,"STERLING INDUSTRIAL REFRIGERATION, INC","STERLING INDUSTRIAL REFRIGERATION, INC","600  AIRPORT BLVD  100",MORRISVILLE,NC,27560,NULL,NULL,NULL,NULL,1010,"Limited Business License",NULL,NULL,1043396,RENEW,NULL,02/15/2015,02/27/2015,N,04/16/2015,04/15/2017,02/27/2015,03/03/2015,AAI,NULL,NULL,NULL,NULL,NULL,"2022-10-06 12:53:44",test,NULL,"2015-02-27 00:00:00","2015-04-16 00:00:00","2017-04-15 00:00:00","2015-03-03 00:00:00",NULL
2863333-20220809,2863333,398443,8,"781 NORTH MILWAUKEE LLC",GIORDANO'S,"6709 N NORTHWEST HWY",CHICAGO,IL,60631,41,5,41-5,16,1329,"Special Event Food",942,"5 Day Single Event  - Special Event Food",2863333,ISSUE,08/08/2022,08/08/2022,08/08/2022,N,08/09/2022,08/15/2022,08/08/2022,08/09/2022,AAI,NULL,NULL,42.003062035,-87.816373718,"(42.003062035390926, -87.81637371807534)","2022-10-06 12:53:44",test,"2022-08-08 00:00:00","2022-08-08 00:00:00","2022-08-09 00:00:00","2022-08-15 00:00:00","2022-08-09 00:00:00",NULL
48621-20150416,2381275,56322,1,"CLARENCE DAVIDS & COMPANY","CLARENCE DAVIDS & COMPANY","22901 S RIDGELAND AVE  1",MATTESON,IL,60443,NULL,NULL,NULL,NULL,1010,"Limited Business License",NULL,NULL,48621,RENEW,NULL,02/15/2015,03/02/2015,N,04/16/2015,04/15/2017,03/02/2015,03/03/2015,AAI,NULL,NULL,NULL,NULL,NULL,"2022-10-06 12:53:44",test,NULL,"2015-03-02 00:00:00","2015-04-16 00:00:00","2017-04-15 00:00:00","2015-03-03 00:00:00",NULL
1681578-20071116,1866132,302020,1,"CHICAGO JIUJITSU, INC","Redzovic Jiu Jitsu","4900 N LINCOLN AVE",CHICAGO,IL,60625,40,3,40-3,20,1010,"Limited Business License",NULL,NULL,1681578,RENEW,NULL,09/21/2007,11/07/2007,N,11/16/2007,09/15/2009,11/07/2007,11/08/2007,AAI,NULL,21,41.970812027,-87.690108461,"(41.970812027202975, -87.69010846133787)","2022-10-06 12:53:44",test,NULL,"2007-11-07 00:00:00","2007-11-16 00:00:00","2009-09-15 00:00:00","2007-11-08 00:00:00",NULL
2863359-20220809,2863359,488443,1,"IMPORTMEX CORPORATION","IMPORTMEX CORPORATION","6146 S ARCHER AVE",CHICAGO,IL,60638,23,NULL,23-,NULL,1010,"Limited Business License",911,"Retail Sales of Clothing / Accessories / Shoes",2863359,ISSUE,08/08/2022,08/08/2022,08/08/2022,N,08/09/2022,08/15/2024,08/08/2022,08/09/2022,AAI,NULL,NULL,41.794318697,-87.772206083,"(41.79431869707475, -87.77220608306601)","2022-10-06 12:53:44",test,"2022-08-08 00:00:00","2022-08-08 00:00:00","2022-08-09 00:00:00","2024-08-15 00:00:00","2022-08-09 00:00:00",NULL
2713029-20220816,2855742,466332,1,"GTS FAST FOOD INC.,","SHABANI'S GTS FAST FOOD","5016 N PULASKI RD 1ST",CHICAGO,IL,60630,39,8,39-8,17,1006,"Retail Food Establishment",781,"Sale of Food Prepared Onsite With Dining Area",2713029,RENEW,NULL,06/15/2022,08/08/2022,N,08/16/2022,08/15/2024,08/08/2022,08/09/2022,AAI,NULL,NULL,41.972405855,-87.728291501,"(41.97240585532906, -87.72829150056414)","2022-10-06 12:53:44",test,NULL,"2022-08-08 00:00:00","2022-08-16 00:00:00","2024-08-15 00:00:00","2022-08-09 00:00:00",NULL
56270-20060216,1660687,57715,1,"W & G MECHANICAL INC","PROTECH SYSTEMS, LTD","9  CORNELL DR  1",LINCOLNSHIRE,IL,60069,NULL,NULL,NULL,NULL,1010,"Limited Business License",NULL,NULL,56270,RENEW,NULL,12/21/2005,01/20/2006,N,02/16/2006,02/15/2007,01/20/2006,01/23/2006,AAI,NULL,NULL,NULL,NULL,NULL,"2022-10-06 12:53:44",test,NULL,"2006-01-20 00:00:00","2006-02-16 00:00:00","2007-02-15 00:00:00","2006-01-23 00:00:00",NULL
2601204-20220716,2849495,427997,1,"FEDERICA LUNA--REGALADO","TACOS DON MEMO","10536 S TORRENCE AVE 1ST",CHICAGO,IL,60617,10,13,10-13,4,1006,"Retail Food Establishment",781,"Sale of Food Prepared Onsite With Dining Area",2601204,RENEW,NULL,05/15/2022,08/09/2022,N,07/16/2022,07/15/2024,08/09/2022,08/09/2022,AAI,NULL,NULL,41.703482872,-87.55975999,"(41.70348287190127, -87.55975998992695)","2022-10-06 12:53:44",test,NULL,"2022-08-09 00:00:00","2022-07-16 00:00:00","2024-07-15 00:00:00","2022-08-09 00:00:00",NULL
1932213-20210816,2793843,296374,4,"ADRIAN OLMEDO SR.","ROYAL PRESTIGE HOGARMEX","3115 W 26TH ST 1",CHICAGO,IL,60623,12,6,12-6,10,1010,"Limited Business License",NULL,NULL,1932213,RENEW,NULL,06/15/2021,08/08/2022,N,08/16/2021,08/15/2023,08/08/2022,08/09/2022,AAI,NULL,25,41.844428666,-87.703236873,"(41.844428665779, -87.70323687321932)","2022-10-06 12:53:44",test,NULL,"2022-08-08 00:00:00","2021-08-16 00:00:00","2023-08-15 00:00:00","2022-08-09 00:00:00",NULL
1842466-20220916,2858055,29686,3,"LA ESPANOLA FOOD DISTRIBUTION CORPORATION","LA ESPANOLA FOOD DISTRIBUTION CORPORATION","401 N OAKLEY BLVD 1 & 2",CHICAGO,IL,60612,27,27,27-27,12,1007,"Wholesale Food Establishment",864,"Wholesale Food Sales",1842466,RENEW,NULL,07/15/2022,08/08/2022,N,09/16/2022,09/15/2024,08/08/2022,08/09/2022,AAI,NULL,NULL,41.888627142,-87.684037515,"(41.88862714182406, -87.68403751481831)","2022-10-06 12:53:44",test,NULL,"2022-08-08 00:00:00","2022-09-16 00:00:00","2024-09-15 00:00:00","2022-08-09 00:00:00",NULL
2016699-20220716,2847513,270103,2,"BEAR NECESSITIES PEDIATRIC CANCER FOUNDATION INC.","BEAR NECESSITIES PEDIATRIC CANCER FOUNDATION","55 W WACKER DR 11TH 1100",CHICAGO,IL,60601,42,9,42-9,1,1625,Raffles,720,"Not-For-Profit Selling Raffles for Prizes of $50 or More",2016699,RENEW,NULL,05/15/2022,05/27/2022,N,07/16/2022,07/15/2023,05/27/2022,08/09/2022,AAI,NULL,NULL,41.886706932,-87.63006619,"(41.88670693228625, -87.63006619014621)","2022-10-06 12:53:44",test,NULL,"2022-05-27 00:00:00","2022-07-16 00:00:00","2023-07-15 00:00:00","2022-08-09 00:00:00",NULL
1873522-20220916,2858217,58423,3,"MARQUETTE ASSOCIATES, INC.","MARQUETTE ASSOCIATES, INC.","180 N LA SALLE ST 35 3500",CHICAGO,IL,60601,42,9,42-9,1,1010,"Limited Business License",897,"Financial Services Commercial Office",1873522,RENEW,NULL,07/15/2022,08/09/2022,N,09/16/2022,09/15/2024,08/09/2022,08/09/2022,AAI,NULL,NULL,41.885444388,-87.632582135,"(41.8854443881431, -87.6325821348462)","2022-10-06 12:53:44",test,NULL,"2022-08-09 00:00:00","2022-09-16 00:00:00","2024-09-15 00:00:00","2022-08-09 00:00:00",NULL
2862692-20220809,2862692,89119,19,"M.D.J. ALBERGA CORP","BELLA LUNA","731 N DEARBORN ST",CHICAGO,IL,60654,2,40,2-40,18,1329,"Special Event Food",942,"5 Day Single Event  - Special Event Food",2862692,ISSUE,07/25/2022,07/25/2022,08/08/2022,N,08/09/2022,08/14/2022,08/08/2022,08/09/2022,AAI,NULL,NULL,41.895773515,-87.629610541,"(41.89577351496085, -87.62961054088532)","2022-10-06 12:53:44",test,"2022-07-25 00:00:00","2022-08-08 00:00:00","2022-08-09 00:00:00","2022-08-14 00:00:00","2022-08-09 00:00:00",NULL
2184083-20220916,2860629,375237,1,"OSKA CHICAGO LLC",OSKA,"660 N WABASH AVE 1ST",CHICAGO,IL,60611,42,56,42-56,18,1010,"Limited Business License",911,"Retail Sales of Clothing / Accessories / Shoes",2184083,RENEW,NULL,07/15/2022,08/08/2022,N,09/16/2022,09/15/2024,08/08/2022,08/09/2022,AAI,NULL,NULL,41.894204391,-87.626934511,"(41.89420439097419, -87.6269345110322)","2022-10-06 12:53:44",test,NULL,"2022-08-08 00:00:00","2022-09-16 00:00:00","2024-09-15 00:00:00","2022-08-09 00:00:00",NULL
2732635-20220816,2854952,408888,1,"SIX NINE FOUR LLC","THE DANDY CROWN","694 N MILWAUKEE AVE 1-2",CHICAGO,IL,60642,27,1,27-1,12,1477,"Outdoor Patio",784,"Sale of Liquor Outdoors on Private Property",2732635,RENEW,NULL,06/15/2022,08/08/2022,N,08/16/2022,03/15/2024,08/08/2022,08/09/2022,AAI,NULL,29,41.894229784,-87.652520708,"(41.89422978422928, -87.65252070814081)","2022-10-06 12:53:44",test,NULL,"2022-08-08 00:00:00","2022-08-16 00:00:00","2024-03-15 00:00:00","2022-08-09 00:00:00",NULL
24657-20150416,2381188,52742,1,"M & O ENVIRONMENTAL COMPANY","M & O ENVIRONMENTAL COMPANY","17217  ASHLAND   1","HAZEL CREST",IL,60429,NULL,NULL,NULL,NULL,1010,"Limited Business License",NULL,NULL,24657,RENEW,NULL,02/15/2015,02/27/2015,N,04/16/2015,04/15/2017,02/27/2015,03/03/2015,AAI,NULL,NULL,NULL,NULL,NULL,"2022-10-06 12:53:44",test,NULL,"2015-02-27 00:00:00","2015-04-16 00:00:00","2017-04-15 00:00:00","2015-03-03 00:00:00",NULL
2744995-20220816,2856049,469216,1,"AMBROSIA HOMES DEVELOPMENT INCORPORATED","AMBROSIA HOMES","6730 N IONIA AVE",CHICAGO,IL,60646,41,NULL,41-,NULL,4404,"Regulated Business License",757,"Residential Real Estate Developer (Home Based Business)",2744995,RENEW,NULL,06/15/2022,08/08/2022,N,08/16/2022,08/15/2024,08/08/2022,08/09/2022,AAI,NULL,NULL,42.002859389,-87.765068428,"(42.00285938871634, -87.76506842791231)","2022-10-06 12:53:44",test,NULL,"2022-08-08 00:00:00","2022-08-16 00:00:00","2024-08-15 00:00:00","2022-08-09 00:00:00",NULL
2308130-20220316,2829310,367721,2,"HIRE THINKING, INC.","ADVANTAGE xPO","224 N DESPLAINES ST 3RD 300",CHICAGO,IL,60661,42,1,42-1,12,1010,"Limited Business License",635,"Commissioned Staffing of Professional, Secretarial and Clerical Work",2308130,RENEW,NULL,01/15/2022,06/14/2022,N,03/16/2022,03/15/2024,06/14/2022,08/09/2022,AAI,NULL,NULL,41.886561942,-87.644417313,"(41.88656194179193, -87.64441731288443)","2022-10-06 12:53:44",test,NULL,"2022-06-14 00:00:00","2022-03-16 00:00:00","2024-03-15 00:00:00","2022-08-09 00:00:00",NULL
2738309-20220816,2854613,392001,2,"CHOICE RECOVERY, INC.","Choice Recovery, Inc","1105  SCHROCK RD  700",COLUMBUS,OH,43229,NULL,NULL,NULL,NULL,4404,"Regulated Business License",912,"Debt Collecting - Administrative Commercial Office",2738309,RENEW,NULL,06/15/2022,08/08/2022,N,08/16/2022,08/15/2024,08/08/2022,08/09/2022,AAI,NULL,NULL,NULL,NULL,NULL,"2022-10-06 12:53:44",test,NULL,"2022-08-08 00:00:00","2022-08-16 00:00:00","2024-08-15 00:00:00","2022-08-09 00:00:00",NULL
2043289-20220916,2860311,354903,1,"thecreditbureau.com Inc.","Thecreditbureau.com Inc.","10 S RIVERSIDE PLZ 8TH 875",CHICAGO,IL,60606,42,12,42-12,1,1010,"Limited Business License",NULL,NULL,2043289,RENEW,NULL,07/15/2022,08/08/2022,N,09/16/2022,09/15/2024,08/08/2022,08/09/2022,AAI,NULL,NULL,41.881664289,-87.638887444,"(41.881664289382925, -87.63888744408949)","2022-10-06 12:53:44",test,NULL,"2022-08-08 00:00:00","2022-09-16 00:00:00","2024-09-15 00:00:00","2022-08-09 00:00:00",NULL
66701-20050816,1604682,43749,1,"CAROLINA'S SILVER INCORPORATED","CAROLINA'S SILVER INCORPORATED","3115 W 26TH ST  313,229F2",CHICAGO,IL,60623,12,6,12-6,10,1010,"Limited Business License",NULL,NULL,66701,RENEW,NULL,06/21/2005,07/14/2005,N,08/16/2005,08/15/2006,07/14/2005,07/15/2005,AAI,NULL,NULL,NULL,NULL,NULL,"2022-10-06 12:53:44",test,NULL,"2005-07-14 00:00:00","2005-08-16 00:00:00","2006-08-15 00:00:00","2005-07-15 00:00:00",NULL
66701-20060816,1725053,43749,1,"CAROLINA'S SILVER INCORPORATED","CAROLINA'S SILVER INCORPORATED","3115 W 26TH ST  313,229F2",CHICAGO,IL,60623,12,6,12-6,10,1010,"Limited Business License",NULL,NULL,66701,RENEW,NULL,06/21/2006,08/08/2006,N,08/16/2006,08/15/2007,08/08/2006,08/09/2006,AAI,NULL,NULL,NULL,NULL,NULL,"2022-10-06 12:53:44",test,NULL,"2006-08-08 00:00:00","2006-08-16 00:00:00","2007-08-15 00:00:00","2006-08-09 00:00:00",NULL
1491357-20220916,2859088,276156,1,"BOCKWINKEL'S AT PARK MILLENNIUM, INC.",BOCKWINKELS,"222 N COLUMBUS DR 1ST",CHICAGO,IL,60601,42,44,42-44,1,1006,"Retail Food Establishment",775,"Retail Sales of Perishable Foods",1491357,RENEW,NULL,07/15/2022,08/08/2022,N,09/16/2022,09/15/2024,08/08/2022,08/09/2022,AAI,NULL,NULL,41.886339416,-87.62083615,"(41.886339416011204, -87.62083614995649)","2022-10-06 12:53:44",test,NULL,"2022-08-08 00:00:00","2022-09-16 00:00:00","2024-09-15 00:00:00","2022-08-09 00:00:00",NULL
58044-20220916,2857867,18589,2,"RANDOLPH/STETSON SOPRAFFINA MARKETCAFFE', L.L.C.","SOPRAFFINA MARKETCAFFE","200 E RANDOLPH ST",CHICAGO,IL,60601,42,44,42-44,1,1006,"Retail Food Establishment",775,"Retail Sales of Perishable Foods",58044,RENEW,NULL,07/15/2022,08/08/2022,N,09/16/2022,09/15/2024,08/08/2022,08/09/2022,AAI,NULL,NULL,41.884632076,-87.622247991,"(41.8846320757672, -87.6222479910888)","2022-10-06 12:53:44",test,NULL,"2022-08-08 00:00:00","2022-09-16 00:00:00","2024-09-15 00:00:00","2022-08-09 00:00:00",NULL
1739005-20210816,2793842,296374,2,"ADRIAN OLMEDO SR.","ROYAL PRESTIGE HOGARMEX","3940 N PULASKI RD 1",CHICAGO,IL,60641,45,27,45-27,17,1010,"Limited Business License",NULL,NULL,1739005,RENEW,NULL,06/15/2021,08/08/2022,N,08/16/2021,08/15/2023,08/08/2022,08/09/2022,AAI,NULL,NULL,41.953062924,-87.72774649,"(41.953062924152825, -87.72774649046039)","2022-10-06 12:53:44",test,NULL,"2022-08-08 00:00:00","2021-08-16 00:00:00","2023-08-15 00:00:00","2022-08-09 00:00:00",NULL
2622254-20220916,2858533,208654,3,"MEDIATEC PUBLISHING, INC.","MEDIATEC PUBLISHING","150 N MICHIGAN AVE 5TH 550",CHICAGO,IL,60601,42,42,42-42,1,1010,"Limited Business License","602 | 708","Administrative Commercial Office | Miscellaneous Commercial Services",2622254,RENEW,NULL,07/15/2022,08/08/2022,N,09/16/2022,09/15/2024,08/08/2022,08/09/2022,AAI,NULL,NULL,41.884530964,-87.624602045,"(41.88453096378336, -87.62460204460082)","2022-10-06 12:53:44",test,NULL,"2022-08-08 00:00:00","2022-09-16 00:00:00","2024-09-15 00:00:00","2022-08-09 00:00:00",NULL
2595134-20191016,2687056,361790,8,"JS FORT GROUP, INC","JIMMY JOHN'S","974 W 35TH PL",CHICAGO,IL,60609,11,NULL,11-,NULL,1006,"Retail Food Establishment",781,"Sale of Food Prepared Onsite With Dining Area",2595134,RENEW,NULL,08/15/2019,08/30/2019,N,10/16/2019,10/15/2021,08/30/2019,09/03/2019,AAI,NULL,NULL,41.829764331,-87.650619898,"(41.82976433054541, -87.65061989801394)","2022-10-06 12:53:44",test,NULL,"2019-08-30 00:00:00","2019-10-16 00:00:00","2021-10-15 00:00:00","2019-09-03 00:00:00",NULL
2093646-20171016,2554263,361790,1,"JS FORT GROUP, INC","JIMMY JOHN'S","2231 N LINCOLN AVE FIRST",CHICAGO,IL,60614,43,NULL,43-,NULL,1006,"Retail Food Establishment",775,"Retail Sales of Perishable Foods",2093646,RENEW,NULL,08/31/2017,10/09/2017,N,10/16/2017,10/15/2019,10/09/2017,10/10/2017,AAI,NULL,35,41.92268911,-87.644693336,"(41.92268910988196, -87.64469333563137)","2022-10-06 12:53:44",test,NULL,"2017-10-09 00:00:00","2017-10-16 00:00:00","2019-10-15 00:00:00","2017-10-10 00:00:00",NULL
2744922-20220816,2856036,469166,1,"E.H. HUDSON CONSULTING LLC","E.H. HUDSON CONSULTING","917 W 18TH ST 2ND FL",CHICAGO,IL,60608,25,NULL,25-,NULL,1010,"Limited Business License",635,"Commissioned Staffing of Professional, Secretarial and Clerical Work",2744922,RENEW,NULL,06/15/2022,06/29/2022,N,08/16/2022,08/15/2024,06/29/2022,08/09/2022,AAI,NULL,NULL,41.857942059,-87.649471778,"(41.85794205877055, -87.64947177765433)","2022-10-06 12:53:44",test,NULL,"2022-06-29 00:00:00","2022-08-16 00:00:00","2024-08-15 00:00:00","2022-08-09 00:00:00",NULL
2757308-20220916,2860028,337377,3,"PRESTRESSED CONCRETE INSTITUTE","Precast/Prestressed Concrete Institute","8770 W BRYN MAWR AVE 11 1150",CHICAGO,IL,60631,41,NULL,41-,NULL,1010,"Limited Business License",904,"Retail Sales of General Merchandise",2757308,RENEW,NULL,07/15/2022,08/09/2022,N,09/16/2022,09/15/2024,08/09/2022,08/09/2022,AAI,NULL,NULL,41.981057158,-87.846310495,"(41.98105715833546, -87.84631049525672)","2022-10-06 12:53:44",test,NULL,"2022-08-09 00:00:00","2022-09-16 00:00:00","2024-09-15 00:00:00","2022-08-09 00:00:00",NULL
2632098-20220916,2859176,288142,3,"HEEJU CHUNG","MASTER CLEANERS","233 N MICHIGAN AVE LL C014",CHICAGO,IL,60601,42,42,42-42,1,4404,"Regulated Business License","631 | 693 | 694","Clothing Alterations | Laundry Service | Laundry Service - Drop Off Only",2632098,RENEW,NULL,07/15/2022,08/08/2022,N,09/16/2022,09/15/2024,08/08/2022,08/09/2022,AAI,NULL,NULL,41.886567371,-87.624384671,"(41.886567370886944, -87.62438467059714)","2022-10-06 12:53:44",test,NULL,"2022-08-08 00:00:00","2022-09-16 00:00:00","2024-09-15 00:00:00","2022-08-09 00:00:00",NULL
1681578-20130916,2274915,302020,1,"CHICAGO JIUJITSU, INC","Redzovic Jiu Jitsu","4900 N LINCOLN AVE",CHICAGO,IL,60625,40,3,40-3,20,1010,"Limited Business License",NULL,NULL,1681578,RENEW,NULL,07/15/2013,08/12/2013,N,09/16/2013,09/15/2015,08/12/2013,08/13/2013,AAI,NULL,21,41.970812027,-87.690108461,"(41.970812027202975, -87.69010846133787)","2022-10-06 12:53:44",test,NULL,"2013-08-12 00:00:00","2013-09-16 00:00:00","2015-09-15 00:00:00","2013-08-13 00:00:00",NULL
2021901-20220916,2860204,351298,1,"INDO-PAK MEAT & GROCERY, LLC","INDO-PAK MEAT & GROCERY, LLC","3922 W LAWRENCE AVE 1ST",CHICAGO,IL,60625,35,30,35-30,17,1781,Tobacco,763,"Retail Sale of Tobacco",2021901,RENEW,NULL,07/15/2022,08/08/2022,N,09/16/2022,09/15/2023,08/08/2022,08/09/2022,AAI,NULL,NULL,41.96836564,-87.726586351,"(41.96836564028846, -87.72658635101799)","2022-10-06 12:53:44",test,NULL,"2022-08-08 00:00:00","2022-09-16 00:00:00","2023-09-15 00:00:00","2022-08-09 00:00:00",NULL
2621603-20220916,2861660,430504,1,"SANTIAGO HERNANDEZ","CALEB'S CUTS","2623 S CENTRAL PARK AVE 1ST",CHICAGO,IL,60623,22,9,22-9,10,1010,"Limited Business License",894,"Hair Services",2621603,RENEW,NULL,07/15/2022,08/09/2022,N,09/16/2022,09/15/2024,08/09/2022,08/09/2022,AAI,NULL,25,41.843669802,-87.714620231,"(41.843669802223765, -87.71462023098465)","2022-10-06 12:53:44",test,NULL,"2022-08-09 00:00:00","2022-09-16 00:00:00","2024-09-15 00:00:00","2022-08-09 00:00:00",NULL
1937618-20081113,1937618,64478,3,"RON HOY","HOYPOLOI O'HARE","11601 W TOUHY AVE TERMINAL T1 B6",CHICAGO,IL,60666,41,27,41-27,16,1010,"Limited Business License",NULL,NULL,1937618,ISSUE,10/22/2008,11/13/2008,11/13/2008,N,11/13/2008,06/15/2010,11/13/2008,11/13/2008,AAI,NULL,NULL,42.008536401,-87.914428439,"(42.008536400868735, -87.91442843927047)","2022-10-06 12:53:44",test,"2008-10-22 00:00:00","2008-11-13 00:00:00","2008-11-13 00:00:00","2010-06-15 00:00:00","2008-11-13 00:00:00",NULL
13154-20220816,2851709,6214,1,"MORENO'S DISCOUNT LIQUORS, INC.","MORENOS DISCOUNT LIQUORS INC","3714-3724 W 26TH ST 1ST",CHICAGO,IL,60623,22,13,22-13,10,1781,Tobacco,763,"Retail Sale of Tobacco",13154,RENEW,NULL,06/15/2022,08/08/2022,N,08/16/2022,08/15/2023,08/08/2022,08/09/2022,AAI,NULL,25,41.844448213,-87.717937398,"(41.84444821332169, -87.7179373980226)","2022-10-06 12:53:44",test,NULL,"2022-08-08 00:00:00","2022-08-16 00:00:00","2023-08-15 00:00:00","2022-08-09 00:00:00",NULL
2487958-20220916,2861247,409377,1,"PMA Consultants LLC","PMA Consultants LLC","333 W WACKER DR  880",CHICAGO,IL,60606,42,NULL,42-,NULL,4404,"Regulated Business License",601,"Acquisition and Improvement of Land/Residential Buildings (Residential Real Estate Developer)",2487958,RENEW,NULL,07/15/2022,08/08/2022,N,09/16/2022,09/15/2024,08/08/2022,08/09/2022,AAI,NULL,NULL,41.886025413,-87.636297703,"(41.886025412541144, -87.63629770323044)","2022-10-06 12:53:44",test,NULL,"2022-08-08 00:00:00","2022-09-16 00:00:00","2024-09-15 00:00:00","2022-08-09 00:00:00",NULL
2846321-20220516,2846321,30322,4,"DRAM SHOP, LTD.","DRAM SHOP","3040-3042 N BROADWAY  1",CHICAGO,IL,60657,44,6,44-6,19,1476,"Special Event Liquor","717 | 996","Special Event Beer & Wine | Special Event Beer, Wine & Spirits",2846321,ISSUE,05/12/2022,05/12/2022,05/13/2022,N,05/16/2022,09/25/2022,05/13/2022,05/16/2022,AAI,NULL,8,41.937595515,-87.644465168,"(41.93759551483016, -87.64446516842042)","2022-10-06 12:53:44",test,"2022-05-12 00:00:00","2022-05-13 00:00:00","2022-05-16 00:00:00","2022-09-25 00:00:00","2022-05-16 00:00:00",NULL
2595122-20191016,2687055,361790,7,"JS FORT GROUP, INC","JIMMY JOHN'S","2810 N CLARK ST 1",CHICAGO,IL,60657,44,NULL,44-,NULL,1006,"Retail Food Establishment",781,"Sale of Food Prepared Onsite With Dining Area",2595122,RENEW,NULL,08/15/2019,08/30/2019,N,10/16/2019,10/15/2021,08/30/2019,09/03/2019,AAI,NULL,8,41.933059384,-87.645265843,"(41.93305938442793, -87.64526584295888)","2022-10-06 12:53:44",test,NULL,"2019-08-30 00:00:00","2019-10-16 00:00:00","2021-10-15 00:00:00","2019-09-03 00:00:00",NULL
2684873-20211016,2805797,361790,10,"JS FORT GROUP, INC","JIMMY JOHN'S 3106","721 S SEELEY AVE",CHICAGO,IL,60612,28,NULL,28-,NULL,1006,"Retail Food Establishment",781,"Sale of Food Prepared Onsite With Dining Area",2684873,RENEW,NULL,08/15/2021,08/18/2021,N,10/16/2021,10/15/2023,08/18/2021,01/24/2022,AAI,NULL,NULL,41.872527531,-87.677441696,"(41.87252753139634, -87.67744169620713)","2022-10-06 12:53:44",test,NULL,"2021-08-18 00:00:00","2021-10-16 00:00:00","2023-10-15 00:00:00","2022-01-24 00:00:00",NULL
2622963-20220916,2861769,431125,1,"LOGISTICS PROPERTY COMPANY, LLC","LOGISTICS PROPERTY COMPANY, LLC","1 N WACKER DR  1925",CHICAGO,IL,60606,42,NULL,42-,NULL,1010,"Limited Business License",602,"Administrative Commercial Office",2622963,RENEW,NULL,07/15/2022,08/08/2022,N,09/16/2022,09/15/2024,08/08/2022,08/09/2022,AAI,NULL,NULL,41.881951876,-87.636620349,"(41.88195187648601, -87.63662034940238)","2022-10-06 12:53:44",test,NULL,"2022-08-08 00:00:00","2022-09-16 00:00:00","2024-09-15 00:00:00","2022-08-09 00:00:00",NULL
2093646-20191016,2687049,361790,1,"JS FORT GROUP, INC","JIMMY JOHN'S","2231 N LINCOLN AVE FIRST",CHICAGO,IL,60614,43,NULL,43-,NULL,1006,"Retail Food Establishment",775,"Retail Sales of Perishable Foods",2093646,RENEW,NULL,08/15/2019,08/30/2019,N,10/16/2019,10/15/2021,08/30/2019,09/03/2019,AAI,NULL,35,41.92268911,-87.644693336,"(41.92268910988196, -87.64469333563137)","2022-10-06 12:53:44",test,NULL,"2019-08-30 00:00:00","2019-10-16 00:00:00","2021-10-15 00:00:00","2019-09-03 00:00:00",NULL
2839855-20220809,2839855,397185,2,"HOP BUTCHER FOR THE WORLD LLC","Hop Butcher For the World","4253-4259 N LINCOLN AVE",CHICAGO,IL,60618,47,NULL,47-,NULL,1470,Tavern,829,"Tavern - Consumption of Liquor on Premise",2839855,ISSUE,03/15/2022,03/15/2022,03/15/2022,Y,08/09/2022,08/15/2024,08/09/2022,08/09/2022,AAI,NULL,38,41.959233094,-87.682153253,"(41.95923309357485, -87.68215325256443)","2022-10-06 12:53:44",test,"2022-03-15 00:00:00","2022-03-15 00:00:00","2022-08-09 00:00:00","2024-08-15 00:00:00","2022-08-09 00:00:00",NULL
1696832-20220916,2857558,5050,3,"IBM CORPORATION","IBM CORPORATION","71 S WACKER DR",CHICAGO,IL,60606,42,12,42-12,1,1010,"Limited Business License",NULL,NULL,1696832,RENEW,NULL,07/15/2022,08/09/2022,N,09/16/2022,09/15/2024,08/09/2022,08/09/2022,AAI,NULL,NULL,41.880717575,-87.636589107,"(41.880717575265145, -87.63658910737162)","2022-10-06 12:53:44",test,NULL,"2022-08-09 00:00:00","2022-09-16 00:00:00","2024-09-15 00:00:00","2022-08-09 00:00:00",NULL
2738699-20220916,2861237,409278,2,"SOUTH CHICAGO ORTHOPEDIC SPECIALISTS, S.C.","South Chicago Orthopedic Specialists, SC","1701 W MONTEREY AVE  4",CHICAGO,IL,60643,19,NULL,19-,NULL,1010,"Limited Business License",767,"Retail Sales of General Merchandise and Non-Perishable Food",2738699,RENEW,NULL,07/15/2022,08/08/2022,N,09/16/2022,09/15/2024,08/08/2022,08/09/2022,AAI,NULL,NULL,41.689999605,-87.664781143,"(41.68999960527153, -87.66478114253208)","2022-10-06 12:53:44",test,NULL,"2022-08-08 00:00:00","2022-09-16 00:00:00","2024-09-15 00:00:00","2022-08-09 00:00:00",NULL
2863348-20220809,2863348,488433,1,"Higher Learning Music Group","Higher Learning Music Group","4803 N MILWAUKEE AVE  B2",CHICAGO,IL,60630,45,NULL,45-,NULL,1010,"Limited Business License",685,"Instruction in Music for Both Children and Adults (Less Than 40% Children)",2863348,ISSUE,08/08/2022,08/08/2022,08/08/2022,N,08/09/2022,08/15/2024,08/08/2022,08/09/2022,AAI,NULL,NULL,41.968015979,-87.760697083,"(41.96801597918601, -87.76069708272314)","2022-10-06 12:53:44",test,"2022-08-08 00:00:00","2022-08-08 00:00:00","2022-08-09 00:00:00","2024-08-15 00:00:00","2022-08-09 00:00:00",NULL
2556044-20220916,2861442,421378,1,"REBECCA BEAN","REBECCA BEAN","[REDACTED FOR PRIVACY]",CHICAGO,IL,60618,33,NULL,33-,NULL,7009,"Pharmaceutical Representative",990,"Markets / Promotes Pharmaceuticals to Health Care Professionals and Conducts Business for More than 15 Calendar Days per Year",2556044,RENEW,NULL,07/15/2022,08/09/2022,N,09/16/2022,09/15/2023,08/09/2022,08/09/2022,AAI,NULL,NULL,NULL,NULL,NULL,"2022-10-06 12:53:44",test,NULL,"2022-08-09 00:00:00","2022-09-16 00:00:00","2023-09-15 00:00:00","2022-08-09 00:00:00",NULL
66701-20080816,1911515,43749,1,"CAROLINA'S SILVER INCORPORATED","CAROLINA'S SILVER INCORPORATED","3115 W 26TH ST  313,229F2",CHICAGO,IL,60623,12,6,12-6,10,1010,"Limited Business License",NULL,NULL,66701,RENEW,NULL,06/16/2008,08/11/2008,N,08/16/2008,08/15/2010,08/11/2008,08/12/2008,AAI,NULL,NULL,NULL,NULL,NULL,"2022-10-06 12:53:44",test,NULL,"2008-08-11 00:00:00","2008-08-16 00:00:00","2010-08-15 00:00:00","2008-08-12 00:00:00",NULL
2492022-20220916,2858033,27859,6,"ONWARD NEIGHBORHOOD HOUSE","ONWARD NEIGHBORHOOD HOUSE","5409-5413 W DIVERSEY AVE 1ST",CHICAGO,IL,60639,30,40,30-40,25,1010,"Limited Business License","602 | 708","Administrative Commercial Office | Miscellaneous Commercial Services",2492022,RENEW,NULL,07/15/2022,08/08/2022,N,09/16/2022,09/15/2024,08/08/2022,08/09/2022,AAI,NULL,NULL,41.931222357,-87.761709339,"(41.931222356647154, -87.76170933866806)","2022-10-06 12:53:44",test,NULL,"2022-08-08 00:00:00","2022-09-16 00:00:00","2024-09-15 00:00:00","2022-08-09 00:00:00",NULL
2549665-20220816,2855171,419741,1,"ELIZA ROSADO","ELIZA ROSADO","[REDACTED FOR PRIVACY]",CHICAGO,IL,60641,31,23,31-23,25,7009,"Pharmaceutical Representative",990,"Markets / Promotes Pharmaceuticals to Health Care Professionals and Conducts Business for More than 15 Calendar Days per Year",2549665,RENEW,NULL,06/15/2022,08/08/2022,N,08/16/2022,08/15/2023,08/08/2022,08/09/2022,AAI,NULL,NULL,NULL,NULL,NULL,"2022-10-06 12:53:44",test,NULL,"2022-08-08 00:00:00","2022-08-16 00:00:00","2023-08-15 00:00:00","2022-08-09 00:00:00",NULL
49346-20220816,2852106,17164,1,"CLUB PARADISE","PARADISE CLUB","4300 W CERMAK RD",CHICAGO,IL,60623,24,58,24-58,10,1006,"Retail Food Establishment",775,"Retail Sales of Perishable Foods",49346,RENEW,NULL,06/15/2022,08/08/2022,N,08/16/2022,08/15/2024,08/08/2022,08/09/2022,AAI,NULL,NULL,41.851543684,-87.732199832,"(41.851543684489044, -87.7321998316158)","2022-10-06 12:53:44",test,NULL,"2022-08-08 00:00:00","2022-08-16 00:00:00","2024-08-15 00:00:00","2022-08-09 00:00:00",NULL
2851056-20220809,2851056,486469,1,"FRANK FOOD MARKET","FRANK FOOD MARKET","5050 W MADISON ST",CHICAGO,IL,60644,28,12,28-12,15,1006,"Retail Food Establishment","640 | 766 | 775","Deli, Butcher or Bakery | Retail Sales of Fresh Fruits and Vegetables (Leafy and Non Leafy Vegetables) | Retail Sales of Perishable Foods",2851056,ISSUE,06/06/2022,06/06/2022,06/06/2022,N,08/09/2022,08/15/2024,08/08/2022,08/09/2022,AAI,NULL,NULL,41.880519302,-87.752195426,"(41.88051930215209, -87.75219542624971)","2022-10-06 12:53:44",test,"2022-06-06 00:00:00","2022-06-06 00:00:00","2022-08-09 00:00:00","2024-08-15 00:00:00","2022-08-09 00:00:00",NULL
2120056-20180616,2591336,64478,4,"RON HOY","HOYPOLOI O'HARE","11601 W TOUHY AVE TERMINAL T2-E5",CHICAGO,IL,60666,41,27,41-27,16,1010,"Limited Business License",NULL,NULL,2120056,RENEW,NULL,04/15/2018,06/15/2018,N,06/16/2018,07/15/2021,06/15/2018,06/15/2018,AAI,NULL,NULL,42.008536401,-87.914428439,"(42.008536400868735, -87.91442843927047)","2022-10-06 12:53:44",test,NULL,"2018-06-15 00:00:00","2018-06-16 00:00:00","2021-07-15 00:00:00","2018-06-15 00:00:00",NULL
44761-20220916,2857849,16473,1,"BOCKWINKEL'S FRESH EXPRESS",BOCKWINKEL'S,"155 N HARBOR DR 1ST",CHICAGO,IL,60601,42,6,42-6,1,1781,Tobacco,763,"Retail Sale of Tobacco",44761,RENEW,NULL,07/15/2022,08/08/2022,N,09/16/2022,09/15/2023,08/08/2022,08/09/2022,AAI,NULL,NULL,41.884750538,-87.615603956,"(41.884750538499375, -87.61560395647253)","2022-10-06 12:53:44",test,NULL,"2022-08-08 00:00:00","2022-09-16 00:00:00","2023-09-15 00:00:00","2022-08-09 00:00:00",NULL
1595939-20220716,2846852,41455,2,"NEW 87TH & STONY ISLAND CURR","NEW 87TH & STONY ISLAND CURRENCY EXCHANGE","8625 S STONY ISLAND AVE",CHICAGO,IL,60617,8,51,8-51,4,1010,"Limited Business License",708,"Miscellaneous Commercial Services",1595939,RENEW,NULL,05/15/2022,05/16/2022,N,07/16/2022,07/15/2024,05/16/2022,05/16/2022,AAI,NULL,50,41.737938418,-87.585078142,"(41.737938417513675, -87.58507814194496)","2022-10-06 12:53:44",test,NULL,"2022-05-16 00:00:00","2022-07-16 00:00:00","2024-07-15 00:00:00","2022-05-16 00:00:00",NULL
38442-20020216,1205914,33672,1,"INTREN, LLC","TRENCH-IT INC","549 W SHERIDAN RD  1ST",MCHENRY,IL,60050,NULL,NULL,NULL,NULL,1010,"Limited Business License",NULL,NULL,38442,RENEW,NULL,12/20/2001,01/10/2002,N,02/16/2002,02/15/2003,01/10/2002,01/11/2002,AAI,NULL,NULL,NULL,NULL,NULL,"2022-10-06 12:53:44",test,NULL,"2002-01-10 00:00:00","2002-02-16 00:00:00","2003-02-15 00:00:00","2002-01-11 00:00:00",NULL
2671889-20210916,2839836,459899,1,"TALARD THAI MARKET, LLC","TALARD THAI MARKET","5351-5353 N BROADWAY  1ST",CHICAGO,IL,60640,48,12,48-12,20,1006,"Retail Food Establishment","640 | 736 | 766 | 767 | 775","Deli, Butcher or Bakery | Preparation of Food, Coffee or Drinks | Retail Sales of Fresh Fruits and Vegetables (Leafy and Non Leafy Vegetables) | Retail Sales of General Merchandise and Non-Perishable Food | Retail Sales of Perishable Foods",2671889,RENEW,NULL,03/15/2022,03/16/2022,N,09/16/2021,09/15/2023,03/16/2022,04/12/2022,AAI,NULL,26,41.979655105,-87.659811811,"(41.97965510467986, -87.65981181140619)","2022-10-06 12:53:44",test,NULL,"2022-03-16 00:00:00","2021-09-16 00:00:00","2023-09-15 00:00:00","2022-04-12 00:00:00",NULL
2041745-20220716,2848277,354243,1,"GREATLAKES ARCHITECTURAL MILLWORKS, LLC","GREATLAKES ARCHITECTURAL MILLWORKS, LLC","2135 W FULTON ST 1ST",CHICAGO,IL,60612,27,27,27-27,12,1009,"Manufacturing Establishments",929,"Miscellaneous Manufacturing",2041745,RENEW,NULL,05/15/2022,05/16/2022,N,07/16/2022,07/15/2024,05/16/2022,05/16/2022,AAI,NULL,NULL,41.886604219,-87.680644642,"(41.88660421942983, -87.6806446416356)","2022-10-06 12:53:44",test,NULL,"2022-05-16 00:00:00","2022-07-16 00:00:00","2024-07-15 00:00:00","2022-05-16 00:00:00",NULL
2214502-20121229,2214502,65792,2,"PAUL D DOOLEY","DOOLEY BROS TOWING & AUTO REP","8517 S VINCENNES AVE 1ST",CHICAGO,IL,60620,21,2,21-2,6,8340,"Motor Vehicle Services License",712,"Motor Vehicle Repair -  Engine and Transmission Work",2214502,ISSUE,NULL,NULL,NULL,N,12/29/2012,07/15/2014,NULL,12/29/2012,AAI,NULL,NULL,41.739354952,-87.63983969,"(41.739354951667266, -87.63983968969981)","2022-10-06 12:53:44",test,NULL,NULL,"2012-12-29 00:00:00","2014-07-15 00:00:00","2012-12-29 00:00:00",NULL
2120056-20120616,2149112,64478,4,"RON HOY","HOYPOLOI O'HARE","11601 W TOUHY AVE TERMINAL T2-E5",CHICAGO,IL,60666,41,27,41-27,16,1010,"Limited Business License",NULL,NULL,2120056,RENEW,NULL,04/16/2012,07/18/2012,N,06/16/2012,06/15/2014,07/18/2012,07/19/2012,AAI,NULL,NULL,42.008536401,-87.914428439,"(42.008536400868735, -87.91442843927047)","2022-10-06 12:53:44",test,NULL,"2012-07-18 00:00:00","2012-06-16 00:00:00","2014-06-15 00:00:00","2012-07-19 00:00:00",NULL
2511697-20171016,2617210,361790,6,"JS FORT GROUP, INC","JIMMY JOHN'S","3506 S STATE ST 1ST FLOOR 1B",CHICAGO,IL,60609,3,23,3-23,2,1006,"Retail Food Establishment",735,"Preparation of Food and Dining on Premise With Seating",2511697,RENEW,NULL,08/08/2018,08/08/2018,N,10/16/2017,10/15/2019,08/08/2018,08/09/2018,AAI,NULL,NULL,41.830782181,-87.626790176,"(41.83078218057412, -87.62679017621963)","2022-10-06 12:53:44",test,NULL,"2018-08-08 00:00:00","2017-10-16 00:00:00","2019-10-15 00:00:00","2018-08-09 00:00:00",NULL
2483344-20220816,2854924,408615,1,"PREMIUM HOME SYSTEMS, LLC","PREMIUM HOME SYSTEMS, LLC","720 S DEARBORN ST 11 1104",CHICAGO,IL,60605,4,54,4-54,1,4404,"Regulated Business License",674,"Home Repair Services (Home Based Business)",2483344,RENEW,NULL,06/15/2022,08/09/2022,N,08/16/2022,08/15/2024,08/09/2022,08/09/2022,AAI,NULL,NULL,41.872924414,-87.629299735,"(41.872924414089155, -87.62929973479568)","2022-10-06 12:53:44",test,NULL,"2022-08-09 00:00:00","2022-08-16 00:00:00","2024-08-15 00:00:00","2022-08-09 00:00:00",NULL
2183768-20220916,2860610,375101,1,"E&E Holdings, INC","Stevo's Grill","2326 W BELMONT AVE 1ST STORE FRONT",CHICAGO,IL,60618,32,NULL,32-,NULL,1006,"Retail Food Establishment",775,"Retail Sales of Perishable Foods",2183768,RENEW,NULL,07/15/2022,08/08/2022,N,09/16/2022,09/15/2024,08/08/2022,08/09/2022,AAI,NULL,NULL,41.939581686,-87.686662276,"(41.939581685727795, -87.68666227599451)","2022-10-06 12:53:44",test,NULL,"2022-08-08 00:00:00","2022-09-16 00:00:00","2024-09-15 00:00:00","2022-08-09 00:00:00",NULL
43386-20220816,2852065,16284,1,"PETERSON OIL CO INC","PETERSON CITGO","1840 W PETERSON AVE 1ST",CHICAGO,IL,60660,40,9,40-9,24,1781,Tobacco,763,"Retail Sale of Tobacco",43386,RENEW,NULL,06/15/2022,08/08/2022,N,08/16/2022,08/15/2023,08/08/2022,08/09/2022,AAI,NULL,NULL,41.990834069,-87.67677173,"(41.99083406875133, -87.67677172960916)","2022-10-06 12:53:44",test,NULL,"2022-08-08 00:00:00","2022-08-16 00:00:00","2023-08-15 00:00:00","2022-08-09 00:00:00",NULL
70477-20060216,1654327,21429,2,"SDD MECHANICAL SYSTEMS INC","SDD MECHANICAL SYSTEMS INC","450 S MINER   1",BENSENVILLE,IL,60106,NULL,NULL,NULL,NULL,1010,"Limited Business License",NULL,NULL,70477,RENEW,NULL,12/21/2005,01/23/2006,N,02/16/2006,02/15/2007,01/23/2006,01/24/2006,AAI,NULL,NULL,NULL,NULL,NULL,"2022-10-06 12:53:44",test,NULL,"2006-01-23 00:00:00","2006-02-16 00:00:00","2007-02-15 00:00:00","2006-01-24 00:00:00",NULL
2791510-20220716,2850008,470546,2,"TWIN MART FOOD & TOBACCO INC.","TWIN MART FOOD & TOBACCO","5360 W DIVISION ST  B",CHICAGO,IL,60651,37,NULL,37-,NULL,1781,Tobacco,"767 | 776 | 904","Retail Sales of General Merchandise and Non-Perishable Food | Retail Sales of Tobacco Products | Retail Sales of General Merchandise",2791510,RENEW,NULL,05/15/2022,08/09/2022,N,07/16/2022,07/15/2023,08/09/2022,08/09/2022,AAI,NULL,NULL,41.902304747,-87.760658263,"(41.90230474661144, -87.76065826255068)","2022-10-06 12:53:44",test,NULL,"2022-08-09 00:00:00","2022-07-16 00:00:00","2023-07-15 00:00:00","2022-08-09 00:00:00",NULL
2744922-20200807,2744922,469166,1,"E.H. HUDSON CONSULTING LLC","E.H. HUDSON CONSULTING","917 W 18TH ST 2ND FL",CHICAGO,IL,60608,25,NULL,25-,NULL,1010,"Limited Business License",635,"Commissioned Staffing of Professional, Secretarial and Clerical Work",2744922,ISSUE,08/06/2020,08/06/2020,08/06/2020,N,08/07/2020,08/15/2022,08/06/2020,08/07/2020,AAI,NULL,NULL,41.857942059,-87.649471778,"(41.85794205877055, -87.64947177765433)","2022-10-06 12:53:44",test,"2020-08-06 00:00:00","2020-08-06 00:00:00","2020-08-07 00:00:00","2022-08-15 00:00:00","2020-08-07 00:00:00",NULL
2283660-20231216,2856938,378455,1,"FOREST EDGE HEALTHCARE & REHABILITATION CENTER, LLC","FOREST EDGE HEALTHCARE & REHABILITATION CENTER","8001 S WESTERN AVE",CHICAGO,IL,60620,18,18,18-18,8,4404,"Regulated Business License",699,"Long Term Care Facility",2283660,RENEW,NULL,07/01/2022,08/08/2022,N,12/16/2023,12/15/2025,08/08/2022,08/09/2022,AAI,NULL,NULL,41.748245609,-87.68265725,"(41.748245609196715, -87.68265725032997)","2022-10-06 12:53:44",test,NULL,"2022-08-08 00:00:00","2023-12-16 00:00:00","2025-12-15 00:00:00","2022-08-09 00:00:00",NULL
2484129-20220816,2854961,409049,1,"ENVOY GLOBAL, INC.",ENVOY,"230 W MONROE ST 27 2700",CHICAGO,IL,60606,42,49,42-49,1,1010,"Limited Business License","708 | 898","Miscellaneous Commercial Services | Computer Design/Development Consulting",2484129,RENEW,NULL,06/15/2022,06/15/2022,N,08/16/2022,08/15/2024,06/15/2022,08/09/2022,AAI,NULL,NULL,41.880757159,-87.634709298,"(41.88075715864721, -87.6347092983425)","2022-10-06 12:53:44",test,NULL,"2022-06-15 00:00:00","2022-08-16 00:00:00","2024-08-15 00:00:00","2022-08-09 00:00:00",NULL
2781115-20220916,2860954,393436,3,"RYE INK LLC","Gryend House","3417 W PETERSON AVE",CHICAGO,IL,60659,39,NULL,39-,NULL,1010,"Limited Business License","767 | 904 | 911","Retail Sales of General Merchandise and Non-Perishable Food | Retail Sales of General Merchandise | Retail Sales of Clothing / Accessories / Shoes",2781115,RENEW,NULL,07/15/2022,08/08/2022,N,09/16/2022,09/15/2024,08/08/2022,08/09/2022,AAI,NULL,NULL,41.990203205,-87.714774674,"(41.990203204638085, -87.71477467390116)","2022-10-06 12:53:44",test,NULL,"2022-08-08 00:00:00","2022-09-16 00:00:00","2024-09-15 00:00:00","2022-08-09 00:00:00",NULL
2184850-20220916,2859798,325290,2,"BROWN GIBBONS LANG & COMPANY LLC","BROWN GIBBONS LANG & COMPANY LLC","980 N MICHIGAN AVE 18TH 1880",CHICAGO,IL,60611,42,42,42-42,18,1010,"Limited Business License",NULL,NULL,2184850,RENEW,NULL,07/15/2022,08/08/2022,N,09/16/2022,09/15/2024,08/08/2022,08/09/2022,AAI,NULL,NULL,41.900801649,-87.624272468,"(41.90080164945196, -87.6242724679302)","2022-10-06 12:53:44",test,NULL,"2022-08-08 00:00:00","2022-09-16 00:00:00","2024-09-15 00:00:00","2022-08-09 00:00:00",NULL
2354003-20220816,2854696,392882,1,"1910 NORTH MILWAUKEE OPERATIONS, LLC",REMEDY,"1910 N MILWAUKEE AVE",CHICAGO,IL,60647,32,31,32-31,14,1471,"Late Hour",785,"Sale of Liquor Until 4am, Monday - Saturday and 5am on Sunday",2354003,RENEW,NULL,06/15/2022,08/08/2022,N,08/16/2022,08/15/2024,08/08/2022,08/09/2022,AAI,NULL,33,41.916111429,-87.686539654,"(41.916111429177185, -87.68653965381526)","2022-10-06 12:53:44",test,NULL,"2022-08-08 00:00:00","2022-08-16 00:00:00","2024-08-15 00:00:00","2022-08-09 00:00:00",NULL
1591757-20051116,1635929,207755,2,"SIRRERA ENTERPRISE INC","SIRRERA  ENTERPRISE INC","30 S STOLP AVE  405",AURORA,IL,60505,NULL,NULL,NULL,NULL,1010,"Limited Business License",NULL,NULL,1591757,RENEW,NULL,09/22/2005,05/16/2006,N,11/16/2005,11/15/2006,05/16/2006,05/17/2006,AAI,NULL,NULL,NULL,NULL,NULL,"2022-10-06 12:53:44",test,NULL,"2006-05-16 00:00:00","2005-11-16 00:00:00","2006-11-15 00:00:00","2006-05-17 00:00:00",NULL
2732523-20220616,2844758,468057,1,"M&G NAILS LLC","M&G Nails LLC","3110 N SHERIDAN RD 1 1C",CHICAGO,IL,60657,44,NULL,44-,NULL,1010,"Limited Business License",895,"Nail Services",2732523,RENEW,NULL,04/15/2022,05/07/2022,N,06/16/2022,06/15/2024,05/07/2022,05/16/2022,AAI,NULL,8,41.938088903,-87.63962668,"(41.93808890294741, -87.6396266802013)","2022-10-06 12:53:44",test,NULL,"2022-05-07 00:00:00","2022-06-16 00:00:00","2024-06-15 00:00:00","2022-05-16 00:00:00",NULL
2458618-20220416,2834100,405358,1,"JACK J MCKEE","JACK J MCKEE","6482 N NOKOMIS AVE",CHICAGO,IL,60646,41,19,41-19,16,4406,"Peddler License",819,"Street Performer, Moving Along the Public Way",2458618,RENEW,NULL,02/15/2022,05/16/2022,N,04/16/2022,04/15/2024,NULL,05/16/2022,AAI,NULL,NULL,41.999422447,-87.75776364,"(41.99942244673917, -87.7577636401846)","2022-10-06 12:53:44",test,NULL,"2022-05-16 00:00:00","2022-04-16 00:00:00","2024-04-15 00:00:00","2022-05-16 00:00:00",NULL
2827693-20220516,2827693,482360,1,"JERRY'S AUTO REPAIR 1 INC.","JERRY'S AUTO REPAIR 1","5201 W ADDISON ST",CHICAGO,IL,60641,30,4,30-4,16,8340,"Motor Vehicle Services License","712 | 1065","Motor Vehicle Repair -  Engine and Transmission Work | Sale of Automobiles (Indoor within an Enclosed Structure)",2827693,ISSUE,01/06/2022,04/19/2022,05/16/2022,N,05/16/2022,06/15/2024,05/16/2022,05/16/2022,AAI,NULL,NULL,41.945889176,-87.757041123,"(41.94588917553282, -87.75704112300077)","2022-10-06 12:53:44",test,"2022-01-06 00:00:00","2022-05-16 00:00:00","2022-05-16 00:00:00","2024-06-15 00:00:00","2022-05-16 00:00:00",NULL
2845533-20220516,2845533,485254,1,"VIBEZ APPAREL & ACCESSORIES LLC","VIBEZ APPAREL & ACCESSORIES","9545 S JEFFERY AVE 1ST A",CHICAGO,IL,60617,7,39,7-39,4,1010,"Limited Business License",911,"Retail Sales of Clothing / Accessories / Shoes",2845533,ISSUE,04/28/2022,05/16/2022,05/16/2022,N,05/16/2022,06/15/2024,05/16/2022,05/16/2022,AAI,NULL,NULL,41.721088238,-87.575176583,"(41.72108823807851, -87.57517658316902)","2022-10-06 12:53:44",test,"2022-04-28 00:00:00","2022-05-16 00:00:00","2022-05-16 00:00:00","2024-06-15 00:00:00","2022-05-16 00:00:00",NULL
1681578-20170916,2545871,302020,1,"CHICAGO JIUJITSU, INC","Redzovic Jiu Jitsu","4900 N LINCOLN AVE",CHICAGO,IL,60625,40,3,40-3,20,1010,"Limited Business License",NULL,NULL,1681578,RENEW,NULL,07/15/2017,09/28/2017,N,09/16/2017,09/15/2019,09/28/2017,09/29/2017,AAI,NULL,21,41.970812027,-87.690108461,"(41.970812027202975, -87.69010846133787)","2022-10-06 12:53:44",test,NULL,"2017-09-28 00:00:00","2017-09-16 00:00:00","2019-09-15 00:00:00","2017-09-29 00:00:00",NULL
2846345-20220516,2846345,36307,4,"LOWER LINK, INC.","UNDERGROUND LOUNGE","952 W NEWPORT AVE",CHICAGO,IL,60657,44,36,44-36,19,1476,"Special Event Liquor",996,"Special Event Beer, Wine & Spirits",2846345,ISSUE,05/13/2022,05/13/2022,05/13/2022,N,05/16/2022,09/28/2022,05/13/2022,05/16/2022,AAI,NULL,NULL,41.944568751,-87.653924324,"(41.9445687505024, -87.65392432426306)","2022-10-06 12:53:44",test,"2022-05-13 00:00:00","2022-05-13 00:00:00","2022-05-16 00:00:00","2022-09-28 00:00:00","2022-05-16 00:00:00",NULL
2588982-20220416,2834352,426075,1,"FERNANDO   VALENCIA","FERNANDO  VALENCIA","6537 S KOMENSKY AVE 1",CHICAGO,IL,60629,13,34,13-34,8,4406,"Peddler License",769,"Peddler- Retail Sales of General Merchandise, Whole Uncut Fruits/Vegetables, Flowers, Moving Along the Public Way",2588982,RENEW,NULL,02/15/2022,05/16/2022,N,04/16/2022,04/15/2024,NULL,05/16/2022,AAI,NULL,3,41.773890931,-87.723710646,"(41.77389093069065, -87.72371064591843)","2022-10-06 12:53:44",test,NULL,"2022-05-16 00:00:00","2022-04-16 00:00:00","2024-04-15 00:00:00","2022-05-16 00:00:00",NULL
2850156-20220516,2850156,485872,1,"ASIA BOUTIQUE LLC","ASIA BOUTIQUE","3851 N OCONTO AVE",CHICAGO,IL,60634,38,3,38-3,16,4404,"Regulated Business License",722,"Online Sales (Home Based Business)",2850156,ISSUE,05/16/2022,05/16/2022,05/16/2022,N,05/16/2022,06/15/2024,05/16/2022,05/16/2022,AAI,NULL,NULL,41.950381645,-87.808246091,"(41.95038164542215, -87.80824609070501)","2022-10-06 12:53:44",test,"2022-05-16 00:00:00","2022-05-16 00:00:00","2022-05-16 00:00:00","2024-06-15 00:00:00","2022-05-16 00:00:00",NULL
1225368-20220516,2837263,243092,1,"RAUL REYES","OHIO FOOD MART","5345 W OHIO ST",CHICAGO,IL,60644,37,17,37-17,15,1781,Tobacco,763,"Retail Sale of Tobacco",1225368,RENEW,NULL,03/15/2022,05/16/2022,N,05/16/2022,05/15/2023,05/16/2022,05/16/2022,AAI,NULL,NULL,41.891049287,-87.759732837,"(41.89104928732453, -87.75973283727541)","2022-10-06 12:53:44",test,NULL,"2022-05-16 00:00:00","2022-05-16 00:00:00","2023-05-15 00:00:00","2022-05-16 00:00:00",NULL
2841452-20220516,2841452,484501,1,"Ashland Liquor & Wine Inc","Ashland Liquor","6257 S ASHLAND AVE",CHICAGO,IL,60636,16,NULL,16-,7,1006,"Retail Food Establishment",775,"Retail Sales of Perishable Foods",2841452,ISSUE,04/14/2022,04/15/2022,04/15/2022,N,05/16/2022,05/15/2024,05/16/2022,05/16/2022,AAI,NULL,NULL,41.779614666,-87.664077489,"(41.7796146657817, -87.66407748925904)","2022-10-06 12:53:44",test,"2022-04-14 00:00:00","2022-04-15 00:00:00","2022-05-16 00:00:00","2024-05-15 00:00:00","2022-05-16 00:00:00",NULL
2608485-20220716,2849561,428710,1,"KALAMPER AUTO REPAIR & TIRE SHOP LLC","KALAMPER AUTO REPAIR & TIRE SHOP","6067 N MILWAUKEE AVE",CHICAGO,IL,60646,39,21,39-21,16,8340,"Motor Vehicle Services License",712,"Motor Vehicle Repair -  Engine and Transmission Work",2608485,RENEW,NULL,05/15/2022,05/15/2022,N,07/16/2022,07/15/2024,05/15/2022,05/16/2022,AAI,NULL,NULL,41.99164795,-87.782279553,"(41.99164795039224, -87.78227955343459)","2022-10-06 12:53:44",test,NULL,"2022-05-15 00:00:00","2022-07-16 00:00:00","2024-07-15 00:00:00","2022-05-16 00:00:00",NULL
2333625-20220616,2843374,351505,2,"GANG LIU","CHICAGO TRANSLATION SERVICES","2358 S WENTWORTH AVE 2F",CHICAGO,IL,60616,25,14,25-14,9,4404,"Regulated Business License",691,"Language Interpreter, Translator (Home Based Business)",2333625,RENEW,NULL,04/15/2022,05/13/2022,N,06/16/2022,06/15/2024,05/13/2022,05/16/2022,AAI,NULL,NULL,41.849206103,-87.632079838,"(41.849206103100016, -87.63207983842298)","2022-10-06 12:53:44",test,NULL,"2022-05-13 00:00:00","2022-06-16 00:00:00","2024-06-15 00:00:00","2022-05-16 00:00:00",NULL
1908413-20220516,2837886,329710,1,"POINT OF IMPACT, INC.","AGIO - USA","222 W MERCHANDISE MART PLZ 16TH 1628",CHICAGO,IL,60654,42,14,42-14,18,1010,"Limited Business License",NULL,NULL,1908413,RENEW,NULL,03/15/2022,05/14/2022,N,05/16/2022,05/15/2024,05/14/2022,05/16/2022,AAI,NULL,NULL,41.888074281,-87.634955203,"(41.8880742810662, -87.63495520292739)","2022-10-06 12:53:44",test,NULL,"2022-05-14 00:00:00","2022-05-16 00:00:00","2024-05-15 00:00:00","2022-05-16 00:00:00",NULL
1594286-20061116,1760983,283518,2,"BORIS MAFOUA","FARAFINA DONKO","706 E 83RD ST",CHICAGO,IL,60619,6,59,6-59,6,1010,"Limited Business License",NULL,NULL,1594286,RENEW,NULL,09/20/2006,10/25/2006,N,11/16/2006,11/15/2007,10/25/2006,10/26/2006,AAI,NULL,NULL,41.744039081,-87.607139229,"(41.744039080934925, -87.60713922889)","2022-10-06 12:53:44",test,NULL,"2006-10-25 00:00:00","2006-11-16 00:00:00","2007-11-15 00:00:00","2006-10-26 00:00:00",NULL
2663744-20220716,2848566,373650,3,"AR RAZZAQ INC.,","AL NOOR MEAT & GROCERY","2514 W DEVON AVE",CHICAGO,IL,60659,50,19,50-19,24,1006,"Retail Food Establishment","640 | 767 | 775","Deli, Butcher or Bakery | Retail Sales of General Merchandise and Non-Perishable Food | Retail Sales of Perishable Foods",2663744,RENEW,NULL,05/15/2022,05/15/2022,N,07/16/2022,07/15/2024,05/15/2022,05/16/2022,AAI,NULL,43,41.997786011,-87.69297775,"(41.997786010547614, -87.69297775001321)","2022-10-06 12:53:44",test,NULL,"2022-05-15 00:00:00","2022-07-16 00:00:00","2024-07-15 00:00:00","2022-05-16 00:00:00",NULL
2469374-20220716,2846792,27912,3,"MUSIC OF THE BAROQUE","MUSIC OF THE BAROQUE","25 E WASHINGTON ST 8TH 823",CHICAGO,IL,60602,42,9,42-9,1,1625,Raffles,"602 | 720","Administrative Commercial Office | Not-For-Profit Selling Raffles for Prizes of $50 or More",2469374,RENEW,NULL,05/15/2022,05/16/2022,N,07/16/2022,07/15/2023,05/16/2022,05/16/2022,AAI,NULL,1,41.883109079,-87.626976034,"(41.883109078966136, -87.62697603370881)","2022-10-06 12:53:44",test,NULL,"2022-05-16 00:00:00","2022-07-16 00:00:00","2023-07-15 00:00:00","2022-05-16 00:00:00",NULL
1337422-20070216,1788938,260245,1,"Linde Gas & Equipment Inc","PRAXAIR DISTRIBUTION, INC.","2224 S ARCHER AVE",CHICAGO,IL,60616,25,18,25-18,9,1010,"Limited Business License",NULL,NULL,1337422,RENEW,NULL,12/20/2006,01/29/2007,N,02/16/2007,05/15/2009,01/29/2007,01/30/2007,AAC,07/16/2008,NULL,41.852491853,-87.635854507,"(41.852491852656364, -87.63585450672153)","2022-10-06 12:53:44",test,NULL,"2007-01-29 00:00:00","2007-02-16 00:00:00","2009-05-15 00:00:00","2007-01-30 00:00:00","2008-07-16 00:00:00"
1622440-20070216,1775760,16869,1,"WILLIE H. CARTER","CARTER'S EXCAVATING","235 E 157TH ST",HARVEY,IL,60426,NULL,NULL,NULL,NULL,1010,"Limited Business License",NULL,NULL,1622440,RENEW,NULL,12/20/2006,02/08/2007,N,02/16/2007,04/15/2008,02/08/2007,02/09/2007,AAI,NULL,NULL,NULL,NULL,NULL,"2022-10-06 12:53:44",test,NULL,"2007-02-08 00:00:00","2007-02-16 00:00:00","2008-04-15 00:00:00","2007-02-09 00:00:00",NULL
2277504-20200216,2707451,369444,1,"NICHOLAS SARICH","TIMELESS TATTOOS","7112 W ARCHER AVE FIRST",CHICAGO,IL,60638,23,NULL,23-,NULL,4404,"Regulated Business License",828,"Tattoo / Permanent Body Art and Make-Up / Micro Blading",2277504,RENEW,NULL,12/15/2019,01/23/2020,N,02/16/2020,02/15/2022,05/16/2022,05/16/2022,AAI,NULL,NULL,41.792083221,-87.799586762,"(41.79208322138412, -87.7995867615771)","2022-10-06 12:53:44",test,NULL,"2020-01-23 00:00:00","2020-02-16 00:00:00","2022-02-15 00:00:00","2022-05-16 00:00:00",NULL
1138788-20060216,1664490,212012,2,"DD&S INC.","D D AND S, INC.","769 W 26TH ST",CHICAGO,IL,60616,11,50,11-50,9,1010,"Limited Business License",NULL,NULL,1138788,RENEW,NULL,12/21/2005,02/16/2006,N,02/16/2006,02/15/2007,02/16/2006,02/17/2006,AAI,NULL,NULL,41.845223478,-87.646090425,"(41.84522347787031, -87.64609042498367)","2022-10-06 12:53:44",test,NULL,"2006-02-16 00:00:00","2006-02-16 00:00:00","2007-02-15 00:00:00","2006-02-17 00:00:00",NULL
2463116-20220516,2839129,405633,1,"LOVE'S PLUMBING AND SEWER, INC.","LOVE'S PLUMBING AND SEWER, INC.","496 E AMBERSIDE DR",ELGIN,IL,60124,NULL,NULL,NULL,NULL,4404,"Regulated Business License",673,"Home Repair Services",2463116,RENEW,NULL,03/15/2022,05/14/2022,N,05/16/2022,05/15/2024,05/14/2022,05/16/2022,AAI,NULL,NULL,NULL,NULL,NULL,"2022-10-06 12:53:44",test,NULL,"2022-05-14 00:00:00","2022-05-16 00:00:00","2024-05-15 00:00:00","2022-05-16 00:00:00",NULL
2846314-20220516,2846314,472297,3,"SANCERRE HOSPITALITY II LLC","ROSE MARY","932-954 W FULTON MARKET",CHICAGO,IL,60607,27,45,27-45,12,1476,"Special Event Liquor",996,"Special Event Beer, Wine & Spirits",2846314,ISSUE,05/12/2022,05/12/2022,05/13/2022,N,05/16/2022,10/31/2022,05/13/2022,05/16/2022,AAI,NULL,NULL,41.886864374,-87.651067518,"(41.88686437354237, -87.65106751780091)","2022-10-06 12:53:44",test,"2022-05-12 00:00:00","2022-05-13 00:00:00","2022-05-16 00:00:00","2022-10-31 00:00:00","2022-05-16 00:00:00",NULL
2812555-20220516,2812555,479118,1,"KAYA DENISE THOMAS","KAYA'S ENHANCEMENTS","7838 S WESTERN AVE",CHICAGO,IL,60620,18,12,18-12,8,1010,"Limited Business License","894 | 904","Hair Services | Retail Sales of General Merchandise",2812555,ISSUE,09/15/2021,05/16/2022,05/16/2022,N,05/16/2022,06/15/2024,05/16/2022,05/16/2022,AAI,NULL,NULL,41.750761033,-87.683013127,"(41.750761032669125, -87.68301312668848)","2022-10-06 12:53:44",test,"2021-09-15 00:00:00","2022-05-16 00:00:00","2022-05-16 00:00:00","2024-06-15 00:00:00","2022-05-16 00:00:00",NULL
1932963-20220716,2847073,66655,5,"CRUZ BROTHER'S CONSTRUCTION COMPANY, INC.","CRUZ BROTHERS CONSTRUCTION CO. INC.","10614 S MACKINAW AVE 1",CHICAGO,IL,60617,10,35,10-35,4,1010,"Limited Business License",NULL,NULL,1932963,RENEW,NULL,05/15/2022,05/16/2022,N,07/16/2022,07/15/2024,05/16/2022,05/16/2022,AAI,NULL,NULL,41.702275622,-87.542708676,"(41.7022756218349, -87.5427086763228)","2022-10-06 12:53:44",test,NULL,"2022-05-16 00:00:00","2022-07-16 00:00:00","2024-07-15 00:00:00","2022-05-16 00:00:00",NULL
1138788-20030816,1373621,212012,2,"DD&S INC.","D D AND S, INC.","769 W 26TH ST",CHICAGO,IL,60616,11,50,11-50,9,1010,"Limited Business License",NULL,NULL,1138788,RENEW,NULL,06/24/2003,07/21/2003,N,08/16/2003,08/15/2004,07/21/2003,07/22/2003,AAI,NULL,NULL,41.845223478,-87.646090425,"(41.84522347787031, -87.64609042498367)","2022-10-06 12:53:44",test,NULL,"2003-07-21 00:00:00","2003-08-16 00:00:00","2004-08-15 00:00:00","2003-07-22 00:00:00",NULL
2850159-20220516,2850159,257540,4,"NEZIR J DRABO","GREAT CAESARS","6055 W BELMONT AVE",CHICAGO,IL,60634,30,21,30-21,25,1010,"Limited Business License",894,"Hair Services",2850159,ISSUE,05/16/2022,05/16/2022,05/16/2022,N,05/16/2022,08/15/2023,05/16/2022,05/16/2022,AAI,NULL,NULL,41.938309863,-87.778369313,"(41.93830986279761, -87.77836931333721)","2022-10-06 12:53:44",test,"2022-05-16 00:00:00","2022-05-16 00:00:00","2022-05-16 00:00:00","2023-08-15 00:00:00","2022-05-16 00:00:00",NULL
2595479-20220516,2839428,427264,1,"DJJE HOLDINGS, LLC","THE PLACE FOR CHILDREN WITH AUTISM","6202 W MONTROSE AVE",CHICAGO,IL,60634,38,14,38-14,16,1010,"Limited Business License",602,"Administrative Commercial Office",2595479,RENEW,NULL,03/15/2022,04/15/2022,N,05/16/2022,05/15/2024,04/15/2022,05/16/2022,AAI,NULL,NULL,41.960392439,-87.782062764,"(41.960392438606085, -87.7820627635443)","2022-10-06 12:53:44",test,NULL,"2022-04-15 00:00:00","2022-05-16 00:00:00","2024-05-15 00:00:00","2022-05-16 00:00:00",NULL
56452-20220916,2858213,57751,1,"GOLDEN STAR INCORPORATED","ADVANCE CONSULTING GROUP INT'L","300 W ADAMS ST  420",CHICAGO,IL,60606,42,12,42-12,1,1010,"Limited Business License",NULL,NULL,56452,RENEW,NULL,07/15/2022,08/08/2022,N,09/16/2022,09/15/2024,08/08/2022,08/09/2022,AAI,NULL,NULL,41.879477859,-87.635311026,"(41.87947785944255, -87.63531102568936)","2022-10-06 12:53:44",test,NULL,"2022-08-08 00:00:00","2022-09-16 00:00:00","2024-09-15 00:00:00","2022-08-09 00:00:00",NULL
66701-20070816,1829276,43749,1,"CAROLINA'S SILVER INCORPORATED","CAROLINA'S SILVER INCORPORATED","3115 W 26TH ST  313,229F2",CHICAGO,IL,60623,12,6,12-6,10,1010,"Limited Business License",NULL,NULL,66701,RENEW,NULL,06/21/2007,08/15/2007,N,08/16/2007,08/15/2008,08/15/2007,08/16/2007,AAI,NULL,NULL,NULL,NULL,NULL,"2022-10-06 12:53:44",test,NULL,"2007-08-15 00:00:00","2007-08-16 00:00:00","2008-08-15 00:00:00","2007-08-16 00:00:00",NULL
2699256-20220716,2849723,464230,1,"PMUTOO, INC.","PICK ME UP CAFE","4882 N CLARK ST 1",CHICAGO,IL,60640,47,30,47-30,20,1006,"Retail Food Establishment","735 | 767","Preparation of Food and Dining on Premise With Seating | Retail Sales of General Merchandise and Non-Perishable Food",2699256,RENEW,NULL,05/15/2022,05/15/2022,N,07/16/2022,07/15/2024,05/15/2022,05/16/2022,AAI,NULL,31,41.971279886,-87.667915428,"(41.9712798856542, -87.66791542761221)","2022-10-06 12:53:44",test,NULL,"2022-05-15 00:00:00","2022-07-16 00:00:00","2024-07-15 00:00:00","2022-05-16 00:00:00",NULL
2214711-20210716,2788062,252672,1,"HERNANDEZ AUTO REPAIR INC","HERNANDEZ AUTO REPAIR","5447 N BROADWAY",CHICAGO,IL,60640,48,6,48-6,20,8340,"Motor Vehicle Services License",712,"Motor Vehicle Repair -  Engine and Transmission Work",2214711,RENEW,NULL,05/15/2021,06/22/2021,N,07/16/2021,07/15/2023,06/22/2021,05/16/2022,AAI,NULL,26,41.981368682,-87.659859787,"(41.98136868151268, -87.65985978680082)","2022-10-06 12:53:44",test,NULL,"2021-06-22 00:00:00","2021-07-16 00:00:00","2023-07-15 00:00:00","2022-05-16 00:00:00",NULL
2744548-20210816,2796478,468934,1,"JACK THOMASON","JACK THOMASON","[REDACTED FOR PRIVACY]",MCFARLAND,WI,53558,NULL,NULL,NULL,NULL,7009,"Pharmaceutical Representative",990,"Markets / Promotes Pharmaceuticals to Health Care Professionals and Conducts Business for More than 15 Calendar Days per Year",2744548,RENEW,NULL,06/15/2021,07/23/2021,N,08/16/2021,10/15/2022,07/23/2021,07/26/2021,AAI,NULL,NULL,NULL,NULL,NULL,"2022-10-06 12:53:44",test,NULL,"2021-07-23 00:00:00","2021-08-16 00:00:00","2022-10-15 00:00:00","2021-07-26 00:00:00",NULL
1337423-20040216,1467161,260245,2,"Linde Gas & Equipment Inc","PRAXAIR DISTRIBUTION, INC.","12000  ROOSEVELT RD",HILLSIDE,IL,60162,NULL,NULL,NULL,NULL,1010,"Limited Business License",NULL,NULL,1337423,RENEW,NULL,12/15/2003,04/21/2003,N,02/16/2004,02/15/2005,12/22/2003,04/15/2004,AAI,NULL,NULL,NULL,NULL,NULL,"2022-10-06 12:53:44",test,NULL,"2003-04-21 00:00:00","2004-02-16 00:00:00","2005-02-15 00:00:00","2004-04-15 00:00:00",NULL
15829-20020216,1203935,27890,1,"WAYMAN DAY CARE CENTER","WAYMAN DAY CARE CENTER","509-511 W ELM ST",CHICAGO,IL,60610,27,52,27-52,18,1584,"Day Care Center 2 - 6 Years",NULL,NULL,15829,RENEW,NULL,12/20/2001,02/11/2002,N,02/16/2002,02/15/2003,07/01/2002,07/02/2002,AAI,NULL,NULL,41.90256459,-87.641584043,"(41.90256459034225, -87.64158404253365)","2022-10-06 12:53:44",test,NULL,"2002-02-11 00:00:00","2002-02-16 00:00:00","2003-02-15 00:00:00","2002-07-02 00:00:00",NULL
1337423-20060216,1667791,260245,2,"Linde Gas & Equipment Inc","PRAXAIR DISTRIBUTION, INC.","12000  ROOSEVELT RD",HILLSIDE,IL,60162,NULL,NULL,NULL,NULL,1010,"Limited Business License",NULL,NULL,1337423,RENEW,NULL,12/21/2005,01/18/2006,N,02/16/2006,02/15/2007,01/18/2006,01/19/2006,AAI,NULL,NULL,NULL,NULL,NULL,"2022-10-06 12:53:44",test,NULL,"2006-01-18 00:00:00","2006-02-16 00:00:00","2007-02-15 00:00:00","2006-01-19 00:00:00",NULL
2443414-20220516,2839028,403567,1,"PAYTON CORPORATION IV","MUFFLERS FOR LESS","1433 E 79TH ST",CHICAGO,IL,60619,8,48,8-48,4,8340,"Motor Vehicle Services License",712,"Motor Vehicle Repair -  Engine and Transmission Work",2443414,RENEW,NULL,03/15/2022,05/13/2022,N,05/16/2022,05/15/2024,05/13/2022,05/16/2022,AAI,NULL,50,41.751340678,-87.589338911,"(41.751340677691935, -87.58933891066079)","2022-10-06 12:53:44",test,NULL,"2022-05-13 00:00:00","2022-05-16 00:00:00","2024-05-15 00:00:00","2022-05-16 00:00:00",NULL
2664588-20190430,2664588,384627,2,"FEDCHEX RECOVERY, LLC","FCR Collection Services dba FCR Services","27042  TOWNE CENTRE DR  SUITE 150","FOOTHILL RANCH",CA,92610,NULL,NULL,NULL,NULL,4404,"Regulated Business License",912,"Debt Collecting - Administrative Commercial Office",2664588,C_LOC,04/29/2019,04/29/2019,04/29/2019,N,04/30/2019,09/15/2019,04/29/2019,04/30/2019,AAI,NULL,NULL,NULL,NULL,NULL,"2022-10-06 12:53:44",test,"2019-04-29 00:00:00","2019-04-29 00:00:00","2019-04-30 00:00:00","2019-09-15 00:00:00","2019-04-30 00:00:00",NULL
2205941-20220516,2837264,243335,2,"ETEK REFRIGERATION HEATING & COOLING","ETEK REFRIGERATION","6534 N ROCKWELL ST 3RD FLOOR 3",CHICAGO,IL,60645,50,36,50-36,24,4404,"Regulated Business License",673,"Home Repair Services",2205941,RENEW,NULL,03/15/2022,05/14/2022,N,05/16/2022,05/15/2024,05/14/2022,05/16/2022,AAI,NULL,NULL,42.00051209,-87.694987329,"(42.00051208958279, -87.6949873291587)","2022-10-06 12:53:44",test,NULL,"2022-05-14 00:00:00","2022-05-16 00:00:00","2024-05-15 00:00:00","2022-05-16 00:00:00",NULL
2671474-20220716,2849681,456090,3,"CUDDLE BUNNY LLC","CUDDLE BUNNY LLC","2901 N CLARK ST",CHICAGO,IL,60657,44,6,44-6,19,4404,"Regulated Business License",927,"Yoga Instruction",2671474,RENEW,NULL,05/15/2022,05/15/2022,N,07/16/2022,07/15/2024,05/15/2022,05/16/2022,AAI,NULL,8,41.934928761,-87.646438175,"(41.934928761184814, -87.6464381749943)","2022-10-06 12:53:44",test,NULL,"2022-05-15 00:00:00","2022-07-16 00:00:00","2024-07-15 00:00:00","2022-05-16 00:00:00",NULL
2042701-20220716,2848307,354612,1,"TOJI ENGINEERING, LTD.","TOJI ENGINEERING, LTD.","415  ELDERBERRY LN 1",STREAMWOOD,IL,60107,NULL,NULL,NULL,NULL,1010,"Limited Business License","901 | 902","Heating, Ventilation and Air Conditioning Services - Residential | Heating, Ventilation and Air Conditioning Services - Commercial",2042701,RENEW,NULL,05/15/2022,05/15/2022,N,07/16/2022,07/15/2024,05/15/2022,05/16/2022,AAI,NULL,NULL,NULL,NULL,NULL,"2022-10-06 12:53:44",test,NULL,"2022-05-15 00:00:00","2022-07-16 00:00:00","2024-07-15 00:00:00","2022-05-16 00:00:00",NULL
2744957-20200914,2744957,469190,1,"Homegrown Wrappings Gift Company","HOMEGROWN WRAPPINGS","1505-1507 W MORSE AVE 1ST",CHICAGO,IL,60626,49,23,49-23,24,1006,"Retail Food Establishment","775 | 904","Retail Sales of Perishable Foods | Retail Sales of General Merchandise",2744957,ISSUE,08/07/2020,08/07/2020,09/02/2020,N,09/14/2020,09/15/2022,09/11/2020,09/14/2020,AAC,08/09/2022,24,42.007760138,-87.668123804,"(42.00776013813342, -87.66812380381613)","2022-10-06 12:53:44",test,"2020-08-07 00:00:00","2020-09-02 00:00:00","2020-09-14 00:00:00","2022-09-15 00:00:00","2020-09-14 00:00:00","2022-08-09 00:00:00"
2738437-20200630,2738437,468522,1,"YINQING YE",Aromatherapy,"4425 S ARCHER AVE 1 A3",CHICAGO,IL,60632,14,NULL,14-,NULL,1010,"Limited Business License","144 | 998","Hair, Nail, and Skin Care Services | Provide Foot Massage - Fully Clothed/No Disrobing",2738437,ISSUE,06/29/2020,06/29/2020,06/29/2020,N,06/30/2020,07/15/2022,06/29/2020,06/30/2020,AAI,NULL,39,41.812756755,-87.706185995,"(41.81275675469049, -87.70618599528053)","2022-10-06 12:53:44",test,"2020-06-29 00:00:00","2020-06-29 00:00:00","2020-06-30 00:00:00","2022-07-15 00:00:00","2020-06-30 00:00:00",NULL
2308808-20220716,2848750,388058,1,"THE HAT CHICAGO, INC.","The Hat","1604 W NORTH AVE 1ST",CHICAGO,IL,60622,32,NULL,32-,NULL,1006,"Retail Food Establishment",735,"Preparation of Food and Dining on Premise With Seating",2308808,RENEW,NULL,05/15/2022,05/15/2022,N,07/16/2022,07/15/2024,05/15/2022,05/16/2022,AAI,NULL,33,41.910736609,-87.667924453,"(41.91073660901789, -87.66792445283261)","2022-10-06 12:53:44",test,NULL,"2022-05-15 00:00:00","2022-07-16 00:00:00","2024-07-15 00:00:00","2022-05-16 00:00:00",NULL
2834892-20220716,2848866,391654,2,"THE SPACE, LLC","THE SPACE LLC","4657 S DREXEL BLVD BALLROOM AND UNIT E",CHICAGO,IL,60653,4,NULL,4-,NULL,4404,"Regulated Business License","661 | 670 | 767 | 896 | 904 | 926","Fitness Training On and Off Premise | Health Club | Retail Sales of General Merchandise and Non-Perishable Food | Skincare Services | Retail Sales of General Merchandise | Fitness Classes",2834892,RENEW,NULL,05/15/2022,05/15/2022,N,07/16/2022,07/15/2024,05/15/2022,05/16/2022,AAI,NULL,47,41.809713939,-87.603753368,"(41.809713938579684, -87.60375336825767)","2022-10-06 12:53:44",test,NULL,"2022-05-15 00:00:00","2022-07-16 00:00:00","2024-07-15 00:00:00","2022-05-16 00:00:00",NULL
2699258-20220716,2849724,464230,1,"PMUTOO, INC.","PICK ME UP CAFE","4882 N CLARK ST 1",CHICAGO,IL,60640,47,30,47-30,20,1475,"Consumption on Premises - Incidental Activity",638,"Consumption of Liquor on Premises",2699258,RENEW,NULL,05/15/2022,05/15/2022,N,07/16/2022,07/15/2024,05/15/2022,05/16/2022,AAI,NULL,31,41.971279886,-87.667915428,"(41.9712798856542, -87.66791542761221)","2022-10-06 12:53:44",test,NULL,"2022-05-15 00:00:00","2022-07-16 00:00:00","2024-07-15 00:00:00","2022-05-16 00:00:00",NULL
2738704-20220716,2849991,468661,1,"The Chicago TREND Corporation","The Chicago TREND Corporation","30 W MONROE ST  510",CHICAGO,IL,60603,42,NULL,42-,NULL,1010,"Limited Business License",602,"Administrative Commercial Office",2738704,RENEW,NULL,05/15/2022,05/15/2022,N,07/16/2022,07/15/2024,05/15/2022,05/16/2022,AAI,NULL,1,41.880838616,-87.628901944,"(41.88083861588338, -87.62890194445242)","2022-10-06 12:53:44",test,NULL,"2022-05-15 00:00:00","2022-07-16 00:00:00","2024-07-15 00:00:00","2022-05-16 00:00:00",NULL
2709506-20220316,2830304,465765,1,"BRUCE FINKELMAN","BRUCE FINKELMAN","[REDACTED FOR PRIVACY]",CHICAGO,IL,60622,1,15,1-15,12,4404,"Regulated Business License",982,"Vacation Rental Building Containing Two to Four Dwelling Units For Transient Occupancy",2709506,RENEW,NULL,01/15/2022,05/13/2022,N,03/16/2022,03/15/2024,05/13/2022,05/16/2022,AAI,NULL,NULL,NULL,NULL,NULL,"2022-10-06 12:53:44",test,NULL,"2022-05-13 00:00:00","2022-03-16 00:00:00","2024-03-15 00:00:00","2022-05-16 00:00:00",NULL
2137801-20120203,2137801,369444,1,"NICHOLAS SARICH","TIMELESS TATTOOS","7112 W ARCHER AVE FIRST",CHICAGO,IL,60638,23,NULL,23-,NULL,1010,"Limited Business License",NULL,NULL,2137801,ISSUE,NULL,02/02/2012,02/02/2012,N,02/03/2012,02/15/2014,02/02/2012,02/03/2012,AAC,07/15/2013,NULL,41.792083221,-87.799586762,"(41.79208322138412, -87.7995867615771)","2022-10-06 12:53:44",test,NULL,"2012-02-02 00:00:00","2012-02-03 00:00:00","2014-02-15 00:00:00","2012-02-03 00:00:00","2013-07-15 00:00:00"
32989-20200416,2714266,32271,1,"FANTASY AMUSEMENT CO., INC.","FANTASY AMUSEMENTS","629 N FORREST   GROUN","ARLINGTON HEIGHTS",IL,60004,NULL,NULL,NULL,NULL,1010,"Limited Business License",NULL,NULL,32989,RENEW,NULL,02/15/2020,09/28/2021,N,04/16/2020,04/15/2022,09/28/2021,05/16/2022,AAI,NULL,NULL,NULL,NULL,NULL,"2022-10-06 12:53:44",test,NULL,"2021-09-28 00:00:00","2020-04-16 00:00:00","2022-04-15 00:00:00","2022-05-16 00:00:00",NULL
2043430-20220716,2848327,354956,1,"GABE'S CONSTRUCTION CO., INC.","GABE'S CONSTRUCTION CO., INC.","4804 N 40TH ST",SHEBOYGAN,WI,53083,NULL,NULL,NULL,NULL,1010,"Limited Business License",NULL,NULL,2043430,RENEW,NULL,05/15/2022,05/16/2022,N,07/16/2022,07/15/2024,05/16/2022,05/16/2022,AAI,NULL,NULL,NULL,NULL,NULL,"2022-10-06 12:53:44",test,NULL,"2022-05-16 00:00:00","2022-07-16 00:00:00","2024-07-15 00:00:00","2022-05-16 00:00:00",NULL
2299358-20220716,2848260,353470,1,"SONA TANCUN, INC.","L.A. TAN","2010 N DAMEN AVE 1 C",CHICAGO,IL,60647,32,5,32-5,14,4404,"Regulated Business License",827,"Tanning Facility",2299358,RENEW,NULL,05/15/2022,05/16/2022,N,07/16/2022,07/15/2024,05/16/2022,05/16/2022,AAI,NULL,33,41.918105342,-87.677780539,"(41.91810534240852, -87.67778053878558)","2022-10-06 12:53:44",test,NULL,"2022-05-16 00:00:00","2022-07-16 00:00:00","2024-07-15 00:00:00","2022-05-16 00:00:00",NULL
1337422-20050216,1567379,260245,1,"Linde Gas & Equipment Inc","PRAXAIR DISTRIBUTION, INC.","2224 S ARCHER AVE",CHICAGO,IL,60616,25,18,25-18,9,1010,"Limited Business License",NULL,NULL,1337422,RENEW,NULL,12/20/2004,03/14/2005,N,02/16/2005,02/15/2006,05/23/2005,05/24/2005,AAI,NULL,NULL,41.852491853,-87.635854507,"(41.852491852656364, -87.63585450672153)","2022-10-06 12:53:44",test,NULL,"2005-03-14 00:00:00","2005-02-16 00:00:00","2006-02-15 00:00:00","2005-05-24 00:00:00",NULL
2283835-20220716,2848708,384555,1,"ENGELS P JIMENEZ","PURO CORTE","1257 N PULASKI RD 1ST F FRONT",CHICAGO,IL,60651,37,4,37-4,25,1010,"Limited Business License",894,"Hair Services",2283835,RENEW,NULL,05/15/2022,05/16/2022,N,07/16/2022,07/15/2024,05/16/2022,05/16/2022,AAI,NULL,NULL,41.904362059,-87.726196345,"(41.904362059005976, -87.72619634529613)","2022-10-06 12:53:44",test,NULL,"2022-05-16 00:00:00","2022-07-16 00:00:00","2024-07-15 00:00:00","2022-05-16 00:00:00",NULL
2334804-20220816,2854585,391088,1,"TACONTENTO CORPORATION",TACONTENTO,"3500 W MONTROSE AVE 1ST",CHICAGO,IL,60618,35,19,35-19,17,1006,"Retail Food Establishment",781,"Sale of Food Prepared Onsite With Dining Area",2334804,RENEW,NULL,06/15/2022,08/08/2022,N,08/16/2022,08/15/2024,08/08/2022,08/09/2022,AAI,NULL,60,41.961208105,-87.715650273,"(41.961208104753815, -87.71565027290319)","2022-10-06 12:53:44",test,NULL,"2022-08-08 00:00:00","2022-08-16 00:00:00","2024-08-15 00:00:00","2022-08-09 00:00:00",NULL
2208877-20220716,2848276,354243,1,"GREATLAKES ARCHITECTURAL MILLWORKS, LLC","GREATLAKES ARCHITECTURAL MILLWORKS, LLC","2135 W FULTON ST 1ST",CHICAGO,IL,60612,27,27,27-27,12,4404,"Regulated Business License",673,"Home Repair Services",2208877,RENEW,NULL,05/15/2022,05/16/2022,N,07/16/2022,07/15/2024,05/16/2022,05/16/2022,AAI,NULL,NULL,41.886604219,-87.680644642,"(41.88660421942983, -87.6806446416356)","2022-10-06 12:53:44",test,NULL,"2022-05-16 00:00:00","2022-07-16 00:00:00","2024-07-15 00:00:00","2022-05-16 00:00:00",NULL
1892674-20220716,2846709,19852,4,"HICKS ENTERPRISES INC",Wendy's,"9843 S WESTERN AVE FIRST",CHICAGO,IL,60643,19,2,19-2,22,1006,"Retail Food Establishment",775,"Retail Sales of Perishable Foods",1892674,RENEW,NULL,05/15/2022,05/15/2022,N,07/16/2022,07/15/2024,05/15/2022,05/16/2022,AAI,NULL,20,41.714211932,-87.681709371,"(41.71421193159268, -87.68170937080606)","2022-10-06 12:53:44",test,NULL,"2022-05-15 00:00:00","2022-07-16 00:00:00","2024-07-15 00:00:00","2022-05-16 00:00:00",NULL
2813697-20220216,2825124,350517,2,"MARIA EUGENIA AGUILAR","MARIA EUGENIA AGUILAR","2855 S KARLOV AVE",CHICAGO,IL,60623,22,24,22-24,10,4406,"Peddler License",769,"Peddler- Retail Sales of General Merchandise, Whole Uncut Fruits/Vegetables, Flowers, Moving Along the Public Way",2813697,RENEW,NULL,12/15/2021,05/16/2022,N,02/16/2022,02/15/2024,NULL,05/16/2022,AAI,NULL,NULL,41.838907398,-87.726687966,"(41.83890739786162, -87.72668796564217)","2022-10-06 12:53:44",test,NULL,"2022-05-16 00:00:00","2022-02-16 00:00:00","2024-02-15 00:00:00","2022-05-16 00:00:00",NULL
2846385-20220516,2846385,485792,1,"DESIGN MODE INC.","DESIGN MODE","4205 N PULASKI RD STOREFRONT",CHICAGO,IL,60641,39,NULL,39-,NULL,1010,"Limited Business License","602 | 767","Administrative Commercial Office | Retail Sales of General Merchandise and Non-Perishable Food",2846385,ISSUE,05/13/2022,05/13/2022,05/13/2022,N,05/16/2022,05/15/2024,05/13/2022,05/16/2022,AAI,NULL,NULL,41.957496556,-87.727581523,"(41.95749655606356, -87.7275815234499)","2022-10-06 12:53:44",test,"2022-05-13 00:00:00","2022-05-13 00:00:00","2022-05-16 00:00:00","2024-05-15 00:00:00","2022-05-16 00:00:00",NULL
2646216-20220516,2839430,427264,3,"DJJE HOLDINGS, LLC","THE PLACE FOR CHILDREN WITH AUTISM","3501 W 26TH ST",CHICAGO,IL,60623,22,NULL,22-,NULL,1010,"Limited Business License",602,"Administrative Commercial Office",2646216,RENEW,NULL,03/15/2022,04/15/2022,N,05/16/2022,05/15/2024,04/15/2022,05/16/2022,AAI,NULL,25,41.844301691,-87.71240564,"(41.844301691218504, -87.71240564022379)","2022-10-06 12:53:44",test,NULL,"2022-04-15 00:00:00","2022-05-16 00:00:00","2024-05-15 00:00:00","2022-05-16 00:00:00",NULL
2846413-20220516,2846413,14172,60,"LIZZIE MCNEILL'S, INC.","LIZZIE MCNEILL'S, INC.","400 N MCCLURG CT",CHICAGO,IL,60611,42,31,42-31,18,1476,"Special Event Liquor",996,"Special Event Beer, Wine & Spirits",2846413,ISSUE,05/13/2022,05/13/2022,05/13/2022,N,05/16/2022,05/23/2022,05/13/2022,05/16/2022,AAI,NULL,NULL,41.889118473,-87.617754877,"(41.88911847301037, -87.61775487651728)","2022-10-06 12:53:44",test,"2022-05-13 00:00:00","2022-05-13 00:00:00","2022-05-16 00:00:00","2022-05-23 00:00:00","2022-05-16 00:00:00",NULL
2846390-20220516,2846390,384980,3,"1INFOTECH CORPORATION",1Infotech,"4651 W 79TH ST 2 202",CHICAGO,IL,60652,18,NULL,18-,NULL,1010,"Limited Business License",602,"Administrative Commercial Office",2846390,C_LOC,05/13/2022,05/13/2022,05/13/2022,N,05/16/2022,04/15/2024,05/13/2022,05/16/2022,AAI,NULL,NULL,41.749088829,-87.738422847,"(41.74908882943119, -87.73842284749492)","2022-10-06 12:53:44",test,"2022-05-13 00:00:00","2022-05-13 00:00:00","2022-05-16 00:00:00","2024-04-15 00:00:00","2022-05-16 00:00:00",NULL
2831241-20220516,2831241,482998,1,"CILANTRO TACO GRILL OLD TOWN LLC","CILANTRO TACO GRILL OLD TOWN","333 W NORTH AVE  B",CHICAGO,IL,60610,27,NULL,27-,NULL,1006,"Retail Food Establishment","781 | 1050","Sale of Food Prepared Onsite With Dining Area | Preparation and Sale of Coffee and/or Drinks",2831241,ISSUE,02/02/2022,02/02/2022,02/04/2022,N,05/16/2022,06/15/2024,05/16/2022,05/16/2022,AAI,NULL,NULL,41.911013149,-87.638017712,"(41.91101314874418, -87.63801771166592)","2022-10-06 12:53:44",test,"2022-02-02 00:00:00","2022-02-04 00:00:00","2022-05-16 00:00:00","2024-06-15 00:00:00","2022-05-16 00:00:00",NULL
1337422-20031027,1337422,260245,1,"Linde Gas & Equipment Inc","PRAXAIR DISTRIBUTION, INC.","2224 S ARCHER AVE",CHICAGO,IL,60616,25,18,25-18,9,1010,"Limited Business License",NULL,NULL,1337422,ISSUE,03/19/2003,10/24/2003,10/24/2003,N,10/27/2003,02/15/2004,10/24/2003,10/27/2003,AAI,NULL,NULL,41.852491853,-87.635854507,"(41.852491852656364, -87.63585450672153)","2022-10-06 12:53:44",test,"2003-03-19 00:00:00","2003-10-24 00:00:00","2003-10-27 00:00:00","2004-02-15 00:00:00","2003-10-27 00:00:00",NULL
2850063-20220516,2850063,485849,1,"FIT N FIX GOWNS & SUITS LLC","FIT N FIX GOWNS & SUITS LLC","2807 N SOUTHPORT AVE",CHICAGO,IL,60657,32,8,32-8,19,4404,"Regulated Business License",631,"Clothing Alterations",2850063,ISSUE,05/16/2022,05/16/2022,05/16/2022,N,05/16/2022,06/15/2024,05/16/2022,05/16/2022,AAI,NULL,27,41.932716877,-87.663431192,"(41.93271687723081, -87.66343119181691)","2022-10-06 12:53:44",test,"2022-05-16 00:00:00","2022-05-16 00:00:00","2022-05-16 00:00:00","2024-06-15 00:00:00","2022-05-16 00:00:00",NULL
2658134-20220816,2851711,6214,2,"MORENO'S DISCOUNT LIQUORS, INC.","OSITO'S TAP","2553 S RIDGEWAY AVE 1",CHICAGO,IL,60623,22,13,22-13,10,1006,"Retail Food Establishment",781,"Sale of Food Prepared Onsite With Dining Area",2658134,RENEW,NULL,06/15/2022,08/08/2022,N,08/16/2022,08/15/2024,08/08/2022,08/09/2022,AAI,NULL,25,41.844597188,-87.718312551,"(41.84459718759861, -87.71831255053898)","2022-10-06 12:53:44",test,NULL,"2022-08-08 00:00:00","2022-08-16 00:00:00","2024-08-15 00:00:00","2022-08-09 00:00:00",NULL
2205886-20220716,2847325,220845,1,"KTKY, INC.","STONY ISLAND MOTEL","9201 S STONY ISLAND AVE",CHICAGO,IL,60617,8,3,8-3,4,4404,"Regulated Business License",676,"Hotel - 7 or More Sleeping Rooms",2205886,RENEW,NULL,05/15/2022,05/15/2022,N,07/16/2022,07/15/2024,05/15/2022,05/16/2022,AAI,NULL,50,41.727766454,-87.58487782,"(41.727766453943474, -87.58487781980263)","2022-10-06 12:53:44",test,NULL,"2022-05-15 00:00:00","2022-07-16 00:00:00","2024-07-15 00:00:00","2022-05-16 00:00:00",NULL
2208522-20220716,2848155,348354,1,"SKYWAY MOTEL & SUITES, INC.","SKYWAY MOTEL & SUITES, INC.","9132-9138 S STONY ISLAND AVE 1 & 2",CHICAGO,IL,60617,8,12,8-12,4,4404,"Regulated Business License",676,"Hotel - 7 or More Sleeping Rooms",2208522,RENEW,NULL,05/15/2022,05/15/2022,N,07/16/2022,07/15/2024,05/15/2022,05/16/2022,AAI,NULL,50,41.728626286,-87.585617211,"(41.72862628586091, -87.58561721097931)","2022-10-06 12:53:44",test,NULL,"2022-05-15 00:00:00","2022-07-16 00:00:00","2024-07-15 00:00:00","2022-05-16 00:00:00",NULL
2677290-20220516,2838108,350741,3,"INVENTABLES, INC.","INVENTABLES, INC.","328 S JEFFERSON ST  260",CHICAGO,IL,60661,42,NULL,42-,NULL,1010,"Limited Business License",602,"Administrative Commercial Office",2677290,RENEW,NULL,03/15/2022,04/22/2022,N,05/16/2022,05/15/2024,04/22/2022,04/25/2022,AAC,05/16/2022,NULL,41.877094135,-87.642654974,"(41.87709413528649, -87.6426549740065)","2022-10-06 12:53:44",test,NULL,"2022-04-22 00:00:00","2022-05-16 00:00:00","2024-05-15 00:00:00","2022-04-25 00:00:00","2022-05-16 00:00:00"
2152900-20220516,2838394,371973,1,"AM DENTAL LAB, INC.","AM DENTAL LAB","6801 W HIGGINS AVE 1ST FLOOR C",CHICAGO,IL,60656,41,NULL,41-,NULL,1010,"Limited Business License",NULL,NULL,2152900,RENEW,NULL,03/15/2022,08/08/2022,N,05/16/2022,05/15/2024,08/08/2022,08/09/2022,AAI,NULL,NULL,41.979014311,-87.797728084,"(41.97901431060554, -87.79772808412088)","2022-10-06 12:53:44",test,NULL,"2022-08-08 00:00:00","2022-05-16 00:00:00","2024-05-15 00:00:00","2022-08-09 00:00:00",NULL
2863358-20220809,2863358,488442,1,"CARDEN GROUP, INC.","STYLE EXTERIORS BY CORLEY","4905 W 95TH ST","OAK LAWN",IL,60453,NULL,NULL,NULL,NULL,1010,"Limited Business License",914,"Roof Repair and Installation",2863358,ISSUE,08/08/2022,08/08/2022,08/08/2022,N,08/09/2022,08/15/2024,08/08/2022,08/09/2022,AAI,NULL,NULL,NULL,NULL,NULL,"2022-10-06 12:53:44",test,"2022-08-08 00:00:00","2022-08-08 00:00:00","2022-08-09 00:00:00","2024-08-15 00:00:00","2022-08-09 00:00:00",NULL
1337423-20070216,1788939,260245,2,"Linde Gas & Equipment Inc","PRAXAIR DISTRIBUTION, INC.","12000  ROOSEVELT RD",HILLSIDE,IL,60162,NULL,NULL,NULL,NULL,1010,"Limited Business License",NULL,NULL,1337423,RENEW,NULL,12/20/2006,01/29/2007,N,02/16/2007,05/15/2009,01/29/2007,01/30/2007,AAI,NULL,NULL,NULL,NULL,NULL,"2022-10-06 12:53:44",test,NULL,"2007-01-29 00:00:00","2007-02-16 00:00:00","2009-05-15 00:00:00","2007-01-30 00:00:00",NULL
2781585-20220516,2839789,474525,1,"JAYU 1 CORPORATION","7-Eleven #38948A","2366 N DAMEN AVE 1",CHICAGO,IL,60647,32,NULL,32-,NULL,1781,Tobacco,"776 | 936 | 937","Retail Sales of Tobacco Products | Retail Sales of Tobacco Accessories | Retail Sales of Tobacco and Flavored Tobacco Products",2781585,RENEW,NULL,03/15/2022,05/14/2022,N,05/16/2022,05/15/2023,05/14/2022,05/16/2022,AAI,NULL,NULL,41.924737806,-87.678029148,"(41.924737806379355, -87.67802914773546)","2022-10-06 12:53:44",test,NULL,"2022-05-14 00:00:00","2022-05-16 00:00:00","2023-05-15 00:00:00","2022-05-16 00:00:00",NULL
1965183-20210416,2773758,342564,1,"ONSITE Woodwork Corporation","ONSITE Woodwork Corporation","4100  ROCK VALLEY PKWY","LOVES PARK",IL,61111,NULL,NULL,NULL,NULL,1010,"Limited Business License",NULL,NULL,1965183,RENEW,NULL,02/15/2021,03/17/2021,N,04/16/2021,04/15/2023,03/17/2021,03/18/2021,AAI,NULL,NULL,NULL,NULL,NULL,"2022-10-06 12:53:44",test,NULL,"2021-03-17 00:00:00","2021-04-16 00:00:00","2023-04-15 00:00:00","2021-03-18 00:00:00",NULL
2850132-20220516,2850132,477170,3,"LATOYA N. WALLS","LATOYA PLACE","5429 W NORTH AVE STOREFRONT",CHICAGO,IL,60639,37,6,37-6,25,4409,"Pop-Up Retail User",1030,"Organizer of a 91-180 Day Event w/ Pop-Up Retail Users at a Trade Show, Exhibition or Convention",2850132,ISSUE,05/16/2022,05/16/2022,05/16/2022,N,05/16/2022,11/13/2022,05/16/2022,05/16/2022,AAI,NULL,NULL,41.909314792,-87.761726257,"(41.90931479244196, -87.76172625733543)","2022-10-06 12:53:44",test,"2022-05-16 00:00:00","2022-05-16 00:00:00","2022-05-16 00:00:00","2022-11-13 00:00:00","2022-05-16 00:00:00",NULL
2560092-20220616,2843059,316510,2,"SAMMY S. NG","NG FAMILY MARTIAL ARTS","2515 S ARCHER AVE 1ST",CHICAGO,IL,60608,11,50,11-50,9,1010,"Limited Business License",848,"Training in The Arts of Combat and Self-Defense, Music, Art, Gymnastics, Dance for Children Under 18 Years of Age (Less Than 40% Children)",2560092,RENEW,NULL,04/15/2022,05/15/2022,N,06/16/2022,06/15/2024,05/15/2022,05/16/2022,AAI,NULL,NULL,41.846831668,-87.647005122,"(41.84683166758328, -87.64700512151654)","2022-10-06 12:53:44",test,NULL,"2022-05-15 00:00:00","2022-06-16 00:00:00","2024-06-15 00:00:00","2022-05-16 00:00:00",NULL
2723849-20220416,2834774,467704,1,"Tavern Rules","Tavern Rules","717 W ARMITAGE AVE 2",CHICAGO,IL,60614,43,NULL,43-,NULL,4404,"Regulated Business License","702 | 719","Marketing / Advertising / Public Relations (Home Based Business) | Professional Consulting (Home Based Business)",2723849,RENEW,NULL,02/15/2022,05/15/2022,N,04/16/2022,04/15/2024,05/15/2022,05/16/2022,AAI,NULL,NULL,41.918092884,-87.646835195,"(41.91809288367274, -87.64683519481473)","2022-10-06 12:53:44",test,NULL,"2022-05-15 00:00:00","2022-04-16 00:00:00","2024-04-15 00:00:00","2022-05-16 00:00:00",NULL
2141800-20220716,2848447,370070,1,"ASCEND JUSTICE","Ascend Justice","555 W HARRISON ST 1ST 1900",CHICAGO,IL,60607,25,28,25-28,1,1625,Raffles,720,"Not-For-Profit Selling Raffles for Prizes of $50 or More",2141800,RENEW,NULL,05/15/2022,05/15/2022,N,07/16/2022,07/15/2023,05/15/2022,05/16/2022,AAI,NULL,NULL,41.874271275,-87.641642831,"(41.87427127468442, -87.6416428312271)","2022-10-06 12:53:44",test,NULL,"2022-05-15 00:00:00","2022-07-16 00:00:00","2023-07-15 00:00:00","2022-05-16 00:00:00",NULL
2846396-20220516,2846396,485815,1,"ALOOR PROPERTIES, LLC","ALOOR PROPERTIES, LLC","5124 S INDIANA AVE  1N",CHICAGO,IL,60615,3,NULL,3-,NULL,4404,"Regulated Business License",724,"Other Home Based Businesses",2846396,ISSUE,05/13/2022,05/13/2022,05/13/2022,N,05/16/2022,05/15/2024,05/13/2022,05/16/2022,AAI,NULL,52,41.801262526,-87.621154734,"(41.80126252630689, -87.62115473405045)","2022-10-06 12:53:44",test,"2022-05-13 00:00:00","2022-05-13 00:00:00","2022-05-16 00:00:00","2024-05-15 00:00:00","2022-05-16 00:00:00",NULL
2602082-20220716,2849515,428406,1,"ACAPULCO BAKERY #2 , INC.","ACAPULCO BAKERY #2","6044 W 63RD ST 1ST",CHICAGO,IL,60638,13,11,13-11,8,1006,"Retail Food Establishment",782,"Sale of Food Prepared Onsite Without Dining Area",2602082,RENEW,NULL,05/15/2022,05/15/2022,N,07/16/2022,07/15/2024,05/15/2022,05/16/2022,AAI,NULL,NULL,41.777938446,-87.773289123,"(41.777938446306344, -87.77328912344171)","2022-10-06 12:53:44",test,NULL,"2022-05-15 00:00:00","2022-07-16 00:00:00","2024-07-15 00:00:00","2022-05-16 00:00:00",NULL
2841170-20220516,2841170,347213,2,"STEVEN P. MONDISA","M-SQUARE PERMIT EXPEDITERS","2155 N ELSTON AVE 7TH 723",CHICAGO,IL,60614,32,37,32-37,14,4404,"Regulated Business License","719 | 738","Professional Consulting (Home Based Business) | Preparation of License, Certificate or Permit Applications For Compensation / Expediter (Home Based Business)",2841170,ISSUE,04/08/2022,04/22/2022,04/22/2022,N,05/16/2022,06/15/2024,05/16/2022,05/16/2022,AAI,NULL,NULL,41.920803578,-87.671108962,"(41.92080357763093, -87.67110896225225)","2022-10-06 12:53:44",test,"2022-04-08 00:00:00","2022-04-22 00:00:00","2022-05-16 00:00:00","2024-06-15 00:00:00","2022-05-16 00:00:00",NULL
2205274-20220516,2836957,62859,1,"ARTHUR LAMBERT","MAGIC AMUSEMENT","3906  TOWER DR  #504","RICHTON PARK",IL,60471,NULL,NULL,NULL,NULL,4404,"Regulated Business License",645,"Distribution, Placing, Leasing or Sales of Automatic Amusement Devices",2205274,RENEW,NULL,03/15/2022,05/15/2022,N,05/16/2022,05/15/2024,05/15/2022,05/16/2022,AAI,NULL,NULL,NULL,NULL,NULL,"2022-10-06 12:53:44",test,NULL,"2022-05-15 00:00:00","2022-05-16 00:00:00","2024-05-15 00:00:00","2022-05-16 00:00:00",NULL
1357355-20070216,1788937,260245,1,"Linde Gas & Equipment Inc","PRAXAIR DISTRIBUTION, INC.","2224 S ARCHER AVE",CHICAGO,IL,60616,25,18,25-18,9,1008,"Hazardous Materials",NULL,NULL,1357355,RENEW,NULL,12/20/2006,01/29/2007,N,02/16/2007,05/15/2009,01/29/2007,01/30/2007,AAC,07/16/2008,NULL,41.852491853,-87.635854507,"(41.852491852656364, -87.63585450672153)","2022-10-06 12:53:44",test,NULL,"2007-01-29 00:00:00","2007-02-16 00:00:00","2009-05-15 00:00:00","2007-01-30 00:00:00","2008-07-16 00:00:00"
6563-20220516,2836869,50615,1,"MARK S FRANK & FRANCES FRANK","M STUART'S LTD","568 W ROOSEVELT RD  1",CHICAGO,IL,60607,25,28,25-28,1,1010,"Limited Business License",NULL,NULL,6563,RENEW,NULL,03/15/2022,05/13/2022,N,05/16/2022,05/15/2024,05/13/2022,05/16/2022,AAI,NULL,NULL,41.867331771,-87.642029466,"(41.8673317708515, -87.64202946634681)","2022-10-06 12:53:44",test,NULL,"2022-05-13 00:00:00","2022-05-16 00:00:00","2024-05-15 00:00:00","2022-05-16 00:00:00",NULL
58453-20220716,2846677,18680,1,"TUMARA FOOD MART INC.",CITGO,"2941 E 83RD ST TH",CHICAGO,IL,60617,7,48,7-48,4,1275,"Filling Station",666,"Operation of a Fuel Filling Station",58453,RENEW,NULL,05/15/2022,05/15/2022,N,07/16/2022,07/15/2024,05/15/2022,05/16/2022,AAI,NULL,NULL,41.744535937,-87.552358447,"(41.74453593701442, -87.55235844692069)","2022-10-06 12:53:44",test,NULL,"2022-05-15 00:00:00","2022-07-16 00:00:00","2024-07-15 00:00:00","2022-05-16 00:00:00",NULL
2822699-20220516,2822699,481459,1,"PEACH TREE ACADEMY LLC","PEACH TREE ACADEMY","4930 W DIVERSEY AVE",CHICAGO,IL,60639,31,NULL,31-,NULL,1023,"Children's Services Facility License",820,"Supervision of, and Care for, Children 0-6 Years of Age, During the Day between 6am-9pm",2822699,ISSUE,11/24/2021,11/24/2021,11/29/2021,N,05/16/2022,06/15/2024,05/16/2022,05/16/2022,AAI,NULL,NULL,41.93159333,-87.750321019,"(41.93159332989326, -87.75032101904218)","2022-10-06 12:53:44",test,"2021-11-24 00:00:00","2021-11-29 00:00:00","2022-05-16 00:00:00","2024-06-15 00:00:00","2022-05-16 00:00:00",NULL
2802933-20210726,2802933,477170,3,"LATOYA N. WALLS","LATOYA PLACE","5429 W NORTH AVE STOREFRONT",CHICAGO,IL,60639,37,6,37-6,25,1010,"Limited Business License","767 | 910 | 1082","Retail Sales of General Merchandise and Non-Perishable Food | Sale of Art | Rental of Miscellaneous Items for Events and Parties",2802933,ISSUE,07/26/2021,07/26/2021,07/26/2021,N,07/26/2021,08/15/2023,07/26/2021,07/26/2021,AAI,NULL,NULL,41.909314792,-87.761726257,"(41.90931479244196, -87.76172625733543)","2022-10-06 12:53:44",test,"2021-07-26 00:00:00","2021-07-26 00:00:00","2021-07-26 00:00:00","2023-08-15 00:00:00","2021-07-26 00:00:00",NULL
2617466-20220916,2861505,427671,1,"STAFFING INC","STAFF ILLINOIS","6190 S ARCHER AVE",CHICAGO,IL,60638,23,22,23-22,8,1010,"Limited Business License",635,"Commissioned Staffing of Professional, Secretarial and Clerical Work",2617466,RENEW,NULL,07/15/2022,08/08/2022,N,09/16/2022,09/15/2024,08/08/2022,08/09/2022,AAI,NULL,NULL,41.794017543,-87.774147371,"(41.794017543044355, -87.7741473714093)","2022-10-06 12:53:44",test,NULL,"2022-08-08 00:00:00","2022-09-16 00:00:00","2024-09-15 00:00:00","2022-08-09 00:00:00",NULL
2595243-20220516,2839407,427101,1,"Honey Hive Salon inc","Honey Hive Salon","4636 N RAVENSWOOD AVE  104",CHICAGO,IL,60640,47,NULL,47-,NULL,1010,"Limited Business License","144 | 767 | 894 | 895 | 896 | 904","Hair, Nail, and Skin Care Services | Retail Sales of General Merchandise and Non-Perishable Food | Hair Services | Nail Services | Skincare Services | Retail Sales of General Merchandise",2595243,RENEW,NULL,03/15/2022,05/14/2022,N,05/16/2022,05/15/2024,05/14/2022,05/16/2022,AAI,NULL,31,41.966234712,-87.674796519,"(41.96623471176423, -87.67479651882446)","2022-10-06 12:53:44",test,NULL,"2022-05-14 00:00:00","2022-05-16 00:00:00","2024-05-15 00:00:00","2022-05-16 00:00:00",NULL
2210868-20220716,2848598,374030,1,"Vincent M O'Leary","V.M. O'Leary Sheet Metal & Heating","820  THREE OAKS  RD",CARY,IL,60013,NULL,NULL,NULL,NULL,4404,"Regulated Business License",673,"Home Repair Services",2210868,RENEW,NULL,05/15/2022,05/15/2022,N,07/16/2022,07/15/2024,05/15/2022,05/16/2022,AAI,NULL,NULL,NULL,NULL,NULL,"2022-10-06 12:53:44",test,NULL,"2022-05-15 00:00:00","2022-07-16 00:00:00","2024-07-15 00:00:00","2022-05-16 00:00:00",NULL
2698235-20220516,2839435,427269,2,"87TH CLEANERS, INC.","LION CLEANER 71ST","7018 S HALSTED ST",CHICAGO,IL,60618,6,NULL,6-,NULL,1010,"Limited Business License","648 | 694","Dry Cleaning - Drop Off Location | Laundry Service - Drop Off Only",2698235,RENEW,NULL,03/15/2022,05/13/2022,N,05/16/2022,05/15/2024,05/13/2022,05/16/2022,AAI,NULL,NULL,41.766416294,-87.644590895,"(41.766416293908975, -87.64459089465835)","2022-10-06 12:53:44",test,NULL,"2022-05-13 00:00:00","2022-05-16 00:00:00","2024-05-15 00:00:00","2022-05-16 00:00:00",NULL
2120727-20211016,2805904,366779,1,"Huseby Cares Network LLC","Huseby Cares Network LLC","5948 N MILWAUKEE AVE 1 1A",CHICAGO,IL,60646,45,NULL,45-,NULL,1010,"Limited Business License",NULL,NULL,2120727,RENEW,NULL,08/15/2021,05/13/2022,N,10/16/2021,10/15/2023,05/13/2022,05/16/2022,AAI,NULL,NULL,41.989705156,-87.780777012,"(41.98970515644051, -87.78077701175351)","2022-10-06 12:53:44",test,NULL,"2022-05-13 00:00:00","2021-10-16 00:00:00","2023-10-15 00:00:00","2022-05-16 00:00:00",NULL
2608764-20220716,2849186,415814,2,"KING IRON WORKS CHICAGO INC.","KING IRON WORKS CHICAGO INC","847 N KILPATRICK AVE",CHICAGO,IL,60651,37,21,37-21,11,4404,"Regulated Business License",673,"Home Repair Services",2608764,RENEW,NULL,05/15/2022,05/15/2022,N,07/16/2022,07/15/2024,05/15/2022,05/16/2022,AAI,NULL,NULL,41.896366825,-87.743409888,"(41.896366825240584, -87.74340988817181)","2022-10-06 12:53:44",test,NULL,"2022-05-15 00:00:00","2022-07-16 00:00:00","2024-07-15 00:00:00","2022-05-16 00:00:00",NULL
1902994-20110516,2086400,260245,3,"Linde Gas & Equipment Inc","PRAXAIR DISTRIBUTION, INC","4967 N ELSTON AVE 1ST",CHICAGO,IL,60630,39,11,39-11,17,1010,"Limited Business License",NULL,NULL,1902994,RENEW,NULL,03/15/2011,03/31/2011,N,05/16/2011,05/15/2013,03/31/2011,04/12/2011,AAC,12/29/2012,NULL,41.971030842,-87.744679828,"(41.97103084180758, -87.74467982803301)","2022-10-06 12:53:44",test,NULL,"2011-03-31 00:00:00","2011-05-16 00:00:00","2013-05-15 00:00:00","2011-04-12 00:00:00","2012-12-29 00:00:00"
2333310-20220616,2843902,390508,1,"Partnership Employment of Chicago LLC","Partnership Employment","560 W WASHINGTON BLVD 3RD 300",CHICAGO,IL,60661,42,NULL,42-,NULL,1010,"Limited Business License",635,"Commissioned Staffing of Professional, Secretarial and Clerical Work",2333310,RENEW,NULL,04/15/2022,05/13/2022,N,06/16/2022,06/15/2024,05/13/2022,05/16/2022,AAI,NULL,NULL,41.883283907,-87.642187219,"(41.88328390714073, -87.64218721938904)","2022-10-06 12:53:44",test,NULL,"2022-05-13 00:00:00","2022-06-16 00:00:00","2024-06-15 00:00:00","2022-05-16 00:00:00",NULL
2850131-20220516,2850131,477170,2,"LATOYA N. WALLS","LATOYA PLACE","5427 W NORTH AVE STOREFRONT",CHICAGO,IL,60639,37,6,37-6,25,4409,"Pop-Up Retail User",1030,"Organizer of a 91-180 Day Event w/ Pop-Up Retail Users at a Trade Show, Exhibition or Convention",2850131,ISSUE,05/16/2022,05/16/2022,05/16/2022,N,05/16/2022,11/13/2022,05/16/2022,05/16/2022,AAI,NULL,NULL,41.909315688,-87.761651124,"(41.90931568835104, -87.76165112446277)","2022-10-06 12:53:44",test,"2022-05-16 00:00:00","2022-05-16 00:00:00","2022-05-16 00:00:00","2022-11-13 00:00:00","2022-05-16 00:00:00",NULL
1902993-20081107,1902993,260245,3,"Linde Gas & Equipment Inc","PRAXAIR DISTRIBUTION, INC","4967 N ELSTON AVE 1ST",CHICAGO,IL,60630,39,11,39-11,17,1008,"Hazardous Materials",NULL,NULL,1902993,ISSUE,04/18/2008,11/04/2008,11/04/2008,N,11/07/2008,05/15/2009,11/06/2008,11/07/2008,AAI,NULL,NULL,41.971030842,-87.744679828,"(41.97103084180758, -87.74467982803301)","2022-10-06 12:53:44",test,"2008-04-18 00:00:00","2008-11-04 00:00:00","2008-11-07 00:00:00","2009-05-15 00:00:00","2008-11-07 00:00:00",NULL
34229-20081016,1923245,1896,60,"HOST INTERNATIONAL, INC.","Caf Des Cartes (Baggage T1)","11601 W TOUHY AVE  TERM",CHICAGO,IL,60666,41,27,41-27,16,1006,"Retail Food Establishment",775,"Retail Sales of Perishable Foods",34229,RENEW,NULL,08/15/2008,10/14/2008,N,10/16/2008,10/15/2010,10/22/2008,10/23/2008,AAI,NULL,NULL,42.008536401,-87.914428439,"(42.008536400868735, -87.91442843927047)","2022-10-06 12:53:44",test,NULL,"2008-10-14 00:00:00","2008-10-16 00:00:00","2010-10-15 00:00:00","2008-10-23 00:00:00",NULL
2146327-20220516,2835648,334153,5,"NUTS ON CLARK UNION STATION AT O'HARE, INC.","NUTS ON CLARK","11601 W TOUHY AVE  T3HU43G",CHICAGO,IL,60666,41,27,41-27,16,1006,"Retail Food Establishment","775 | 963","Retail Sales of Perishable Foods | Automatic Food Vending Machine Business",2146327,C_SBA,03/03/2022,05/13/2022,NULL,N,05/16/2022,01/15/2024,05/13/2022,05/16/2022,AAI,NULL,NULL,42.008536401,-87.914428439,"(42.008536400868735, -87.91442843927047)","2022-10-06 12:53:44",test,"2022-03-03 00:00:00",NULL,"2022-05-16 00:00:00","2024-01-15 00:00:00","2022-05-16 00:00:00",NULL
2846215-20220516,2846215,207412,28,"BUCK MANAGEMENT GROUP LLC","Buck Management Group LLC","855 W MADISON ST",CHICAGO,IL,60607,27,NULL,27-,NULL,1010,"Limited Business License",1078,"Property Management / Real Estate Management",2846215,ISSUE,05/11/2022,05/11/2022,05/11/2022,N,05/16/2022,09/15/2022,05/11/2022,05/16/2022,AAI,NULL,NULL,41.881631137,-87.649547598,"(41.881631136865984, -87.6495475984714)","2022-10-06 12:53:44",test,"2022-05-11 00:00:00","2022-05-11 00:00:00","2022-05-16 00:00:00","2022-09-15 00:00:00","2022-05-16 00:00:00",NULL
2738437-20220716,2849938,468522,1,"YINQING YE",Aromatherapy,"4425 S ARCHER AVE 1 A3",CHICAGO,IL,60632,14,NULL,14-,NULL,1010,"Limited Business License","144 | 998","Hair, Nail, and Skin Care Services | Provide Foot Massage - Fully Clothed/No Disrobing",2738437,RENEW,NULL,05/15/2022,05/16/2022,N,07/16/2022,07/15/2024,05/16/2022,05/16/2022,AAI,NULL,39,41.812756755,-87.706185995,"(41.81275675469049, -87.70618599528053)","2022-10-06 12:53:44",test,NULL,"2022-05-16 00:00:00","2022-07-16 00:00:00","2024-07-15 00:00:00","2022-05-16 00:00:00",NULL
2608601-20220716,2849570,428773,1,"ANTHONY HARRIS","ANTHONY HARRIS","1548 W 80TH ST  1B",CHICAGO,IL,60620,21,30,21-30,6,4406,"Peddler License",769,"Peddler- Retail Sales of General Merchandise, Whole Uncut Fruits/Vegetables, Flowers, Moving Along the Public Way",2608601,RENEW,NULL,05/15/2022,05/16/2022,N,07/16/2022,07/15/2024,NULL,05/16/2022,AAI,NULL,32,41.74864217,-87.66291612,"(41.748642169513495, -87.66291611951999)","2022-10-06 12:53:44",test,NULL,"2022-05-16 00:00:00","2022-07-16 00:00:00","2024-07-15 00:00:00","2022-05-16 00:00:00",NULL
2713373-20220516,2839433,427264,6,"DJJE HOLDINGS, LLC","The Place for Children with Autism","9139 S COMMERCIAL AVE N/A N/A",CHICAGO,IL,60617,10,NULL,10-,NULL,1010,"Limited Business License",602,"Administrative Commercial Office",2713373,RENEW,NULL,03/15/2022,04/15/2022,N,05/16/2022,05/15/2024,04/15/2022,05/16/2022,AAI,NULL,5,41.728909499,-87.55108091,"(41.728909499294396, -87.55108090975568)","2022-10-06 12:53:44",test,NULL,"2022-04-15 00:00:00","2022-05-16 00:00:00","2024-05-15 00:00:00","2022-05-16 00:00:00",NULL
2664588-20190916,2681906,384627,2,"FEDCHEX RECOVERY, LLC","FCR Collection Services dba FCR Services","27042  TOWNE CENTRE DR  SUITE 150","FOOTHILL RANCH",CA,92610,NULL,NULL,NULL,NULL,4404,"Regulated Business License",912,"Debt Collecting - Administrative Commercial Office",2664588,RENEW,NULL,07/15/2019,07/15/2019,N,09/16/2019,09/15/2021,07/15/2019,07/16/2019,AAI,NULL,NULL,NULL,NULL,NULL,"2022-10-06 12:53:44",test,NULL,"2019-07-15 00:00:00","2019-09-16 00:00:00","2021-09-15 00:00:00","2019-07-16 00:00:00",NULL
2677290-20190621,2677290,350741,3,"INVENTABLES, INC.","INVENTABLES, INC.","328 S JEFFERSON ST  260",CHICAGO,IL,60661,42,NULL,42-,NULL,1010,"Limited Business License",602,"Administrative Commercial Office",2677290,C_LOC,06/20/2019,06/20/2019,06/20/2019,N,06/21/2019,05/15/2020,06/20/2019,06/21/2019,AAI,NULL,NULL,41.877094135,-87.642654974,"(41.87709413528649, -87.6426549740065)","2022-10-06 12:53:44",test,"2019-06-20 00:00:00","2019-06-20 00:00:00","2019-06-21 00:00:00","2020-05-15 00:00:00","2019-06-21 00:00:00",NULL
2321286-20220416,2833765,388980,2,"Magic Nails Spa","MAGIC NAILS SPA","2321 W MADISON ST 1ST",CHICAGO,IL,60612,27,53,27-53,12,1010,"Limited Business License",895,"Nail Services",2321286,RENEW,NULL,02/15/2022,05/14/2022,N,04/16/2022,04/15/2024,05/14/2022,05/16/2022,AAI,NULL,NULL,41.881076509,-87.684847399,"(41.881076509462126, -87.68484739887545)","2022-10-06 12:53:44",test,NULL,"2022-05-14 00:00:00","2022-04-16 00:00:00","2024-04-15 00:00:00","2022-05-16 00:00:00",NULL
1902994-20090516,1961938,260245,3,"Linde Gas & Equipment Inc","PRAXAIR DISTRIBUTION, INC","4967 N ELSTON AVE 1ST",CHICAGO,IL,60630,39,11,39-11,17,1010,"Limited Business License",NULL,NULL,1902994,RENEW,NULL,03/16/2009,03/31/2009,N,05/16/2009,05/15/2011,03/31/2009,04/01/2009,AAI,NULL,NULL,41.971030842,-87.744679828,"(41.97103084180758, -87.74467982803301)","2022-10-06 12:53:44",test,NULL,"2009-03-31 00:00:00","2009-05-16 00:00:00","2011-05-15 00:00:00","2009-04-01 00:00:00",NULL
2583726-20220316,2830134,425507,1,"RJS MARKETING SOLUTIONS, L.L.C.","RJS MARKETING SOLUTIONS, L.L.C.","5415 N SHERIDAN RD 8TH 814",CHICAGO,IL,60640,48,9,48-9,20,4404,"Regulated Business License",719,"Professional Consulting (Home Based Business)",2583726,RENEW,NULL,01/15/2022,04/13/2022,N,03/16/2022,03/15/2024,04/13/2022,04/14/2022,AAI,NULL,NULL,41.98047333,-87.654952641,"(41.980473329827255, -87.65495264052998)","2022-10-06 12:53:44",test,NULL,"2022-04-13 00:00:00","2022-03-16 00:00:00","2024-03-15 00:00:00","2022-04-14 00:00:00",NULL
2594664-20220516,2839355,426847,1,"WINDY CITY FACILITATION L.L.C.","WINDY CITY FACILITATION L.L.C.","1136 S DELANO CT  B201",CHICAGO,IL,60605,25,21,25-21,1,1010,"Limited Business License","633 | 753 | 813","Commercial Janitorial Services | Residential Cleaning Services | Snowplowing",2594664,RENEW,NULL,03/15/2022,05/14/2022,N,05/16/2022,05/15/2024,05/14/2022,05/16/2022,AAI,NULL,NULL,NULL,NULL,NULL,"2022-10-06 12:53:44",test,NULL,"2022-05-14 00:00:00","2022-05-16 00:00:00","2024-05-15 00:00:00","2022-05-16 00:00:00",NULL
74820-20220516,2836983,63704,1,"OUSMANE DIALLO","AICHA HAIR BRAIDING","5103 W NORTH AVE",CHICAGO,IL,60639,37,31,37-31,25,1010,"Limited Business License",894,"Hair Services",74820,RENEW,NULL,03/15/2022,05/14/2022,N,05/16/2022,05/15/2024,05/14/2022,05/16/2022,AAI,NULL,NULL,41.909419159,-87.753634811,"(41.90941915858756, -87.75363481083784)","2022-10-06 12:53:44",test,NULL,"2022-05-14 00:00:00","2022-05-16 00:00:00","2024-05-15 00:00:00","2022-05-16 00:00:00",NULL
66701-20030816,1366372,43749,1,"CAROLINA'S SILVER INCORPORATED","CAROLINA'S SILVER INCORPORATED","3115 W 26TH ST  313,229F2",CHICAGO,IL,60623,12,6,12-6,10,1010,"Limited Business License",NULL,NULL,66701,RENEW,NULL,06/24/2003,08/12/2003,N,08/16/2003,08/15/2004,08/12/2003,08/13/2003,AAI,NULL,NULL,NULL,NULL,NULL,"2022-10-06 12:53:44",test,NULL,"2003-08-12 00:00:00","2003-08-16 00:00:00","2004-08-15 00:00:00","2003-08-13 00:00:00",NULL
2277504-20180216,2573593,369444,1,"NICHOLAS SARICH","TIMELESS TATTOOS","7112 W ARCHER AVE FIRST",CHICAGO,IL,60638,23,NULL,23-,NULL,4404,"Regulated Business License",828,"Tattoo / Permanent Body Art and Make-Up / Micro Blading",2277504,RENEW,NULL,12/15/2017,01/17/2018,N,02/16/2018,02/15/2020,01/17/2018,01/18/2018,AAI,NULL,NULL,41.792083221,-87.799586762,"(41.79208322138412, -87.7995867615771)","2022-10-06 12:53:44",test,NULL,"2018-01-17 00:00:00","2018-02-16 00:00:00","2020-02-15 00:00:00","2018-01-18 00:00:00",NULL
2803473-20220516,2803473,477705,1,"PRISCILLA A. BANUELOS","PRISCILLA A. BANUELOS","4001 W ARGYLE ST",CHICAGO,IL,60630,39,8,39-8,17,4406,"Peddler License",819,"Street Performer, Moving Along the Public Way",2803473,ISSUE,08/05/2021,08/05/2021,05/16/2022,N,05/16/2022,06/15/2024,NULL,05/16/2022,AAI,NULL,NULL,41.971773606,-87.728191125,"(41.97177360641689, -87.72819112543313)","2022-10-06 12:53:44",test,"2021-08-05 00:00:00","2022-05-16 00:00:00","2022-05-16 00:00:00","2024-06-15 00:00:00","2022-05-16 00:00:00",NULL
1822870-20220616,2842948,294995,2,"HYE JUNG HA","ADVANCED CLEANERS","1717 N WESTERN AVE 1ST",CHICAGO,IL,60647,32,31,32-31,14,1010,"Limited Business License",648,"Dry Cleaning - Drop Off Location",1822870,RENEW,NULL,04/15/2022,05/15/2022,N,06/16/2022,06/15/2024,05/15/2022,05/16/2022,AAI,NULL,33,41.912670571,-87.687134497,"(41.91267057110256, -87.6871344969001)","2022-10-06 12:53:44",test,NULL,"2022-05-15 00:00:00","2022-06-16 00:00:00","2024-06-15 00:00:00","2022-05-16 00:00:00",NULL
2216248-20121229,2216248,260245,3,"Linde Gas & Equipment Inc","PRAXAIR DISTRIBUTION, INC","4967 N ELSTON AVE 1ST",CHICAGO,IL,60630,39,11,39-11,17,4404,"Regulated Business License",816,"Storage or Use of Hazardous Materials",2216248,ISSUE,NULL,NULL,NULL,N,12/29/2012,05/15/2013,NULL,12/29/2012,AAI,NULL,NULL,41.971030842,-87.744679828,"(41.97103084180758, -87.74467982803301)","2022-10-06 12:53:44",test,NULL,NULL,"2012-12-29 00:00:00","2013-05-15 00:00:00","2012-12-29 00:00:00",NULL
2608763-20220716,2849187,415814,2,"KING IRON WORKS CHICAGO INC.","KING IRON WORKS CHICAGO INC","847 N KILPATRICK AVE",CHICAGO,IL,60651,37,21,37-21,11,1009,"Manufacturing Establishments",929,"Miscellaneous Manufacturing",2608763,RENEW,NULL,05/15/2022,05/15/2022,N,07/16/2022,07/15/2024,05/15/2022,05/16/2022,AAI,NULL,NULL,41.896366825,-87.743409888,"(41.896366825240584, -87.74340988817181)","2022-10-06 12:53:44",test,NULL,"2022-05-15 00:00:00","2022-07-16 00:00:00","2024-07-15 00:00:00","2022-05-16 00:00:00",NULL
2791404-20220716,2850016,475451,1,"DISTILLED, INC.","DISTILLED SMOKE","169 N WELLS ST",CHICAGO,IL,60606,42,NULL,42-,NULL,1781,Tobacco,"776 | 936","Retail Sales of Tobacco Products | Retail Sales of Tobacco Accessories",2791404,RENEW,NULL,05/15/2022,05/15/2022,N,07/16/2022,07/15/2023,05/15/2022,05/16/2022,AAI,NULL,NULL,41.885073562,-87.633764757,"(41.88507356203613, -87.63376475726596)","2022-10-06 12:53:44",test,NULL,"2022-05-15 00:00:00","2022-07-16 00:00:00","2023-07-15 00:00:00","2022-05-16 00:00:00",NULL
2609370-20220716,2849617,429066,1,"RUNWAY STUDIOS LLC","RUNWAY STUDIOS LLC","5637 W 63RD ST 1ST",CHICAGO,IL,60638,13,26,13-26,8,1010,"Limited Business License","144 | 998","Hair, Nail, and Skin Care Services | Provide Foot Massage - Fully Clothed/No Disrobing",2609370,RENEW,NULL,05/15/2022,05/15/2022,N,07/16/2022,07/15/2024,05/15/2022,05/16/2022,AAI,NULL,NULL,41.777912983,-87.76317401,"(41.777912983303764, -87.76317400983231)","2022-10-06 12:53:44",test,NULL,"2022-05-15 00:00:00","2022-07-16 00:00:00","2024-07-15 00:00:00","2022-05-16 00:00:00",NULL
2477046-20220716,2848825,391226,2,"Duet Dance Studio LLC","Duet Dance Studio","2412 W NORTH AVE 2ND 2 R",CHICAGO,IL,60647,1,27,1-27,14,1010,"Limited Business License",661,"Fitness Training On and Off Premise",2477046,RENEW,NULL,05/15/2022,05/15/2022,N,07/16/2022,07/15/2024,05/15/2022,05/16/2022,AAI,NULL,33,41.910423585,-87.687791748,"(41.910423585331024, -87.68779174763705)","2022-10-06 12:53:44",test,NULL,"2022-05-15 00:00:00","2022-07-16 00:00:00","2024-07-15 00:00:00","2022-05-16 00:00:00",NULL
1138788-20040816,1420777,212012,2,"DD&S INC.","D D AND S, INC.","769 W 26TH ST",CHICAGO,IL,60616,11,50,11-50,9,1010,"Limited Business License",NULL,NULL,1138788,RENEW,NULL,06/30/2004,09/01/2004,N,08/16/2004,02/15/2005,09/01/2004,09/02/2004,AAI,NULL,NULL,41.845223478,-87.646090425,"(41.84522347787031, -87.64609042498367)","2022-10-06 12:53:44",test,NULL,"2004-09-01 00:00:00","2004-08-16 00:00:00","2005-02-15 00:00:00","2004-09-02 00:00:00",NULL
2850133-20220516,2850133,47752,7,"SAMUEL PEDRO ALVAREZ-SANTILLAN","VIVA SALUDABLE RESALE","4100 S ASHLAND AVE",CHICAGO,IL,60609,12,19,12-19,9,1010,"Limited Business License",767,"Retail Sales of General Merchandise and Non-Perishable Food",2850133,ISSUE,05/16/2022,05/16/2022,05/16/2022,N,05/16/2022,01/15/2023,05/16/2022,05/16/2022,AAI,NULL,10,41.819441426,-87.665375545,"(41.81944142629576, -87.6653755449091)","2022-10-06 12:53:44",test,"2022-05-16 00:00:00","2022-05-16 00:00:00","2022-05-16 00:00:00","2023-01-15 00:00:00","2022-05-16 00:00:00",NULL
2411036-20220716,2848956,399197,1,"POLITICAL FUND-CHICAGO JOURNEYMEN PLUMBERS' LOCAL UNION 130, U.A.","POLITICAL FUND-CHICAGO JOURNEYMEN PLUMBERS' LOCAL UNION 130, U.A.","1340 W WASHINGTON BLVD",CHICAGO,IL,60607,27,7,27-7,12,1625,Raffles,720,"Not-For-Profit Selling Raffles for Prizes of $50 or More",2411036,RENEW,NULL,05/15/2022,05/16/2022,N,07/16/2022,07/15/2023,05/16/2022,05/16/2022,AAI,NULL,NULL,41.883024036,-87.661256362,"(41.88302403623101, -87.66125636214211)","2022-10-06 12:53:44",test,NULL,"2022-05-16 00:00:00","2022-07-16 00:00:00","2023-07-15 00:00:00","2022-05-16 00:00:00",NULL
2601933-20220616,2844618,428266,1,"TRN MOBILITY SOLUTIONS, LLC","101 Mobility of Naperville","1701  QUINCY AVE  UNIT 12",NAPERVILLE,IL,60540,NULL,NULL,NULL,NULL,4404,"Regulated Business License","658 | 673 | 754 | 755","Fence Installation, Brick Patios, Retaining Walls, Cement Work In Residential Properties | Home Repair Services | Residential Construction / Minor Home Repair Services | Residential Installations",2601933,RENEW,NULL,04/15/2022,05/13/2022,N,06/16/2022,06/15/2024,05/13/2022,05/16/2022,AAI,NULL,NULL,41.878176188,-87.669960016,"(41.878176187876605, -87.66996001591953)","2022-10-06 12:53:44",test,NULL,"2022-05-13 00:00:00","2022-06-16 00:00:00","2024-06-15 00:00:00","2022-05-16 00:00:00",NULL
2609042-20220716,2849598,428939,1,"BRADLEY BRANDL","BRADLEY BRANDL","[REDACTED FOR PRIVACY]","OAK LAWN",IL,60453,NULL,NULL,NULL,NULL,7009,"Pharmaceutical Representative",990,"Markets / Promotes Pharmaceuticals to Health Care Professionals and Conducts Business for More than 15 Calendar Days per Year",2609042,RENEW,NULL,05/15/2022,05/16/2022,N,07/16/2022,07/15/2023,05/16/2022,05/16/2022,AAI,NULL,NULL,NULL,NULL,NULL,"2022-10-06 12:53:44",test,NULL,"2022-05-16 00:00:00","2022-07-16 00:00:00","2023-07-15 00:00:00","2022-05-16 00:00:00",NULL
2476237-20220716,2848535,373455,3,"6C'S LLC","CLEAN CUTS CONCRETE CUTTING CONSTRUCTION COMPANY","10534 S AVENUE J  1",CHICAGO,IL,60617,10,33,10-33,4,4404,"Regulated Business License",719,"Professional Consulting (Home Based Business)",2476237,RENEW,NULL,05/15/2022,05/15/2022,N,07/16/2022,07/15/2024,05/15/2022,05/16/2022,AAI,NULL,NULL,41.70350248,-87.534227405,"(41.70350248047684, -87.53422740521714)","2022-10-06 12:53:44",test,NULL,"2022-05-15 00:00:00","2022-07-16 00:00:00","2024-07-15 00:00:00","2022-05-16 00:00:00",NULL
2850164-20220516,2850164,485878,1,"HORTENSIA PAREDES","GATITA'S FLOWERS HORTENCSIA PAREDES","5114 S HONORE ST",CHICAGO,IL,60609,16,8,16-8,9,4406,"Peddler License",769,"Peddler- Retail Sales of General Merchandise, Whole Uncut Fruits/Vegetables, Flowers, Moving Along the Public Way",2850164,ISSUE,05/16/2022,05/16/2022,05/16/2022,N,05/16/2022,06/15/2024,NULL,05/16/2022,AAI,NULL,NULL,41.80077801,-87.670995646,"(41.80077800981146, -87.6709956462254)","2022-10-06 12:53:44",test,"2022-05-16 00:00:00","2022-05-16 00:00:00","2022-05-16 00:00:00","2024-06-15 00:00:00","2022-05-16 00:00:00",NULL
2600704-20220616,2844539,427758,1,"Zachs HVAC LLC","Zachs HVAC LLC","1817 E KENSINGTON RD","MOUNT PROSPECT",IL,60056,NULL,NULL,NULL,NULL,4404,"Regulated Business License",901,"Heating, Ventilation and Air Conditioning Services - Residential",2600704,RENEW,NULL,04/15/2022,05/13/2022,N,06/16/2022,06/15/2024,05/13/2022,05/16/2022,AAI,NULL,NULL,NULL,NULL,NULL,"2022-10-06 12:53:44",test,NULL,"2022-05-13 00:00:00","2022-06-16 00:00:00","2024-06-15 00:00:00","2022-05-16 00:00:00",NULL
1330822-20120516,2144730,257587,1,"CARLOS O. MENJIVAR","FIVE STAR FENCING","417 E CHICAGO AVE",INDIANA,IL,46312,NULL,NULL,NULL,NULL,1011,"Home Repair",NULL,NULL,1330822,RENEW,NULL,03/15/2012,09/24/2012,N,05/16/2012,05/15/2014,09/24/2012,09/25/2012,AAC,12/29/2012,NULL,NULL,NULL,NULL,"2022-10-06 12:53:44",test,NULL,"2012-09-24 00:00:00","2012-05-16 00:00:00","2014-05-15 00:00:00","2012-09-25 00:00:00","2012-12-29 00:00:00"
2846282-20220516,2846282,485743,1,"I.Z.W Enterprise LLC","I.Z.W Enterprise LLC","125 S WACKER DR 2ND 300",CHICAGO,IL,60606,42,NULL,42-,NULL,1010,"Limited Business License",1076,"Sales / Rental / Lease of Motorized Vehicles - Outdoor Sales",2846282,ISSUE,05/12/2022,05/12/2022,05/15/2022,N,05/16/2022,06/15/2024,05/15/2022,05/16/2022,AAI,NULL,NULL,41.880013427,-87.636572385,"(41.88001342713154, -87.63657238450709)","2022-10-06 12:53:44",test,"2022-05-12 00:00:00","2022-05-15 00:00:00","2022-05-16 00:00:00","2024-06-15 00:00:00","2022-05-16 00:00:00",NULL
24453-20060216,1656304,30050,1,"RONALD J WASHINGTON","HART REMODELING & HOME IMPROVE","3831 W 178 ST  1","COUNTRY CLUB HILLS",IL,60478,NULL,NULL,NULL,NULL,1010,"Limited Business License",NULL,NULL,24453,RENEW,NULL,12/21/2005,02/02/2006,N,02/16/2006,02/15/2007,02/02/2006,02/03/2006,AAI,NULL,NULL,NULL,NULL,NULL,"2022-10-06 12:53:44",test,NULL,"2006-02-02 00:00:00","2006-02-16 00:00:00","2007-02-15 00:00:00","2006-02-03 00:00:00",NULL
2163913-20220716,2848572,373722,1,"KARAVITES RESTAURANT 33426, LLC",MCDONALD'S,"1378-84 W LAKE ST 1ST",CHICAGO,IL,60607,27,33,27-33,12,1006,"Retail Food Establishment",775,"Retail Sales of Perishable Foods",2163913,RENEW,NULL,05/15/2022,05/16/2022,N,07/16/2022,07/15/2024,05/16/2022,05/16/2022,AAI,NULL,NULL,41.885536587,-87.661822711,"(41.885536586504884, -87.66182271082023)","2022-10-06 12:53:44",test,NULL,"2022-05-16 00:00:00","2022-07-16 00:00:00","2024-07-15 00:00:00","2022-05-16 00:00:00",NULL
2216654-20220716,2847166,201439,1,"KINDRA LAKE TOWING, LP","KINDRA LAKE TOWING, LP","9864 S AVENUE N",CHICAGO,IL,60617,10,NULL,10-,4,4404,"Regulated Business License",816,"Storage or Use of Hazardous Materials",2216654,RENEW,NULL,05/15/2022,05/16/2022,N,07/16/2022,07/15/2024,05/16/2022,05/16/2022,AAI,NULL,NULL,NULL,NULL,NULL,"2022-10-06 12:53:44",test,NULL,"2022-05-16 00:00:00","2022-07-16 00:00:00","2024-07-15 00:00:00","2022-05-16 00:00:00",NULL
2846322-20220516,2846322,394451,6,"MORGANS ON FULTON, LLC","MARVIN'S FOOD & FUEL / MORGAN'S ON FULTON","932-954 W FULTON MARKET",CHICAGO,IL,60607,27,45,27-45,12,1476,"Special Event Liquor",996,"Special Event Beer, Wine & Spirits",2846322,ISSUE,05/12/2022,05/12/2022,05/13/2022,N,05/16/2022,10/31/2022,05/13/2022,05/16/2022,AAI,NULL,NULL,41.886864374,-87.651067518,"(41.88686437354237, -87.65106751780091)","2022-10-06 12:53:44",test,"2022-05-12 00:00:00","2022-05-13 00:00:00","2022-05-16 00:00:00","2022-10-31 00:00:00","2022-05-16 00:00:00",NULL
2631034-20201116,2752905,432219,1,"PONTE CATRINA LLC","PONTE CATRINA LLC","2150 S CANALPORT AVE 5 5B",CHICAGO,IL,60608,25,NULL,25-,12,1010,"Limited Business License",894,"Hair Services",2631034,RENEW,NULL,09/15/2020,05/13/2022,N,11/16/2020,11/15/2022,05/13/2022,05/16/2022,AAI,NULL,NULL,41.853301464,-87.649929695,"(41.8533014640748, -87.649929695282)","2022-10-06 12:53:44",test,NULL,"2022-05-13 00:00:00","2020-11-16 00:00:00","2022-11-15 00:00:00","2022-05-16 00:00:00",NULL
2294149-20220716,2848715,386270,1,"DDMB 2, LLC","EMPORIUM LOGAN SQUARE","2363-2365 N MILWAUKEE AVE",CHICAGO,IL,60647,1,10,1-10,14,1006,"Retail Food Establishment",781,"Sale of Food Prepared Onsite With Dining Area",2294149,RENEW,NULL,05/15/2022,05/15/2022,N,07/16/2022,07/15/2024,05/15/2022,05/16/2022,AAI,NULL,NULL,41.924260821,-87.699331748,"(41.92426082139295, -87.69933174792325)","2022-10-06 12:53:44",test,NULL,"2022-05-15 00:00:00","2022-07-16 00:00:00","2024-07-15 00:00:00","2022-05-16 00:00:00",NULL
2333076-20220516,2838018,345099,3,"CANNON MEDIA, INC.","CANNON MEDIA, INC.","564 W RANDOLPH ST 2ND",CHICAGO,IL,60661,42,21,42-21,1,1010,"Limited Business License",703,"Advertising / Marketing / Sales Office",2333076,RENEW,NULL,03/15/2022,05/13/2022,N,05/16/2022,05/15/2024,05/13/2022,05/16/2022,AAI,NULL,NULL,41.884543398,-87.642331387,"(41.884543397737836, -87.64233138672651)","2022-10-06 12:53:44",test,NULL,"2022-05-13 00:00:00","2022-05-16 00:00:00","2024-05-15 00:00:00","2022-05-16 00:00:00",NULL
1716789-20220716,2847882,304797,1,"UNIQUE SILVER, INC","GREEN ARCH FOOD MART","5555 N BROADWAY",CHICAGO,IL,60640,48,3,48-3,20,1781,Tobacco,763,"Retail Sale of Tobacco",1716789,RENEW,NULL,05/15/2022,05/15/2022,N,07/16/2022,07/15/2023,05/15/2022,05/16/2022,AAI,NULL,26,41.983420091,-87.659915817,"(41.98342009074442, -87.65991581678234)","2022-10-06 12:53:44",test,NULL,"2022-05-15 00:00:00","2022-07-16 00:00:00","2023-07-15 00:00:00","2022-05-16 00:00:00",NULL
3636-20220416,2832330,62599,2,"ANDREW J MCGANN & SON FUNERAL","ANDREW J MCGANN & SON FUNERAL","10727 S PULASKI RD 1ST",CHICAGO,IL,60655,19,16,19-16,22,1010,"Limited Business License",709,"Miscellaneous Personal Services",3636,RENEW,NULL,02/15/2022,05/13/2022,N,04/16/2022,04/15/2024,05/13/2022,05/16/2022,AAI,NULL,NULL,41.697937675,-87.720463212,"(41.69793767496546, -87.7204632123981)","2022-10-06 12:53:44",test,NULL,"2022-05-13 00:00:00","2022-04-16 00:00:00","2024-04-15 00:00:00","2022-05-16 00:00:00",NULL
2827835-20220112,2827835,368459,21,"LITTLE GOAT, LLC","LITTLE GOAT","800-820 W RANDOLPH ST 1",CHICAGO,IL,60607,27,45,27-45,12,1476,"Special Event Liquor","717 | 996","Special Event Beer & Wine | Special Event Beer, Wine & Spirits",2827835,ISSUE,01/11/2022,01/11/2022,01/11/2022,N,01/12/2022,07/11/2022,01/11/2022,01/12/2022,AAI,NULL,NULL,41.884515458,-87.6474973,"(41.88451545836221, -87.64749730032112)","2022-10-06 12:53:44",test,"2022-01-11 00:00:00","2022-01-11 00:00:00","2022-01-12 00:00:00","2022-07-11 00:00:00","2022-01-12 00:00:00",NULL
2152583-20220516,2838360,371783,1,"BIG G'S PIZZA, LLC","BIG G'S PIZZA","3716 N CLARK ST 1ST",CHICAGO,IL,60613,44,50,44-50,19,1006,"Retail Food Establishment",775,"Retail Sales of Perishable Foods",2152583,RENEW,NULL,03/15/2022,04/26/2022,N,05/16/2022,05/15/2024,04/26/2022,05/16/2022,AAI,NULL,17,41.949475526,-87.658514833,"(41.949475525899906, -87.6585148333457)","2022-10-06 12:53:44",test,NULL,"2022-04-26 00:00:00","2022-05-16 00:00:00","2024-05-15 00:00:00","2022-05-16 00:00:00",NULL
2718616-20220416,2834643,467294,1,"NANCY HUGHES","NANCY L HUGHES","11117 S EMERALD AVE 1",CHICAGO,IL,60628,34,NULL,34-,NULL,4404,"Regulated Business License",599,"Accounting / Tax Preparation (Home Based Business)",2718616,RENEW,NULL,02/15/2022,05/15/2022,N,04/16/2022,04/15/2024,05/16/2022,05/16/2022,AAI,NULL,NULL,41.69182848,-87.641004968,"(41.69182847978469, -87.6410049681931)","2022-10-06 12:53:44",test,NULL,"2022-05-15 00:00:00","2022-04-16 00:00:00","2024-04-15 00:00:00","2022-05-16 00:00:00",NULL
2398277-20220616,2842634,254387,4,"WELLNER ASSEMBLING INC.","IT'S ALL RIGHT HERE","3105 S WALLACE ST",CHICAGO,IL,60616,11,42,11-42,9,1010,"Limited Business License",767,"Retail Sales of General Merchandise and Non-Perishable Food",2398277,RENEW,NULL,04/15/2022,05/13/2022,N,06/16/2022,06/15/2024,05/13/2022,05/16/2022,AAI,NULL,NULL,41.837905425,-87.641262507,"(41.837905425190684, -87.6412625072719)","2022-10-06 12:53:44",test,NULL,"2022-05-13 00:00:00","2022-06-16 00:00:00","2024-06-15 00:00:00","2022-05-16 00:00:00",NULL
1138788-20100216,2011060,212012,2,"DD&S INC.","D D AND S, INC.","769 W 26TH ST",CHICAGO,IL,60616,11,50,11-50,9,1010,"Limited Business License",NULL,NULL,1138788,RENEW,NULL,12/16/2009,02/02/2010,N,02/16/2010,02/15/2012,02/02/2010,02/03/2010,AAI,NULL,NULL,41.845223478,-87.646090425,"(41.84522347787031, -87.64609042498367)","2022-10-06 12:53:44",test,NULL,"2010-02-02 00:00:00","2010-02-16 00:00:00","2012-02-15 00:00:00","2010-02-03 00:00:00",NULL
60855-20220616,2841845,19168,1,"FIFY CORPORATION","BP AMOCO","3101 S MICHIGAN AVE 1ST",CHICAGO,IL,60616,3,53,3-53,2,1006,"Retail Food Establishment",775,"Retail Sales of Perishable Foods",60855,RENEW,NULL,04/15/2022,05/15/2022,N,06/16/2022,06/15/2024,05/15/2022,05/16/2022,AAI,NULL,NULL,41.838251391,-87.623294811,"(41.8382513911452, -87.62329481051012)","2022-10-06 12:53:44",test,NULL,"2022-05-15 00:00:00","2022-06-16 00:00:00","2024-06-15 00:00:00","2022-05-16 00:00:00",NULL
2845912-20220516,2845912,485517,1,"KOOL FLOW HEATING AND COOLING LIMITED","KOOL FLOW HEATING AND COOLING","369 E 147 TH ST ST  A",HARVEY,IL,60426,NULL,NULL,NULL,NULL,4404,"Regulated Business License",901,"Heating, Ventilation and Air Conditioning Services - Residential",2845912,ISSUE,05/05/2022,05/05/2022,05/15/2022,N,05/16/2022,06/15/2024,05/15/2022,05/16/2022,AAI,NULL,NULL,NULL,NULL,NULL,"2022-10-06 12:53:44",test,"2022-05-05 00:00:00","2022-05-15 00:00:00","2022-05-16 00:00:00","2024-06-15 00:00:00","2022-05-16 00:00:00",NULL
2802932-20210726,2802932,477170,3,"LATOYA N. WALLS","LATOYA PLACE","5429 W NORTH AVE STOREFRONT",CHICAGO,IL,60639,37,6,37-6,25,4409,"Pop-Up Retail User",1031,"Organizer of a 181-365 Day Event w/ Pop-Up Retail Users at a Trade Show, Exhibition or Convention",2802932,ISSUE,07/26/2021,07/26/2021,07/26/2021,N,07/26/2021,01/30/2022,07/26/2021,07/26/2021,AAI,NULL,NULL,41.909314792,-87.761726257,"(41.90931479244196, -87.76172625733543)","2022-10-06 12:53:44",test,"2021-07-26 00:00:00","2021-07-26 00:00:00","2021-07-26 00:00:00","2022-01-30 00:00:00","2021-07-26 00:00:00",NULL
2120056-20200616,2724865,64478,4,"RON HOY","HOYPOLOI O'HARE","11601 W TOUHY AVE TERMINAL T2-E5",CHICAGO,IL,60666,41,27,41-27,16,1010,"Limited Business License",NULL,NULL,2120056,RENEW,NULL,04/15/2020,08/09/2022,N,06/16/2020,06/15/2022,08/09/2022,08/09/2022,AAI,NULL,NULL,42.008536401,-87.914428439,"(42.008536400868735, -87.91442843927047)","2022-10-06 12:53:44",test,NULL,"2022-08-09 00:00:00","2020-06-16 00:00:00","2022-06-15 00:00:00","2022-08-09 00:00:00",NULL
2109602-20210116,2759700,55799,5,"LARRY J. GILLIAM","LARRY'S CONSTRUCTION","4829 W 109TH ST  204","OAK LAWN",IL,60453,NULL,NULL,NULL,NULL,1010,"Limited Business License",NULL,NULL,2109602,RENEW,NULL,11/15/2020,06/23/2021,N,01/16/2021,01/15/2023,04/09/2021,07/06/2021,AAI,NULL,NULL,NULL,NULL,NULL,"2022-10-06 12:53:44",test,NULL,"2021-06-23 00:00:00","2021-01-16 00:00:00","2023-01-15 00:00:00","2021-07-06 00:00:00",NULL
2827667-20220616,2844581,427985,2,"SOUTHTOWN SUB, LLC","SOUTHTOWN SUB","112 E 71ST ST",CHICAGO,IL,60619,6,11,6-11,3,1006,"Retail Food Establishment",782,"Sale of Food Prepared Onsite Without Dining Area",2827667,RENEW,NULL,04/15/2022,05/13/2022,N,06/16/2022,06/15/2024,05/13/2022,05/16/2022,AAI,NULL,NULL,41.76570172,-87.621109463,"(41.76570172043141, -87.62110946315975)","2022-10-06 12:53:44",test,NULL,"2022-05-13 00:00:00","2022-06-16 00:00:00","2024-06-15 00:00:00","2022-05-16 00:00:00",NULL
1138788-20050216,1563591,212012,2,"DD&S INC.","D D AND S, INC.","769 W 26TH ST",CHICAGO,IL,60616,11,50,11-50,9,1010,"Limited Business License",NULL,NULL,1138788,RENEW,NULL,12/20/2004,02/14/2005,N,02/16/2005,02/15/2006,02/14/2005,02/14/2005,AAI,NULL,NULL,41.845223478,-87.646090425,"(41.84522347787031, -87.64609042498367)","2022-10-06 12:53:44",test,NULL,"2005-02-14 00:00:00","2005-02-16 00:00:00","2006-02-15 00:00:00","2005-02-14 00:00:00",NULL
2608601-20200716,2732333,428773,1,"ANTHONY HARRIS","ANTHONY HARRIS","1548 W 80TH ST  1B",CHICAGO,IL,60620,21,30,21-30,6,4406,"Peddler License",769,"Peddler- Retail Sales of General Merchandise, Whole Uncut Fruits/Vegetables, Flowers, Moving Along the Public Way",2608601,RENEW,NULL,05/15/2020,08/04/2021,N,07/16/2020,07/15/2022,NULL,08/04/2021,AAI,NULL,32,41.74864217,-87.66291612,"(41.748642169513495, -87.66291611951999)","2022-10-06 12:53:44",test,NULL,"2021-08-04 00:00:00","2020-07-16 00:00:00","2022-07-15 00:00:00","2021-08-04 00:00:00",NULL
2728217-20220916,2861908,467790,1,"Knezovic Kreative Enterprises LLC",doma,"944-946 N ORLEANS ST",CHICAGO,IL,60610,27,NULL,27-,NULL,1006,"Retail Food Establishment","767 | 781","Retail Sales of General Merchandise and Non-Perishable Food | Sale of Food Prepared Onsite With Dining Area",2728217,RENEW,NULL,07/15/2022,08/08/2022,N,09/16/2022,09/15/2024,08/08/2022,08/09/2022,AAI,NULL,NULL,41.900334724,-87.637463095,"(41.90033472432364, -87.63746309536123)","2022-10-06 12:53:44",test,NULL,"2022-08-08 00:00:00","2022-09-16 00:00:00","2024-09-15 00:00:00","2022-08-09 00:00:00",NULL
2205513-20220716,2847072,66655,5,"CRUZ BROTHER'S CONSTRUCTION COMPANY, INC.","CRUZ BROTHERS CONSTRUCTION CO. INC.","10614 S MACKINAW AVE 1",CHICAGO,IL,60617,10,35,10-35,4,4404,"Regulated Business License",673,"Home Repair Services",2205513,RENEW,NULL,05/15/2022,05/16/2022,N,07/16/2022,07/15/2024,05/16/2022,05/16/2022,AAI,NULL,NULL,41.702275622,-87.542708676,"(41.7022756218349, -87.5427086763228)","2022-10-06 12:53:44",test,NULL,"2022-05-16 00:00:00","2022-07-16 00:00:00","2024-07-15 00:00:00","2022-05-16 00:00:00",NULL
38442-20050216,1555737,33672,1,"INTREN, LLC","TRENCH-IT INC","549 W SHERIDAN RD  1ST",MCHENRY,IL,60050,NULL,NULL,NULL,NULL,1010,"Limited Business License",NULL,NULL,38442,RENEW,NULL,12/20/2004,01/24/2005,N,02/16/2005,02/15/2006,01/24/2005,01/25/2005,AAC,03/09/2005,NULL,NULL,NULL,NULL,"2022-10-06 12:53:44",test,NULL,"2005-01-24 00:00:00","2005-02-16 00:00:00","2006-02-15 00:00:00","2005-01-25 00:00:00","2005-03-09 00:00:00"
2622165-20220516,2839429,427264,2,"DJJE HOLDINGS, LLC","THE PLACE FOR CHILDREN WITH AUTISM","2701 W PETERSON AVE",CHICAGO,IL,60659,40,NULL,40-,NULL,1010,"Limited Business License",602,"Administrative Commercial Office",2622165,RENEW,NULL,03/15/2022,04/15/2022,N,05/16/2022,05/15/2024,04/15/2022,05/16/2022,AAI,NULL,NULL,41.990346333,-87.697025923,"(41.99034633253336, -87.69702592272303)","2022-10-06 12:53:44",test,NULL,"2022-04-15 00:00:00","2022-05-16 00:00:00","2024-05-15 00:00:00","2022-05-16 00:00:00",NULL
1357355-20031030,1357355,260245,1,"Linde Gas & Equipment Inc","PRAXAIR DISTRIBUTION, INC.","2224 S ARCHER AVE",CHICAGO,IL,60616,25,18,25-18,9,1008,"Hazardous Materials",NULL,NULL,1357355,ISSUE,06/05/2003,10/24/2003,10/24/2003,N,10/30/2003,02/15/2004,10/29/2003,10/30/2003,AAI,NULL,NULL,41.852491853,-87.635854507,"(41.852491852656364, -87.63585450672153)","2022-10-06 12:53:44",test,"2003-06-05 00:00:00","2003-10-24 00:00:00","2003-10-30 00:00:00","2004-02-15 00:00:00","2003-10-30 00:00:00",NULL
2543059-20220716,2849325,418651,1,"RUDY MCCALEBB","RUDY MCCALEBB","[REDACTED FOR PRIVACY]",CHICAGO,IL,60649,5,NULL,5-,NULL,7009,"Pharmaceutical Representative",990,"Markets / Promotes Pharmaceuticals to Health Care Professionals and Conducts Business for More than 15 Calendar Days per Year",2543059,RENEW,NULL,05/15/2022,05/15/2022,N,07/16/2022,07/15/2023,05/15/2022,05/16/2022,AAI,NULL,NULL,NULL,NULL,NULL,"2022-10-06 12:53:44",test,NULL,"2022-05-15 00:00:00","2022-07-16 00:00:00","2023-07-15 00:00:00","2022-05-16 00:00:00",NULL
2615964-20211216,2814910,54013,4,"LA HACIENDA BRANDS INC","LA HACIENDA BRANDS, INC.","2420 S WOOD ST",CHICAGO,IL,60608,25,15,25-15,10,1006,"Retail Food Establishment",931,"Retail Sales and Wholesale of Perishable Foods",2615964,RENEW,NULL,10/15/2021,05/13/2022,N,12/16/2021,12/15/2023,05/13/2022,05/16/2022,AAI,NULL,NULL,41.84787201,-87.670948545,"(41.84787200960281, -87.67094854477632)","2022-10-06 12:53:44",test,NULL,"2022-05-13 00:00:00","2021-12-16 00:00:00","2023-12-15 00:00:00","2022-05-16 00:00:00",NULL
2738593-20220716,2847678,280602,2,"NEW SOUTH CHICAGO CURRENCY EXCHANGE, INC","New South Chicago Currency Exchange, inc.","3018 E 92ND ST",CHICAGO,IL,60617,10,NULL,10-,NULL,1010,"Limited Business License","659 | 897","Financial and Accounting Services | Financial Services Commercial Office",2738593,RENEW,NULL,05/15/2022,05/16/2022,N,07/16/2022,07/15/2024,05/16/2022,05/16/2022,AAI,NULL,5,41.728370597,-87.550394348,"(41.72837059747941, -87.55039434765226)","2022-10-06 12:53:44",test,NULL,"2022-05-16 00:00:00","2022-07-16 00:00:00","2024-07-15 00:00:00","2022-05-16 00:00:00",NULL
2469224-20220716,2849022,406605,1,"GT COMMERCIAL INC.","ILLINOIS PROPERTY MANAGEMENT GROUP, INC.","2502 N CLARK ST 2ND 232",CHICAGO,IL,60614,43,34,43-34,19,1010,"Limited Business License",708,"Miscellaneous Commercial Services",2469224,RENEW,NULL,05/15/2022,05/15/2022,N,07/16/2022,07/15/2024,05/15/2022,05/16/2022,AAI,NULL,23,41.927859079,-87.64199486,"(41.92785907934172, -87.6419948599232)","2022-10-06 12:53:44",test,NULL,"2022-05-15 00:00:00","2022-07-16 00:00:00","2024-07-15 00:00:00","2022-05-16 00:00:00",NULL
2041789-20220716,2848278,354264,1,"ACESS CONTEMPORARY MUSIC","ACESS CONTEMPORARY MUSIC","1758 W WILSON AVE 1",CHICAGO,IL,60640,47,34,47-34,19,1010,"Limited Business License",NULL,NULL,2041789,RENEW,NULL,05/15/2022,05/15/2022,N,07/16/2022,07/15/2024,05/15/2022,05/16/2022,AAI,NULL,31,41.965291077,-87.673254998,"(41.965291076939614, -87.67325499771431)","2022-10-06 12:53:44",test,NULL,"2022-05-15 00:00:00","2022-07-16 00:00:00","2024-07-15 00:00:00","2022-05-16 00:00:00",NULL
2518080-20220716,2847559,274541,4,"JEWISH COUNCIL FOR YOUTH SERVICES","JEWISH COUNCIL FOR YOUTH SERVICES","150 N MICHIGAN AVE  SUITE 640",CHICAGO,IL,60601,42,NULL,42-,NULL,1625,Raffles,720,"Not-For-Profit Selling Raffles for Prizes of $50 or More",2518080,RENEW,NULL,05/15/2022,05/16/2022,N,07/16/2022,07/15/2023,05/16/2022,05/16/2022,AAI,NULL,NULL,41.884530964,-87.624602045,"(41.88453096378336, -87.62460204460082)","2022-10-06 12:53:44",test,NULL,"2022-05-16 00:00:00","2022-07-16 00:00:00","2023-07-15 00:00:00","2022-05-16 00:00:00",NULL
2757396-20220716,2848246,352235,1,"TWIN TONE, LLC","HI FI FITNESS","820 N ORLEANS ST LOWER LEVEL 100",CHICAGO,IL,60610,27,51,27-51,18,4404,"Regulated Business License","661 | 926","Fitness Training On and Off Premise | Fitness Classes",2757396,RENEW,NULL,05/15/2022,05/15/2022,N,07/16/2022,07/15/2024,05/15/2022,05/16/2022,AAI,NULL,NULL,41.897338047,-87.63734543,"(41.897338047455214, -87.63734543001038)","2022-10-06 12:53:44",test,NULL,"2022-05-15 00:00:00","2022-07-16 00:00:00","2024-07-15 00:00:00","2022-05-16 00:00:00",NULL
